"DESCRIPTION","DURATION IN MS","NAME","PARENT SUITE","START TIME","STATUS","STOP TIME","SUB SUITE","SUITE","TEST CLASS","TEST METHOD"
"","36","R.2 Проверка шрифта заголовка 'Восстановление пароля'","tests.ui_tests","Sun Nov 09 04:02:41 UTC 2025","passed","Sun Nov 09 04:02:41 UTC 2025","TestPasswordRecoveryPage","password_recovery_test","",""
"","39","W.7 Проверка видимости заголовка 'Ваши рабочие пространства'","tests.ui_tests","Sun Nov 09 04:05:56 UTC 2025","passed","Sun Nov 09 04:05:56 UTC 2025","TestWorkspacePage","workspace_page_test","",""
"","85","F.3 Проверка элемента 'info@pulsewave.ru'в хедере","tests.ui_tests","Sun Nov 09 03:47:54 UTC 2025","passed","Sun Nov 09 03:47:54 UTC 2025","TestFooter","footer_test","",""
"","43","F.5 Проверка размера шрифта надписи 'info@pulsewave.ru' в футере","tests.ui_tests","Sun Nov 09 03:50:16 UTC 2025","passed","Sun Nov 09 03:50:16 UTC 2025","TestFooter","footer_test","",""
"","45","F.5 Проверка шрифта надписи 'info@pulsewave.ru' в футере","tests.ui_tests","Sun Nov 09 03:52:45 UTC 2025","passed","Sun Nov 09 03:52:45 UTC 2025","TestFooter","footer_test","",""
"","1312","L.7 Авторизация с некорректным емайл","tests.ui_tests","Sun Nov 09 04:02:12 UTC 2025","passed","Sun Nov 09 04:02:13 UTC 2025","TestLoginPage","login_page_test","",""
"","63","F.5 Проверка цвета шрифта надписи 'info@pulsewave.ru' в футере","tests.ui_tests","Sun Nov 09 03:51:22 UTC 2025","passed","Sun Nov 09 03:51:22 UTC 2025","TestFooter","footer_test","",""
"","43","F.2 Проверка отсутствия ссылки на Лицензионное соглашение со страницы 'https://app.pulsewave.ru/auth/signup","tests.ui_tests","Sun Nov 09 03:46:40 UTC 2025","passed","Sun Nov 09 03:46:40 UTC 2025","TestFooter","footer_test","",""
"","28","H.8 Проверка цвета кнопки 'Регистрация в хедере https://app.pulsewave.ru/auth/login'","tests.ui_tests","Sun Nov 09 04:01:25 UTC 2025","passed","Sun Nov 09 04:01:25 UTC 2025","TestHeader","header_test","",""
"","540","A.27 POST Регистрация пользователя без пароля","tests.api_tests","Sun Nov 09 03:43:54 UTC 2025","passed","Sun Nov 09 03:43:54 UTC 2025","TestAPI","api_test","",""
"","860","A.28 POST Регистрация пользователя без подтверждения подписки","tests.api_tests","Sun Nov 09 03:43:54 UTC 2025","passed","Sun Nov 09 03:43:55 UTC 2025","TestAPI","api_test","",""
"","812","A.8 POST Создать пару токенов access и refresh","tests.api_tests","Sun Nov 09 03:43:09 UTC 2025","passed","Sun Nov 09 03:43:10 UTC 2025","TestAPI","api_test","",""
"","39","S.5 Проверка размера шрифта заголовка 'Регистрация'","tests.ui_tests","Sun Nov 09 04:03:57 UTC 2025","passed","Sun Nov 09 04:03:57 UTC 2025","TestSignupPage","signup_page_test","",""
"","1504","W.5 Проверка что авторизованный пользователь может выйти из аккаунта","tests.ui_tests","Sun Nov 09 04:05:42 UTC 2025","passed","Sun Nov 09 04:05:43 UTC 2025","TestWorkspacePage","workspace_page_test","",""
"","51","F.6 Проверка шрифта надписи '© PulseWave, 2023-2025' в футере","tests.ui_tests","Sun Nov 09 03:56:09 UTC 2025","passed","Sun Nov 09 03:56:09 UTC 2025","TestFooter","footer_test","",""
"","2854","A.12 DELETE Удалить РП","tests.api_tests","Sun Nov 09 03:43:18 UTC 2025","passed","Sun Nov 09 03:43:20 UTC 2025","TestAPI","api_test","",""
"","0","S.13 Окно регистрации сообщение 'Регистрируясь, я соглашаюсь с Условиями пользования и Политикой конфиденциальности'","tests.ui_tests","Sun Nov 09 04:05:02 UTC 2025","skipped","Sun Nov 09 04:05:02 UTC 2025","TestSignupPage","signup_page_test","",""
"Удаление как из участников так и из приглашенных","2218","A.6 POST Удаление приглашенного пользователей из РП","tests.api_tests","Sun Nov 09 03:43:06 UTC 2025","passed","Sun Nov 09 03:43:08 UTC 2025","TestAPI","api_test","",""
"","555","A.30 POST Создать пользователя с некорректными данными","tests.api_tests","Sun Nov 09 03:44:08 UTC 2025","passed","Sun Nov 09 03:44:09 UTC 2025","TestAPI","api_test","",""
"","351","S.16 Регистрация с корректным email и слабым паролем и подтверждением пароля","tests.ui_tests","Sun Nov 09 04:05:13 UTC 2025","passed","Sun Nov 09 04:05:13 UTC 2025","TestSignupPage","signup_page_test","",""
"","1185","A.2 POST Создать пользователя с корректными данными","tests.api_tests","Sun Nov 09 03:42:06 UTC 2025","passed","Sun Nov 09 03:42:07 UTC 2025","TestAPI","api_test","",""
"","50","F.2 Проверка отсутствия ссылки на Лицензионное соглашение со страницы 'https://pulsewave.ru/","tests.ui_tests","Sun Nov 09 03:46:33 UTC 2025","passed","Sun Nov 09 03:46:33 UTC 2025","TestFooter","footer_test","",""
"","773","W.8 Проверка невидимости кнопки 'Отметить все как прочитанные' в прочитанных уведомлениях","tests.ui_tests","Sun Nov 09 04:06:01 UTC 2025","passed","Sun Nov 09 04:06:02 UTC 2025","TestWorkspacePage","workspace_page_test","",""
"","5833","A.13 POST Подтверждение приглашения в РП","tests.api_tests","Sun Nov 09 03:43:20 UTC 2025","passed","Sun Nov 09 03:43:26 UTC 2025","TestAPI","api_test","",""
"","1726","A.25 DELETE Удалить авторизованного пользователя","tests.api_tests","Sun Nov 09 03:43:51 UTC 2025","passed","Sun Nov 09 03:43:53 UTC 2025","TestAPI","api_test","",""
"","40","S.5 Проверка цвета шрифта заголовка 'Регистрация'","tests.ui_tests","Sun Nov 09 04:04:01 UTC 2025","passed","Sun Nov 09 04:04:01 UTC 2025","TestSignupPage","signup_page_test","",""
"","16460","S.1 Регистрация с корректными email и паролем и с согласием на подписку","tests.ui_tests","Sun Nov 09 04:03:26 UTC 2025","passed","Sun Nov 09 04:03:43 UTC 2025","TestSignupPage","signup_page_test","",""
"","32","H.7 Проверка цвета кнопки 'Войти' в хедере https://app.pulsewave.ru/auth/password?email=","tests.ui_tests","Sun Nov 09 04:01:04 UTC 2025","passed","Sun Nov 09 04:01:04 UTC 2025","TestHeader","header_test","",""
"","3001","F.1 Проверка попапа о принятии файлов cookie на странице https://app.pulsewave.ru/auth/signup","tests.ui_tests","Sun Nov 09 03:45:25 UTC 2025","passed","Sun Nov 09 03:45:28 UTC 2025","TestFooter","footer_test","",""
"","643","W.11 Проверка видимости уведомлений","tests.ui_tests","Sun Nov 09 04:06:20 UTC 2025","passed","Sun Nov 09 04:06:21 UTC 2025","TestWorkspacePage","workspace_page_test","",""
"","47","F.5 Проверка шрифта надписи 'info@pulsewave.ru' в футере","tests.ui_tests","Sun Nov 09 03:52:34 UTC 2025","passed","Sun Nov 09 03:52:35 UTC 2025","TestFooter","footer_test","",""
"","30","H.7 Проверка шрифта кнопки 'Войти' в хедере https://app.pulsewave.ru/auth/password?email=","tests.ui_tests","Sun Nov 09 04:00:58 UTC 2025","passed","Sun Nov 09 04:00:58 UTC 2025","TestHeader","header_test","",""
"","26","H.7 Проверка цвета кнопки 'Войти' в хедере https://app.pulsewave.ru/auth/signup","tests.ui_tests","Sun Nov 09 04:01:01 UTC 2025","passed","Sun Nov 09 04:01:01 UTC 2025","TestHeader","header_test","",""
"","1824","H.2 Проверка редиректа на главную страницу при клике на логотип","tests.ui_tests","Sun Nov 09 04:00:09 UTC 2025","passed","Sun Nov 09 04:00:11 UTC 2025","TestHeader","header_test","",""
"","563","A.30 POST Создать пользователя с некорректными данными","tests.api_tests","Sun Nov 09 03:44:07 UTC 2025","passed","Sun Nov 09 03:44:08 UTC 2025","TestAPI","api_test","",""
"","43","F.5 Проверка размера шрифта надписи 'info@pulsewave.ru' в футере","tests.ui_tests","Sun Nov 09 03:50:19 UTC 2025","passed","Sun Nov 09 03:50:20 UTC 2025","TestFooter","footer_test","",""
"","87","F.3 Проверка элемента 'info@pulsewave.ru'в хедере","tests.ui_tests","Sun Nov 09 03:47:49 UTC 2025","passed","Sun Nov 09 03:47:49 UTC 2025","TestFooter","footer_test","",""
"","26","H.8 Проверка размера шрифта кнопки 'Регистрация в хедере https://app.pulsewave.ru/auth/login'","tests.ui_tests","Sun Nov 09 04:01:07 UTC 2025","passed","Sun Nov 09 04:01:07 UTC 2025","TestHeader","header_test","",""
"","25","H.7 Проверка размера шрифта кнопки 'Войти' в хедере https://app.pulsewave.ru/auth/signup","tests.ui_tests","Sun Nov 09 04:00:41 UTC 2025","passed","Sun Nov 09 04:00:41 UTC 2025","TestHeader","header_test","",""
"","98","F.3 Проверка элемента 'info@pulsewave.ru'в хедере","tests.ui_tests","Sun Nov 09 03:47:51 UTC 2025","passed","Sun Nov 09 03:47:52 UTC 2025","TestFooter","footer_test","",""
"","11627","A.5 POST Повторная отправка ссылки с приглашением пользователя","tests.api_tests","Sun Nov 09 03:42:54 UTC 2025","passed","Sun Nov 09 03:43:06 UTC 2025","TestAPI","api_test","",""
"","57","F.8 Проверка кликабельности значка LinkedIn на странице 'https://app.pulsewave.ru/auth/password?email=' в футере","tests.ui_tests","Sun Nov 09 03:58:43 UTC 2025","passed","Sun Nov 09 03:58:43 UTC 2025","TestFooter","footer_test","",""
"","0","S.15 Окно регистрации сообщение 'Регистрируясь, я соглашаюсь с Условиями пользования и Политикой конфиденциальности', проверка корректности перехода по ссылке 'Условиями пользования'","tests.ui_tests","Sun Nov 09 04:05:02 UTC 2025","skipped","Sun Nov 09 04:05:02 UTC 2025","TestSignupPage","signup_page_test","",""
"","2330","L.4 Авторизация с корректными данными","tests.ui_tests","Sun Nov 09 04:01:59 UTC 2025","passed","Sun Nov 09 04:02:01 UTC 2025","TestLoginPage","login_page_test","",""
"","2315","L.9 Авторизация с логином заглавными буквами","tests.ui_tests","Sun Nov 09 04:02:27 UTC 2025","passed","Sun Nov 09 04:02:29 UTC 2025","TestLoginPage","login_page_test","",""
"","1247","W.12 Проверка прочтения уведомлений","tests.ui_tests","Sun Nov 09 04:06:26 UTC 2025","passed","Sun Nov 09 04:06:28 UTC 2025","TestWorkspacePage","workspace_page_test","",""
"","1406","A.16 POST Создать Рабочее пространство","tests.api_tests","Sun Nov 09 03:43:30 UTC 2025","passed","Sun Nov 09 03:43:32 UTC 2025","TestAPI","api_test","",""
"","33","H.7 Проверка цвета шрифта кнопки 'Войти' в хедере https://app.pulsewave.ru/auth/password?email=","tests.ui_tests","Sun Nov 09 04:00:51 UTC 2025","passed","Sun Nov 09 04:00:51 UTC 2025","TestHeader","header_test","",""
"","2080","R.3  Проверка некликабельности кнопки 'Продолжить'","tests.ui_tests","Sun Nov 09 04:02:45 UTC 2025","passed","Sun Nov 09 04:02:47 UTC 2025","TestPasswordRecoveryPage","password_recovery_test","",""
"","62","M.2 Проверка кликабельности логотипа на лендинге","tests.ui_tests","Sun Nov 09 04:01:35 UTC 2025","passed","Sun Nov 09 04:01:35 UTC 2025","TestLendingPage","lending_test","",""
"","343","S.16 Регистрация с корректным email и слабым паролем и подтверждением пароля","tests.ui_tests","Sun Nov 09 04:05:09 UTC 2025","passed","Sun Nov 09 04:05:10 UTC 2025","TestSignupPage","signup_page_test","",""
"","1941","H.2 Проверка редиректа на главную страницу при клике на логотип","tests.ui_tests","Sun Nov 09 04:00:04 UTC 2025","passed","Sun Nov 09 04:00:05 UTC 2025","TestHeader","header_test","",""
"","586","H.6 Проверка перехода на страницу 'https://app.pulsewave.ru/auth/signup' по кнопке 'Регистрация'","tests.ui_tests","Sun Nov 09 04:00:34 UTC 2025","passed","Sun Nov 09 04:00:35 UTC 2025","TestHeader","header_test","",""
"","1245","R.6 Восстановить пароль на некорректный емайл","tests.ui_tests","Sun Nov 09 04:03:22 UTC 2025","passed","Sun Nov 09 04:03:23 UTC 2025","TestPasswordRecoveryPage","password_recovery_test","",""
"","867","A.1 GET Проверка доступности API","tests.api_tests","Sun Nov 09 03:42:05 UTC 2025","passed","Sun Nov 09 03:42:06 UTC 2025","TestAPI","api_test","",""
"","44","F.5 Проверка шрифта надписи 'info@pulsewave.ru' в футере","tests.ui_tests","Sun Nov 09 03:52:38 UTC 2025","passed","Sun Nov 09 03:52:38 UTC 2025","TestFooter","footer_test","",""
"","32","H.8 Проверка цвета шрифта кнопки 'Регистрация в хедере https://app.pulsewave.ru/auth/password?email='","tests.ui_tests","Sun Nov 09 04:01:16 UTC 2025","passed","Sun Nov 09 04:01:16 UTC 2025","TestHeader","header_test","",""
"","1329","L.5 Авторизация с некорректным паролем","tests.ui_tests","Sun Nov 09 04:02:04 UTC 2025","passed","Sun Nov 09 04:02:05 UTC 2025","TestLoginPage","login_page_test","",""
"","69","S.12 Окно регистрации сообщение 'Я согласен получать новости и обновления PulseWave'","tests.ui_tests","Sun Nov 09 04:05:02 UTC 2025","passed","Sun Nov 09 04:05:02 UTC 2025","TestSignupPage","signup_page_test","",""
"","25","H.8 Проверка шрифта кнопки 'Регистрация в хедере https://app.pulsewave.ru/auth/login'","tests.ui_tests","Sun Nov 09 04:01:19 UTC 2025","passed","Sun Nov 09 04:01:19 UTC 2025","TestHeader","header_test","",""
"","44","R.1 Проверка текста заголовка 'Восстановление пароля'","tests.ui_tests","Sun Nov 09 04:02:32 UTC 2025","passed","Sun Nov 09 04:02:32 UTC 2025","TestPasswordRecoveryPage","password_recovery_test","",""
"Пользователи добавляются по одному. Если пользователя не существует, он будет создан","8792","A.4 POST Пригласить пользователя по email","tests.api_tests","Sun Nov 09 03:42:46 UTC 2025","passed","Sun Nov 09 03:42:54 UTC 2025","TestAPI","api_test","",""
"","63","F.9 Проверка перехода в LinkedIn на странице 'https://app.pulsewave.ru/auth/password?email=' в футере","tests.ui_tests","Sun Nov 09 03:59:55 UTC 2025","passed","Sun Nov 09 03:59:55 UTC 2025","TestFooter","footer_test","",""
"","2140","A.9 GET Получить список всех Рабочих пространств авторизованного пользователя","tests.api_tests","Sun Nov 09 03:43:10 UTC 2025","passed","Sun Nov 09 03:43:12 UTC 2025","TestAPI","api_test","",""
"","41","F.2 Проверка отсутствия ссылки на Лицензионное соглашение со страницы 'https://app.pulsewave.ru/auth/login","tests.ui_tests","Sun Nov 09 03:46:36 UTC 2025","passed","Sun Nov 09 03:46:37 UTC 2025","TestFooter","footer_test","",""
