"Status","Start Time","Stop Time","Duration in ms","Parent Suite","Suite","Sub Suite","Test Class","Test Method","Name","Description"
"passed","Sat May 25 02:29:05 GMT 2024","Sat May 25 02:29:05 GMT 2024","32","tests.test_footer","test_footer","TestFooter","","","Проверка шрифта ссылки 'Условия пользования' в футере",""
"passed","Sat May 25 02:37:20 GMT 2024","Sat May 25 02:37:20 GMT 2024","3","tests.test_workspace_page","test_workspace_page","TestWorkspacePage","","","Проверка заголовка рабочего пространства",""
"passed","Sat May 25 02:30:26 GMT 2024","Sat May 25 02:30:26 GMT 2024","58","tests.test_header","test_header","TestHeader","","","1.13 Проверка редиректа на главную страницу при клике на логотип",""
"passed","Sat May 25 02:32:43 GMT 2024","Sat May 25 02:32:46 GMT 2024","2782","tests.test_login_page","test_login_page","TestLoginPage","","","Авторизация с некорректным паролем",""
"passed","Sat May 25 02:24:46 GMT 2024","Sat May 25 02:24:57 GMT 2024","10407","tests.test_api","test_api","TestAPI","","","GET Получение комментария",""
"passed","Sat May 25 02:22:47 GMT 2024","Sat May 25 02:22:55 GMT 2024","8265","tests.test_api","test_api","TestAPI","","","PATCH Частично обновить колонку (название/порядковый номер)",""
"passed","Sat May 25 02:30:23 GMT 2024","Sat May 25 02:30:23 GMT 2024","29","tests.test_header","test_header","TestHeader","","","Проверка некликабельности логотипа на Главной странице",""
"passed","Sat May 25 02:21:00 GMT 2024","Sat May 25 02:21:04 GMT 2024","3815","tests.test_api","test_api","TestAPI","","","Проверка недействительности кеша доски",""
"passed","Sat May 25 02:34:13 GMT 2024","Sat May 25 02:34:13 GMT 2024","34","tests.test_main_page","test_main_page","TestMainPage","","","Проверка шрифта элемента 'Одно приложениe для решения всех Ваших задач!' в футере",""
"passed","Sat May 25 02:28:44 GMT 2024","Sat May 25 02:28:44 GMT 2024","33","tests.test_footer","test_footer","TestFooter","","","Проверка размера шрифта ссылки 'Условия пользования' в футере",""
"passed","Sat May 25 02:27:10 GMT 2024","Sat May 25 02:27:14 GMT 2024","3078","tests.test_api","test_api","TestAPI","","","DELETE Удалить авторизованного пользователя",""
"passed","Sat May 25 02:21:46 GMT 2024","Sat May 25 02:21:50 GMT 2024","3820","tests.test_api","test_api","TestAPI","","","GET Список всех досок указанного РП",""
"passed","Sat May 25 02:32:05 GMT 2024","Sat May 25 02:32:05 GMT 2024","36","tests.test_header","test_header","TestHeader","","","Проверка шрифта кнопки 'Регистрация в хедере https://pulsewave.ru/'",""
"passed","Sat May 25 02:32:26 GMT 2024","Sat May 25 02:32:26 GMT 2024","34","tests.test_login_page","test_login_page","TestLoginPage","","","Проверка размера шрифта заголовка 'Войти'",""
"passed","Sat May 25 02:24:22 GMT 2024","Sat May 25 02:24:24 GMT 2024","1930","tests.test_api","test_api","TestAPI","","","PATCH Отметить прочтение всех уведомлений",""
"passed","Sat May 25 02:20:54 GMT 2024","Sat May 25 02:20:57 GMT 2024","3326","tests.test_api","test_api","TestAPI","","","POST Повторная отправка ссылки с приглашением пользователя",""
"passed","Sat May 25 02:30:59 GMT 2024","Sat May 25 02:30:59 GMT 2024","59","tests.test_header","test_header","TestHeader","","","Проверка перехода на страницу 'https://pulsewave.ru/auth/login' по кнопке 'Войти'",""
"passed","Sat May 25 02:26:20 GMT 2024","Sat May 25 02:26:22 GMT 2024","1872","tests.test_api","test_api","TestAPI","","","GET Получить данные авторизованного пользователя me",""
"passed","Sat May 25 02:26:36 GMT 2024","Sat May 25 02:26:49 GMT 2024","12946","tests.test_api","test_api","TestAPI","","","POST Запрос на смену почты",""
"passed","Sat May 25 02:34:59 GMT 2024","Sat May 25 02:35:15 GMT 2024","16250","tests.test_password_recovery","test_password_recovery","TestPasswordRecoveryPage","","","3.2, 3.2.1 Восстановить пароль на корректный емайл",""
"passed","Sat May 25 02:21:12 GMT 2024","Sat May 25 02:21:16 GMT 2024","4224","tests.test_api","test_api","TestAPI","","","GET Информация о конкретном рабочем пространстве",""
"passed","Sat May 25 02:27:51 GMT 2024","Sat May 25 02:27:53 GMT 2024","2691","tests.test_footer","test_footer","TestFooter","","","Проверка попапа о принятии файлов cookie на странице https://pulsewave.ru/auth/signup",""
"passed","Sat May 25 02:33:40 GMT 2024","Sat May 25 02:33:40 GMT 2024","36","tests.test_main_page","test_main_page","TestMainPage","","","Проверка размера шрифта элемента 'Самый высокий уровень бесперебойной работы!' в футере",""
"passed","Sat May 25 02:29:56 GMT 2024","Sat May 25 02:29:56 GMT 2024","33","tests.test_footer","test_footer","TestFooter","","","Проверка размера шрифта надписи '© PulseWave, 2023-2024' в футере",""
"passed","Sat May 25 02:30:41 GMT 2024","Sat May 25 02:30:41 GMT 2024","36","tests.test_header","test_header","TestHeader","","","Проверка текста кнопки 'Войти'",""
"passed","Sat May 25 02:23:04 GMT 2024","Sat May 25 02:23:12 GMT 2024","8441","tests.test_api","test_api","TestAPI","","","GET Список всех задач колонки",""
"passed","Sat May 25 02:24:35 GMT 2024","Sat May 25 02:24:46 GMT 2024","11454","tests.test_api","test_api","TestAPI","","","DELETE Удалить комментарий",""
"passed","Sat May 25 02:30:20 GMT 2024","Sat May 25 02:30:20 GMT 2024","32","tests.test_footer","test_footer","TestFooter","","","Проверка шрифта надписи '© PulseWave, 2023-2024' в футере",""
"passed","Sat May 25 02:21:10 GMT 2024","Sat May 25 02:21:12 GMT 2024","1793","tests.test_api","test_api","TestAPI","","","GET Получить список всех Рабочих пространств авторизованного пользователя",""
"passed","Sat May 25 02:37:10 GMT 2024","Sat May 25 02:37:10 GMT 2024","268","tests.test_signup_page","test_signup_page","TestSignupPage","","","1.31- 1.34 Регистрация с корректным email и слабым паролем и подтверждением пароля",""
"passed","Sat May 25 02:36:38 GMT 2024","Sat May 25 02:36:40 GMT 2024","2242","tests.test_signup_page","test_signup_page","TestSignupPage","","","1.25 Регистрация с корректным email и подтверждением пароля и пустым паролем",""
"passed","Sat May 25 02:33:43 GMT 2024","Sat May 25 02:33:43 GMT 2024","36","tests.test_main_page","test_main_page","TestMainPage","","","Проверка цвета шрифта элемента 'Самый высокий уровень бесперебойной работы!' в футере",""
"skipped","Sat May 25 02:24:57 GMT 2024","Sat May 25 02:25:09 GMT 2024","11823","tests.test_api","test_api","TestAPI","","","GET Список стикеров задачи",""
"passed","Sat May 25 02:21:08 GMT 2024","Sat May 25 02:21:10 GMT 2024","1775","tests.test_api","test_api","TestAPI","","","POST Создать пару токенов access и refresh",""
"passed","Sat May 25 02:21:59 GMT 2024","Sat May 25 02:22:05 GMT 2024","6143","tests.test_api","test_api","TestAPI","","","PUT Обновить доску",""
"passed","Sat May 25 02:28:38 GMT 2024","Sat May 25 02:28:38 GMT 2024","34","tests.test_footer","test_footer","TestFooter","","","Проверка размера шрифта ссылки 'Условия пользования' в футере",""
"skipped","Sat May 25 02:25:30 GMT 2024","Sat May 25 02:25:40 GMT 2024","10591","tests.test_api","test_api","TestAPI","","","PUT Обновить стикер",""
"passed","Sat May 25 02:35:50 GMT 2024","Sat May 25 02:35:50 GMT 2024","35","tests.test_signup_page","test_signup_page","TestSignupPage","","","1.16 Проверка текста заголовка 'Регистрация'",""
"passed","Sat May 25 02:26:34 GMT 2024","Sat May 25 02:26:36 GMT 2024","1956","tests.test_api","test_api","TestAPI","","","PUT Обновить все данные авторизованного пользователя me",""
"passed","Sat May 25 02:22:37 GMT 2024","Sat May 25 02:22:47 GMT 2024","9401","tests.test_api","test_api","TestAPI","","","PUT Обновить колонку (название и порядковый номер)",""
"passed","Sat May 25 02:36:48 GMT 2024","Sat May 25 02:36:48 GMT 2024","56","tests.test_signup_page","test_signup_page","TestSignupPage","","","1.27 Окно регистрации сообщение 'Я согласен получать новости и обновления PulseWave'",""
"passed","Sat May 25 02:34:07 GMT 2024","Sat May 25 02:34:07 GMT 2024","33","tests.test_main_page","test_main_page","TestMainPage","","","Проверка размера шрифта элемента 'Одно приложениe для решения всех Ваших задач!' в футере",""
"passed","Sat May 25 02:33:06 GMT 2024","Sat May 25 02:33:06 GMT 2024","62","tests.test_main_page","test_main_page","TestMainPage","","","1.1 Проверка перехода на страницу https://pulsewave.ru/auth/signup по кнопке 'Зарегистрироваться'",""
"passed","Sat May 25 02:29:08 GMT 2024","Sat May 25 02:29:08 GMT 2024","33","tests.test_footer","test_footer","TestFooter","","","Проверка шрифта ссылки 'Условия пользования' в футере",""
"passed","Sat May 25 02:29:32 GMT 2024","Sat May 25 02:29:32 GMT 2024","34","tests.test_footer","test_footer","TestFooter","","","Проверка цвета шрифта надписи 'info@pulsewave.ru' в футере",""
"passed","Sat May 25 02:31:08 GMT 2024","Sat May 25 02:31:08 GMT 2024","62","tests.test_header","test_header","TestHeader","","","1.2 Проверка перехода на страницу 'https://pulsewave.ru/auth/signup' по кнопке 'Регистрация'",""
"passed","Sat May 25 02:32:32 GMT 2024","Sat May 25 02:32:32 GMT 2024","32","tests.test_login_page","test_login_page","TestLoginPage","","","Проверка шрифта заголовка 'Войти'",""
"passed","Sat May 25 02:26:15 GMT 2024","Sat May 25 02:26:18 GMT 2024","3234","tests.test_api","test_api","TestAPI","","","POST Обновить JWT access_token авторизованного пользователя",""
"passed","Sat May 25 02:29:29 GMT 2024","Sat May 25 02:29:29 GMT 2024","32","tests.test_footer","test_footer","TestFooter","","","Проверка цвета шрифта надписи 'info@pulsewave.ru' в футере",""
"passed","Sat May 25 02:33:37 GMT 2024","Sat May 25 02:33:37 GMT 2024","35","tests.test_main_page","test_main_page","TestMainPage","","","Проверка шрифта элемента 'Удобный и понятный интерфейс!' в футере",""
"passed","Sat May 25 02:33:31 GMT 2024","Sat May 25 02:33:31 GMT 2024","36","tests.test_main_page","test_main_page","TestMainPage","","","Проверка размера шрифта элемента 'Удобный и понятный интерфейс!' в футере",""
"passed","Sat May 25 02:33:10 GMT 2024","Sat May 25 02:33:10 GMT 2024","34","tests.test_main_page","test_main_page","TestMainPage","","","Проверка размера шрифта элемента 'PULSEWAVE'",""
"passed","Sat May 25 02:28:56 GMT 2024","Sat May 25 02:28:56 GMT 2024","33","tests.test_footer","test_footer","TestFooter","","","Проверка цвета шрифта ссылки 'Условия пользования' в футере",""
"passed","Sat May 25 02:30:05 GMT 2024","Sat May 25 02:30:05 GMT 2024","36","tests.test_footer","test_footer","TestFooter","","","Проверка цвета шрифта надписи '© PulseWave, 2023-2024' в футере",""
"passed","Sat May 25 02:33:13 GMT 2024","Sat May 25 02:33:13 GMT 2024","35","tests.test_main_page","test_main_page","TestMainPage","","","Проверка цвета шрифта элемента 'PULSEWAVE'",""
"passed","Sat May 25 02:36:43 GMT 2024","Sat May 25 02:36:45 GMT 2024","2232","tests.test_signup_page","test_signup_page","TestSignupPage","","","1.26 Регистрация с пустым email и сильным паролем и подтверждением пароля",""
"passed","Sat May 25 02:28:17 GMT 2024","Sat May 25 02:28:17 GMT 2024","60","tests.test_footer","test_footer","TestFooter","","","Проверка элемента 'info@pulsewave.ru'в хедере",""
"passed","Sat May 25 02:36:51 GMT 2024","Sat May 25 02:36:51 GMT 2024","54","tests.test_signup_page","test_signup_page","TestSignupPage","","","1.28 Окно регистрации сообщение 'Регистрируясь, я соглашаюсь с Условиями пользования и Политикой конфиденциальности'",""
"passed","Sat May 25 02:28:26 GMT 2024","Sat May 25 02:28:26 GMT 2024","35","tests.test_footer","test_footer","TestFooter","","","Проверка года © PulseWave, 2024 в хедере",""
"passed","Sat May 25 02:37:24 GMT 2024","Sat May 25 02:37:24 GMT 2024","9","tests.test_workspace_page","test_workspace_page","TestWorkspacePage","","","Проверка видимости аватара",""
"passed","Sat May 25 02:33:01 GMT 2024","Sat May 25 02:33:03 GMT 2024","2189","tests.test_login_page","test_login_page","TestLoginPage","","","Авторизация с пустым паролем",""
"passed","Sat May 25 02:34:40 GMT 2024","Sat May 25 02:34:40 GMT 2024","33","tests.test_password_recovery","test_password_recovery","TestPasswordRecoveryPage","","","Проверка размера шрифта заголовка 'Восстановление пароля'",""
"passed","Sat May 25 02:24:13 GMT 2024","Sat May 25 02:24:15 GMT 2024","2065","tests.test_api","test_api","TestAPI","","","POST Создать Рабочее пространство",""
"passed","Sat May 25 02:27:14 GMT 2024","Sat May 25 02:27:14 GMT 2024","600","tests.test_api","test_api","TestAPI","","","POST Регистрация пользователя без электронной почты",""
"passed","Sat May 25 02:24:17 GMT 2024","Sat May 25 02:24:20 GMT 2024","2700","tests.test_api","test_api","TestAPI","","","PATCH Отметить прочтение уведомления",""
"passed","Sat May 25 02:29:17 GMT 2024","Sat May 25 02:29:17 GMT 2024","33","tests.test_footer","test_footer","TestFooter","","","Проверка размера шрифта надписи 'info@pulsewave.ru' в футере",""
"passed","Sat May 25 02:31:35 GMT 2024","Sat May 25 02:31:35 GMT 2024","34","tests.test_header","test_header","TestHeader","","","Проверка шрифта кнопки 'Войти' в хедере https://pulsewave.ru/auth/password?email=",""
"passed","Sat May 25 02:22:29 GMT 2024","Sat May 25 02:22:37 GMT 2024","8315","tests.test_api","test_api","TestAPI","","","GET Информация о конкретной колонке",""
"passed","Sat May 25 02:28:03 GMT 2024","Sat May 25 02:28:03 GMT 2024","135","tests.test_footer","test_footer","TestFooter","","","Проверка перехода на страницу c лицензионным соглашением со страницы 'https://pulsewave.ru/auth/login",""
"passed","Sat May 25 02:22:17 GMT 2024","Sat May 25 02:22:23 GMT 2024","5637","tests.test_api","test_api","TestAPI","","","POST Создать колонку на доске",""
"passed","Sat May 25 02:30:38 GMT 2024","Sat May 25 02:30:38 GMT 2024","36","tests.test_header","test_header","TestHeader","","","Проверка текста кнопки 'Войти'",""
"passed","Sat May 25 02:37:03 GMT 2024","Sat May 25 02:37:04 GMT 2024","266","tests.test_signup_page","test_signup_page","TestSignupPage","","","1.31- 1.34 Регистрация с корректным email и слабым паролем и подтверждением пароля",""
"skipped","Sat May 25 02:25:40 GMT 2024","Sat May 25 02:25:51 GMT 2024","10751","tests.test_api","test_api","TestAPI","","","PATCH Частично обновить стикер {'name': 'Amanda'}",""
"passed","Sat May 25 02:35:42 GMT 2024","Sat May 25 02:35:43 GMT 2024","268","tests.test_signup_page","test_signup_page","TestSignupPage","","","1.6 Регистрация с корректным email и не совпадающими паролем и подтверждением пароля",""
"passed","Sat May 25 02:24:15 GMT 2024","Sat May 25 02:24:17 GMT 2024","2257","tests.test_api","test_api","TestAPI","","","GET Список уведомлений текущего пользователя",""
"passed","Sat May 25 02:27:15 GMT 2024","Sat May 25 02:27:27 GMT 2024","12074","tests.test_api","test_api","TestAPI","","","POST Регистрация пользователя без подтверждения подписки",""
"passed","Sat May 25 02:31:02 GMT 2024","Sat May 25 02:31:02 GMT 2024","65","tests.test_header","test_header","TestHeader","","","1.2 Проверка перехода на страницу 'https://pulsewave.ru/auth/signup' по кнопке 'Регистрация'",""
"passed","Sat May 25 02:28:14 GMT 2024","Sat May 25 02:28:15 GMT 2024","61","tests.test_footer","test_footer","TestFooter","","","Проверка элемента 'info@pulsewave.ru'в хедере",""
"passed","Sat May 25 02:21:16 GMT 2024","Sat May 25 02:21:20 GMT 2024","4118","tests.test_api","test_api","TestAPI","","","PUT Обновить все данные РП (на данный момент только имя)",""
"passed","Sat May 25 02:32:49 GMT 2024","Sat May 25 02:32:49 GMT 2024","46","tests.test_login_page","test_login_page","TestLoginPage","","","Окно авторизации сообщение 'Забыли пароль?'",""
"passed","Sat May 25 02:28:50 GMT 2024","Sat May 25 02:28:50 GMT 2024","33","tests.test_footer","test_footer","TestFooter","","","Проверка цвета шрифта ссылки 'Условия пользования' в футере",""
"skipped","Sat May 25 02:25:19 GMT 2024","Sat May 25 02:25:30 GMT 2024","10237","tests.test_api","test_api","TestAPI","","","GET Представление одного стикера",""
"passed","Sat May 25 02:28:53 GMT 2024","Sat May 25 02:28:53 GMT 2024","33","tests.test_footer","test_footer","TestFooter","","","Проверка цвета шрифта ссылки 'Условия пользования' в футере",""
"passed","Sat May 25 02:33:58 GMT 2024","Sat May 25 02:33:58 GMT 2024","33","tests.test_main_page","test_main_page","TestMainPage","","","Проверка размера шрифта элемента 'Неограниченный функционал, понятный интерфейс и большое количество возможностей
помогут Вам улучшить рабочий процесс.' в футере",""
"passed","Sat May 25 02:28:47 GMT 2024","Sat May 25 02:28:47 GMT 2024","33","tests.test_footer","test_footer","TestFooter","","","Проверка цвета шрифта ссылки 'Условия пользования' в футере",""
"passed","Sat May 25 02:33:19 GMT 2024","Sat May 25 02:33:19 GMT 2024","34","tests.test_main_page","test_main_page","TestMainPage","","","Проверка размера шрифта кнопки 'Зарегистрироваться'",""
"passed","Sat May 25 02:37:44 GMT 2024","Sat May 25 02:37:44 GMT 2024","31","tests.test_workspace_page","test_workspace_page","TestWorkspacePage","","","Проверка видимости заголовка 'Ваши рабочие пространства'",""
"passed","Sat May 25 02:32:52 GMT 2024","Sat May 25 02:32:53 GMT 2024","1227","tests.test_login_page","test_login_page","TestLoginPage","","","Авторизация с некорректным емайл",""
"passed","Sat May 25 02:31:17 GMT 2024","Sat May 25 02:31:17 GMT 2024","33","tests.test_header","test_header","TestHeader","","","Проверка размера шрифта кнопки 'Войти' в хедере https://pulsewave.ru/auth/password?email=",""
"passed","Sat May 25 02:21:53 GMT 2024","Sat May 25 02:21:59 GMT 2024","5740","tests.test_api","test_api","TestAPI","","","GET Информация о конкретной доске",""
"passed","Sat May 25 02:22:11 GMT 2024","Sat May 25 02:22:13 GMT 2024","2143","tests.test_api","test_api","TestAPI","","","POST Создать доску без указания РП","Создание доски без указания РП, будет создано дефолтное РП для этой доски"
"passed","Sat May 25 02:30:11 GMT 2024","Sat May 25 02:30:11 GMT 2024","34","tests.test_footer","test_footer","TestFooter","","","Проверка шрифта надписи '© PulseWave, 2023-2024' в футере",""
"passed","Sat May 25 02:22:23 GMT 2024","Sat May 25 02:22:29 GMT 2024","6038","tests.test_api","test_api","TestAPI","","","GET Список всех колонок доски",""
"passed","Sat May 25 02:33:34 GMT 2024","Sat May 25 02:33:34 GMT 2024","37","tests.test_main_page","test_main_page","TestMainPage","","","Проверка цвета шрифта элемента 'Удобный и понятный интерфейс!' в футере",""
"passed","Sat May 25 02:21:28 GMT 2024","Sat May 25 02:21:46 GMT 2024","17605","tests.test_api","test_api","TestAPI","","","POST Подтверждение приглашения в РП",""
"passed","Sat May 25 02:26:26 GMT 2024","Sat May 25 02:26:30 GMT 2024","4117","tests.test_api","test_api","TestAPI","","","PUT Обновить все данные авторизованного пользователя по id",""
"passed","Sat May 25 02:31:44 GMT 2024","Sat May 25 02:31:44 GMT 2024","33","tests.test_header","test_header","TestHeader","","","Проверка цвета кнопки 'Войти' в хедере https://pulsewave.ru/auth/password?email=",""
"passed","Sat May 25 02:34:43 GMT 2024","Sat May 25 02:34:43 GMT 2024","34","tests.test_password_recovery","test_password_recovery","TestPasswordRecoveryPage","","","Проверка цвета шрифта заголовка 'Восстановление пароля'",""
"skipped","Sat May 25 02:26:02 GMT 2024","Sat May 25 02:26:13 GMT 2024","11065","tests.test_api","test_api","TestAPI","","","DELETE Удалить стикер",""
"passed","Sat May 25 02:37:00 GMT 2024","Sat May 25 02:37:00 GMT 2024","267","tests.test_signup_page","test_signup_page","TestSignupPage","","","1.31- 1.34 Регистрация с корректным email и слабым паролем и подтверждением пароля",""
"passed","Sat May 25 02:35:53 GMT 2024","Sat May 25 02:35:53 GMT 2024","33","tests.test_signup_page","test_signup_page","TestSignupPage","","","1.17-1.19 Проверка размера шрифта заголовка 'Регистрация'",""
"passed","Sat May 25 02:32:20 GMT 2024","Sat May 25 02:32:20 GMT 2024","33","tests.test_header","test_header","TestHeader","","","Проверка цвета кнопки 'Регистрация в хедере https://pulsewave.ru/auth/password?email='",""
"passed","Sat May 25 02:32:29 GMT 2024","Sat May 25 02:32:29 GMT 2024","33","tests.test_login_page","test_login_page","TestLoginPage","","","Проверка цвета шрифта заголовка 'Войти'",""
"passed","Sat May 25 02:23:22 GMT 2024","Sat May 25 02:23:35 GMT 2024","12375","tests.test_api","test_api","TestAPI","","","PUT Обновить задачу","Для перемещения между колонок нужно передать column - id новой колонки и index - куда ее вставить"
"passed","Sat May 25 02:32:08 GMT 2024","Sat May 25 02:32:08 GMT 2024","32","tests.test_header","test_header","TestHeader","","","Проверка шрифта кнопки 'Регистрация в хедере https://pulsewave.ru/auth/login'",""
"passed","Sat May 25 02:24:24 GMT 2024","Sat May 25 02:24:35 GMT 2024","10570","tests.test_api","test_api","TestAPI","","","POST Создать комментарий",""
"passed","Sat May 25 02:27:06 GMT 2024","Sat May 25 02:27:10 GMT 2024","4873","tests.test_api","test_api","TestAPI","","","POST Подтверждение сброса пароля. Когда пользователь переходит по ссылке     auth/password/reset/confirm/{uid}/{token}",""
"passed","Sat May 25 02:34:28 GMT 2024","Sat May 25 02:34:28 GMT 2024","39","tests.test_main_page","test_main_page","TestMainPage","","","Проверка текста элемента 'Ваша безопасность и конфиденциальность для нас на первом месте!'",""
"passed","Sat May 25 02:28:41 GMT 2024","Sat May 25 02:28:41 GMT 2024","33","tests.test_footer","test_footer","TestFooter","","","Проверка размера шрифта ссылки 'Условия пользования' в футере",""
