"Status","Start Time","Stop Time","Duration in ms","Parent Suite","Suite","Sub Suite","Test Class","Test Method","Name","Description"
"passed","Sat May 25 02:27:27 GMT 2024","Sat May 25 02:27:43 GMT 2024","16308","tests.test_api","test_api","TestAPI","","","DELETE Активировать и удалить авторизованного пользователя",""
"passed","Sat May 25 02:33:28 GMT 2024","Sat May 25 02:33:28 GMT 2024","34","tests.test_main_page","test_main_page","TestMainPage","","","Проверка цвета кнопки 'Зарегистрироваться'",""
"passed","Sat May 25 02:31:53 GMT 2024","Sat May 25 02:31:53 GMT 2024","32","tests.test_header","test_header","TestHeader","","","Проверка размера шрифта кнопки 'Регистрация в хедере https://pulsewave.ru/auth/password?email='",""
"passed","Sat May 25 02:37:15 GMT 2024","Sat May 25 02:37:15 GMT 2024","2","tests.test_workspace_page","test_workspace_page","TestWorkspacePage","","","Проверка перехода в рабочее пространство авторизованного пользователя",""
"passed","Sat May 25 02:31:29 GMT 2024","Sat May 25 02:31:29 GMT 2024","34","tests.test_header","test_header","TestHeader","","","Проверка шрифта кнопки 'Войти' в хедере https://pulsewave.ru/",""
"passed","Sat May 25 02:37:29 GMT 2024","Sat May 25 02:37:29 GMT 2024","2","tests.test_workspace_page","test_workspace_page","TestWorkspacePage","","","Проверка что авторизованный пользователь попадает в Рабочие пространства",""
"passed","Sat May 25 02:29:44 GMT 2024","Sat May 25 02:29:44 GMT 2024","33","tests.test_footer","test_footer","TestFooter","","","Проверка шрифта надписи 'info@pulsewave.ru' в футере",""
"passed","Sat May 25 02:30:53 GMT 2024","Sat May 25 02:30:53 GMT 2024","64","tests.test_header","test_header","TestHeader","","","Проверка перехода на страницу 'https://pulsewave.ru/auth/login' по кнопке 'Войти'",""
"passed","Sat May 25 02:33:52 GMT 2024","Sat May 25 02:33:52 GMT 2024","37","tests.test_main_page","test_main_page","TestMainPage","","","Проверка цвета шрифта элемента 'Ваша безопасность и конфиденциальность для нас на первом месте!' в футере",""
"passed","Sat May 25 02:29:14 GMT 2024","Sat May 25 02:29:14 GMT 2024","32","tests.test_footer","test_footer","TestFooter","","","Проверка размера шрифта надписи 'info@pulsewave.ru' в футере",""
"passed","Sat May 25 02:26:30 GMT 2024","Sat May 25 02:26:34 GMT 2024","3907","tests.test_api","test_api","TestAPI","","","PATCH Частично обновить данные авторизованного пользователя",""
"passed","Sat May 25 02:31:47 GMT 2024","Sat May 25 02:31:47 GMT 2024","35","tests.test_header","test_header","TestHeader","","","Проверка размера шрифта кнопки 'Регистрация в хедере https://pulsewave.ru/'",""
"passed","Sat May 25 02:31:59 GMT 2024","Sat May 25 02:31:59 GMT 2024","33","tests.test_header","test_header","TestHeader","","","Проверка цвета шрифта кнопки 'Регистрация в хедере https://pulsewave.ru/auth/login'",""
"passed","Sat May 25 02:34:04 GMT 2024","Sat May 25 02:34:04 GMT 2024","34","tests.test_main_page","test_main_page","TestMainPage","","","Проверка шрифта элемента 'Неограниченный функционал, понятный интерфейс и большое количество возможностей
помогут Вам улучшить рабочий процесс.' в футере",""
"passed","Sat May 25 02:30:08 GMT 2024","Sat May 25 02:30:08 GMT 2024","34","tests.test_footer","test_footer","TestFooter","","","Проверка цвета шрифта надписи '© PulseWave, 2023-2024' в футере",""
"passed","Sat May 25 02:36:05 GMT 2024","Sat May 25 02:36:05 GMT 2024","255","tests.test_signup_page","test_signup_page","TestSignupPage","","","1.21, 1.22 Регистрация с некорректным email и сильным паролем и подтверждением пароля",""
"passed","Sat May 25 02:35:46 GMT 2024","Sat May 25 02:35:47 GMT 2024","1289","tests.test_signup_page","test_signup_page","TestSignupPage","","","1.11 Регистрация с уже зарегистрированным email и корректными паролем и подтверждением пароля",""
"passed","Sat May 25 02:23:47 GMT 2024","Sat May 25 02:23:58 GMT 2024","10332","tests.test_api","test_api","TestAPI","","","DELETE Удалить задачу",""
"passed","Sat May 25 02:33:22 GMT 2024","Sat May 25 02:33:22 GMT 2024","33","tests.test_main_page","test_main_page","TestMainPage","","","Проверка цвета шрифта кнопки 'Зарегистрироваться'",""
"passed","Sat May 25 02:34:49 GMT 2024","Sat May 25 02:34:51 GMT 2024","2073","tests.test_password_recovery","test_password_recovery","TestPasswordRecoveryPage","","","3.4 Проверка некликабельности кнопки 'Продолжить'",""
"passed","Sat May 25 02:27:44 GMT 2024","Sat May 25 02:27:48 GMT 2024","3676","tests.test_footer","test_footer","TestFooter","","","Проверка попапа о принятии файлов cookie на странице https://pulsewave.ru/",""
"passed","Sat May 25 02:31:14 GMT 2024","Sat May 25 02:31:14 GMT 2024","32","tests.test_header","test_header","TestHeader","","","Проверка размера шрифта кнопки 'Войти' в хедере https://pulsewave.ru/auth/signup",""
"passed","Sat May 25 02:30:32 GMT 2024","Sat May 25 02:30:32 GMT 2024","60","tests.test_header","test_header","TestHeader","","","1.13 Проверка редиректа на главную страницу при клике на логотип",""
"passed","Sat May 25 02:34:10 GMT 2024","Sat May 25 02:34:10 GMT 2024","33","tests.test_main_page","test_main_page","TestMainPage","","","Проверка цвета шрифта элемента 'Одно приложениe для решения всех Ваших задач!' в футере",""
"passed","Sat May 25 02:27:48 GMT 2024","Sat May 25 02:27:50 GMT 2024","2659","tests.test_footer","test_footer","TestFooter","","","Проверка попапа о принятии файлов cookie на странице https://pulsewave.ru/auth/login",""
"passed","Sat May 25 02:37:07 GMT 2024","Sat May 25 02:37:07 GMT 2024","268","tests.test_signup_page","test_signup_page","TestSignupPage","","","1.31- 1.34 Регистрация с корректным email и слабым паролем и подтверждением пароля",""
