"DESCRIPTION","DURATION IN MS","NAME","PARENT SUITE","START TIME","STATUS","STOP TIME","SUB SUITE","SUITE","TEST CLASS","TEST METHOD"
"","12887","R.4 Проверить сообщение об отправке ссылки восстановления пароля на емайл","tests.ui_tests","Thu Nov 13 05:25:57 UTC 2025","passed","Thu Nov 13 05:26:10 UTC 2025","TestPasswordRecoveryPage","password_recovery_test","",""
"","44","F.6 Проверка шрифта надписи '© PulseWave, 2023-2025' в футере","tests.ui_tests","Thu Nov 13 05:18:46 UTC 2025","passed","Thu Nov 13 05:18:46 UTC 2025","TestFooter","footer_test","",""
"","58","F.8 Проверка кликабельности значка LinkedIn на странице 'https://app.pulsewave.ru/auth/signup' в футере","tests.ui_tests","Thu Nov 13 05:21:20 UTC 2025","passed","Thu Nov 13 05:21:20 UTC 2025","TestFooter","footer_test","",""
"","50","F.6 Проверка размера шрифта надписи '© PulseWave, 2023-2025' в футере","tests.ui_tests","Thu Nov 13 05:16:17 UTC 2025","passed","Thu Nov 13 05:16:17 UTC 2025","TestFooter","footer_test","",""
"","365","S.6 Окно регистрации сообщение 'Слабый пароль. Пароль должен содержать минимум 8 символов, включая буквы и цифры'","tests.ui_tests","Thu Nov 13 05:27:14 UTC 2025","passed","Thu Nov 13 05:27:15 UTC 2025","TestSignupPage","signup_page_test","",""
"","1655","A.16 POST Создать Рабочее пространство","tests.api_tests","Thu Nov 13 05:05:31 UTC 2025","passed","Thu Nov 13 05:05:33 UTC 2025","TestAPI","api_test","",""
"","653","A.7 POST Регистрация ранее зарегистрированного пользователя","tests.api_tests","Thu Nov 13 05:05:06 UTC 2025","passed","Thu Nov 13 05:05:07 UTC 2025","TestAPI","api_test","",""
"","44","F.5 Проверка шрифта надписи 'info@pulsewave.ru' в футере","tests.ui_tests","Thu Nov 13 05:15:06 UTC 2025","passed","Thu Nov 13 05:15:06 UTC 2025","TestFooter","footer_test","",""
"","3550","F.1 Проверка попапа о принятии файлов cookie на странице https://app.pulsewave.ru/auth/signup","tests.ui_tests","Thu Nov 13 05:07:41 UTC 2025","passed","Thu Nov 13 05:07:44 UTC 2025","TestFooter","footer_test","",""
"","595","H.6 Проверка перехода на страницу 'https://app.pulsewave.ru/auth/signup' по кнопке 'Регистрация'","tests.ui_tests","Thu Nov 13 05:23:26 UTC 2025","passed","Thu Nov 13 05:23:26 UTC 2025","TestHeader","header_test","",""
"","649","A.26 POST Регистрация пользователя без электронной почты","tests.api_tests","Thu Nov 13 05:06:14 UTC 2025","passed","Thu Nov 13 05:06:14 UTC 2025","TestAPI","api_test","",""
"","25","H.7 Проверка цвета шрифта кнопки 'Войти' в хедере https://app.pulsewave.ru/auth/signup","tests.ui_tests","Thu Nov 13 05:23:37 UTC 2025","passed","Thu Nov 13 05:23:37 UTC 2025","TestHeader","header_test","",""
"","0","S.14 Окно регистрации сообщение 'Регистрируясь, я соглашаюсь с Условиями пользования и Политикой конфиденциальности' проверка корректности перехода по ссылке 'Политикой конфиденциальности'","tests.ui_tests","Thu Nov 13 05:27:59 UTC 2025","skipped","Thu Nov 13 05:27:59 UTC 2025","TestSignupPage","signup_page_test","",""
"","27","H.7 Проверка шрифта кнопки 'Войти' в хедере https://app.pulsewave.ru/auth/signup","tests.ui_tests","Thu Nov 13 05:23:44 UTC 2025","passed","Thu Nov 13 05:23:44 UTC 2025","TestHeader","header_test","",""
"","9882","S.8 Регистрация с корректными email и паролем без согласия на подписку","tests.ui_tests","Thu Nov 13 05:27:26 UTC 2025","passed","Thu Nov 13 05:27:36 UTC 2025","TestSignupPage","signup_page_test","",""
"","37","R.2 Проверка цвета шрифта заголовка 'Восстановление пароля'","tests.ui_tests","Thu Nov 13 05:25:44 UTC 2025","passed","Thu Nov 13 05:25:44 UTC 2025","TestPasswordRecoveryPage","password_recovery_test","",""
"","35","H.3 Проверка текста кнопки 'Войти'","tests.ui_tests","Thu Nov 13 05:23:02 UTC 2025","passed","Thu Nov 13 05:23:02 UTC 2025","TestHeader","header_test","",""
"","42","F.6 Проверка размера шрифта надписи '© PulseWave, 2023-2025' в футере","tests.ui_tests","Thu Nov 13 05:16:30 UTC 2025","passed","Thu Nov 13 05:16:30 UTC 2025","TestFooter","footer_test","",""
"","649","A.30 POST Создать пользователя с некорректными данными","tests.api_tests","Thu Nov 13 05:06:21 UTC 2025","passed","Thu Nov 13 05:06:21 UTC 2025","TestAPI","api_test","",""
"","1322","L.7 Авторизация с некорректным емайл","tests.ui_tests","Thu Nov 13 05:25:13 UTC 2025","passed","Thu Nov 13 05:25:15 UTC 2025","TestLoginPage","login_page_test","",""
"","10","F.7 Проверка значка LinkedIn на странице 'https://pulsewave.ru/' в футере","tests.ui_tests","Thu Nov 13 05:19:59 UTC 2025","passed","Thu Nov 13 05:19:59 UTC 2025","TestFooter","footer_test","",""
"","2304","S.9 Регистрация с корректным email и паролем и пустым подтверждением пароля","tests.ui_tests","Thu Nov 13 05:27:40 UTC 2025","passed","Thu Nov 13 05:27:42 UTC 2025","TestSignupPage","signup_page_test","",""
"","4","W.2 Проверка заголовка рабочего пространства","tests.ui_tests","Thu Nov 13 05:28:24 UTC 2025","passed","Thu Nov 13 05:28:24 UTC 2025","TestWorkspacePage","workspace_page_test","",""
"","50","F.5 Проверка шрифта надписи 'info@pulsewave.ru' в футере","tests.ui_tests","Thu Nov 13 05:15:03 UTC 2025","passed","Thu Nov 13 05:15:03 UTC 2025","TestFooter","footer_test","",""
"","51","F.5 Проверка цвета шрифта надписи 'info@pulsewave.ru' в футере","tests.ui_tests","Thu Nov 13 05:13:48 UTC 2025","passed","Thu Nov 13 05:13:48 UTC 2025","TestFooter","footer_test","",""
"","62","F.8 Проверка кликабельности значка LinkedIn на странице 'https://app.pulsewave.ru/auth/password?email=' в футере","tests.ui_tests","Thu Nov 13 05:21:23 UTC 2025","passed","Thu Nov 13 05:21:23 UTC 2025","TestFooter","footer_test","",""
"","3247","A.15 GET Список всех пользователей доски для назначения ответственных","tests.api_tests","Thu Nov 13 05:05:28 UTC 2025","passed","Thu Nov 13 05:05:31 UTC 2025","TestAPI","api_test","",""
"","47","F.4 Проверка года © PulseWave, 2025 в футере","tests.ui_tests","Thu Nov 13 05:11:19 UTC 2025","passed","Thu Nov 13 05:11:19 UTC 2025","TestFooter","footer_test","",""
"","33","H.7 Проверка шрифта кнопки 'Войти' в хедере https://app.pulsewave.ru/auth/password?email=","tests.ui_tests","Thu Nov 13 05:23:48 UTC 2025","passed","Thu Nov 13 05:23:48 UTC 2025","TestHeader","header_test","",""
"","1633","A.18 POST Обновить JWT refresh token авторизованного пользователя","tests.api_tests","Thu Nov 13 05:05:34 UTC 2025","passed","Thu Nov 13 05:05:36 UTC 2025","TestAPI","api_test","",""
"","354","S.16 Регистрация с корректным email и слабым паролем и подтверждением пароля","tests.ui_tests","Thu Nov 13 05:28:07 UTC 2025","passed","Thu Nov 13 05:28:07 UTC 2025","TestSignupPage","signup_page_test","",""
"","1615","Проверка доступности https://pulsewave.ru/","tests.api_tests","Thu Nov 13 05:06:23 UTC 2025","passed","Thu Nov 13 05:06:25 UTC 2025","TestAvailability","availability_test","",""
"","42","F.6 Проверка цвета шрифта надписи '© PulseWave, 2023-2025' в футере","tests.ui_tests","Thu Nov 13 05:17:40 UTC 2025","passed","Thu Nov 13 05:17:40 UTC 2025","TestFooter","footer_test","",""
"","42","F.2 Проверка отсутствия ссылки на Лицензионное соглашение со страницы 'https://app.pulsewave.ru/auth/password?email=","tests.ui_tests","Thu Nov 13 05:09:02 UTC 2025","passed","Thu Nov 13 05:09:02 UTC 2025","TestFooter","footer_test","",""
"","3","W.4 Проверка что авторизованный пользователь попадает в Рабочие пространства","tests.ui_tests","Thu Nov 13 05:28:36 UTC 2025","passed","Thu Nov 13 05:28:36 UTC 2025","TestWorkspacePage","workspace_page_test","",""
"","25","H.7 Проверка цвета кнопки 'Войти' в хедере https://app.pulsewave.ru/auth/signup","tests.ui_tests","Thu Nov 13 05:23:52 UTC 2025","passed","Thu Nov 13 05:23:52 UTC 2025","TestHeader","header_test","",""
"","32","H.8 Проверка шрифта кнопки 'Регистрация в хедере https://app.pulsewave.ru/auth/password?email='","tests.ui_tests","Thu Nov 13 05:24:16 UTC 2025","passed","Thu Nov 13 05:24:16 UTC 2025","TestHeader","header_test","",""
"","42","S.5 Проверка цвета шрифта заголовка 'Регистрация'","tests.ui_tests","Thu Nov 13 05:27:07 UTC 2025","passed","Thu Nov 13 05:27:07 UTC 2025","TestSignupPage","signup_page_test","",""
"","41","F.6 Проверка размера шрифта надписи '© PulseWave, 2023-2025' в футере","tests.ui_tests","Thu Nov 13 05:16:20 UTC 2025","passed","Thu Nov 13 05:16:20 UTC 2025","TestFooter","footer_test","",""
"","2000","A.2 POST Создать пользователя с корректными данными","tests.api_tests","Thu Nov 13 05:04:21 UTC 2025","passed","Thu Nov 13 05:04:23 UTC 2025","TestAPI","api_test","",""
"","88","F.3 Проверка элемента 'info@pulsewave.ru'в хедере","tests.ui_tests","Thu Nov 13 05:10:16 UTC 2025","passed","Thu Nov 13 05:10:16 UTC 2025","TestFooter","footer_test","",""
"","41","L.2 Проверка размера шрифта заголовка 'Войти'","tests.ui_tests","Thu Nov 13 05:24:43 UTC 2025","passed","Thu Nov 13 05:24:43 UTC 2025","TestLoginPage","login_page_test","",""
"","59","F.6 Проверка цвета шрифта надписи '© PulseWave, 2023-2025' в футере","tests.ui_tests","Thu Nov 13 05:17:32 UTC 2025","passed","Thu Nov 13 05:17:33 UTC 2025","TestFooter","footer_test","",""
"","58","F.5 Проверка размера шрифта надписи 'info@pulsewave.ru' в футере","tests.ui_tests","Thu Nov 13 05:12:33 UTC 2025","passed","Thu Nov 13 05:12:33 UTC 2025","TestFooter","footer_test","",""
"","2015","W.6 Проверка перехода в Рабочие пространства по ссылке На главную","tests.ui_tests","Thu Nov 13 05:28:50 UTC 2025","passed","Thu Nov 13 05:28:52 UTC 2025","TestWorkspacePage","workspace_page_test","",""
"","33","H.8 Проверка цвета шрифта кнопки 'Регистрация в хедере https://app.pulsewave.ru/auth/password?email='","tests.ui_tests","Thu Nov 13 05:24:10 UTC 2025","passed","Thu Nov 13 05:24:10 UTC 2025","TestHeader","header_test","",""
"","5684","A.24 POST Установить новый пароль. Используется в личном кабинете после авторизации.","tests.api_tests","Thu Nov 13 05:06:06 UTC 2025","passed","Thu Nov 13 05:06:12 UTC 2025","TestAPI","api_test","",""
"","6114","A.13 POST Подтверждение приглашения в РП","tests.api_tests","Thu Nov 13 05:05:20 UTC 2025","passed","Thu Nov 13 05:05:26 UTC 2025","TestAPI","api_test","",""
"","64","F.9 Проверка перехода в LinkedIn на странице 'https://app.pulsewave.ru/auth/password?email=' в футере","tests.ui_tests","Thu Nov 13 05:22:37 UTC 2025","passed","Thu Nov 13 05:22:37 UTC 2025","TestFooter","footer_test","",""
"","77","F.9 Проверка перехода в LinkedIn на странице 'https://pulsewave.ru/' в футере","tests.ui_tests","Thu Nov 13 05:22:25 UTC 2025","passed","Thu Nov 13 05:22:25 UTC 2025","TestFooter","footer_test","",""
"","45","F.5 Проверка цвета шрифта надписи 'info@pulsewave.ru' в футере","tests.ui_tests","Thu Nov 13 05:13:57 UTC 2025","passed","Thu Nov 13 05:13:57 UTC 2025","TestFooter","footer_test","",""
"","69","F.8 Проверка кликабельности значка LinkedIn на странице 'https://pulsewave.ru/' в футере","tests.ui_tests","Thu Nov 13 05:21:11 UTC 2025","passed","Thu Nov 13 05:21:12 UTC 2025","TestFooter","footer_test","",""
"","3497","M.1 Проверка редиректа с /home на страницу лендинга","tests.ui_tests","Thu Nov 13 05:24:24 UTC 2025","passed","Thu Nov 13 05:24:28 UTC 2025","TestLendingPage","lending_test","",""
"","24","H.8 Проверка шрифта кнопки 'Регистрация в хедере https://app.pulsewave.ru/auth/login'","tests.ui_tests","Thu Nov 13 05:24:13 UTC 2025","passed","Thu Nov 13 05:24:13 UTC 2025","TestHeader","header_test","",""
"","43","F.2 Проверка отсутствия ссылки на Лицензионное соглашение со страницы 'https://app.pulsewave.ru/auth/login","tests.ui_tests","Thu Nov 13 05:08:54 UTC 2025","passed","Thu Nov 13 05:08:54 UTC 2025","TestFooter","footer_test","",""
"","1787","A.1 GET Проверка доступности API","tests.api_tests","Thu Nov 13 05:04:19 UTC 2025","passed","Thu Nov 13 05:04:21 UTC 2025","TestAPI","api_test","",""
"","13221","A.23 POST Подтверждение сброса пароля. Когда пользователь переходит по ссылке     auth/password/reset/confirm/{uid}/{token}","tests.api_tests","Thu Nov 13 05:05:53 UTC 2025","passed","Thu Nov 13 05:06:06 UTC 2025","TestAPI","api_test","",""
"","42","L.2 Проверка цвета шрифта заголовка 'Войти'","tests.ui_tests","Thu Nov 13 05:24:47 UTC 2025","passed","Thu Nov 13 05:24:47 UTC 2025","TestLoginPage","login_page_test","",""
"","338","S.7 Регистрация с некорректным email и сильным паролем и подтверждением пароля","tests.ui_tests","Thu Nov 13 05:27:22 UTC 2025","passed","Thu Nov 13 05:27:22 UTC 2025","TestSignupPage","signup_page_test","",""
"","90","F.3 Проверка элемента 'info@pulsewave.ru'в хедере","tests.ui_tests","Thu Nov 13 05:10:09 UTC 2025","passed","Thu Nov 13 05:10:09 UTC 2025","TestFooter","footer_test","",""
"","58","L.6 Окно авторизации сообщение 'Забыли пароль?'","tests.ui_tests","Thu Nov 13 05:25:10 UTC 2025","passed","Thu Nov 13 05:25:10 UTC 2025","TestLoginPage","login_page_test","",""
"","64","S.12 Окно регистрации сообщение 'Я согласен получать новости и обновления PulseWave'","tests.ui_tests","Thu Nov 13 05:27:59 UTC 2025","passed","Thu Nov 13 05:27:59 UTC 2025","TestSignupPage","signup_page_test","",""
"","40","F.6 Проверка шрифта надписи '© PulseWave, 2023-2025' в футере","tests.ui_tests","Thu Nov 13 05:18:52 UTC 2025","passed","Thu Nov 13 05:18:52 UTC 2025","TestFooter","footer_test","",""
"","26","H.8 Проверка размера шрифта кнопки 'Регистрация в хедере https://app.pulsewave.ru/auth/login'","tests.ui_tests","Thu Nov 13 05:23:59 UTC 2025","passed","Thu Nov 13 05:23:59 UTC 2025","TestHeader","header_test","",""
"","552","F.5 Проверка шрифта надписи 'info@pulsewave.ru' в футере","tests.ui_tests","Thu Nov 13 05:15:10 UTC 2025","passed","Thu Nov 13 05:15:10 UTC 2025","TestFooter","footer_test","",""
"","170","W.10 Проверка цвета переключателя 'Непрочитанные'","tests.ui_tests","Thu Nov 13 05:29:19 UTC 2025","passed","Thu Nov 13 05:29:19 UTC 2025","TestWorkspacePage","workspace_page_test","",""
"","4879","A.29 DELETE Активировать и удалить авторизованного пользователя","tests.api_tests","Thu Nov 13 05:06:16 UTC 2025","passed","Thu Nov 13 05:06:21 UTC 2025","TestAPI","api_test","",""
"","3149","A.12 DELETE Удалить РП","tests.api_tests","Thu Nov 13 05:05:17 UTC 2025","passed","Thu Nov 13 05:05:20 UTC 2025","TestAPI","api_test","",""
"","30","H.4 Проверка текста кнопки 'Регистрация'","tests.ui_tests","Thu Nov 13 05:23:05 UTC 2025","passed","Thu Nov 13 05:23:05 UTC 2025","TestHeader","header_test","",""
"","92","F.3 Проверка элемента 'info@pulsewave.ru'в хедере","tests.ui_tests","Thu Nov 13 05:10:13 UTC 2025","passed","Thu Nov 13 05:10:13 UTC 2025","TestFooter","footer_test","",""
"","1065","F.5 Проверка размера шрифта надписи 'info@pulsewave.ru' в футере","tests.ui_tests","Thu Nov 13 05:12:40 UTC 2025","passed","Thu Nov 13 05:12:41 UTC 2025","TestFooter","footer_test","",""
"","58","F.8 Проверка кликабельности значка LinkedIn на странице 'https://app.pulsewave.ru/auth/login' в футере","tests.ui_tests","Thu Nov 13 05:21:16 UTC 2025","passed","Thu Nov 13 05:21:16 UTC 2025","TestFooter","footer_test","",""
"","15351","A.5 POST Повторная отправка ссылки с приглашением пользователя","tests.api_tests","Thu Nov 13 05:04:49 UTC 2025","passed","Thu Nov 13 05:05:04 UTC 2025","TestAPI","api_test","",""
"","2237","L.8 Авторизация с пустым паролем","tests.ui_tests","Thu Nov 13 05:25:25 UTC 2025","passed","Thu Nov 13 05:25:27 UTC 2025","TestLoginPage","login_page_test","",""
"","2836","F.1 Проверка попапа о принятии файлов cookie на странице https://app.pulsewave.ru/auth/password?email=","tests.ui_tests","Thu Nov 13 05:07:44 UTC 2025","passed","Thu Nov 13 05:07:47 UTC 2025","TestFooter","footer_test","",""
"","43","F.4 Проверка года © PulseWave, 2025 в футере","tests.ui_tests","Thu Nov 13 05:11:30 UTC 2025","passed","Thu Nov 13 05:11:30 UTC 2025","TestFooter","footer_test","",""
"","348","S.2 Регистрация с корректным email и не совпадающими паролем и подтверждением пароля","tests.ui_tests","Thu Nov 13 05:26:50 UTC 2025","passed","Thu Nov 13 05:26:50 UTC 2025","TestSignupPage","signup_page_test","",""
"","2080","R.3  Проверка некликабельности кнопки 'Продолжить'","tests.ui_tests","Thu Nov 13 05:25:52 UTC 2025","passed","Thu Nov 13 05:25:54 UTC 2025","TestPasswordRecoveryPage","password_recovery_test","",""
"","9907","S.1 Регистрация с корректными email и паролем и с согласием на подписку","tests.ui_tests","Thu Nov 13 05:26:36 UTC 2025","passed","Thu Nov 13 05:26:46 UTC 2025","TestSignupPage","signup_page_test","",""
"","31","H.8 Проверка цвета кнопки 'Регистрация в хедере https://app.pulsewave.ru/auth/password?email='","tests.ui_tests","Thu Nov 13 05:24:24 UTC 2025","passed","Thu Nov 13 05:24:24 UTC 2025","TestHeader","header_test","",""
"Создание доски без указания РП, будет создано дефолтное РП для этой доски","1613","A.14 POST Создать доску без указания РП","tests.api_tests","Thu Nov 13 05:05:26 UTC 2025","passed","Thu Nov 13 05:05:28 UTC 2025","TestAPI","api_test","",""
"","1563","A.9 GET Получить список всех Рабочих пространств авторизованного пользователя","tests.api_tests","Thu Nov 13 05:05:08 UTC 2025","passed","Thu Nov 13 05:05:10 UTC 2025","TestAPI","api_test","",""
"","2312","H.2 Проверка редиректа на главную страницу при клике на логотип","tests.ui_tests","Thu Nov 13 05:22:46 UTC 2025","passed","Thu Nov 13 05:22:49 UTC 2025","TestHeader","header_test","",""
"","343","S.16 Регистрация с корректным email и слабым паролем и подтверждением пароля","tests.ui_tests","Thu Nov 13 05:28:02 UTC 2025","passed","Thu Nov 13 05:28:02 UTC 2025","TestSignupPage","signup_page_test","",""
"","1849","L.5 Авторизация с некорректным паролем","tests.ui_tests","Thu Nov 13 05:25:04 UTC 2025","passed","Thu Nov 13 05:25:06 UTC 2025","TestLoginPage","login_page_test","",""
"","11417","A.21 POST Подтверждение смены почты пользователя. Токен из ссылки auth/change_email/{token}.","tests.api_tests","Thu Nov 13 05:05:40 UTC 2025","passed","Thu Nov 13 05:05:51 UTC 2025","TestAPI","api_test","",""
"","636","A.27 POST Регистрация пользователя без пароля","tests.api_tests","Thu Nov 13 05:06:14 UTC 2025","passed","Thu Nov 13 05:06:15 UTC 2025","TestAPI","api_test","",""
"","32","H.7 Проверка размера шрифта кнопки 'Войти' в хедере https://app.pulsewave.ru/auth/password?email=","tests.ui_tests","Thu Nov 13 05:23:34 UTC 2025","passed","Thu Nov 13 05:23:34 UTC 2025","TestHeader","header_test","",""
"","609","L.3 Проверка редиректа на страницу восстановления пароля при клике на ссылку 'Забыли пароль?'","tests.ui_tests","Thu Nov 13 05:24:54 UTC 2025","passed","Thu Nov 13 05:24:55 UTC 2025","TestLoginPage","login_page_test","",""
"","44","F.5 Проверка шрифта надписи 'info@pulsewave.ru' в футере","tests.ui_tests","Thu Nov 13 05:15:14 UTC 2025","passed","Thu Nov 13 05:15:14 UTC 2025","TestFooter","footer_test","",""
"","2021","W.5 Проверка что авторизованный пользователь может выйти из аккаунта","tests.ui_tests","Thu Nov 13 05:28:42 UTC 2025","passed","Thu Nov 13 05:28:44 UTC 2025","TestWorkspacePage","workspace_page_test","",""
"","3226","F.1 Проверка попапа о принятии файлов cookie на странице https://app.pulsewave.ru/auth/login","tests.ui_tests","Thu Nov 13 05:07:37 UTC 2025","passed","Thu Nov 13 05:07:40 UTC 2025","TestFooter","footer_test","",""
"","2290","S.11 Регистрация с пустым email и сильным паролем и подтверждением пароля","tests.ui_tests","Thu Nov 13 05:27:53 UTC 2025","passed","Thu Nov 13 05:27:55 UTC 2025","TestSignupPage","signup_page_test","",""
"","42","L.1 Проверка текста заголовка 'Войти'","tests.ui_tests","Thu Nov 13 05:24:39 UTC 2025","passed","Thu Nov 13 05:24:39 UTC 2025","TestLoginPage","login_page_test","",""
"","584","H.5 Проверка перехода на страницу 'https://app.pulsewave.ru/auth/login' по кнопке 'Войти'","tests.ui_tests","Thu Nov 13 05:23:13 UTC 2025","passed","Thu Nov 13 05:23:14 UTC 2025","TestHeader","header_test","",""
"","2375","L.4 Авторизация с корректными данными","tests.ui_tests","Thu Nov 13 05:24:59 UTC 2025","passed","Thu Nov 13 05:25:01 UTC 2025","TestLoginPage","login_page_test","",""
"","1984","A.25 DELETE Удалить авторизованного пользователя","tests.api_tests","Thu Nov 13 05:06:12 UTC 2025","passed","Thu Nov 13 05:06:14 UTC 2025","TestAPI","api_test","",""
"","642","A.30 POST Создать пользователя с некорректными данными","tests.api_tests","Thu Nov 13 05:06:22 UTC 2025","passed","Thu Nov 13 05:06:23 UTC 2025","TestAPI","api_test","",""
"","2305","L.9 Авторизация с логином заглавными буквами","tests.ui_tests","Thu Nov 13 05:25:31 UTC 2025","passed","Thu Nov 13 05:25:33 UTC 2025","TestLoginPage","login_page_test","",""
"","19992","A.3 POST Активация пользователя с корректными данными","tests.api_tests","Thu Nov 13 05:04:23 UTC 2025","passed","Thu Nov 13 05:04:43 UTC 2025","TestAPI","api_test","",""
"","945","A.28 POST Регистрация пользователя без подтверждения подписки","tests.api_tests","Thu Nov 13 05:06:15 UTC 2025","passed","Thu Nov 13 05:06:16 UTC 2025","TestAPI","api_test","",""
"","657","A.30 POST Создать пользователя с некорректными данными","tests.api_tests","Thu Nov 13 05:06:21 UTC 2025","passed","Thu Nov 13 05:06:22 UTC 2025","TestAPI","api_test","",""
"","2009","A.20 POST Запрос на смену почты","tests.api_tests","Thu Nov 13 05:05:38 UTC 2025","passed","Thu Nov 13 05:05:40 UTC 2025","TestAPI","api_test","",""
"","0","S.13 Окно регистрации сообщение 'Регистрируясь, я соглашаюсь с Условиями пользования и Политикой конфиденциальности'","tests.ui_tests","Thu Nov 13 05:27:59 UTC 2025","skipped","Thu Nov 13 05:27:59 UTC 2025","TestSignupPage","signup_page_test","",""
