"DESCRIPTION","DURATION IN MS","NAME","PARENT SUITE","START TIME","STATUS","STOP TIME","SUB SUITE","SUITE","TEST CLASS","TEST METHOD"
"","53","M.4 Проверка текста кнопки 'Бесплатная регистрация' на лендинге","tests.ui_tests","Thu Nov 13 05:24:35 UTC 2025","passed","Thu Nov 13 05:24:35 UTC 2025","TestLendingPage","lending_test","",""
"","46","F.5 Проверка размера шрифта надписи 'info@pulsewave.ru' в футере","tests.ui_tests","Thu Nov 13 05:12:36 UTC 2025","passed","Thu Nov 13 05:12:37 UTC 2025","TestFooter","footer_test","",""
"","31","H.7 Проверка цвета кнопки 'Войти' в хедере https://app.pulsewave.ru/auth/password?email=","tests.ui_tests","Thu Nov 13 05:23:55 UTC 2025","passed","Thu Nov 13 05:23:55 UTC 2025","TestHeader","header_test","",""
"","0","S.15 Окно регистрации сообщение 'Регистрируясь, я соглашаюсь с Условиями пользования и Политикой конфиденциальности', проверка корректности перехода по ссылке 'Условиями пользования'","tests.ui_tests","Thu Nov 13 05:27:59 UTC 2025","skipped","Thu Nov 13 05:27:59 UTC 2025","TestSignupPage","signup_page_test","",""
"","354","S.16 Регистрация с корректным email и слабым паролем и подтверждением пароля","tests.ui_tests","Thu Nov 13 05:28:11 UTC 2025","passed","Thu Nov 13 05:28:12 UTC 2025","TestSignupPage","signup_page_test","",""
"","1590","A.19 GET Получить данные авторизованного пользователя me","tests.api_tests","Thu Nov 13 05:05:36 UTC 2025","passed","Thu Nov 13 05:05:38 UTC 2025","TestAPI","api_test","",""
"","1650","A.17 GET Получить список всех пользователей для поиска","tests.api_tests","Thu Nov 13 05:05:33 UTC 2025","passed","Thu Nov 13 05:05:34 UTC 2025","TestAPI","api_test","",""
"","43","R.1 Проверка текста заголовка 'Восстановление пароля'","tests.ui_tests","Thu Nov 13 05:25:37 UTC 2025","passed","Thu Nov 13 05:25:37 UTC 2025","TestPasswordRecoveryPage","password_recovery_test","",""
"","41","R.2 Проверка размера шрифта заголовка 'Восстановление пароля'","tests.ui_tests","Thu Nov 13 05:25:41 UTC 2025","passed","Thu Nov 13 05:25:41 UTC 2025","TestPasswordRecoveryPage","password_recovery_test","",""
"","56","F.2 Проверка отсутствия ссылки на Лицензионное соглашение со страницы 'https://pulsewave.ru/","tests.ui_tests","Thu Nov 13 05:08:50 UTC 2025","passed","Thu Nov 13 05:08:50 UTC 2025","TestFooter","footer_test","",""
"","26","H.7 Проверка размера шрифта кнопки 'Войти' в хедере https://app.pulsewave.ru/auth/signup","tests.ui_tests","Thu Nov 13 05:23:31 UTC 2025","passed","Thu Nov 13 05:23:31 UTC 2025","TestHeader","header_test","",""
"","9","F.7 Проверка значка LinkedIn на странице 'https://app.pulsewave.ru/auth/password?email=' в футере","tests.ui_tests","Thu Nov 13 05:20:09 UTC 2025","passed","Thu Nov 13 05:20:09 UTC 2025","TestFooter","footer_test","",""
"","40","L.2 Проверка шрифта заголовка 'Войти'","tests.ui_tests","Thu Nov 13 05:24:51 UTC 2025","passed","Thu Nov 13 05:24:51 UTC 2025","TestLoginPage","login_page_test","",""
"","39","R.2 Проверка шрифта заголовка 'Восстановление пароля'","tests.ui_tests","Thu Nov 13 05:25:48 UTC 2025","passed","Thu Nov 13 05:25:48 UTC 2025","TestPasswordRecoveryPage","password_recovery_test","",""
"","46","F.2 Проверка отсутствия ссылки на Лицензионное соглашение со страницы 'https://app.pulsewave.ru/auth/signup","tests.ui_tests","Thu Nov 13 05:08:58 UTC 2025","passed","Thu Nov 13 05:08:58 UTC 2025","TestFooter","footer_test","",""
"","62496","F.1 Проверка попапа о принятии файлов cookie на странице https://pulsewave.ru/","tests.ui_tests","Thu Nov 13 05:06:34 UTC 2025","passed","Thu Nov 13 05:07:37 UTC 2025","TestFooter","footer_test","",""
"","39","F.6 Проверка цвета шрифта надписи '© PulseWave, 2023-2025' в футере","tests.ui_tests","Thu Nov 13 05:17:36 UTC 2025","passed","Thu Nov 13 05:17:36 UTC 2025","TestFooter","footer_test","",""
"","3234","A.11 PATCH Частично обновить данные РП (на данный момент только имя)","tests.api_tests","Thu Nov 13 05:05:14 UTC 2025","passed","Thu Nov 13 05:05:17 UTC 2025","TestAPI","api_test","",""
"","2060","H.2 Проверка редиректа на главную страницу при клике на логотип","tests.ui_tests","Thu Nov 13 05:22:40 UTC 2025","passed","Thu Nov 13 05:22:42 UTC 2025","TestHeader","header_test","",""
"","54","M.3 Проверка текста кнопки 'Войти' на лендинге","tests.ui_tests","Thu Nov 13 05:24:33 UTC 2025","passed","Thu Nov 13 05:24:33 UTC 2025","TestLendingPage","lending_test","",""
"","586","H.6 Проверка перехода на страницу 'https://app.pulsewave.ru/auth/signup' по кнопке 'Регистрация'","tests.ui_tests","Thu Nov 13 05:23:21 UTC 2025","passed","Thu Nov 13 05:23:22 UTC 2025","TestHeader","header_test","",""
"","1252","R.6 Восстановить пароль на некорректный емайл","tests.ui_tests","Thu Nov 13 05:26:31 UTC 2025","passed","Thu Nov 13 05:26:32 UTC 2025","TestPasswordRecoveryPage","password_recovery_test","",""
"","3","W.1 Проверка перехода в рабочее пространство авторизованного пользователя","tests.ui_tests","Thu Nov 13 05:28:18 UTC 2025","passed","Thu Nov 13 05:28:18 UTC 2025","TestWorkspacePage","workspace_page_test","",""
"","44","F.6 Проверка размера шрифта надписи '© PulseWave, 2023-2025' в футере","tests.ui_tests","Thu Nov 13 05:16:24 UTC 2025","passed","Thu Nov 13 05:16:24 UTC 2025","TestFooter","footer_test","",""
"","47","F.5 Проверка цвета шрифта надписи 'info@pulsewave.ru' в футере","tests.ui_tests","Thu Nov 13 05:13:52 UTC 2025","passed","Thu Nov 13 05:13:52 UTC 2025","TestFooter","footer_test","",""
"","12838","R.5 Восстановить пароль на корректный емайл","tests.ui_tests","Thu Nov 13 05:26:15 UTC 2025","passed","Thu Nov 13 05:26:28 UTC 2025","TestPasswordRecoveryPage","password_recovery_test","",""
"","1886","S.3 Регистрация с уже зарегистрированным email и корректными паролем и подтверждением пароля","tests.ui_tests","Thu Nov 13 05:26:54 UTC 2025","passed","Thu Nov 13 05:26:56 UTC 2025","TestSignupPage","signup_page_test","",""
"Удаление как из участников так и из приглашенных","2302","A.6 POST Удаление приглашенного пользователей из РП","tests.api_tests","Thu Nov 13 05:05:04 UTC 2025","passed","Thu Nov 13 05:05:06 UTC 2025","TestAPI","api_test","",""
"","29","H.3 Проверка текста кнопки 'Войти'","tests.ui_tests","Thu Nov 13 05:22:58 UTC 2025","passed","Thu Nov 13 05:22:58 UTC 2025","TestHeader","header_test","",""
"","38","F.6 Проверка шрифта надписи '© PulseWave, 2023-2025' в футере","tests.ui_tests","Thu Nov 13 05:18:49 UTC 2025","passed","Thu Nov 13 05:18:49 UTC 2025","TestFooter","footer_test","",""
"","2348","H.2 Проверка редиректа на главную страницу при клике на логотип","tests.ui_tests","Thu Nov 13 05:22:52 UTC 2025","passed","Thu Nov 13 05:22:55 UTC 2025","TestHeader","header_test","",""
"","107","F.3 Проверка элемента 'info@pulsewave.ru'в хедере","tests.ui_tests","Thu Nov 13 05:10:05 UTC 2025","passed","Thu Nov 13 05:10:05 UTC 2025","TestFooter","footer_test","",""
"","38","F.6 Проверка цвета шрифта надписи '© PulseWave, 2023-2025' в футере","tests.ui_tests","Thu Nov 13 05:17:43 UTC 2025","passed","Thu Nov 13 05:17:43 UTC 2025","TestFooter","footer_test","",""
"","1258","W.9 Проверка возможности изменить цвет переключателя 'Непрочитанные'","tests.ui_tests","Thu Nov 13 05:29:11 UTC 2025","passed","Thu Nov 13 05:29:13 UTC 2025","TestWorkspacePage","workspace_page_test","",""
"","44","F.5 Проверка размера шрифта надписи 'info@pulsewave.ru' в футере","tests.ui_tests","Thu Nov 13 05:12:46 UTC 2025","passed","Thu Nov 13 05:12:46 UTC 2025","TestFooter","footer_test","",""
"","1595","A.22 POST Сброс пароля","tests.api_tests","Thu Nov 13 05:05:51 UTC 2025","passed","Thu Nov 13 05:05:53 UTC 2025","TestAPI","api_test","",""
"","46","F.4 Проверка года © PulseWave, 2025 в футере","tests.ui_tests","Thu Nov 13 05:11:27 UTC 2025","passed","Thu Nov 13 05:11:27 UTC 2025","TestFooter","footer_test","",""
"","26","H.8 Проверка цвета кнопки 'Регистрация в хедере https://app.pulsewave.ru/auth/login'","tests.ui_tests","Thu Nov 13 05:24:21 UTC 2025","passed","Thu Nov 13 05:24:21 UTC 2025","TestHeader","header_test","",""
"","45","F.4 Проверка года © PulseWave, 2025 в футере","tests.ui_tests","Thu Nov 13 05:11:23 UTC 2025","passed","Thu Nov 13 05:11:23 UTC 2025","TestFooter","footer_test","",""
"","339","S.7 Регистрация с некорректным email и сильным паролем и подтверждением пароля","tests.ui_tests","Thu Nov 13 05:27:18 UTC 2025","passed","Thu Nov 13 05:27:18 UTC 2025","TestSignupPage","signup_page_test","",""
"Пользователи добавляются по одному. Если пользователя не существует, он будет создан","5351","A.4 POST Пригласить пользователя по email","tests.api_tests","Thu Nov 13 05:04:43 UTC 2025","passed","Thu Nov 13 05:04:49 UTC 2025","TestAPI","api_test","",""
"","1773","W.12 Проверка прочтения уведомлений","tests.ui_tests","Thu Nov 13 05:29:33 UTC 2025","passed","Thu Nov 13 05:29:34 UTC 2025","TestWorkspacePage","workspace_page_test","",""
"","32","H.8 Проверка размера шрифта кнопки 'Регистрация в хедере https://app.pulsewave.ru/auth/password?email='","tests.ui_tests","Thu Nov 13 05:24:02 UTC 2025","passed","Thu Nov 13 05:24:02 UTC 2025","TestHeader","header_test","",""
"","61","F.9 Проверка перехода в LinkedIn на странице 'https://app.pulsewave.ru/auth/login' в футере","tests.ui_tests","Thu Nov 13 05:22:30 UTC 2025","passed","Thu Nov 13 05:22:30 UTC 2025","TestFooter","footer_test","",""
"","36","H.4 Проверка текста кнопки 'Регистрация'","tests.ui_tests","Thu Nov 13 05:23:09 UTC 2025","passed","Thu Nov 13 05:23:10 UTC 2025","TestHeader","header_test","",""
"","10","F.7 Проверка значка LinkedIn на странице 'https://app.pulsewave.ru/auth/signup' в футере","tests.ui_tests","Thu Nov 13 05:20:06 UTC 2025","passed","Thu Nov 13 05:20:06 UTC 2025","TestFooter","footer_test","",""
"","46","F.5 Проверка цвета шрифта надписи 'info@pulsewave.ru' в футере","tests.ui_tests","Thu Nov 13 05:14:00 UTC 2025","passed","Thu Nov 13 05:14:00 UTC 2025","TestFooter","footer_test","",""
"","7","W.3 Проверка видимости аватара","tests.ui_tests","Thu Nov 13 05:28:30 UTC 2025","passed","Thu Nov 13 05:28:30 UTC 2025","TestWorkspacePage","workspace_page_test","",""
"","1148","W.11 Проверка видимости уведомлений","tests.ui_tests","Thu Nov 13 05:29:25 UTC 2025","passed","Thu Nov 13 05:29:26 UTC 2025","TestWorkspacePage","workspace_page_test","",""
"","35","H.7 Проверка цвета шрифта кнопки 'Войти' в хедере https://app.pulsewave.ru/auth/password?email=","tests.ui_tests","Thu Nov 13 05:23:40 UTC 2025","passed","Thu Nov 13 05:23:40 UTC 2025","TestHeader","header_test","",""
"","9","F.7 Проверка значка LinkedIn на странице 'https://app.pulsewave.ru/auth/login' в футере","tests.ui_tests","Thu Nov 13 05:20:02 UTC 2025","passed","Thu Nov 13 05:20:02 UTC 2025","TestFooter","footer_test","",""
"","591","H.5 Проверка перехода на страницу 'https://app.pulsewave.ru/auth/login' по кнопке 'Войти'","tests.ui_tests","Thu Nov 13 05:23:17 UTC 2025","passed","Thu Nov 13 05:23:18 UTC 2025","TestHeader","header_test","",""
"","66","F.9 Проверка перехода в LinkedIn на странице 'https://app.pulsewave.ru/auth/signup' в футере","tests.ui_tests","Thu Nov 13 05:22:33 UTC 2025","passed","Thu Nov 13 05:22:33 UTC 2025","TestFooter","footer_test","",""
"","40","S.5 Проверка шрифта заголовка 'Регистрация'","tests.ui_tests","Thu Nov 13 05:27:10 UTC 2025","passed","Thu Nov 13 05:27:11 UTC 2025","TestSignupPage","signup_page_test","",""
"","803","Проверка доступности https://app.pulsewave.ru/","tests.api_tests","Thu Nov 13 05:06:23 UTC 2025","passed","Thu Nov 13 05:06:23 UTC 2025","TestAvailability","availability_test","",""
"","55","M.2 Проверка кликабельности логотипа на лендинге","tests.ui_tests","Thu Nov 13 05:24:30 UTC 2025","passed","Thu Nov 13 05:24:30 UTC 2025","TestLendingPage","lending_test","",""
"","2297","S.10 Регистрация с корректным email и подтверждением пароля и пустым паролем","tests.ui_tests","Thu Nov 13 05:27:47 UTC 2025","passed","Thu Nov 13 05:27:49 UTC 2025","TestSignupPage","signup_page_test","",""
"","42","S.4 Проверка текста заголовка 'Регистрация'","tests.ui_tests","Thu Nov 13 05:27:00 UTC 2025","passed","Thu Nov 13 05:27:00 UTC 2025","TestSignupPage","signup_page_test","",""
"","2228","L.8 Авторизация с пустым емайл","tests.ui_tests","Thu Nov 13 05:25:19 UTC 2025","passed","Thu Nov 13 05:25:21 UTC 2025","TestLoginPage","login_page_test","",""
"","27","H.8 Проверка цвета шрифта кнопки 'Регистрация в хедере https://app.pulsewave.ru/auth/login'","tests.ui_tests","Thu Nov 13 05:24:06 UTC 2025","passed","Thu Nov 13 05:24:06 UTC 2025","TestHeader","header_test","",""
"","1057","A.8 POST Создать пару токенов access и refresh","tests.api_tests","Thu Nov 13 05:05:07 UTC 2025","passed","Thu Nov 13 05:05:08 UTC 2025","TestAPI","api_test","",""
"","94","W.13 Проверка видимости выпадающего меню Рабочие пространства","tests.ui_tests","Thu Nov 13 05:29:41 UTC 2025","passed","Thu Nov 13 05:29:41 UTC 2025","TestWorkspacePage","workspace_page_test","",""
"","41","S.5 Проверка размера шрифта заголовка 'Регистрация'","tests.ui_tests","Thu Nov 13 05:27:04 UTC 2025","passed","Thu Nov 13 05:27:04 UTC 2025","TestSignupPage","signup_page_test","",""
"","271","W.8 Проверка невидимости кнопки 'Отметить все как прочитанные' в прочитанных уведомлениях","tests.ui_tests","Thu Nov 13 05:29:05 UTC 2025","passed","Thu Nov 13 05:29:05 UTC 2025","TestWorkspacePage","workspace_page_test","",""
"","4265","A.10 GET Информация о конкретном рабочем пространстве","tests.api_tests","Thu Nov 13 05:05:10 UTC 2025","passed","Thu Nov 13 05:05:14 UTC 2025","TestAPI","api_test","",""
"","34","W.7 Проверка видимости заголовка 'Ваши рабочие пространства'","tests.ui_tests","Thu Nov 13 05:28:59 UTC 2025","passed","Thu Nov 13 05:28:59 UTC 2025","TestWorkspacePage","workspace_page_test","",""
"","40","F.6 Проверка шрифта надписи '© PulseWave, 2023-2025' в футере","tests.ui_tests","Thu Nov 13 05:18:56 UTC 2025","passed","Thu Nov 13 05:18:56 UTC 2025","TestFooter","footer_test","",""
