"DESCRIPTION","DURATION IN MS","NAME","PARENT SUITE","START TIME","STATUS","STOP TIME","SUB SUITE","SUITE","TEST CLASS","TEST METHOD"
"","530","H.7 Проверка цвета шрифта кнопки 'Войти' в хедере https://app.pulsewave.ru/auth/signup","tests.ui_tests","Fri Dec 19 04:13:26 UTC 2025","passed","Fri Dec 19 04:13:27 UTC 2025","TestHeader","header_test","",""
"","3534","A.11 PATCH Частично обновить данные РП (на данный момент только имя)","tests.api_tests","Fri Dec 19 03:55:57 UTC 2025","passed","Fri Dec 19 03:56:00 UTC 2025","TestAPI","api_test","",""
"","29","H.8 Проверка размера шрифта кнопки 'Регистрация в хедере https://app.pulsewave.ru/auth/login'","tests.ui_tests","Fri Dec 19 04:13:42 UTC 2025","passed","Fri Dec 19 04:13:42 UTC 2025","TestHeader","header_test","",""
"","1300","A.18 POST Обновить JWT refresh token авторизованного пользователя","tests.api_tests","Fri Dec 19 03:56:15 UTC 2025","passed","Fri Dec 19 03:56:16 UTC 2025","TestAPI","api_test","",""
"","530","H.8 Проверка цвета кнопки 'Регистрация в хедере https://app.pulsewave.ru/auth/login'","tests.ui_tests","Fri Dec 19 04:13:56 UTC 2025","passed","Fri Dec 19 04:13:57 UTC 2025","TestHeader","header_test","",""
"","355","S.2 Регистрация с корректным email и не совпадающими паролем и подтверждением пароля","tests.ui_tests","Fri Dec 19 04:15:49 UTC 2025","passed","Fri Dec 19 04:15:49 UTC 2025","TestSignupPage","signup_page_test","",""
"","568","S.12 Окно регистрации сообщение 'Я согласен получать новости и обновления PulseWave'","tests.ui_tests","Fri Dec 19 04:16:40 UTC 2025","passed","Fri Dec 19 04:16:41 UTC 2025","TestSignupPage","signup_page_test","",""
"","42","L.2 Проверка размера шрифта заголовка 'Войти'","tests.ui_tests","Fri Dec 19 04:14:16 UTC 2025","passed","Fri Dec 19 04:14:16 UTC 2025","TestLoginPage","login_page_test","",""
"","1909","F.1 Проверка попапа о принятии файлов cookie на странице https://app.pulsewave.ru/auth/signup","tests.ui_tests","Fri Dec 19 03:58:36 UTC 2025","passed","Fri Dec 19 03:58:38 UTC 2025","TestFooter","footer_test","",""
"","607","Проверка доступности https://api.dev.pulsewave.ru/api/healthcheck/","tests.api_tests","Fri Dec 19 03:57:21 UTC 2025","passed","Fri Dec 19 03:57:22 UTC 2025","TestAvailability","availability_test","",""
"","46","F.5 Проверка цвета шрифта надписи 'info@pulsewave.ru' в футере","tests.ui_tests","Fri Dec 19 04:04:33 UTC 2025","passed","Fri Dec 19 04:04:33 UTC 2025","TestFooter","footer_test","",""
"","55","F.5 Проверка размера шрифта надписи 'info@pulsewave.ru' в футере","tests.ui_tests","Fri Dec 19 04:03:16 UTC 2025","passed","Fri Dec 19 04:03:16 UTC 2025","TestFooter","footer_test","",""
"","909","A.1 GET Проверка доступности API","tests.api_tests","Fri Dec 19 03:55:34 UTC 2025","passed","Fri Dec 19 03:55:35 UTC 2025","TestAPI","api_test","",""
"","3110","R.4 Проверить сообщение об отправке ссылки восстановления пароля на емайл","tests.ui_tests","Fri Dec 19 04:15:10 UTC 2025","passed","Fri Dec 19 04:15:13 UTC 2025","TestPasswordRecoveryPage","password_recovery_test","",""
"","62067","F.1 Проверка попапа о принятии файлов cookie на странице https://pulsewave.ru/","tests.ui_tests","Fri Dec 19 03:57:31 UTC 2025","passed","Fri Dec 19 03:58:33 UTC 2025","TestFooter","footer_test","",""
"","529","H.7 Проверка шрифта кнопки 'Войти' в хедере https://app.pulsewave.ru/auth/signup","tests.ui_tests","Fri Dec 19 04:13:31 UTC 2025","passed","Fri Dec 19 04:13:32 UTC 2025","TestHeader","header_test","",""
"","739","Проверка доступности https://app.dev.pulsewave.ru/","tests.api_tests","Fri Dec 19 03:57:21 UTC 2025","passed","Fri Dec 19 03:57:21 UTC 2025","TestAvailability","availability_test","",""
"","112","F.3 Проверка элемента 'info@pulsewave.ru'в хедере","tests.ui_tests","Fri Dec 19 04:00:56 UTC 2025","passed","Fri Dec 19 04:00:56 UTC 2025","TestFooter","footer_test","",""
"","594","H.6 Проверка перехода на страницу 'https://app.pulsewave.ru/auth/signup' по кнопке 'Регистрация'","tests.ui_tests","Fri Dec 19 04:13:18 UTC 2025","passed","Fri Dec 19 04:13:19 UTC 2025","TestHeader","header_test","",""
"","1266","W.9 Проверка возможности изменить цвет переключателя 'Непрочитанные'","tests.ui_tests","Fri Dec 19 04:17:36 UTC 2025","passed","Fri Dec 19 04:17:37 UTC 2025","TestWorkspacePage","workspace_page_test","",""
"","60","F.8 Проверка кликабельности значка LinkedIn на странице 'https://app.pulsewave.ru/auth/signup' в футере","tests.ui_tests","Fri Dec 19 04:11:30 UTC 2025","passed","Fri Dec 19 04:11:30 UTC 2025","TestFooter","footer_test","",""
"","550","S.5 Проверка шрифта заголовка 'Регистрация'","tests.ui_tests","Fri Dec 19 04:16:03 UTC 2025","passed","Fri Dec 19 04:16:04 UTC 2025","TestSignupPage","signup_page_test","",""
"","2762","S.11 Регистрация с пустым email и сильным паролем и подтверждением пароля","tests.ui_tests","Fri Dec 19 04:16:35 UTC 2025","passed","Fri Dec 19 04:16:38 UTC 2025","TestSignupPage","signup_page_test","",""
"","1523","H.2 Проверка редиректа на главную страницу при клике на логотип","tests.ui_tests","Fri Dec 19 04:12:45 UTC 2025","passed","Fri Dec 19 04:12:47 UTC 2025","TestHeader","header_test","",""
"","67","F.5 Проверка шрифта надписи 'info@pulsewave.ru' в футере","tests.ui_tests","Fri Dec 19 04:05:40 UTC 2025","passed","Fri Dec 19 04:05:40 UTC 2025","TestFooter","footer_test","",""
"","47","F.5 Проверка размера шрифта надписи 'info@pulsewave.ru' в футере","tests.ui_tests","Fri Dec 19 04:03:18 UTC 2025","passed","Fri Dec 19 04:03:18 UTC 2025","TestFooter","footer_test","",""
"","497","A.30 POST Создать пользователя с некорректными данными","tests.api_tests","Fri Dec 19 03:57:19 UTC 2025","passed","Fri Dec 19 03:57:19 UTC 2025","TestAPI","api_test","",""
"","29","H.8 Проверка цвета шрифта кнопки 'Регистрация в хедере https://app.pulsewave.ru/auth/login'","tests.ui_tests","Fri Dec 19 04:13:47 UTC 2025","passed","Fri Dec 19 04:13:47 UTC 2025","TestHeader","header_test","",""
"","1283","A.22 POST Сброс пароля","tests.api_tests","Fri Dec 19 03:56:41 UTC 2025","passed","Fri Dec 19 03:56:42 UTC 2025","TestAPI","api_test","",""
"","47","F.2 Проверка отсутствия ссылки на Лицензионное соглашение со страницы 'https://pulsewave.ru/","tests.ui_tests","Fri Dec 19 03:59:44 UTC 2025","passed","Fri Dec 19 03:59:44 UTC 2025","TestFooter","footer_test","",""
"","4644","M.1 Проверка редиректа с /home на страницу лендинга","tests.ui_tests","Fri Dec 19 04:14:00 UTC 2025","passed","Fri Dec 19 04:14:04 UTC 2025","TestLendingPage","lending_test","",""
"","546","F.6 Проверка цвета шрифта надписи '© PulseWave, 2023-2025' в футере","tests.ui_tests","Fri Dec 19 04:08:00 UTC 2025","passed","Fri Dec 19 04:08:00 UTC 2025","TestFooter","footer_test","",""
"","71","F.9 Проверка перехода в LinkedIn на странице 'https://app.pulsewave.ru/auth/signup' в футере","tests.ui_tests","Fri Dec 19 04:12:40 UTC 2025","passed","Fri Dec 19 04:12:40 UTC 2025","TestFooter","footer_test","",""
"","105","W.13 Проверка видимости выпадающего меню Рабочие пространства","tests.ui_tests","Fri Dec 19 04:17:58 UTC 2025","passed","Fri Dec 19 04:17:58 UTC 2025","TestWorkspacePage","workspace_page_test","",""
"","164","W.10 Проверка цвета переключателя 'Непрочитанные'","tests.ui_tests","Fri Dec 19 04:17:42 UTC 2025","passed","Fri Dec 19 04:17:42 UTC 2025","TestWorkspacePage","workspace_page_test","",""
"","644","W.11 Проверка видимости уведомлений","tests.ui_tests","Fri Dec 19 04:17:47 UTC 2025","passed","Fri Dec 19 04:17:48 UTC 2025","TestWorkspacePage","workspace_page_test","",""
"","41","L.1 Проверка текста заголовка 'Войти'","tests.ui_tests","Fri Dec 19 04:14:14 UTC 2025","passed","Fri Dec 19 04:14:14 UTC 2025","TestLoginPage","login_page_test","",""
"","8","F.7 Проверка значка LinkedIn на странице 'https://app.pulsewave.ru/auth/login' в футере","tests.ui_tests","Fri Dec 19 04:10:17 UTC 2025","passed","Fri Dec 19 04:10:17 UTC 2025","TestFooter","footer_test","",""
"","2177","F.1 Проверка попапа о принятии файлов cookie на странице https://app.pulsewave.ru/auth/login","tests.ui_tests","Fri Dec 19 03:58:34 UTC 2025","passed","Fri Dec 19 03:58:36 UTC 2025","TestFooter","footer_test","",""
"","1239","Проверка доступности https://web.dev.pulsewave.ru/","tests.api_tests","Fri Dec 19 03:57:19 UTC 2025","passed","Fri Dec 19 03:57:21 UTC 2025","TestAvailability","availability_test","",""
"","760","A.28 POST Регистрация пользователя без подтверждения подписки","tests.api_tests","Fri Dec 19 03:57:11 UTC 2025","passed","Fri Dec 19 03:57:12 UTC 2025","TestAPI","api_test","",""
"","177","M.2 Проверка кликабельности логотипа на лендинге","tests.ui_tests","Fri Dec 19 04:14:06 UTC 2025","passed","Fri Dec 19 04:14:06 UTC 2025","TestLendingPage","lending_test","",""
"Пользователи добавляются по одному. Если пользователя не существует, он будет создан","4184","A.4 POST Пригласить пользователя по email","tests.api_tests","Fri Dec 19 03:55:40 UTC 2025","passed","Fri Dec 19 03:55:44 UTC 2025","TestAPI","api_test","",""
"","8","W.3 Проверка видимости аватара","tests.ui_tests","Fri Dec 19 04:17:05 UTC 2025","passed","Fri Dec 19 04:17:05 UTC 2025","TestWorkspacePage","workspace_page_test","",""
"","1501","W.6 Проверка перехода в Рабочие пространства по ссылке На главную","tests.ui_tests","Fri Dec 19 04:17:20 UTC 2025","passed","Fri Dec 19 04:17:22 UTC 2025","TestWorkspacePage","workspace_page_test","",""
"","12","F.7 Проверка значка LinkedIn на странице 'https://pulsewave.ru/' в футере","tests.ui_tests","Fri Dec 19 04:10:14 UTC 2025","passed","Fri Dec 19 04:10:14 UTC 2025","TestFooter","footer_test","",""
"","85","F.9 Проверка перехода в LinkedIn на странице 'https://pulsewave.ru/' в футере","tests.ui_tests","Fri Dec 19 04:12:35 UTC 2025","passed","Fri Dec 19 04:12:35 UTC 2025","TestFooter","footer_test","",""
"","831","S.7 Регистрация с некорректным email и сильным паролем и подтверждением пароля","tests.ui_tests","Fri Dec 19 04:16:09 UTC 2025","passed","Fri Dec 19 04:16:10 UTC 2025","TestSignupPage","signup_page_test","",""
"","0","S.14 Окно регистрации сообщение 'Регистрируясь, я соглашаюсь с Условиями пользования и Политикой конфиденциальности' проверка корректности перехода по ссылке 'Политикой конфиденциальности'","tests.ui_tests","Fri Dec 19 04:16:41 UTC 2025","skipped","Fri Dec 19 04:16:41 UTC 2025","TestSignupPage","signup_page_test","",""
"","45","F.5 Проверка цвета шрифта надписи 'info@pulsewave.ru' в футере","tests.ui_tests","Fri Dec 19 04:04:25 UTC 2025","passed","Fri Dec 19 04:04:25 UTC 2025","TestFooter","footer_test","",""
"","7468","R.5 Восстановить пароль на корректный емайл","tests.ui_tests","Fri Dec 19 04:15:16 UTC 2025","passed","Fri Dec 19 04:15:23 UTC 2025","TestPasswordRecoveryPage","password_recovery_test","",""
"","43","S.4 Проверка текста заголовка 'Регистрация'","tests.ui_tests","Fri Dec 19 04:15:56 UTC 2025","passed","Fri Dec 19 04:15:56 UTC 2025","TestSignupPage","signup_page_test","",""
"","57","F.8 Проверка кликабельности значка LinkedIn на странице 'https://app.pulsewave.ru/auth/login' в футере","tests.ui_tests","Fri Dec 19 04:11:27 UTC 2025","passed","Fri Dec 19 04:11:27 UTC 2025","TestFooter","footer_test","",""
"","4153","A.5 POST Повторная отправка ссылки с приглашением пользователя","tests.api_tests","Fri Dec 19 03:55:44 UTC 2025","passed","Fri Dec 19 03:55:48 UTC 2025","TestAPI","api_test","",""
"","4901","A.24 POST Установить новый пароль. Используется в личном кабинете после авторизации.","tests.api_tests","Fri Dec 19 03:57:03 UTC 2025","passed","Fri Dec 19 03:57:08 UTC 2025","TestAPI","api_test","",""
"","1279","A.17 GET Получить список всех пользователей для поиска","tests.api_tests","Fri Dec 19 03:56:14 UTC 2025","passed","Fri Dec 19 03:56:15 UTC 2025","TestAPI","api_test","",""
"","2223","L.8 Авторизация с пустым емайл","tests.ui_tests","Fri Dec 19 04:14:42 UTC 2025","passed","Fri Dec 19 04:14:44 UTC 2025","TestLoginPage","login_page_test","",""
"","15260","S.1 Регистрация с корректными email и паролем и с согласием на подписку","tests.ui_tests","Fri Dec 19 04:15:30 UTC 2025","passed","Fri Dec 19 04:15:45 UTC 2025","TestSignupPage","signup_page_test","",""
"Удаление как из участников так и из приглашенных","2317","A.6 POST Удаление приглашенного пользователей из РП","tests.api_tests","Fri Dec 19 03:55:48 UTC 2025","passed","Fri Dec 19 03:55:51 UTC 2025","TestAPI","api_test","",""
"","3","W.4 Проверка что авторизованный пользователь попадает в Рабочие пространства","tests.ui_tests","Fri Dec 19 04:17:09 UTC 2025","passed","Fri Dec 19 04:17:09 UTC 2025","TestWorkspacePage","workspace_page_test","",""
"","52","F.5 Проверка размера шрифта надписи 'info@pulsewave.ru' в футере","tests.ui_tests","Fri Dec 19 04:03:21 UTC 2025","passed","Fri Dec 19 04:03:21 UTC 2025","TestFooter","footer_test","",""
"","844","S.6 Окно регистрации сообщение 'Слабый пароль. Пароль должен содержать минимум 8 символов, включая буквы и цифры'","tests.ui_tests","Fri Dec 19 04:16:06 UTC 2025","passed","Fri Dec 19 04:16:07 UTC 2025","TestSignupPage","signup_page_test","",""
"","3131","A.10 GET Информация о конкретном рабочем пространстве","tests.api_tests","Fri Dec 19 03:55:54 UTC 2025","passed","Fri Dec 19 03:55:57 UTC 2025","TestAPI","api_test","",""
"","1250","R.6 Восстановить пароль на некорректный емайл","tests.ui_tests","Fri Dec 19 04:15:27 UTC 2025","passed","Fri Dec 19 04:15:28 UTC 2025","TestPasswordRecoveryPage","password_recovery_test","",""
"","43","F.6 Проверка шрифта надписи '© PulseWave, 2023-2025' в футере","tests.ui_tests","Fri Dec 19 04:09:08 UTC 2025","passed","Fri Dec 19 04:09:08 UTC 2025","TestFooter","footer_test","",""
"","47","F.4 Проверка года © PulseWave, 2025 в футере","tests.ui_tests","Fri Dec 19 04:02:11 UTC 2025","passed","Fri Dec 19 04:02:11 UTC 2025","TestFooter","footer_test","",""
"","8127","S.8 Регистрация с корректными email и паролем без согласия на подписку","tests.ui_tests","Fri Dec 19 04:16:15 UTC 2025","passed","Fri Dec 19 04:16:23 UTC 2025","TestSignupPage","signup_page_test","",""
"","1389","S.3 Регистрация с уже зарегистрированным email и корректными паролем и подтверждением пароля","tests.ui_tests","Fri Dec 19 04:15:51 UTC 2025","passed","Fri Dec 19 04:15:53 UTC 2025","TestSignupPage","signup_page_test","",""
"","1510","W.5 Проверка что авторизованный пользователь может выйти из аккаунта","tests.ui_tests","Fri Dec 19 04:17:14 UTC 2025","passed","Fri Dec 19 04:17:16 UTC 2025","TestWorkspacePage","workspace_page_test","",""
