"DESCRIPTION","DURATION IN MS","NAME","PARENT SUITE","START TIME","STATUS","STOP TIME","SUB SUITE","SUITE","TEST CLASS","TEST METHOD"
"","535","H.8 Проверка шрифта кнопки 'Регистрация в хедере https://app.pulsewave.ru/auth/password?email='","tests.ui_tests","Fri Dec 19 04:13:54 UTC 2025","passed","Fri Dec 19 04:13:54 UTC 2025","TestHeader","header_test","",""
"","2337","L.4 Авторизация с корректными данными","tests.ui_tests","Fri Dec 19 04:14:27 UTC 2025","passed","Fri Dec 19 04:14:29 UTC 2025","TestLoginPage","login_page_test","",""
"","49","F.4 Проверка года © PulseWave, 2025 в футере","tests.ui_tests","Fri Dec 19 04:02:13 UTC 2025","passed","Fri Dec 19 04:02:13 UTC 2025","TestFooter","footer_test","",""
"","1778","A.20 POST Запрос на смену почты","tests.api_tests","Fri Dec 19 03:56:18 UTC 2025","passed","Fri Dec 19 03:56:20 UTC 2025","TestAPI","api_test","",""
"","118","F.3 Проверка элемента 'info@pulsewave.ru'в хедере","tests.ui_tests","Fri Dec 19 04:01:01 UTC 2025","passed","Fri Dec 19 04:01:01 UTC 2025","TestFooter","footer_test","",""
"","2297","L.9 Авторизация с логином заглавными буквами","tests.ui_tests","Fri Dec 19 04:14:51 UTC 2025","passed","Fri Dec 19 04:14:53 UTC 2025","TestLoginPage","login_page_test","",""
"","1405","A.9 GET Получить список всех Рабочих пространств авторизованного пользователя","tests.api_tests","Fri Dec 19 03:55:52 UTC 2025","passed","Fri Dec 19 03:55:54 UTC 2025","TestAPI","api_test","",""
"","58","M.4 Проверка текста кнопки 'Бесплатная регистрация' на лендинге","tests.ui_tests","Fri Dec 19 04:14:11 UTC 2025","passed","Fri Dec 19 04:14:11 UTC 2025","TestLendingPage","lending_test","",""
"","720","Проверка доступности https://app.pulsewave.ru/","tests.api_tests","Fri Dec 19 03:57:23 UTC 2025","passed","Fri Dec 19 03:57:24 UTC 2025","TestAvailability","availability_test","",""
"","74","F.9 Проверка перехода в LinkedIn на странице 'https://app.pulsewave.ru/auth/password?email=' в футере","tests.ui_tests","Fri Dec 19 04:12:43 UTC 2025","passed","Fri Dec 19 04:12:43 UTC 2025","TestFooter","footer_test","",""
"","36","H.4 Проверка текста кнопки 'Регистрация'","tests.ui_tests","Fri Dec 19 04:13:05 UTC 2025","passed","Fri Dec 19 04:13:05 UTC 2025","TestHeader","header_test","",""
"","9","F.7 Проверка значка LinkedIn на странице 'https://app.pulsewave.ru/auth/password?email=' в футере","tests.ui_tests","Fri Dec 19 04:10:22 UTC 2025","passed","Fri Dec 19 04:10:22 UTC 2025","TestFooter","footer_test","",""
"","52","F.5 Проверка цвета шрифта надписи 'info@pulsewave.ru' в футере","tests.ui_tests","Fri Dec 19 04:04:28 UTC 2025","passed","Fri Dec 19 04:04:28 UTC 2025","TestFooter","footer_test","",""
"","520","F.7 Проверка значка LinkedIn на странице 'https://app.pulsewave.ru/auth/signup' в футере","tests.ui_tests","Fri Dec 19 04:10:19 UTC 2025","passed","Fri Dec 19 04:10:20 UTC 2025","TestFooter","footer_test","",""
"","92","F.3 Проверка элемента 'info@pulsewave.ru'в хедере","tests.ui_tests","Fri Dec 19 04:01:03 UTC 2025","passed","Fri Dec 19 04:01:04 UTC 2025","TestFooter","footer_test","",""
"","486","Проверка доступности https://api.pulsewave.ru/api/healthcheck/","tests.api_tests","Fri Dec 19 03:57:24 UTC 2025","passed","Fri Dec 19 03:57:24 UTC 2025","TestAvailability","availability_test","",""
"","1341","L.5 Авторизация с некорректным паролем","tests.ui_tests","Fri Dec 19 04:14:32 UTC 2025","passed","Fri Dec 19 04:14:33 UTC 2025","TestLoginPage","login_page_test","",""
"","47","F.4 Проверка года © PulseWave, 2025 в футере","tests.ui_tests","Fri Dec 19 04:02:08 UTC 2025","passed","Fri Dec 19 04:02:08 UTC 2025","TestFooter","footer_test","",""
"","1255","W.12 Проверка прочтения уведомлений","tests.ui_tests","Fri Dec 19 04:17:52 UTC 2025","passed","Fri Dec 19 04:17:53 UTC 2025","TestWorkspacePage","workspace_page_test","",""
"","497","A.30 POST Создать пользователя с некорректными данными","tests.api_tests","Fri Dec 19 03:57:18 UTC 2025","passed","Fri Dec 19 03:57:19 UTC 2025","TestAPI","api_test","",""
"","514","A.26 POST Регистрация пользователя без электронной почты","tests.api_tests","Fri Dec 19 03:57:10 UTC 2025","passed","Fri Dec 19 03:57:10 UTC 2025","TestAPI","api_test","",""
"","53","F.6 Проверка шрифта надписи '© PulseWave, 2023-2025' в футере","tests.ui_tests","Fri Dec 19 04:09:05 UTC 2025","passed","Fri Dec 19 04:09:05 UTC 2025","TestFooter","footer_test","",""
"","592","H.6 Проверка перехода на страницу 'https://app.pulsewave.ru/auth/signup' по кнопке 'Регистрация'","tests.ui_tests","Fri Dec 19 04:13:14 UTC 2025","passed","Fri Dec 19 04:13:15 UTC 2025","TestHeader","header_test","",""
"","0","S.13 Окно регистрации сообщение 'Регистрируясь, я соглашаюсь с Условиями пользования и Политикой конфиденциальности'","tests.ui_tests","Fri Dec 19 04:16:41 UTC 2025","skipped","Fri Dec 19 04:16:41 UTC 2025","TestSignupPage","signup_page_test","",""
"","66","S.5 Проверка цвета шрифта заголовка 'Регистрация'","tests.ui_tests","Fri Dec 19 04:16:01 UTC 2025","passed","Fri Dec 19 04:16:01 UTC 2025","TestSignupPage","signup_page_test","",""
"","545","F.6 Проверка размера шрифта надписи '© PulseWave, 2023-2025' в футере","tests.ui_tests","Fri Dec 19 04:06:47 UTC 2025","passed","Fri Dec 19 04:06:47 UTC 2025","TestFooter","footer_test","",""
"","1684","A.25 DELETE Удалить авторизованного пользователя","tests.api_tests","Fri Dec 19 03:57:08 UTC 2025","passed","Fri Dec 19 03:57:10 UTC 2025","TestAPI","api_test","",""
"","37","R.2 Проверка цвета шрифта заголовка 'Восстановление пароля'","tests.ui_tests","Fri Dec 19 04:15:01 UTC 2025","passed","Fri Dec 19 04:15:01 UTC 2025","TestPasswordRecoveryPage","password_recovery_test","",""
"","530","H.7 Проверка цвета кнопки 'Войти' в хедере https://app.pulsewave.ru/auth/signup","tests.ui_tests","Fri Dec 19 04:13:36 UTC 2025","passed","Fri Dec 19 04:13:37 UTC 2025","TestHeader","header_test","",""
"","37","H.8 Проверка цвета шрифта кнопки 'Регистрация в хедере https://app.pulsewave.ru/auth/password?email='","tests.ui_tests","Fri Dec 19 04:13:49 UTC 2025","passed","Fri Dec 19 04:13:49 UTC 2025","TestHeader","header_test","",""
"","596","H.5 Проверка перехода на страницу 'https://app.pulsewave.ru/auth/login' по кнопке 'Войти'","tests.ui_tests","Fri Dec 19 04:13:11 UTC 2025","passed","Fri Dec 19 04:13:12 UTC 2025","TestHeader","header_test","",""
"","324","W.8 Проверка невидимости кнопки 'Отметить все как прочитанные' в прочитанных уведомлениях","tests.ui_tests","Fri Dec 19 04:17:31 UTC 2025","passed","Fri Dec 19 04:17:31 UTC 2025","TestWorkspacePage","workspace_page_test","",""
"","1081","A.2 POST Создать пользователя с корректными данными","tests.api_tests","Fri Dec 19 03:55:35 UTC 2025","passed","Fri Dec 19 03:55:36 UTC 2025","TestAPI","api_test","",""
"","36","H.3 Проверка текста кнопки 'Войти'","tests.ui_tests","Fri Dec 19 04:13:00 UTC 2025","passed","Fri Dec 19 04:13:00 UTC 2025","TestHeader","header_test","",""
"","41","R.2 Проверка размера шрифта заголовка 'Восстановление пароля'","tests.ui_tests","Fri Dec 19 04:14:58 UTC 2025","passed","Fri Dec 19 04:14:58 UTC 2025","TestPasswordRecoveryPage","password_recovery_test","",""
"","44","F.5 Проверка шрифта надписи 'info@pulsewave.ru' в футере","tests.ui_tests","Fri Dec 19 04:05:42 UTC 2025","passed","Fri Dec 19 04:05:42 UTC 2025","TestFooter","footer_test","",""
"","38","H.7 Проверка цвета кнопки 'Войти' в хедере https://app.pulsewave.ru/auth/password?email=","tests.ui_tests","Fri Dec 19 04:13:39 UTC 2025","passed","Fri Dec 19 04:13:39 UTC 2025","TestHeader","header_test","",""
"","3","W.2 Проверка заголовка рабочего пространства","tests.ui_tests","Fri Dec 19 04:17:00 UTC 2025","passed","Fri Dec 19 04:17:00 UTC 2025","TestWorkspacePage","workspace_page_test","",""
"","2067","H.2 Проверка редиректа на главную страницу при клике на логотип","tests.ui_tests","Fri Dec 19 04:12:49 UTC 2025","passed","Fri Dec 19 04:12:51 UTC 2025","TestHeader","header_test","",""
"","486","A.27 POST Регистрация пользователя без пароля","tests.api_tests","Fri Dec 19 03:57:10 UTC 2025","passed","Fri Dec 19 03:57:11 UTC 2025","TestAPI","api_test","",""
"","2694","A.15 GET Список всех пользователей доски для назначения ответственных","tests.api_tests","Fri Dec 19 03:56:10 UTC 2025","passed","Fri Dec 19 03:56:13 UTC 2025","TestAPI","api_test","",""
"","330","S.7 Регистрация с некорректным email и сильным паролем и подтверждением пароля","tests.ui_tests","Fri Dec 19 04:16:12 UTC 2025","passed","Fri Dec 19 04:16:13 UTC 2025","TestSignupPage","signup_page_test","",""
"","2243","L.8 Авторизация с пустым паролем","tests.ui_tests","Fri Dec 19 04:14:46 UTC 2025","passed","Fri Dec 19 04:14:48 UTC 2025","TestLoginPage","login_page_test","",""
"","587","F.3 Проверка элемента 'info@pulsewave.ru'в хедере","tests.ui_tests","Fri Dec 19 04:00:58 UTC 2025","passed","Fri Dec 19 04:00:58 UTC 2025","TestFooter","footer_test","",""
"","820","S.16 Регистрация с корректным email и слабым паролем и подтверждением пароля","tests.ui_tests","Fri Dec 19 04:16:46 UTC 2025","passed","Fri Dec 19 04:16:47 UTC 2025","TestSignupPage","signup_page_test","",""
"","42","L.2 Проверка цвета шрифта заголовка 'Войти'","tests.ui_tests","Fri Dec 19 04:14:19 UTC 2025","passed","Fri Dec 19 04:14:19 UTC 2025","TestLoginPage","login_page_test","",""
"","1521","H.2 Проверка редиректа на главную страницу при клике на логотип","tests.ui_tests","Fri Dec 19 04:12:53 UTC 2025","passed","Fri Dec 19 04:12:55 UTC 2025","TestHeader","header_test","",""
"","64","F.9 Проверка перехода в LinkedIn на странице 'https://app.pulsewave.ru/auth/login' в футере","tests.ui_tests","Fri Dec 19 04:12:38 UTC 2025","passed","Fri Dec 19 04:12:38 UTC 2025","TestFooter","footer_test","",""
"","44","F.2 Проверка отсутствия ссылки на Лицензионное соглашение со страницы 'https://app.pulsewave.ru/auth/login","tests.ui_tests","Fri Dec 19 03:59:46 UTC 2025","passed","Fri Dec 19 03:59:46 UTC 2025","TestFooter","footer_test","",""
"","3","W.1 Проверка перехода в рабочее пространство авторизованного пользователя","tests.ui_tests","Fri Dec 19 04:16:55 UTC 2025","passed","Fri Dec 19 04:16:55 UTC 2025","TestWorkspacePage","workspace_page_test","",""
"","1310","A.19 GET Получить данные авторизованного пользователя me","tests.api_tests","Fri Dec 19 03:56:16 UTC 2025","passed","Fri Dec 19 03:56:18 UTC 2025","TestAPI","api_test","",""
"","605","L.3 Проверка редиректа на страницу восстановления пароля при клике на ссылку 'Забыли пароль?'","tests.ui_tests","Fri Dec 19 04:14:24 UTC 2025","passed","Fri Dec 19 04:14:25 UTC 2025","TestLoginPage","login_page_test","",""
"","21246","A.23 POST Подтверждение сброса пароля. Когда пользователь переходит по ссылке     auth/password/reset/confirm/{uid}/{token}","tests.api_tests","Fri Dec 19 03:56:42 UTC 2025","passed","Fri Dec 19 03:57:03 UTC 2025","TestAPI","api_test","",""
"","2082","R.3  Проверка некликабельности кнопки 'Продолжить'","tests.ui_tests","Fri Dec 19 04:15:06 UTC 2025","passed","Fri Dec 19 04:15:08 UTC 2025","TestPasswordRecoveryPage","password_recovery_test","",""
"","28","H.8 Проверка шрифта кнопки 'Регистрация в хедере https://app.pulsewave.ru/auth/login'","tests.ui_tests","Fri Dec 19 04:13:51 UTC 2025","passed","Fri Dec 19 04:13:51 UTC 2025","TestHeader","header_test","",""
"","37","F.6 Проверка цвета шрифта надписи '© PulseWave, 2023-2025' в футере","tests.ui_tests","Fri Dec 19 04:08:03 UTC 2025","passed","Fri Dec 19 04:08:03 UTC 2025","TestFooter","footer_test","",""
"","1184","Проверка доступности https://pulsewave.ru/","tests.api_tests","Fri Dec 19 03:57:22 UTC 2025","passed","Fri Dec 19 03:57:23 UTC 2025","TestAvailability","availability_test","",""
"","38","L.2 Проверка шрифта заголовка 'Войти'","tests.ui_tests","Fri Dec 19 04:14:21 UTC 2025","passed","Fri Dec 19 04:14:21 UTC 2025","TestLoginPage","login_page_test","",""
"","64","F.8 Проверка кликабельности значка LinkedIn на странице 'https://app.pulsewave.ru/auth/password?email=' в футере","tests.ui_tests","Fri Dec 19 04:11:33 UTC 2025","passed","Fri Dec 19 04:11:33 UTC 2025","TestFooter","footer_test","",""
"","0","S.15 Окно регистрации сообщение 'Регистрируясь, я соглашаюсь с Условиями пользования и Политикой конфиденциальности', проверка корректности перехода по ссылке 'Условиями пользования'","tests.ui_tests","Fri Dec 19 04:16:41 UTC 2025","skipped","Fri Dec 19 04:16:41 UTC 2025","TestSignupPage","signup_page_test","",""
"","33","H.8 Проверка размера шрифта кнопки 'Регистрация в хедере https://app.pulsewave.ru/auth/password?email='","tests.ui_tests","Fri Dec 19 04:13:44 UTC 2025","passed","Fri Dec 19 04:13:44 UTC 2025","TestHeader","header_test","",""
"","520","A.7 POST Регистрация ранее зарегистрированного пользователя","tests.api_tests","Fri Dec 19 03:55:51 UTC 2025","passed","Fri Dec 19 03:55:51 UTC 2025","TestAPI","api_test","",""
"","29","H.4 Проверка текста кнопки 'Регистрация'","tests.ui_tests","Fri Dec 19 04:13:03 UTC 2025","passed","Fri Dec 19 04:13:03 UTC 2025","TestHeader","header_test","",""
"","32","H.7 Проверка шрифта кнопки 'Войти' в хедере https://app.pulsewave.ru/auth/password?email=","tests.ui_tests","Fri Dec 19 04:13:34 UTC 2025","passed","Fri Dec 19 04:13:34 UTC 2025","TestHeader","header_test","",""
"","50","F.6 Проверка размера шрифта надписи '© PulseWave, 2023-2025' в футере","tests.ui_tests","Fri Dec 19 04:06:45 UTC 2025","passed","Fri Dec 19 04:06:45 UTC 2025","TestFooter","footer_test","",""
"","529","H.7 Проверка размера шрифта кнопки 'Войти' в хедере https://app.pulsewave.ru/auth/signup","tests.ui_tests","Fri Dec 19 04:13:21 UTC 2025","passed","Fri Dec 19 04:13:22 UTC 2025","TestHeader","header_test","",""
"","2770","S.10 Регистрация с корректным email и подтверждением пароля и пустым паролем","tests.ui_tests","Fri Dec 19 04:16:30 UTC 2025","passed","Fri Dec 19 04:16:33 UTC 2025","TestSignupPage","signup_page_test","",""
"","40","R.2 Проверка шрифта заголовка 'Восстановление пароля'","tests.ui_tests","Fri Dec 19 04:15:03 UTC 2025","passed","Fri Dec 19 04:15:03 UTC 2025","TestPasswordRecoveryPage","password_recovery_test","",""
"","35","H.8 Проверка цвета кнопки 'Регистрация в хедере https://app.pulsewave.ru/auth/password?email='","tests.ui_tests","Fri Dec 19 04:13:59 UTC 2025","passed","Fri Dec 19 04:13:59 UTC 2025","TestHeader","header_test","",""
"","826","S.16 Регистрация с корректным email и слабым паролем и подтверждением пароля","tests.ui_tests","Fri Dec 19 04:16:49 UTC 2025","passed","Fri Dec 19 04:16:50 UTC 2025","TestSignupPage","signup_page_test","",""
"","496","A.30 POST Создать пользователя с некорректными данными","tests.api_tests","Fri Dec 19 03:57:18 UTC 2025","passed","Fri Dec 19 03:57:18 UTC 2025","TestAPI","api_test","",""
"","52","F.5 Проверка шрифта надписи 'info@pulsewave.ru' в футере","tests.ui_tests","Fri Dec 19 04:05:35 UTC 2025","passed","Fri Dec 19 04:05:35 UTC 2025","TestFooter","footer_test","",""
"","4098","A.3 POST Активация пользователя с корректными данными","tests.api_tests","Fri Dec 19 03:55:36 UTC 2025","passed","Fri Dec 19 03:55:40 UTC 2025","TestAPI","api_test","",""
"","46","F.5 Проверка размера шрифта надписи 'info@pulsewave.ru' в футере","tests.ui_tests","Fri Dec 19 04:03:23 UTC 2025","passed","Fri Dec 19 04:03:23 UTC 2025","TestFooter","footer_test","",""
"","548","R.1 Проверка текста заголовка 'Восстановление пароля'","tests.ui_tests","Fri Dec 19 04:14:55 UTC 2025","passed","Fri Dec 19 04:14:56 UTC 2025","TestPasswordRecoveryPage","password_recovery_test","",""
"","534","H.3 Проверка текста кнопки 'Войти'","tests.ui_tests","Fri Dec 19 04:12:57 UTC 2025","passed","Fri Dec 19 04:12:58 UTC 2025","TestHeader","header_test","",""
"","5149","A.13 POST Подтверждение приглашения в РП","tests.api_tests","Fri Dec 19 03:56:03 UTC 2025","passed","Fri Dec 19 03:56:08 UTC 2025","TestAPI","api_test","",""
"","44","F.6 Проверка размера шрифта надписи '© PulseWave, 2023-2025' в футере","tests.ui_tests","Fri Dec 19 04:06:53 UTC 2025","passed","Fri Dec 19 04:06:53 UTC 2025","TestFooter","footer_test","",""
"","46","F.6 Проверка цвета шрифта надписи '© PulseWave, 2023-2025' в футере","tests.ui_tests","Fri Dec 19 04:07:55 UTC 2025","passed","Fri Dec 19 04:07:55 UTC 2025","TestFooter","footer_test","",""
"","36","W.7 Проверка видимости заголовка 'Ваши рабочие пространства'","tests.ui_tests","Fri Dec 19 04:17:26 UTC 2025","passed","Fri Dec 19 04:17:26 UTC 2025","TestWorkspacePage","workspace_page_test","",""
"","21137","A.21 POST Подтверждение смены почты пользователя. Токен из ссылки auth/change_email/{token}.","tests.api_tests","Fri Dec 19 03:56:20 UTC 2025","passed","Fri Dec 19 03:56:41 UTC 2025","TestAPI","api_test","",""
"","1931","F.1 Проверка попапа о принятии файлов cookie на странице https://app.pulsewave.ru/auth/password?email=","tests.ui_tests","Fri Dec 19 03:58:39 UTC 2025","passed","Fri Dec 19 03:58:40 UTC 2025","TestFooter","footer_test","",""
"","553","F.5 Проверка цвета шрифта надписи 'info@pulsewave.ru' в футере","tests.ui_tests","Fri Dec 19 04:04:30 UTC 2025","passed","Fri Dec 19 04:04:31 UTC 2025","TestFooter","footer_test","",""
"","1257","A.16 POST Создать Рабочее пространство","tests.api_tests","Fri Dec 19 03:56:13 UTC 2025","passed","Fri Dec 19 03:56:14 UTC 2025","TestAPI","api_test","",""
"","47","F.6 Проверка шрифта надписи '© PulseWave, 2023-2025' в футере","tests.ui_tests","Fri Dec 19 04:09:10 UTC 2025","passed","Fri Dec 19 04:09:10 UTC 2025","TestFooter","footer_test","",""
"","39","F.6 Проверка размера шрифта надписи '© PulseWave, 2023-2025' в футере","tests.ui_tests","Fri Dec 19 04:06:50 UTC 2025","passed","Fri Dec 19 04:06:50 UTC 2025","TestFooter","footer_test","",""
"","31","H.7 Проверка размера шрифта кнопки 'Войти' в хедере https://app.pulsewave.ru/auth/password?email=","tests.ui_tests","Fri Dec 19 04:13:24 UTC 2025","passed","Fri Dec 19 04:13:24 UTC 2025","TestHeader","header_test","",""
"Создание доски без указания РП, будет создано дефолтное РП для этой доски","1414","A.14 POST Создать доску без указания РП","tests.api_tests","Fri Dec 19 03:56:08 UTC 2025","passed","Fri Dec 19 03:56:10 UTC 2025","TestAPI","api_test","",""
"","50","F.4 Проверка года © PulseWave, 2025 в футере","tests.ui_tests","Fri Dec 19 04:02:06 UTC 2025","passed","Fri Dec 19 04:02:06 UTC 2025","TestFooter","footer_test","",""
"","1320","L.7 Авторизация с некорректным емайл","tests.ui_tests","Fri Dec 19 04:14:38 UTC 2025","passed","Fri Dec 19 04:14:39 UTC 2025","TestLoginPage","login_page_test","",""
"","6437","A.29 DELETE Активировать и удалить авторизованного пользователя","tests.api_tests","Fri Dec 19 03:57:12 UTC 2025","passed","Fri Dec 19 03:57:18 UTC 2025","TestAPI","api_test","",""
"","1016","A.8 POST Создать пару токенов access и refresh","tests.api_tests","Fri Dec 19 03:55:51 UTC 2025","passed","Fri Dec 19 03:55:52 UTC 2025","TestAPI","api_test","",""
"","42","F.6 Проверка шрифта надписи '© PulseWave, 2023-2025' в футере","tests.ui_tests","Fri Dec 19 04:09:12 UTC 2025","passed","Fri Dec 19 04:09:12 UTC 2025","TestFooter","footer_test","",""
"","2302","S.9 Регистрация с корректным email и паролем и пустым подтверждением пароля","tests.ui_tests","Fri Dec 19 04:16:25 UTC 2025","passed","Fri Dec 19 04:16:28 UTC 2025","TestSignupPage","signup_page_test","",""
"","2913","A.12 DELETE Удалить РП","tests.api_tests","Fri Dec 19 03:56:00 UTC 2025","passed","Fri Dec 19 03:56:03 UTC 2025","TestAPI","api_test","",""
"","47","F.2 Проверка отсутствия ссылки на Лицензионное соглашение со страницы 'https://app.pulsewave.ru/auth/password?email=","tests.ui_tests","Fri Dec 19 03:59:52 UTC 2025","passed","Fri Dec 19 03:59:52 UTC 2025","TestFooter","footer_test","",""
"","39","S.5 Проверка размера шрифта заголовка 'Регистрация'","tests.ui_tests","Fri Dec 19 04:15:58 UTC 2025","passed","Fri Dec 19 04:15:58 UTC 2025","TestSignupPage","signup_page_test","",""
"","47","F.5 Проверка шрифта надписи 'info@pulsewave.ru' в футере","tests.ui_tests","Fri Dec 19 04:05:37 UTC 2025","passed","Fri Dec 19 04:05:38 UTC 2025","TestFooter","footer_test","",""
"","34","H.7 Проверка цвета шрифта кнопки 'Войти' в хедере https://app.pulsewave.ru/auth/password?email=","tests.ui_tests","Fri Dec 19 04:13:29 UTC 2025","passed","Fri Dec 19 04:13:29 UTC 2025","TestHeader","header_test","",""
"","82","F.8 Проверка кликабельности значка LinkedIn на странице 'https://pulsewave.ru/' в футере","tests.ui_tests","Fri Dec 19 04:11:24 UTC 2025","passed","Fri Dec 19 04:11:25 UTC 2025","TestFooter","footer_test","",""
"","828","S.16 Регистрация с корректным email и слабым паролем и подтверждением пароля","tests.ui_tests","Fri Dec 19 04:16:43 UTC 2025","passed","Fri Dec 19 04:16:44 UTC 2025","TestSignupPage","signup_page_test","",""
"","1082","H.5 Проверка перехода на страницу 'https://app.pulsewave.ru/auth/login' по кнопке 'Войти'","tests.ui_tests","Fri Dec 19 04:13:07 UTC 2025","passed","Fri Dec 19 04:13:08 UTC 2025","TestHeader","header_test","",""
"","544","F.2 Проверка отсутствия ссылки на Лицензионное соглашение со страницы 'https://app.pulsewave.ru/auth/signup","tests.ui_tests","Fri Dec 19 03:59:49 UTC 2025","passed","Fri Dec 19 03:59:49 UTC 2025","TestFooter","footer_test","",""
"","40","F.6 Проверка цвета шрифта надписи '© PulseWave, 2023-2025' в футере","tests.ui_tests","Fri Dec 19 04:07:58 UTC 2025","passed","Fri Dec 19 04:07:58 UTC 2025","TestFooter","footer_test","",""
"","50","M.3 Проверка текста кнопки 'Войти' на лендинге","tests.ui_tests","Fri Dec 19 04:14:09 UTC 2025","passed","Fri Dec 19 04:14:09 UTC 2025","TestLendingPage","lending_test","",""
"","61","L.6 Окно авторизации сообщение 'Забыли пароль?'","tests.ui_tests","Fri Dec 19 04:14:36 UTC 2025","passed","Fri Dec 19 04:14:36 UTC 2025","TestLoginPage","login_page_test","",""
