"Status","Start Time","Stop Time","Duration in ms","Parent Suite","Suite","Sub Suite","Test Class","Test Method","Name","Description"
"passed","Sun Dec 17 23:28:08 GMT 2023","Sun Dec 17 23:28:16 GMT 2023","7094","tests.test_api","test_api","TestAPI","","","POST Запрос на смену почты",""
"passed","Sun Dec 17 23:27:38 GMT 2023","Sun Dec 17 23:27:39 GMT 2023","1541","tests.test_api","test_api","TestAPI","","","POST Создать доску без указания РП","Создание доски без указания РП, будет создано дефолтное РП для этой доски"
"passed","Sun Dec 17 23:31:31 GMT 2023","Sun Dec 17 23:31:31 GMT 2023","33","tests.test_main_page","test_main_page","TestMainPage","","","Проверка размера шрифта кнопки 'Регистрация'",""
"passed","Sun Dec 17 23:33:11 GMT 2023","Sun Dec 17 23:33:11 GMT 2023","52","tests.test_signup_page","test_signup_page","TestSignupPage","","","Окно регистрации сообщение 'Пароль должен содержать не менее 8 символов, включая минимум 1 цифру, 1 строчную и 1 заглавную буквы, 1 спецсимвол.'",""
"passed","Sun Dec 17 23:32:49 GMT 2023","Sun Dec 17 23:32:49 GMT 2023","37","tests.test_main_page","test_main_page","TestMainPage","","","Проверка текста элемента 'Ваша безопасность и конфиденциальность для нас на первом месте!'",""
"passed","Sun Dec 17 23:32:06 GMT 2023","Sun Dec 17 23:32:06 GMT 2023","34","tests.test_main_page","test_main_page","TestMainPage","","","Проверка шрифта элемента 'Самый высокий уровень бесперебойной работы!' в футере",""
"passed","Sun Dec 17 23:27:30 GMT 2023","Sun Dec 17 23:27:35 GMT 2023","4260","tests.test_api","test_api","TestAPI","","","POST Активация пользователя с корректными данными",""
"passed","Sun Dec 17 23:31:12 GMT 2023","Sun Dec 17 23:31:12 GMT 2023","33","tests.test_main_page","test_main_page","TestMainPage","","","Проверка размера шрифта элемента 'PULSEWAVE'",""
"passed","Sun Dec 17 23:33:08 GMT 2023","Sun Dec 17 23:33:08 GMT 2023","59","tests.test_signup_page","test_signup_page","TestSignupPage","","","Проверка редиректа на главную страницу при клике на логотип",""
"passed","Sun Dec 17 23:32:35 GMT 2023","Sun Dec 17 23:32:35 GMT 2023","40","tests.test_main_page","test_main_page","TestMainPage","","","Проверка текста кнопки 'Регистрация'",""
"passed","Sun Dec 17 23:30:13 GMT 2023","Sun Dec 17 23:30:13 GMT 2023","34","tests.test_footer","test_footer","TestFooter","","","Проверка размера шрифта надписи '© PulseWave, 2023' в футере",""
"passed","Sun Dec 17 23:32:44 GMT 2023","Sun Dec 17 23:32:44 GMT 2023","39","tests.test_main_page","test_main_page","TestMainPage","","","Проверка текста элемента 'Удобный и понятный интерфейс!'",""
"passed","Sun Dec 17 23:33:33 GMT 2023","Sun Dec 17 23:33:33 GMT 2023","269","tests.test_signup_page","test_signup_page","TestSignupPage","","","Регистрация с корректным email и слабым паролем и подтверждением пароля",""
"passed","Sun Dec 17 23:33:02 GMT 2023","Sun Dec 17 23:33:03 GMT 2023","32","tests.test_signup_page","test_signup_page","TestSignupPage","","","Проверка цвета шрифта заголовка 'Регистрация'",""
"passed","Sun Dec 17 23:27:42 GMT 2023","Sun Dec 17 23:27:45 GMT 2023","2891","tests.test_api","test_api","TestAPI","","","POST Создать колонку на доске",""
"passed","Sun Dec 17 23:30:24 GMT 2023","Sun Dec 17 23:30:24 GMT 2023","35","tests.test_footer","test_footer","TestFooter","","","Проверка цвета шрифта надписи '© PulseWave, 2023' в футере",""
"passed","Sun Dec 17 23:32:19 GMT 2023","Sun Dec 17 23:32:19 GMT 2023","33","tests.test_main_page","test_main_page","TestMainPage","","","Проверка цвета шрифта элемента 'Неограниченный функционал, понятный интерфейс и большое количество возможностей
помогут Вам улучшить рабочий процесс.' в футере",""
"passed","Sun Dec 17 23:33:36 GMT 2023","Sun Dec 17 23:33:36 GMT 2023","255","tests.test_signup_page","test_signup_page","TestSignupPage","","","Регистрация с некорректным email и сильным паролем и подтверждением пароля",""
"passed","Sun Dec 17 23:31:44 GMT 2023","Sun Dec 17 23:31:44 GMT 2023","34","tests.test_main_page","test_main_page","TestMainPage","","","Проверка цвета шрифта кнопки 'Зарегистрироваться'",""
"passed","Sun Dec 17 23:30:16 GMT 2023","Sun Dec 17 23:30:16 GMT 2023","33","tests.test_footer","test_footer","TestFooter","","","Проверка размера шрифта надписи '© PulseWave, 2023' в футере",""
"passed","Sun Dec 17 23:33:13 GMT 2023","Sun Dec 17 23:33:13 GMT 2023","55","tests.test_signup_page","test_signup_page","TestSignupPage","","","Окно регистрации сообщение 'Я согласен получать новости и обновления PulseWave'",""
"passed","Sun Dec 17 23:27:35 GMT 2023","Sun Dec 17 23:27:35 GMT 2023","779","tests.test_api","test_api","TestAPI","","","POST Регистрация ранее зарегистрированного пользователя",""
"passed","Sun Dec 17 23:28:57 GMT 2023","Sun Dec 17 23:28:58 GMT 2023","135","tests.test_footer","test_footer","TestFooter","","","Проверка перехода на страницу c лицензионным соглашением со страницы 'https://front.pwave.pnpl.tech/",""
"passed","Sun Dec 17 23:31:06 GMT 2023","Sun Dec 17 23:31:06 GMT 2023","63","tests.test_main_page","test_main_page","TestMainPage","","","Проверка перехода на страницу 'https://front.pwave.pnpl.tech/auth/signup' по кнопке 'Регистрация'",""
"passed","Sun Dec 17 23:30:19 GMT 2023","Sun Dec 17 23:30:19 GMT 2023","33","tests.test_footer","test_footer","TestFooter","","","Проверка цвета шрифта надписи '© PulseWave, 2023' в футере",""
"passed","Sun Dec 17 23:29:03 GMT 2023","Sun Dec 17 23:29:03 GMT 2023","132","tests.test_footer","test_footer","TestFooter","","","Проверка перехода на страницу c лицензионным соглашением со страницы 'https://front.pwave.pnpl.tech/auth/signup",""
"passed","Sun Dec 17 23:30:43 GMT 2023","Sun Dec 17 23:30:43 GMT 2023","34","tests.test_login_page","test_login_page","TestLoginPage","","","Проверка шрифта заголовка 'Войти'",""
"passed","Sun Dec 17 23:30:11 GMT 2023","Sun Dec 17 23:30:11 GMT 2023","32","tests.test_footer","test_footer","TestFooter","","","Проверка размера шрифта надписи '© PulseWave, 2023' в футере",""
"passed","Sun Dec 17 23:31:52 GMT 2023","Sun Dec 17 23:31:52 GMT 2023","34","tests.test_main_page","test_main_page","TestMainPage","","","Проверка размера шрифта элемента 'Удобный и понятный интерфейс!' в футере",""
"passed","Sun Dec 17 23:32:30 GMT 2023","Sun Dec 17 23:32:30 GMT 2023","32","tests.test_main_page","test_main_page","TestMainPage","","","Проверка шрифта элемента 'Одно приложениe для решения всех Ваших задач!' в футере",""
"passed","Sun Dec 17 23:29:36 GMT 2023","Sun Dec 17 23:29:36 GMT 2023","34","tests.test_footer","test_footer","TestFooter","","","Проверка цвета шрифта ссылки 'Условия пользования' в футере",""
