"Status","Start Time","Stop Time","Duration in ms","Parent Suite","Suite","Sub Suite","Test Class","Test Method","Name","Description"
"passed","Sun Dec 17 23:29:46 GMT 2023","Sun Dec 17 23:29:46 GMT 2023","32","tests.test_footer","test_footer","TestFooter","","","Проверка размера шрифта надписи 'pulsewave@gmail.com' в футере",""
"passed","Sun Dec 17 23:29:19 GMT 2023","Sun Dec 17 23:29:19 GMT 2023","36","tests.test_footer","test_footer","TestFooter","","","Проверка года © PulseWave, 2023 в хедере",""
"passed","Sun Dec 17 23:31:23 GMT 2023","Sun Dec 17 23:31:23 GMT 2023","34","tests.test_main_page","test_main_page","TestMainPage","","","Проверка цвета шрифта кнопки 'Войти'",""
"passed","Sun Dec 17 23:30:00 GMT 2023","Sun Dec 17 23:30:00 GMT 2023","33","tests.test_footer","test_footer","TestFooter","","","Проверка цвета шрифта надписи 'pulsewave@gmail.com' в футере",""
"passed","Sun Dec 17 23:32:27 GMT 2023","Sun Dec 17 23:32:27 GMT 2023","33","tests.test_main_page","test_main_page","TestMainPage","","","Проверка цвета шрифта элемента 'Одно приложениe для решения всех Ваших задач!' в футере",""
"passed","Sun Dec 17 23:27:24 GMT 2023","Sun Dec 17 23:27:30 GMT 2023","6567","tests.test_api","test_api","TestAPI","","","POST Создать пользователя с корректными данными",""
"passed","Sun Dec 17 23:30:48 GMT 2023","Sun Dec 17 23:30:52 GMT 2023","3181","tests.test_login_page","test_login_page","TestLoginPage","","","Авторизация с корректными данными",""
"passed","Sun Dec 17 23:29:17 GMT 2023","Sun Dec 17 23:29:17 GMT 2023","35","tests.test_footer","test_footer","TestFooter","","","Проверка года © PulseWave, 2023 в хедере",""
"passed","Sun Dec 17 23:29:09 GMT 2023","Sun Dec 17 23:29:09 GMT 2023","65","tests.test_footer","test_footer","TestFooter","","","Проверка элемента 'pulsewave@gmail.com'в хедере",""
"passed","Sun Dec 17 23:33:42 GMT 2023","Sun Dec 17 23:33:42 GMT 2023","271","tests.test_signup_page","test_signup_page","TestSignupPage","","","Регистрация с корректным email и не совпадающими паролем и подтверждением пароля",""
"passed","Sun Dec 17 23:32:38 GMT 2023","Sun Dec 17 23:32:38 GMT 2023","37","tests.test_main_page","test_main_page","TestMainPage","","","Проверка текста кнопки 'Зарегистрироваться'",""
"passed","Sun Dec 17 23:33:39 GMT 2023","Sun Dec 17 23:33:39 GMT 2023","256","tests.test_signup_page","test_signup_page","TestSignupPage","","","Регистрация с некорректным email и сильным паролем и подтверждением пароля",""
"passed","Sun Dec 17 23:30:30 GMT 2023","Sun Dec 17 23:30:30 GMT 2023","33","tests.test_footer","test_footer","TestFooter","","","Проверка шрифта надписи '© PulseWave, 2023' в футере",""
"passed","Sun Dec 17 23:33:45 GMT 2023","Sun Dec 17 23:33:54 GMT 2023","8962","tests.test_signup_page","test_signup_page","TestSignupPage","","","Регистрация с корректными email и паролем",""
"passed","Sun Dec 17 23:30:05 GMT 2023","Sun Dec 17 23:30:05 GMT 2023","32","tests.test_footer","test_footer","TestFooter","","","Проверка шрифта надписи 'pulsewave@gmail.com' в футере",""
"passed","Sun Dec 17 23:29:00 GMT 2023","Sun Dec 17 23:29:00 GMT 2023","133","tests.test_footer","test_footer","TestFooter","","","Проверка перехода на страницу c лицензионным соглашением со страницы 'https://front.pwave.pnpl.tech/auth/login",""
"passed","Sun Dec 17 23:33:05 GMT 2023","Sun Dec 17 23:33:05 GMT 2023","32","tests.test_signup_page","test_signup_page","TestSignupPage","","","Проверка шрифта заголовка 'Регистрация'",""
"passed","Sun Dec 17 23:30:32 GMT 2023","Sun Dec 17 23:30:32 GMT 2023","32","tests.test_footer","test_footer","TestFooter","","","Проверка шрифта надписи '© PulseWave, 2023' в футере",""
"passed","Sun Dec 17 23:29:49 GMT 2023","Sun Dec 17 23:29:49 GMT 2023","31","tests.test_footer","test_footer","TestFooter","","","Проверка размера шрифта надписи 'pulsewave@gmail.com' в футере",""
"passed","Sun Dec 17 23:32:25 GMT 2023","Sun Dec 17 23:32:25 GMT 2023","33","tests.test_main_page","test_main_page","TestMainPage","","","Проверка размера шрифта элемента 'Одно приложениe для решения всех Ваших задач!' в футере",""
"passed","Sun Dec 17 23:27:54 GMT 2023","Sun Dec 17 23:27:56 GMT 2023","2153","tests.test_api","test_api","TestAPI","","","POST Обновить JWT access_token авторизованного пользователя",""
"passed","Sun Dec 17 23:31:47 GMT 2023","Sun Dec 17 23:31:47 GMT 2023","34","tests.test_main_page","test_main_page","TestMainPage","","","Проверка шрифта кнопки 'Зарегистрироваться'",""
"passed","Sun Dec 17 23:31:41 GMT 2023","Sun Dec 17 23:31:41 GMT 2023","32","tests.test_main_page","test_main_page","TestMainPage","","","Проверка размера шрифта кнопки 'Зарегистрироваться'",""
"passed","Sun Dec 17 23:31:36 GMT 2023","Sun Dec 17 23:31:36 GMT 2023","33","tests.test_main_page","test_main_page","TestMainPage","","","Проверка шрифта кнопки 'Регистрация'",""
"passed","Sun Dec 17 23:32:54 GMT 2023","Sun Dec 17 23:32:54 GMT 2023","36","tests.test_main_page","test_main_page","TestMainPage","","","Проверка текста элемента 'Одно приложениe для решения всех Ваших задач!'",""
"passed","Sun Dec 17 23:32:03 GMT 2023","Sun Dec 17 23:32:03 GMT 2023","34","tests.test_main_page","test_main_page","TestMainPage","","","Проверка цвета шрифта элемента 'Самый высокий уровень бесперебойной работы!' в футере",""
"passed","Sun Dec 17 23:28:16 GMT 2023","Sun Dec 17 23:28:20 GMT 2023","4302","tests.test_api","test_api","TestAPI","","","POST Подтверждение смены почты пользователя. Токен получить из ссылки auth/change_email/{token}.",""
"passed","Sun Dec 17 23:31:04 GMT 2023","Sun Dec 17 23:31:04 GMT 2023","60","tests.test_main_page","test_main_page","TestMainPage","","","Проверка перехода на страницу 'https://front.pwave.pnpl.tech/auth/login' по кнопке 'Войти'",""
"passed","Sun Dec 17 23:27:57 GMT 2023","Sun Dec 17 23:27:59 GMT 2023","1335","tests.test_api","test_api","TestAPI","","","GET Получить данные авторизованного пользователя me",""
"passed","Sun Dec 17 23:29:38 GMT 2023","Sun Dec 17 23:29:38 GMT 2023","33","tests.test_footer","test_footer","TestFooter","","","Проверка шрифта ссылки 'Условия пользования' в футере",""
"passed","Sun Dec 17 23:27:51 GMT 2023","Sun Dec 17 23:27:52 GMT 2023","1356","tests.test_api","test_api","TestAPI","","","POST Создать Рабочее пространство",""
"passed","Sun Dec 17 23:32:00 GMT 2023","Sun Dec 17 23:32:00 GMT 2023","34","tests.test_main_page","test_main_page","TestMainPage","","","Проверка размера шрифта элемента 'Самый высокий уровень бесперебойной работы!' в футере",""
"passed","Sun Dec 17 23:28:07 GMT 2023","Sun Dec 17 23:28:08 GMT 2023","1364","tests.test_api","test_api","TestAPI","","","PUT Обновить все данные авторизованного пользователя me",""
"passed","Sun Dec 17 23:32:08 GMT 2023","Sun Dec 17 23:32:08 GMT 2023","35","tests.test_main_page","test_main_page","TestMainPage","","","Проверка размера шрифта элемента 'Ваша безопасность и конфиденциальность для нас на первом месте!' в футере",""
"passed","Sun Dec 17 23:29:54 GMT 2023","Sun Dec 17 23:29:55 GMT 2023","34","tests.test_footer","test_footer","TestFooter","","","Проверка цвета шрифта надписи 'pulsewave@gmail.com' в футере",""
"passed","Sun Dec 17 23:31:01 GMT 2023","Sun Dec 17 23:31:01 GMT 2023","5","tests.test_main_page","test_main_page","TestMainPage","","","Проверка некликабельности логотипа на главной странице",""
"passed","Sun Dec 17 23:31:17 GMT 2023","Sun Dec 17 23:31:17 GMT 2023","32","tests.test_main_page","test_main_page","TestMainPage","","","Проверка шрифта элемента 'PULSEWAVE'",""
"passed","Sun Dec 17 23:31:28 GMT 2023","Sun Dec 17 23:31:28 GMT 2023","34","tests.test_main_page","test_main_page","TestMainPage","","","Проверка цвета кнопки 'Войти'",""
"passed","Sun Dec 17 23:33:19 GMT 2023","Sun Dec 17 23:33:19 GMT 2023","97","tests.test_signup_page","test_signup_page","TestSignupPage","","","Окно регистрации сообщение 'Регистрируясь, я соглашаюсь с Условиями пользования и Политикой конфиденциальности', проверка корректности перехода по ссылке 'Условиями пользования'",""
"passed","Sun Dec 17 23:29:28 GMT 2023","Sun Dec 17 23:29:28 GMT 2023","31","tests.test_footer","test_footer","TestFooter","","","Проверка размера шрифта ссылки 'Условия пользования' в футере",""
"passed","Sun Dec 17 23:29:22 GMT 2023","Sun Dec 17 23:29:22 GMT 2023","33","tests.test_footer","test_footer","TestFooter","","","Проверка размера шрифта ссылки 'Условия пользования' в футере",""
"passed","Sun Dec 17 23:28:34 GMT 2023","Sun Dec 17 23:28:41 GMT 2023","6457","tests.test_api","test_api","TestAPI","","","POST Регистрация пользователя без подтверждения подписки",""
"passed","Sun Dec 17 23:33:16 GMT 2023","Sun Dec 17 23:33:16 GMT 2023","55","tests.test_signup_page","test_signup_page","TestSignupPage","","","Окно регистрации сообщение 'Регистрируясь, я соглашаюсь с Условиями пользования и Политикой конфиденциальности'",""
"passed","Sun Dec 17 23:28:41 GMT 2023","Sun Dec 17 23:28:46 GMT 2023","5046","tests.test_api","test_api","TestAPI","","","DELETE Активировать и удалить авторизованного пользователя",""
"passed","Sun Dec 17 23:32:11 GMT 2023","Sun Dec 17 23:32:11 GMT 2023","34","tests.test_main_page","test_main_page","TestMainPage","","","Проверка цвета шрифта элемента 'Ваша безопасность и конфиденциальность для нас на первом месте!' в футере",""
"passed","Sun Dec 17 23:30:54 GMT 2023","Sun Dec 17 23:30:56 GMT 2023","1236","tests.test_login_page","test_login_page","TestLoginPage","","","Авторизация с некорректным паролем",""
"passed","Sun Dec 17 23:31:58 GMT 2023","Sun Dec 17 23:31:58 GMT 2023","34","tests.test_main_page","test_main_page","TestMainPage","","","Проверка шрифта элемента 'Удобный и понятный интерфейс!' в футере",""
"passed","Sun Dec 17 23:29:14 GMT 2023","Sun Dec 17 23:29:14 GMT 2023","37","tests.test_footer","test_footer","TestFooter","","","Проверка года © PulseWave, 2023 в хедере",""
"passed","Sun Dec 17 23:30:58 GMT 2023","Sun Dec 17 23:30:58 GMT 2023","45","tests.test_login_page","test_login_page","TestLoginPage","","","Окно авторизации сообщение 'Забыли пароль?'",""
"passed","Sun Dec 17 23:28:04 GMT 2023","Sun Dec 17 23:28:07 GMT 2023","2726","tests.test_api","test_api","TestAPI","","","PATCH Частично обновить данные авторизованного пользователя",""
"passed","Sun Dec 17 23:33:27 GMT 2023","Sun Dec 17 23:33:27 GMT 2023","265","tests.test_signup_page","test_signup_page","TestSignupPage","","","Регистрация с корректным email и слабым паролем и подтверждением пароля",""
"passed","Sun Dec 17 23:27:59 GMT 2023","Sun Dec 17 23:28:02 GMT 2023","2894","tests.test_api","test_api","TestAPI","","","GET Получить данные авторизованного пользователя по id",""
"passed","Sun Dec 17 23:29:11 GMT 2023","Sun Dec 17 23:29:11 GMT 2023","67","tests.test_footer","test_footer","TestFooter","","","Проверка элемента 'pulsewave@gmail.com'в хедере",""
"passed","Sun Dec 17 23:30:08 GMT 2023","Sun Dec 17 23:30:08 GMT 2023","31","tests.test_footer","test_footer","TestFooter","","","Проверка шрифта надписи 'pulsewave@gmail.com' в футере",""
"passed","Sun Dec 17 23:28:33 GMT 2023","Sun Dec 17 23:28:34 GMT 2023","580","tests.test_api","test_api","TestAPI","","","POST Регистрация пользователя без пароля",""
"passed","Sun Dec 17 23:33:21 GMT 2023","Sun Dec 17 23:33:22 GMT 2023","93","tests.test_signup_page","test_signup_page","TestSignupPage","","","Окно регистрации сообщение 'Регистрируясь, я соглашаюсь с Условиями пользования и Политикой конфиденциальности' проверка корректности перехода по ссылке 'Политикой конфиденциальности'",""
"passed","Sun Dec 17 23:32:46 GMT 2023","Sun Dec 17 23:32:46 GMT 2023","37","tests.test_main_page","test_main_page","TestMainPage","","","Проверка текста элемента 'Самый высокий уровень бесперебойной работы!'",""
"passed","Sun Dec 17 23:27:56 GMT 2023","Sun Dec 17 23:27:57 GMT 2023","1341","tests.test_api","test_api","TestAPI","","","GET Получить данные авторизованного пользователя",""
"passed","Sun Dec 17 23:30:38 GMT 2023","Sun Dec 17 23:30:38 GMT 2023","34","tests.test_login_page","test_login_page","TestLoginPage","","","Проверка размера шрифта заголовка 'Войти'",""
"passed","Sun Dec 17 23:29:41 GMT 2023","Sun Dec 17 23:29:41 GMT 2023","34","tests.test_footer","test_footer","TestFooter","","","Проверка шрифта ссылки 'Условия пользования' в футере",""
"passed","Sun Dec 17 23:29:52 GMT 2023","Sun Dec 17 23:29:52 GMT 2023","31","tests.test_footer","test_footer","TestFooter","","","Проверка размера шрифта надписи 'pulsewave@gmail.com' в футере",""
"passed","Sun Dec 17 23:28:20 GMT 2023","Sun Dec 17 23:28:27 GMT 2023","6862","tests.test_api","test_api","TestAPI","","","POST Сброс пароля",""
"passed","Sun Dec 17 23:29:57 GMT 2023","Sun Dec 17 23:29:57 GMT 2023","32","tests.test_footer","test_footer","TestFooter","","","Проверка цвета шрифта надписи 'pulsewave@gmail.com' в футере",""
"passed","Sun Dec 17 23:30:46 GMT 2023","Sun Dec 17 23:30:46 GMT 2023","58","tests.test_login_page","test_login_page","TestLoginPage","","","Проверка редиректа на главную страницу при клике на логотип",""
"passed","Sun Dec 17 23:30:27 GMT 2023","Sun Dec 17 23:30:27 GMT 2023","32","tests.test_footer","test_footer","TestFooter","","","Проверка шрифта надписи '© PulseWave, 2023' в футере",""
"passed","Sun Dec 17 23:31:39 GMT 2023","Sun Dec 17 23:31:39 GMT 2023","34","tests.test_main_page","test_main_page","TestMainPage","","","Проверка цвета кнопки 'Регистрация'",""
"passed","Sun Dec 17 23:27:35 GMT 2023","Sun Dec 17 23:27:36 GMT 2023","942","tests.test_api","test_api","TestAPI","","","POST Создать пару токенов access и refresh",""
"passed","Sun Dec 17 23:27:52 GMT 2023","Sun Dec 17 23:27:54 GMT 2023","2036","tests.test_api","test_api","TestAPI","","","GET Получить список всех пользователей для поиска",""
"passed","Sun Dec 17 23:31:33 GMT 2023","Sun Dec 17 23:31:33 GMT 2023","34","tests.test_main_page","test_main_page","TestMainPage","","","Проверка цвета шрифта кнопки 'Регистрация'",""
"passed","Sun Dec 17 23:28:50 GMT 2023","Sun Dec 17 23:28:52 GMT 2023","2001","tests.test_footer","test_footer","TestFooter","","","Проверка попапа о принятии файлов cookie на странице https://front.pwave.pnpl.tech/auth/login",""
"passed","Sun Dec 17 23:28:47 GMT 2023","Sun Dec 17 23:28:49 GMT 2023","2242","tests.test_footer","test_footer","TestFooter","","","Проверка попапа о принятии файлов cookie на странице https://front.pwave.pnpl.tech/",""
"passed","Sun Dec 17 23:32:16 GMT 2023","Sun Dec 17 23:32:17 GMT 2023","35","tests.test_main_page","test_main_page","TestMainPage","","","Проверка размера шрифта элемента 'Неограниченный функционал, понятный интерфейс и большое количество возможностей
помогут Вам улучшить рабочий процесс.' в футере",""
"passed","Sun Dec 17 23:31:09 GMT 2023","Sun Dec 17 23:31:09 GMT 2023","63","tests.test_main_page","test_main_page","TestMainPage","","","Проверка перехода на страницу https://front.pwave.pnpl.tech/auth/signup по кнопке 'Зарегистрироваться'",""
"passed","Sun Dec 17 23:32:41 GMT 2023","Sun Dec 17 23:32:41 GMT 2023","36","tests.test_main_page","test_main_page","TestMainPage","","","Проверка текста элемента 'PULSEWAVE'",""
"passed","Sun Dec 17 23:32:52 GMT 2023","Sun Dec 17 23:32:52 GMT 2023","37","tests.test_main_page","test_main_page","TestMainPage","","","Проверка текста элемента 'Неограниченный функционал, понятный интерфейс и большое количество возможностей
помогут Вам улучшить рабочий процесс.'",""
"passed","Sun Dec 17 23:28:33 GMT 2023","Sun Dec 17 23:28:33 GMT 2023","580","tests.test_api","test_api","TestAPI","","","POST Регистрация пользователя без емайл",""
"passed","Sun Dec 17 23:31:55 GMT 2023","Sun Dec 17 23:31:55 GMT 2023","36","tests.test_main_page","test_main_page","TestMainPage","","","Проверка цвета шрифта элемента 'Удобный и понятный интерфейс!' в футере",""
"passed","Sun Dec 17 23:27:39 GMT 2023","Sun Dec 17 23:27:42 GMT 2023","2934","tests.test_api","test_api","TestAPI","","","GET Список всех колонок доски",""
"passed","Sun Dec 17 23:31:25 GMT 2023","Sun Dec 17 23:31:25 GMT 2023","31","tests.test_main_page","test_main_page","TestMainPage","","","Проверка шрифта кнопки 'Войти'",""
"passed","Sun Dec 17 23:29:06 GMT 2023","Sun Dec 17 23:29:06 GMT 2023","65","tests.test_footer","test_footer","TestFooter","","","Проверка элемента 'pulsewave@gmail.com'в хедере",""
"passed","Sun Dec 17 23:28:27 GMT 2023","Sun Dec 17 23:28:31 GMT 2023","4598","tests.test_api","test_api","TestAPI","","","POST Подтверждение сброса пароля. Когда пользователь переходит по ссылке     auth/password/reset/confirm/{uid}/{token}",""
"passed","Sun Dec 17 23:31:20 GMT 2023","Sun Dec 17 23:31:20 GMT 2023","34","tests.test_main_page","test_main_page","TestMainPage","","","Проверка размера шрифта кнопки 'Войти'",""
"passed","Sun Dec 17 23:29:30 GMT 2023","Sun Dec 17 23:29:30 GMT 2023","34","tests.test_footer","test_footer","TestFooter","","","Проверка цвета шрифта ссылки 'Условия пользования' в футере",""
"passed","Sun Dec 17 23:32:57 GMT 2023","Sun Dec 17 23:32:57 GMT 2023","35","tests.test_signup_page","test_signup_page","TestSignupPage","","","Проверка текста заголовка 'Регистрация'",""
"passed","Sun Dec 17 23:29:33 GMT 2023","Sun Dec 17 23:29:33 GMT 2023","34","tests.test_footer","test_footer","TestFooter","","","Проверка цвета шрифта ссылки 'Условия пользования' в футере",""
"passed","Sun Dec 17 23:33:30 GMT 2023","Sun Dec 17 23:33:30 GMT 2023","266","tests.test_signup_page","test_signup_page","TestSignupPage","","","Регистрация с корректным email и слабым паролем и подтверждением пароля",""
"passed","Sun Dec 17 23:32:33 GMT 2023","Sun Dec 17 23:32:33 GMT 2023","37","tests.test_main_page","test_main_page","TestMainPage","","","Проверка текста кнопки 'Войти'",""
"passed","Sun Dec 17 23:28:53 GMT 2023","Sun Dec 17 23:28:55 GMT 2023","1998","tests.test_footer","test_footer","TestFooter","","","Проверка попапа о принятии файлов cookie на странице https://front.pwave.pnpl.tech/auth/signup",""
"passed","Sun Dec 17 23:31:50 GMT 2023","Sun Dec 17 23:31:50 GMT 2023","34","tests.test_main_page","test_main_page","TestMainPage","","","Проверка цвета кнопки 'Зарегистрироваться'",""
"passed","Sun Dec 17 23:30:35 GMT 2023","Sun Dec 17 23:30:35 GMT 2023","35","tests.test_login_page","test_login_page","TestLoginPage","","","Проверка текста заголовка 'Войти'",""
"passed","Sun Dec 17 23:30:21 GMT 2023","Sun Dec 17 23:30:22 GMT 2023","33","tests.test_footer","test_footer","TestFooter","","","Проверка цвета шрифта надписи '© PulseWave, 2023' в футере",""
"passed","Sun Dec 17 23:28:02 GMT 2023","Sun Dec 17 23:28:04 GMT 2023","2698","tests.test_api","test_api","TestAPI","","","PUT Обновить все данные авторизованного пользователя по id",""
"passed","Sun Dec 17 23:33:00 GMT 2023","Sun Dec 17 23:33:00 GMT 2023","36","tests.test_signup_page","test_signup_page","TestSignupPage","","","Проверка размера шрифта заголовка 'Регистрация'",""
"passed","Sun Dec 17 23:32:22 GMT 2023","Sun Dec 17 23:32:22 GMT 2023","33","tests.test_main_page","test_main_page","TestMainPage","","","Проверка шрифта элемента 'Неограниченный функционал, понятный интерфейс и большое количество возможностей
помогут Вам улучшить рабочий процесс.' в футере",""
"passed","Sun Dec 17 23:27:45 GMT 2023","Sun Dec 17 23:27:51 GMT 2023","5386","tests.test_api","test_api","TestAPI","","","GET Информация о конкретной колонке",""
"passed","Sun Dec 17 23:33:24 GMT 2023","Sun Dec 17 23:33:25 GMT 2023","267","tests.test_signup_page","test_signup_page","TestSignupPage","","","Регистрация с корректным email и слабым паролем и подтверждением пароля",""
"passed","Sun Dec 17 23:31:14 GMT 2023","Sun Dec 17 23:31:14 GMT 2023","33","tests.test_main_page","test_main_page","TestMainPage","","","Проверка цвета шрифта элемента 'PULSEWAVE'",""
"passed","Sun Dec 17 23:27:36 GMT 2023","Sun Dec 17 23:27:38 GMT 2023","1543","tests.test_api","test_api","TestAPI","","","POST Получить список всех Рабочих пространств авторизованного пользователя",""
"passed","Sun Dec 17 23:29:25 GMT 2023","Sun Dec 17 23:29:25 GMT 2023","32","tests.test_footer","test_footer","TestFooter","","","Проверка размера шрифта ссылки 'Условия пользования' в футере",""
"passed","Sun Dec 17 23:30:40 GMT 2023","Sun Dec 17 23:30:40 GMT 2023","32","tests.test_login_page","test_login_page","TestLoginPage","","","Проверка цвета шрифта заголовка 'Войти'",""
"passed","Sun Dec 17 23:29:44 GMT 2023","Sun Dec 17 23:29:44 GMT 2023","32","tests.test_footer","test_footer","TestFooter","","","Проверка шрифта ссылки 'Условия пользования' в футере",""
"passed","Sun Dec 17 23:28:31 GMT 2023","Sun Dec 17 23:28:33 GMT 2023","1545","tests.test_api","test_api","TestAPI","","","DELETE Удалить авторизованного пользователя",""
"passed","Sun Dec 17 23:30:03 GMT 2023","Sun Dec 17 23:30:03 GMT 2023","32","tests.test_footer","test_footer","TestFooter","","","Проверка шрифта надписи 'pulsewave@gmail.com' в футере",""
"passed","Sun Dec 17 23:32:14 GMT 2023","Sun Dec 17 23:32:14 GMT 2023","35","tests.test_main_page","test_main_page","TestMainPage","","","Проверка шрифта элемента 'Ваша безопасность и конфиденциальность для нас на первом месте!' в футере",""
