"Status","Start Time","Stop Time","Duration in ms","Parent Suite","Suite","Sub Suite","Test Class","Test Method","Name","Description"
"failed","Thu Apr 18 10:17:57 GMT 2024","Thu Apr 18 10:18:02 GMT 2024","5007","tests.test_api","test_api","TestAPI","","","POST Активация пользователя с корректными данными",""
"broken","Thu Apr 18 10:24:04 GMT 2024","Thu Apr 18 10:24:17 GMT 2024","12795","tests.test_api","test_api","TestAPI","","","PATCH Частично обновить стикер {'name': 'Henry'}",""
"passed","Thu Apr 18 10:28:08 GMT 2024","Thu Apr 18 10:28:08 GMT 2024","37","tests.test_footer","test_footer","TestFooter","","","Проверка цвета шрифта ссылки 'Условия пользования' в футере",""
"passed","Thu Apr 18 10:34:46 GMT 2024","Thu Apr 18 10:34:46 GMT 2024","36","tests.test_main_page","test_main_page","TestMainPage","","","Проверка размера шрифта элемента 'Неограниченный функционал, понятный интерфейс и большое количество возможностей
помогут Вам улучшить рабочий процесс.' в футере",""
"passed","Thu Apr 18 10:26:46 GMT 2024","Thu Apr 18 10:26:49 GMT 2024","3362","tests.test_footer","test_footer","TestFooter","","","Проверка попапа о принятии файлов cookie на странице https://pulsewave.ru/auth/signup",""
"broken","Thu Apr 18 10:21:12 GMT 2024","Thu Apr 18 10:21:25 GMT 2024","12631","tests.test_api","test_api","TestAPI","","","GET Получение одной задачи",""
"passed","Thu Apr 18 10:28:40 GMT 2024","Thu Apr 18 10:28:40 GMT 2024","36","tests.test_footer","test_footer","TestFooter","","","Проверка размера шрифта надписи 'info@pulsewave.ru' в футере",""
"passed","Thu Apr 18 10:35:33 GMT 2024","Thu Apr 18 10:35:33 GMT 2024","39","tests.test_main_page","test_main_page","TestMainPage","","","Проверка текста элемента 'Одно приложениe для решения всех Ваших задач!'",""
"passed","Thu Apr 18 10:35:18 GMT 2024","Thu Apr 18 10:35:18 GMT 2024","42","tests.test_main_page","test_main_page","TestMainPage","","","Проверка текста элемента 'Удобный и понятный интерфейс!'",""
"passed","Thu Apr 18 10:29:59 GMT 2024","Thu Apr 18 10:29:59 GMT 2024","36","tests.test_footer","test_footer","TestFooter","","","Проверка шрифта надписи '© PulseWave, 2023-2024' в футере",""
"passed","Thu Apr 18 10:25:07 GMT 2024","Thu Apr 18 10:25:14 GMT 2024","6117","tests.test_api","test_api","TestAPI","","","PATCH Частично обновить данные авторизованного пользователя",""
"passed","Thu Apr 18 10:33:34 GMT 2024","Thu Apr 18 10:33:36 GMT 2024","2208","tests.test_login_page","test_login_page","TestLoginPage","","","Авторизация с пустым паролем",""
"passed","Thu Apr 18 10:18:02 GMT 2024","Thu Apr 18 10:18:08 GMT 2024","6121","tests.test_api","test_api","TestAPI","","","POST Пригласить пользователя по email","Пользователи добавляются по одному. Если пользователя не существует, он будет создан"
"passed","Thu Apr 18 10:27:18 GMT 2024","Thu Apr 18 10:27:18 GMT 2024","68","tests.test_footer","test_footer","TestFooter","","","Проверка элемента 'info@pulsewave.ru'в хедере",""
"passed","Thu Apr 18 10:27:22 GMT 2024","Thu Apr 18 10:27:22 GMT 2024","68","tests.test_footer","test_footer","TestFooter","","","Проверка элемента 'info@pulsewave.ru'в хедере",""
"passed","Thu Apr 18 10:31:06 GMT 2024","Thu Apr 18 10:31:06 GMT 2024","71","tests.test_header","test_header","TestHeader","","","1.2 Проверка перехода на страницу 'https://pulsewave.ru/auth/signup' по кнопке 'Регистрация'",""
"broken","Thu Apr 18 10:24:17 GMT 2024","Thu Apr 18 10:24:30 GMT 2024","12529","tests.test_api","test_api","TestAPI","","","PATCH Частично обновить стикер {'color': '#FFC727'}",""
"passed","Thu Apr 18 10:27:02 GMT 2024","Thu Apr 18 10:27:02 GMT 2024","145","tests.test_footer","test_footer","TestFooter","","","Проверка перехода на страницу c лицензионным соглашением со страницы 'https://pulsewave.ru/auth/login",""
"passed","Thu Apr 18 10:18:13 GMT 2024","Thu Apr 18 10:18:18 GMT 2024","4774","tests.test_api","test_api","TestAPI","","","POST Удаление приглашенного пользователей из РП","Удаление как из участников так и из приглашенных"
"passed","Thu Apr 18 10:35:37 GMT 2024","Thu Apr 18 10:35:37 GMT 2024","39","tests.test_password_recovery","test_password_recovery","TestPasswordRecoveryPage","","","Проверка текста заголовка 'Восстановление пароля'",""
"passed","Thu Apr 18 10:30:30 GMT 2024","Thu Apr 18 10:30:30 GMT 2024","43","tests.test_header","test_header","TestHeader","","","Проверка текста кнопки 'Войти'",""
"broken","Thu Apr 18 10:18:18 GMT 2024","Thu Apr 18 10:18:23 GMT 2024","4534","tests.test_api","test_api","TestAPI","","","Проверка недействительности кеша доски",""
"passed","Thu Apr 18 10:31:42 GMT 2024","Thu Apr 18 10:31:42 GMT 2024","37","tests.test_header","test_header","TestHeader","","","Проверка шрифта кнопки 'Войти' в хедере https://pulsewave.ru/auth/password?email=",""
"passed","Thu Apr 18 10:39:49 GMT 2024","Thu Apr 18 10:39:49 GMT 2024","163","tests.test_workspace_page","test_workspace_page","TestWorkspacePage","","","Проверка что авторизованный пользователь может выйти из аккаунта",""
"passed","Thu Apr 18 10:18:34 GMT 2024","Thu Apr 18 10:18:40 GMT 2024","6307","tests.test_api","test_api","TestAPI","","","GET Информация о конкретном рабочем пространстве",""
"passed","Thu Apr 18 10:33:20 GMT 2024","Thu Apr 18 10:33:20 GMT 2024","55","tests.test_login_page","test_login_page","TestLoginPage","","","Окно авторизации сообщение 'Забыли пароль?'",""
"passed","Thu Apr 18 10:30:26 GMT 2024","Thu Apr 18 10:30:26 GMT 2024","41","tests.test_header","test_header","TestHeader","","","Проверка текста кнопки 'Войти'",""
"passed","Thu Apr 18 10:32:17 GMT 2024","Thu Apr 18 10:32:17 GMT 2024","39","tests.test_header","test_header","TestHeader","","","Проверка цвета шрифта кнопки 'Регистрация в хедере https://pulsewave.ru/auth/password?email='",""
"passed","Thu Apr 18 10:29:15 GMT 2024","Thu Apr 18 10:29:15 GMT 2024","35","tests.test_footer","test_footer","TestFooter","","","Проверка шрифта надписи 'info@pulsewave.ru' в футере",""
"passed","Thu Apr 18 10:39:01 GMT 2024","Thu Apr 18 10:39:01 GMT 2024","110","tests.test_signup_page","test_signup_page","TestSignupPage","","","1.30 Окно регистрации сообщение 'Регистрируясь, я соглашаюсь с Условиями пользования и Политикой конфиденциальности', проверка корректности перехода по ссылке 'Условиями пользования'",""
"passed","Thu Apr 18 10:34:38 GMT 2024","Thu Apr 18 10:34:38 GMT 2024","39","tests.test_main_page","test_main_page","TestMainPage","","","Проверка цвета шрифта элемента 'Ваша безопасность и конфиденциальность для нас на первом месте!' в футере",""
"passed","Thu Apr 18 10:28:48 GMT 2024","Thu Apr 18 10:28:48 GMT 2024","37","tests.test_footer","test_footer","TestFooter","","","Проверка цвета шрифта надписи 'info@pulsewave.ru' в футере",""
"passed","Thu Apr 18 10:32:57 GMT 2024","Thu Apr 18 10:32:58 GMT 2024","35","tests.test_login_page","test_login_page","TestLoginPage","","","Проверка шрифта заголовка 'Войти'",""
"passed","Thu Apr 18 10:32:37 GMT 2024","Thu Apr 18 10:32:37 GMT 2024","36","tests.test_header","test_header","TestHeader","","","Проверка цвета кнопки 'Регистрация в хедере https://pulsewave.ru/auth/login'",""
"passed","Thu Apr 18 10:28:32 GMT 2024","Thu Apr 18 10:28:32 GMT 2024","35","tests.test_footer","test_footer","TestFooter","","","Проверка размера шрифта надписи 'info@pulsewave.ru' в футере",""
"passed","Thu Apr 18 10:24:53 GMT 2024","Thu Apr 18 10:24:56 GMT 2024","2981","tests.test_api","test_api","TestAPI","","","GET Получить данные авторизованного пользователя me",""
"passed","Thu Apr 18 10:18:40 GMT 2024","Thu Apr 18 10:18:46 GMT 2024","5670","tests.test_api","test_api","TestAPI","","","PUT Обновить все данные РП (на данный момент только имя)",""
"passed","Thu Apr 18 10:32:54 GMT 2024","Thu Apr 18 10:32:54 GMT 2024","39","tests.test_login_page","test_login_page","TestLoginPage","","","Проверка цвета шрифта заголовка 'Войти'",""
"broken","Thu Apr 18 10:21:01 GMT 2024","Thu Apr 18 10:21:12 GMT 2024","10541","tests.test_api","test_api","TestAPI","","","GET Список всех задач колонки",""
"broken","Thu Apr 18 10:24:30 GMT 2024","Thu Apr 18 10:24:41 GMT 2024","11824","tests.test_api","test_api","TestAPI","","","DELETE Удалить стикер",""
"broken","Thu Apr 18 10:23:52 GMT 2024","Thu Apr 18 10:24:04 GMT 2024","12320","tests.test_api","test_api","TestAPI","","","PUT Обновить стикер",""
"passed","Thu Apr 18 10:29:43 GMT 2024","Thu Apr 18 10:29:43 GMT 2024","36","tests.test_footer","test_footer","TestFooter","","","Проверка цвета шрифта надписи '© PulseWave, 2023-2024' в футере",""
"broken","Thu Apr 18 10:20:30 GMT 2024","Thu Apr 18 10:20:41 GMT 2024","10715","tests.test_api","test_api","TestAPI","","","PUT Обновить колонку (название и порядковый номер)",""
"passed","Thu Apr 18 10:28:20 GMT 2024","Thu Apr 18 10:28:20 GMT 2024","36","tests.test_footer","test_footer","TestFooter","","","Проверка шрифта ссылки 'Условия пользования' в футере",""
"passed","Thu Apr 18 10:39:36 GMT 2024","Thu Apr 18 10:39:36 GMT 2024","10","tests.test_workspace_page","test_workspace_page","TestWorkspacePage","","","Проверка видимости аватара",""
"passed","Thu Apr 18 10:35:06 GMT 2024","Thu Apr 18 10:35:06 GMT 2024","36","tests.test_main_page","test_main_page","TestMainPage","","","Проверка шрифта элемента 'Одно приложениe для решения всех Ваших задач!' в футере",""
"broken","Thu Apr 18 10:20:04 GMT 2024","Thu Apr 18 10:20:12 GMT 2024","7901","tests.test_api","test_api","TestAPI","","","POST Создать колонку на доске",""
"broken","Thu Apr 18 10:20:12 GMT 2024","Thu Apr 18 10:20:20 GMT 2024","8156","tests.test_api","test_api","TestAPI","","","GET Список всех колонок доски",""
"passed","Thu Apr 18 10:26:04 GMT 2024","Thu Apr 18 10:26:05 GMT 2024","841","tests.test_api","test_api","TestAPI","","","POST Регистрация пользователя без пароля",""
"passed","Thu Apr 18 10:33:01 GMT 2024","Thu Apr 18 10:33:01 GMT 2024","69","tests.test_login_page","test_login_page","TestLoginPage","","","Проверка редиректа на страницу восстановления пароля при клике на ссылку 'Забыли пароль?'",""
"passed","Thu Apr 18 10:30:15 GMT 2024","Thu Apr 18 10:30:15 GMT 2024","67","tests.test_header","test_header","TestHeader","","","1.13 Проверка редиректа на главную страницу при клике на логотип",""
"passed","Thu Apr 18 10:38:53 GMT 2024","Thu Apr 18 10:38:54 GMT 2024","63","tests.test_signup_page","test_signup_page","TestSignupPage","","","1.28 Окно регистрации сообщение 'Регистрируясь, я соглашаюсь с Условиями пользования и Политикой конфиденциальности'",""
"passed","Thu Apr 18 10:30:22 GMT 2024","Thu Apr 18 10:30:22 GMT 2024","41","tests.test_header","test_header","TestHeader","","","Проверка текста кнопки 'Войти'",""
"passed","Thu Apr 18 10:17:43 GMT 2024","Thu Apr 18 10:17:57 GMT 2024","13780","tests.test_api","test_api","TestAPI","","","POST Создать пользователя с корректными данными",""
"passed","Thu Apr 18 10:39:30 GMT 2024","Thu Apr 18 10:39:30 GMT 2024","4","tests.test_workspace_page","test_workspace_page","TestWorkspacePage","","","Проверка заголовка рабочего пространства",""
"passed","Thu Apr 18 10:28:36 GMT 2024","Thu Apr 18 10:28:36 GMT 2024","35","tests.test_footer","test_footer","TestFooter","","","Проверка размера шрифта надписи 'info@pulsewave.ru' в футере",""
"passed","Thu Apr 18 10:35:41 GMT 2024","Thu Apr 18 10:35:41 GMT 2024","34","tests.test_password_recovery","test_password_recovery","TestPasswordRecoveryPage","","","Проверка размера шрифта заголовка 'Восстановление пароля'",""
"passed","Thu Apr 18 10:28:56 GMT 2024","Thu Apr 18 10:28:56 GMT 2024","36","tests.test_footer","test_footer","TestFooter","","","Проверка цвета шрифта надписи 'info@pulsewave.ru' в футере",""
"passed","Thu Apr 18 10:25:16 GMT 2024","Thu Apr 18 10:25:31 GMT 2024","14315","tests.test_api","test_api","TestAPI","","","POST Запрос на смену почты",""
"passed","Thu Apr 18 10:29:39 GMT 2024","Thu Apr 18 10:29:39 GMT 2024","37","tests.test_footer","test_footer","TestFooter","","","Проверка цвета шрифта надписи '© PulseWave, 2023-2024' в футере",""
"passed","Thu Apr 18 10:34:58 GMT 2024","Thu Apr 18 10:34:58 GMT 2024","37","tests.test_main_page","test_main_page","TestMainPage","","","Проверка размера шрифта элемента 'Одно приложениe для решения всех Ваших задач!' в футере",""
"passed","Thu Apr 18 10:29:00 GMT 2024","Thu Apr 18 10:29:00 GMT 2024","36","tests.test_footer","test_footer","TestFooter","","","Проверка цвета шрифта надписи 'info@pulsewave.ru' в футере",""
"broken","Thu Apr 18 10:22:10 GMT 2024","Thu Apr 18 10:22:19 GMT 2024","8837","tests.test_api","test_api","TestAPI","","","DELETE Удалить доску",""
"passed","Thu Apr 18 10:31:22 GMT 2024","Thu Apr 18 10:31:22 GMT 2024","41","tests.test_header","test_header","TestHeader","","","Проверка цвета шрифта кнопки 'Войти' в хедере https://pulsewave.ru/",""
"passed","Thu Apr 18 10:30:03 GMT 2024","Thu Apr 18 10:30:03 GMT 2024","35","tests.test_footer","test_footer","TestFooter","","","Проверка шрифта надписи '© PulseWave, 2023-2024' в футере",""
"passed","Thu Apr 18 10:27:53 GMT 2024","Thu Apr 18 10:27:53 GMT 2024","38","tests.test_footer","test_footer","TestFooter","","","Проверка размера шрифта ссылки 'Условия пользования' в футере",""
"passed","Thu Apr 18 10:38:57 GMT 2024","Thu Apr 18 10:38:57 GMT 2024","101","tests.test_signup_page","test_signup_page","TestSignupPage","","","1.29 Окно регистрации сообщение 'Регистрируясь, я соглашаюсь с Условиями пользования и Политикой конфиденциальности' проверка корректности перехода по ссылке 'Политикой конфиденциальности'",""
"passed","Thu Apr 18 10:25:02 GMT 2024","Thu Apr 18 10:25:07 GMT 2024","5721","tests.test_api","test_api","TestAPI","","","PUT Обновить все данные авторизованного пользователя по id",""
"passed","Thu Apr 18 10:26:57 GMT 2024","Thu Apr 18 10:26:57 GMT 2024","152","tests.test_footer","test_footer","TestFooter","","","Проверка перехода на страницу c лицензионным соглашением со страницы 'https://pulsewave.ru/",""
"passed","Thu Apr 18 10:31:34 GMT 2024","Thu Apr 18 10:31:34 GMT 2024","39","tests.test_header","test_header","TestHeader","","","Проверка шрифта кнопки 'Войти' в хедере https://pulsewave.ru/",""
"passed","Thu Apr 18 10:28:24 GMT 2024","Thu Apr 18 10:28:24 GMT 2024","35","tests.test_footer","test_footer","TestFooter","","","Проверка шрифта ссылки 'Условия пользования' в футере",""
"passed","Thu Apr 18 10:32:33 GMT 2024","Thu Apr 18 10:32:33 GMT 2024","40","tests.test_header","test_header","TestHeader","","","Проверка цвета кнопки 'Регистрация в хедере https://pulsewave.ru/'",""
"passed","Thu Apr 18 10:18:08 GMT 2024","Thu Apr 18 10:18:13 GMT 2024","5555","tests.test_api","test_api","TestAPI","","","POST Повторная отправка ссылки с приглашением пользователя",""
"passed","Thu Apr 18 10:37:55 GMT 2024","Thu Apr 18 10:37:55 GMT 2024","60","tests.test_signup_page","test_signup_page","TestSignupPage","","","1.20 Окно регистрации сообщение 'Пароль должен содержать не менее 8 символов, включая минимум 1 цифру, 1 строчную и 1 заглавную буквы, 1 спецсимвол.'",""
"passed","Thu Apr 18 10:33:48 GMT 2024","Thu Apr 18 10:33:48 GMT 2024","37","tests.test_main_page","test_main_page","TestMainPage","","","Проверка цвета шрифта элемента 'PULSEWAVE'",""
"passed","Thu Apr 18 10:25:14 GMT 2024","Thu Apr 18 10:25:16 GMT 2024","2751","tests.test_api","test_api","TestAPI","","","PUT Обновить все данные авторизованного пользователя me",""
"passed","Thu Apr 18 10:18:29 GMT 2024","Thu Apr 18 10:18:31 GMT 2024","2442","tests.test_api","test_api","TestAPI","","","POST Создать пару токенов access и refresh",""
"passed","Thu Apr 18 10:30:18 GMT 2024","Thu Apr 18 10:30:19 GMT 2024","70","tests.test_header","test_header","TestHeader","","","1.13 Проверка редиректа на главную страницу при клике на логотип",""
"passed","Thu Apr 18 10:35:49 GMT 2024","Thu Apr 18 10:35:49 GMT 2024","37","tests.test_password_recovery","test_password_recovery","TestPasswordRecoveryPage","","","Проверка шрифта заголовка 'Восстановление пароля'",""
"passed","Thu Apr 18 10:25:59 GMT 2024","Thu Apr 18 10:26:03 GMT 2024","4755","tests.test_api","test_api","TestAPI","","","DELETE Удалить авторизованного пользователя",""
"passed","Thu Apr 18 10:22:23 GMT 2024","Thu Apr 18 10:22:26 GMT 2024","3289","tests.test_api","test_api","TestAPI","","","GET Список уведомлений текущего пользователя",""
"passed","Thu Apr 18 10:31:38 GMT 2024","Thu Apr 18 10:31:38 GMT 2024","38","tests.test_header","test_header","TestHeader","","","Проверка шрифта кнопки 'Войти' в хедере https://pulsewave.ru/auth/signup",""
"passed","Thu Apr 18 10:19:58 GMT 2024","Thu Apr 18 10:20:04 GMT 2024","5928","tests.test_api","test_api","TestAPI","","","GET Список всех пользователей доски для назначения ответственных",""
"passed","Thu Apr 18 10:38:32 GMT 2024","Thu Apr 18 10:38:34 GMT 2024","2267","tests.test_signup_page","test_signup_page","TestSignupPage","","","1.24 Регистрация с корректным email и паролем и пустым подтверждением пароля",""
"passed","Thu Apr 18 10:38:03 GMT 2024","Thu Apr 18 10:38:03 GMT 2024","279","tests.test_signup_page","test_signup_page","TestSignupPage","","","1.21, 1.22 Регистрация с некорректным email и сильным паролем и подтверждением пароля",""
"passed","Thu Apr 18 10:30:11 GMT 2024","Thu Apr 18 10:30:11 GMT 2024","65","tests.test_header","test_header","TestHeader","","","1.13 Проверка редиректа на главную страницу при клике на логотип",""
"passed","Thu Apr 18 10:34:34 GMT 2024","Thu Apr 18 10:34:34 GMT 2024","40","tests.test_main_page","test_main_page","TestMainPage","","","Проверка размера шрифта элемента 'Ваша безопасность и конфиденциальность для нас на первом месте!' в футере",""
"passed","Thu Apr 18 10:37:39 GMT 2024","Thu Apr 18 10:37:39 GMT 2024","40","tests.test_signup_page","test_signup_page","TestSignupPage","","","1.16 Проверка текста заголовка 'Регистрация'",""
"passed","Thu Apr 18 10:37:51 GMT 2024","Thu Apr 18 10:37:51 GMT 2024","36","tests.test_signup_page","test_signup_page","TestSignupPage","","","1.17-1.19 Проверка шрифта заголовка 'Регистрация'",""
"broken","Thu Apr 18 10:21:48 GMT 2024","Thu Apr 18 10:22:00 GMT 2024","11153","tests.test_api","test_api","TestAPI","","","DELETE Удалить задачу",""
"passed","Thu Apr 18 10:34:07 GMT 2024","Thu Apr 18 10:34:07 GMT 2024","36","tests.test_main_page","test_main_page","TestMainPage","","","Проверка цвета кнопки 'Зарегистрироваться'",""
"broken","Thu Apr 18 10:20:41 GMT 2024","Thu Apr 18 10:20:51 GMT 2024","9696","tests.test_api","test_api","TestAPI","","","PATCH Частично обновить колонку (название/порядковый номер)",""
"passed","Thu Apr 18 10:34:50 GMT 2024","Thu Apr 18 10:34:50 GMT 2024","38","tests.test_main_page","test_main_page","TestMainPage","","","Проверка цвета шрифта элемента 'Неограниченный функционал, понятный интерфейс и большое количество возможностей
помогут Вам улучшить рабочий процесс.' в футере",""
"passed","Thu Apr 18 10:37:43 GMT 2024","Thu Apr 18 10:37:43 GMT 2024","36","tests.test_signup_page","test_signup_page","TestSignupPage","","","1.17-1.19 Проверка размера шрифта заголовка 'Регистрация'",""
"broken","Thu Apr 18 10:21:37 GMT 2024","Thu Apr 18 10:21:48 GMT 2024","11558","tests.test_api","test_api","TestAPI","","","PATCH Частично обновить задачу","Перемещение между колонками возможно только PUT запросом"
"passed","Thu Apr 18 10:38:44 GMT 2024","Thu Apr 18 10:38:46 GMT 2024","2254","tests.test_signup_page","test_signup_page","TestSignupPage","","","1.26 Регистрация с пустым email и сильным паролем и подтверждением пароля",""
"passed","Thu Apr 18 10:25:37 GMT 2024","Thu Apr 18 10:25:51 GMT 2024","13653","tests.test_api","test_api","TestAPI","","","POST Сброс пароля",""
"passed","Thu Apr 18 10:27:49 GMT 2024","Thu Apr 18 10:27:49 GMT 2024","35","tests.test_footer","test_footer","TestFooter","","","Проверка размера шрифта ссылки 'Условия пользования' в футере",""
"passed","Thu Apr 18 10:30:07 GMT 2024","Thu Apr 18 10:30:07 GMT 2024","32","tests.test_header","test_header","TestHeader","","","Проверка некликабельности логотипа на Главной странице",""
"passed","Thu Apr 18 10:32:45 GMT 2024","Thu Apr 18 10:32:45 GMT 2024","41","tests.test_login_page","test_login_page","TestLoginPage","","","Проверка текста заголовка 'Войти'",""
"passed","Thu Apr 18 10:40:02 GMT 2024","Thu Apr 18 10:40:02 GMT 2024","34","tests.test_workspace_page","test_workspace_page","TestWorkspacePage","","","Проверка видимости заголовка 'Ваши рабочие пространства'",""
"passed","Thu Apr 18 10:36:43 GMT 2024","Thu Apr 18 10:36:44 GMT 2024","1187","tests.test_password_recovery","test_password_recovery","TestPasswordRecoveryPage","","","3.3 Восстановить пароль на некорректный емайл",""
"passed","Thu Apr 18 10:31:46 GMT 2024","Thu Apr 18 10:31:46 GMT 2024","41","tests.test_header","test_header","TestHeader","","","Проверка цвета кнопки 'Войти' в хедере https://pulsewave.ru/",""
"passed","Thu Apr 18 10:27:26 GMT 2024","Thu Apr 18 10:27:26 GMT 2024","67","tests.test_footer","test_footer","TestFooter","","","Проверка элемента 'info@pulsewave.ru'в хедере",""
"passed","Thu Apr 18 10:26:50 GMT 2024","Thu Apr 18 10:26:53 GMT 2024","3432","tests.test_footer","test_footer","TestFooter","","","Проверка попапа о принятии файлов cookie на странице https://pulsewave.ru/auth/password?email=",""
