"Status","Start Time","Stop Time","Duration in ms","Parent Suite","Suite","Sub Suite","Test Class","Test Method","Name","Description"
"passed","Thu Apr 18 10:34:00 GMT 2024","Thu Apr 18 10:34:00 GMT 2024","36","tests.test_main_page","test_main_page","TestMainPage","","","Проверка цвета шрифта кнопки 'Зарегистрироваться'",""
"passed","Thu Apr 18 10:35:59 GMT 2024","Thu Apr 18 10:36:01 GMT 2024","2215","tests.test_password_recovery","test_password_recovery","TestPasswordRecoveryPage","","","Проверить сообщение об отправке ссылки восстановления пароля на емайл",""
"passed","Thu Apr 18 10:33:23 GMT 2024","Thu Apr 18 10:33:24 GMT 2024","1241","tests.test_login_page","test_login_page","TestLoginPage","","","Авторизация с некорректным емайл",""
"passed","Thu Apr 18 10:34:42 GMT 2024","Thu Apr 18 10:34:42 GMT 2024","38","tests.test_main_page","test_main_page","TestMainPage","","","Проверка шрифта элемента 'Ваша безопасность и конфиденциальность для нас на первом месте!' в футере",""
"passed","Thu Apr 18 10:22:30 GMT 2024","Thu Apr 18 10:22:34 GMT 2024","4322","tests.test_api","test_api","TestAPI","","","PUT Отметить прочтение уведомления",""
"passed","Thu Apr 18 10:37:30 GMT 2024","Thu Apr 18 10:37:31 GMT 2024","292","tests.test_signup_page","test_signup_page","TestSignupPage","","","1.6 Регистрация с корректным email и не совпадающими паролем и подтверждением пароля",""
"passed","Thu Apr 18 10:28:28 GMT 2024","Thu Apr 18 10:28:28 GMT 2024","36","tests.test_footer","test_footer","TestFooter","","","Проверка шрифта ссылки 'Условия пользования' в футере",""
"passed","Thu Apr 18 10:32:25 GMT 2024","Thu Apr 18 10:32:25 GMT 2024","43","tests.test_header","test_header","TestHeader","","","Проверка шрифта кнопки 'Регистрация в хедере https://pulsewave.ru/auth/login'",""
"passed","Thu Apr 18 10:33:28 GMT 2024","Thu Apr 18 10:33:30 GMT 2024","2199","tests.test_login_page","test_login_page","TestLoginPage","","","Авторизация с пустым емайл",""
"passed","Thu Apr 18 10:18:52 GMT 2024","Thu Apr 18 10:18:58 GMT 2024","6300","tests.test_api","test_api","TestAPI","","","DELETE Частично обновить данные РП (на данный момент только имя)",""
"passed","Thu Apr 18 10:28:52 GMT 2024","Thu Apr 18 10:28:52 GMT 2024","35","tests.test_footer","test_footer","TestFooter","","","Проверка цвета шрифта надписи 'info@pulsewave.ru' в футере",""
"passed","Thu Apr 18 10:34:15 GMT 2024","Thu Apr 18 10:34:15 GMT 2024","40","tests.test_main_page","test_main_page","TestMainPage","","","Проверка цвета шрифта элемента 'Удобный и понятный интерфейс!' в футере",""
"passed","Thu Apr 18 10:32:21 GMT 2024","Thu Apr 18 10:32:21 GMT 2024","40","tests.test_header","test_header","TestHeader","","","Проверка шрифта кнопки 'Регистрация в хедере https://pulsewave.ru/'",""
"passed","Thu Apr 18 10:24:41 GMT 2024","Thu Apr 18 10:24:45 GMT 2024","3198","tests.test_api","test_api","TestAPI","","","GET Получить список всех пользователей для поиска",""
"passed","Thu Apr 18 10:29:27 GMT 2024","Thu Apr 18 10:29:27 GMT 2024","35","tests.test_footer","test_footer","TestFooter","","","Проверка размера шрифта надписи '© PulseWave, 2023-2024' в футере",""
"passed","Thu Apr 18 10:33:44 GMT 2024","Thu Apr 18 10:33:44 GMT 2024","36","tests.test_main_page","test_main_page","TestMainPage","","","Проверка размера шрифта элемента 'PULSEWAVE'",""
"passed","Thu Apr 18 10:18:28 GMT 2024","Thu Apr 18 10:18:29 GMT 2024","836","tests.test_api","test_api","TestAPI","","","POST Регистрация ранее зарегистрированного пользователя",""
"broken","Thu Apr 18 10:36:05 GMT 2024","Thu Apr 18 10:36:39 GMT 2024","34069","tests.test_password_recovery","test_password_recovery","TestPasswordRecoveryPage","","","3.2, 3.2.1 Восстановить пароль на корректный емайл",""
"broken","Thu Apr 18 10:23:25 GMT 2024","Thu Apr 18 10:23:39 GMT 2024","13490","tests.test_api","test_api","TestAPI","","","POST Создать стикер к задаче",""
"passed","Thu Apr 18 10:34:19 GMT 2024","Thu Apr 18 10:34:19 GMT 2024","39","tests.test_main_page","test_main_page","TestMainPage","","","Проверка шрифта элемента 'Удобный и понятный интерфейс!' в футере",""
"passed","Thu Apr 18 10:35:25 GMT 2024","Thu Apr 18 10:35:25 GMT 2024","43","tests.test_main_page","test_main_page","TestMainPage","","","Проверка текста элемента 'Ваша безопасность и конфиденциальность для нас на первом месте!'",""
"passed","Thu Apr 18 10:32:41 GMT 2024","Thu Apr 18 10:32:41 GMT 2024","38","tests.test_header","test_header","TestHeader","","","Проверка цвета кнопки 'Регистрация в хедере https://pulsewave.ru/auth/password?email='",""
"passed","Thu Apr 18 10:31:14 GMT 2024","Thu Apr 18 10:31:14 GMT 2024","38","tests.test_header","test_header","TestHeader","","","Проверка размера шрифта кнопки 'Войти' в хедере https://pulsewave.ru/auth/signup",""
"passed","Thu Apr 18 10:31:30 GMT 2024","Thu Apr 18 10:31:30 GMT 2024","39","tests.test_header","test_header","TestHeader","","","Проверка цвета шрифта кнопки 'Войти' в хедере https://pulsewave.ru/auth/password?email=",""
"passed","Thu Apr 18 10:18:58 GMT 2024","Thu Apr 18 10:19:19 GMT 2024","21191","tests.test_api","test_api","TestAPI","","","POST Подтверждение приглашения в РП",""
"passed","Thu Apr 18 10:24:49 GMT 2024","Thu Apr 18 10:24:53 GMT 2024","3108","tests.test_api","test_api","TestAPI","","","GET Получить данные авторизованного пользователя",""
"passed","Thu Apr 18 10:27:10 GMT 2024","Thu Apr 18 10:27:10 GMT 2024","142","tests.test_footer","test_footer","TestFooter","","","Проверка перехода на страницу c лицензионным соглашением со страницы 'https://pulsewave.ru/auth/password?email=",""
"passed","Thu Apr 18 10:32:09 GMT 2024","Thu Apr 18 10:32:09 GMT 2024","40","tests.test_header","test_header","TestHeader","","","Проверка цвета шрифта кнопки 'Регистрация в хедере https://pulsewave.ru/'",""
"passed","Thu Apr 18 10:28:44 GMT 2024","Thu Apr 18 10:28:44 GMT 2024","35","tests.test_footer","test_footer","TestFooter","","","Проверка размера шрифта надписи 'info@pulsewave.ru' в футере",""
