"DESCRIPTION","DURATION IN MS","NAME","PARENT SUITE","START TIME","STATUS","STOP TIME","SUB SUITE","SUITE","TEST CLASS","TEST METHOD"
"","3478","A.15 GET Список всех пользователей доски для назначения ответственных","tests.api_tests","Wed Nov 05 14:24:23 UTC 2025","passed","Wed Nov 05 14:24:26 UTC 2025","TestAPI","api_test","",""
"","2791","L.9 Авторизация с логином заглавными буквами","tests.ui_tests","Wed Nov 05 14:44:51 UTC 2025","passed","Wed Nov 05 14:44:54 UTC 2025","TestLoginPage","login_page_test","",""
"","2290","S.10 Регистрация с корректным email и подтверждением пароля и пустым паролем","tests.ui_tests","Wed Nov 05 14:47:55 UTC 2025","passed","Wed Nov 05 14:47:57 UTC 2025","TestSignupPage","signup_page_test","",""
"","60","F.9 Проверка перехода в LinkedIn на странице 'https://app.pulsewave.ru/auth/signup' в футере","tests.ui_tests","Wed Nov 05 14:41:43 UTC 2025","passed","Wed Nov 05 14:41:43 UTC 2025","TestFooter","footer_test","",""
"","722","A.26 POST Регистрация пользователя без электронной почты","tests.api_tests","Wed Nov 05 14:24:58 UTC 2025","passed","Wed Nov 05 14:24:59 UTC 2025","TestAPI","api_test","",""
"","1155","A.28 POST Регистрация пользователя без подтверждения подписки","tests.api_tests","Wed Nov 05 14:25:00 UTC 2025","passed","Wed Nov 05 14:25:01 UTC 2025","TestAPI","api_test","",""
"","4232","F.1 Проверка попапа о принятии файлов cookie на странице https://app.pulsewave.ru/auth/login","tests.ui_tests","Wed Nov 05 14:26:26 UTC 2025","passed","Wed Nov 05 14:26:30 UTC 2025","TestFooter","footer_test","",""
"","3828","F.1 Проверка попапа о принятии файлов cookie на странице https://app.pulsewave.ru/auth/password?email=","tests.ui_tests","Wed Nov 05 14:26:35 UTC 2025","passed","Wed Nov 05 14:26:39 UTC 2025","TestFooter","footer_test","",""
"","3440","A.12 DELETE Удалить РП","tests.api_tests","Wed Nov 05 14:24:07 UTC 2025","passed","Wed Nov 05 14:24:11 UTC 2025","TestAPI","api_test","",""
"","10047","A.13 POST Подтверждение приглашения в РП","tests.api_tests","Wed Nov 05 14:24:11 UTC 2025","passed","Wed Nov 05 14:24:21 UTC 2025","TestAPI","api_test","",""
"","32","H.8 Проверка цвета кнопки 'Регистрация в хедере https://app.pulsewave.ru/auth/password?email='","tests.ui_tests","Wed Nov 05 14:43:42 UTC 2025","passed","Wed Nov 05 14:43:42 UTC 2025","TestHeader","header_test","",""
"","11395","R.4 Проверить сообщение об отправке ссылки восстановления пароля на емайл","tests.ui_tests","Wed Nov 05 14:45:19 UTC 2025","passed","Wed Nov 05 14:45:30 UTC 2025","TestPasswordRecoveryPage","password_recovery_test","",""
"","2205","H.2 Проверка редиректа на главную страницу при клике на логотип","tests.ui_tests","Wed Nov 05 14:42:03 UTC 2025","passed","Wed Nov 05 14:42:05 UTC 2025","TestHeader","header_test","",""
"","33","H.7 Проверка цвета кнопки 'Войти' в хедере https://app.pulsewave.ru/auth/password?email=","tests.ui_tests","Wed Nov 05 14:43:09 UTC 2025","passed","Wed Nov 05 14:43:09 UTC 2025","TestHeader","header_test","",""
"","2043","A.20 POST Запрос на смену почты","tests.api_tests","Wed Nov 05 14:24:33 UTC 2025","passed","Wed Nov 05 14:24:35 UTC 2025","TestAPI","api_test","",""
"","38","R.2 Проверка шрифта заголовка 'Восстановление пароля'","tests.ui_tests","Wed Nov 05 14:45:08 UTC 2025","passed","Wed Nov 05 14:45:08 UTC 2025","TestPasswordRecoveryPage","password_recovery_test","",""
"","2364","H.2 Проверка редиректа на главную страницу при клике на логотип","tests.ui_tests","Wed Nov 05 14:41:57 UTC 2025","passed","Wed Nov 05 14:42:00 UTC 2025","TestHeader","header_test","",""
"","21752","S.1 Регистрация с корректными email и паролем и с согласием на подписку","tests.ui_tests","Wed Nov 05 14:45:52 UTC 2025","passed","Wed Nov 05 14:46:14 UTC 2025","TestSignupPage","signup_page_test","",""
"","4452","A.3 POST Активация пользователя с корректными данными","tests.api_tests","Wed Nov 05 14:23:26 UTC 2025","passed","Wed Nov 05 14:23:30 UTC 2025","TestAPI","api_test","",""
"","336","S.16 Регистрация с корректным email и слабым паролем и подтверждением пароля","tests.ui_tests","Wed Nov 05 14:48:11 UTC 2025","passed","Wed Nov 05 14:48:12 UTC 2025","TestSignupPage","signup_page_test","",""
"","58","F.8 Проверка кликабельности значка LinkedIn на странице 'https://app.pulsewave.ru/auth/signup' в футере","tests.ui_tests","Wed Nov 05 14:40:28 UTC 2025","passed","Wed Nov 05 14:40:28 UTC 2025","TestFooter","footer_test","",""
"","86","F.3 Проверка элемента 'info@pulsewave.ru'в хедере","tests.ui_tests","Wed Nov 05 14:29:06 UTC 2025","passed","Wed Nov 05 14:29:06 UTC 2025","TestFooter","footer_test","",""
"","42","F.2 Проверка отсутствия ссылки на Лицензионное соглашение со страницы 'https://app.pulsewave.ru/auth/signup","tests.ui_tests","Wed Nov 05 14:27:50 UTC 2025","passed","Wed Nov 05 14:27:50 UTC 2025","TestFooter","footer_test","",""
"","11","F.7 Проверка значка LinkedIn на странице 'https://pulsewave.ru/' в футере","tests.ui_tests","Wed Nov 05 14:39:04 UTC 2025","passed","Wed Nov 05 14:39:04 UTC 2025","TestFooter","footer_test","",""
"","59","F.6 Проверка шрифта надписи '© PulseWave, 2023-2025' в футере","tests.ui_tests","Wed Nov 05 14:37:48 UTC 2025","passed","Wed Nov 05 14:37:49 UTC 2025","TestFooter","footer_test","",""
"","1855","L.5 Авторизация с некорректным паролем","tests.ui_tests","Wed Nov 05 14:44:23 UTC 2025","passed","Wed Nov 05 14:44:25 UTC 2025","TestLoginPage","login_page_test","",""
"","1748","A.17 GET Получить список всех пользователей для поиска","tests.api_tests","Wed Nov 05 14:24:28 UTC 2025","passed","Wed Nov 05 14:24:30 UTC 2025","TestAPI","api_test","",""
"","349","S.6 Окно регистрации сообщение 'Слабый пароль. Пароль должен содержать минимум 8 символов, включая буквы и цифры'","tests.ui_tests","Wed Nov 05 14:46:43 UTC 2025","passed","Wed Nov 05 14:46:43 UTC 2025","TestSignupPage","signup_page_test","",""
"","583","H.5 Проверка перехода на страницу 'https://app.pulsewave.ru/auth/login' по кнопке 'Войти'","tests.ui_tests","Wed Nov 05 14:42:26 UTC 2025","passed","Wed Nov 05 14:42:26 UTC 2025","TestHeader","header_test","",""
"","2080","R.3  Проверка некликабельности кнопки 'Продолжить'","tests.ui_tests","Wed Nov 05 14:45:12 UTC 2025","passed","Wed Nov 05 14:45:15 UTC 2025","TestPasswordRecoveryPage","password_recovery_test","",""
"","24","H.7 Проверка цвета кнопки 'Войти' в хедере https://app.pulsewave.ru/auth/signup","tests.ui_tests","Wed Nov 05 14:43:05 UTC 2025","passed","Wed Nov 05 14:43:05 UTC 2025","TestHeader","header_test","",""
"","51","M.4 Проверка текста кнопки 'Бесплатная регистрация' на лендинге","tests.ui_tests","Wed Nov 05 14:43:53 UTC 2025","passed","Wed Nov 05 14:43:53 UTC 2025","TestLendingPage","lending_test","",""
"","631","W.11 Проверка видимости уведомлений","tests.ui_tests","Wed Nov 05 14:49:39 UTC 2025","passed","Wed Nov 05 14:49:39 UTC 2025","TestWorkspacePage","workspace_page_test","",""
"","1726","A.19 GET Получить данные авторизованного пользователя me","tests.api_tests","Wed Nov 05 14:24:31 UTC 2025","passed","Wed Nov 05 14:24:33 UTC 2025","TestAPI","api_test","",""
"","48559","S.8 Регистрация с корректными email и паролем без согласия на подписку","tests.ui_tests","Wed Nov 05 14:46:56 UTC 2025","passed","Wed Nov 05 14:47:44 UTC 2025","TestSignupPage","signup_page_test","",""
"","2209","L.8 Авторизация с пустым емайл","tests.ui_tests","Wed Nov 05 14:44:39 UTC 2025","passed","Wed Nov 05 14:44:41 UTC 2025","TestLoginPage","login_page_test","",""
"","43","F.5 Проверка цвета шрифта надписи 'info@pulsewave.ru' в футере","tests.ui_tests","Wed Nov 05 14:32:51 UTC 2025","passed","Wed Nov 05 14:32:51 UTC 2025","TestFooter","footer_test","",""
"","8692","R.5 Восстановить пароль на корректный емайл","tests.ui_tests","Wed Nov 05 14:45:34 UTC 2025","passed","Wed Nov 05 14:45:43 UTC 2025","TestPasswordRecoveryPage","password_recovery_test","",""
"","756","W.8 Проверка невидимости кнопки 'Отметить все как прочитанные' в прочитанных уведомлениях","tests.ui_tests","Wed Nov 05 14:49:16 UTC 2025","passed","Wed Nov 05 14:49:17 UTC 2025","TestWorkspacePage","workspace_page_test","",""
"","666","W.10 Проверка цвета переключателя 'Непрочитанные'","tests.ui_tests","Wed Nov 05 14:49:31 UTC 2025","passed","Wed Nov 05 14:49:32 UTC 2025","TestWorkspacePage","workspace_page_test","",""
"","2838","M.1 Проверка редиректа с /home на страницу лендинга","tests.ui_tests","Wed Nov 05 14:43:43 UTC 2025","passed","Wed Nov 05 14:43:45 UTC 2025","TestLendingPage","lending_test","",""
"","81","F.9 Проверка перехода в LinkedIn на странице 'https://pulsewave.ru/' в футере","tests.ui_tests","Wed Nov 05 14:41:34 UTC 2025","passed","Wed Nov 05 14:41:34 UTC 2025","TestFooter","footer_test","",""
"","11","F.7 Проверка значка LinkedIn на странице 'https://app.pulsewave.ru/auth/login' в футере","tests.ui_tests","Wed Nov 05 14:39:08 UTC 2025","passed","Wed Nov 05 14:39:08 UTC 2025","TestFooter","footer_test","",""
"","65","S.12 Окно регистрации сообщение 'Я согласен получать новости и обновления PulseWave'","tests.ui_tests","Wed Nov 05 14:48:07 UTC 2025","passed","Wed Nov 05 14:48:07 UTC 2025","TestSignupPage","signup_page_test","",""
"","40","F.6 Проверка размера шрифта надписи '© PulseWave, 2023-2025' в футере","tests.ui_tests","Wed Nov 05 14:35:31 UTC 2025","passed","Wed Nov 05 14:35:31 UTC 2025","TestFooter","footer_test","",""
"","40","F.4 Проверка года © PulseWave, 2025 в футере","tests.ui_tests","Wed Nov 05 14:30:29 UTC 2025","passed","Wed Nov 05 14:30:29 UTC 2025","TestFooter","footer_test","",""
"","45","M.3 Проверка текста кнопки 'Войти' на лендинге","tests.ui_tests","Wed Nov 05 14:43:51 UTC 2025","passed","Wed Nov 05 14:43:51 UTC 2025","TestLendingPage","lending_test","",""
"","28","H.7 Проверка цвета шрифта кнопки 'Войти' в хедере https://app.pulsewave.ru/auth/signup","tests.ui_tests","Wed Nov 05 14:42:51 UTC 2025","passed","Wed Nov 05 14:42:51 UTC 2025","TestHeader","header_test","",""
"","89","F.3 Проверка элемента 'info@pulsewave.ru'в хедере","tests.ui_tests","Wed Nov 05 14:29:09 UTC 2025","passed","Wed Nov 05 14:29:09 UTC 2025","TestFooter","footer_test","",""
"","600","L.3 Проверка редиректа на страницу восстановления пароля при клике на ссылку 'Забыли пароль?'","tests.ui_tests","Wed Nov 05 14:44:12 UTC 2025","passed","Wed Nov 05 14:44:12 UTC 2025","TestLoginPage","login_page_test","",""
"","2225","L.8 Авторизация с пустым паролем","tests.ui_tests","Wed Nov 05 14:44:45 UTC 2025","passed","Wed Nov 05 14:44:47 UTC 2025","TestLoginPage","login_page_test","",""
"","2","W.1 Проверка перехода в рабочее пространство авторизованного пользователя","tests.ui_tests","Wed Nov 05 14:48:27 UTC 2025","passed","Wed Nov 05 14:48:27 UTC 2025","TestWorkspacePage","workspace_page_test","",""
"","40","F.5 Проверка шрифта надписи 'info@pulsewave.ru' в футере","tests.ui_tests","Wed Nov 05 14:34:14 UTC 2025","passed","Wed Nov 05 14:34:14 UTC 2025","TestFooter","footer_test","",""
"","47","F.6 Проверка цвета шрифта надписи '© PulseWave, 2023-2025' в футере","tests.ui_tests","Wed Nov 05 14:36:34 UTC 2025","passed","Wed Nov 05 14:36:34 UTC 2025","TestFooter","footer_test","",""
"","34","H.7 Проверка цвета шрифта кнопки 'Войти' в хедере https://app.pulsewave.ru/auth/password?email=","tests.ui_tests","Wed Nov 05 14:42:55 UTC 2025","passed","Wed Nov 05 14:42:55 UTC 2025","TestHeader","header_test","",""
"","727","A.30 POST Создать пользователя с некорректными данными","tests.api_tests","Wed Nov 05 14:25:12 UTC 2025","passed","Wed Nov 05 14:25:12 UTC 2025","TestAPI","api_test","",""
"","36","H.3 Проверка текста кнопки 'Войти'","tests.ui_tests","Wed Nov 05 14:42:14 UTC 2025","passed","Wed Nov 05 14:42:14 UTC 2025","TestHeader","header_test","",""
"","112","F.8 Проверка кликабельности значка LinkedIn на странице 'https://pulsewave.ru/' в футере","tests.ui_tests","Wed Nov 05 14:40:20 UTC 2025","passed","Wed Nov 05 14:40:20 UTC 2025","TestFooter","footer_test","",""
"","36","F.6 Проверка цвета шрифта надписи '© PulseWave, 2023-2025' в футере","tests.ui_tests","Wed Nov 05 14:36:46 UTC 2025","passed","Wed Nov 05 14:36:46 UTC 2025","TestFooter","footer_test","",""
"","4106","A.10 GET Информация о конкретном рабочем пространстве","tests.api_tests","Wed Nov 05 14:24:00 UTC 2025","passed","Wed Nov 05 14:24:04 UTC 2025","TestAPI","api_test","",""
"","54","M.2 Проверка кликабельности логотипа на лендинге","tests.ui_tests","Wed Nov 05 14:43:48 UTC 2025","passed","Wed Nov 05 14:43:48 UTC 2025","TestLendingPage","lending_test","",""
"","43","F.5 Проверка размера шрифта надписи 'info@pulsewave.ru' в футере","tests.ui_tests","Wed Nov 05 14:31:40 UTC 2025","passed","Wed Nov 05 14:31:40 UTC 2025","TestFooter","footer_test","",""
"","46","F.5 Проверка размера шрифта надписи 'info@pulsewave.ru' в футере","tests.ui_tests","Wed Nov 05 14:31:44 UTC 2025","passed","Wed Nov 05 14:31:44 UTC 2025","TestFooter","footer_test","",""
"","39","F.2 Проверка отсутствия ссылки на Лицензионное соглашение со страницы 'https://app.pulsewave.ru/auth/login","tests.ui_tests","Wed Nov 05 14:27:45 UTC 2025","passed","Wed Nov 05 14:27:45 UTC 2025","TestFooter","footer_test","",""
"","1020","A.8 POST Создать пару токенов access и refresh","tests.api_tests","Wed Nov 05 14:23:57 UTC 2025","passed","Wed Nov 05 14:23:58 UTC 2025","TestAPI","api_test","",""
