"DESCRIPTION","DURATION IN MS","NAME","PARENT SUITE","START TIME","STATUS","STOP TIME","SUB SUITE","SUITE","TEST CLASS","TEST METHOD"
"","9","W.3 Проверка видимости аватара","tests.ui_tests","Tue Dec 02 04:12:06 UTC 2025","passed","Tue Dec 02 04:12:06 UTC 2025","TestWorkspacePage","workspace_page_test","",""
"","908","S.7 Регистрация с некорректным email и сильным паролем и подтверждением пароля","tests.ui_tests","Tue Dec 02 04:11:04 UTC 2025","passed","Tue Dec 02 04:11:04 UTC 2025","TestSignupPage","signup_page_test","",""
"","0","S.13 Окно регистрации сообщение 'Регистрируясь, я соглашаюсь с Условиями пользования и Политикой конфиденциальности'","tests.ui_tests","Tue Dec 02 04:11:43 UTC 2025","skipped","Tue Dec 02 04:11:43 UTC 2025","TestSignupPage","signup_page_test","",""
"","82","F.9 Проверка перехода в LinkedIn на странице 'https://pulsewave.ru/' в футере","tests.ui_tests","Tue Dec 02 04:07:38 UTC 2025","passed","Tue Dec 02 04:07:38 UTC 2025","TestFooter","footer_test","",""
"","47","F.6 Проверка шрифта надписи '© PulseWave, 2023-2025' в футере","tests.ui_tests","Tue Dec 02 04:04:10 UTC 2025","passed","Tue Dec 02 04:04:10 UTC 2025","TestFooter","footer_test","",""
"","80","F.8 Проверка кликабельности значка LinkedIn на странице 'https://pulsewave.ru/' в футере","tests.ui_tests","Tue Dec 02 04:06:28 UTC 2025","passed","Tue Dec 02 04:06:28 UTC 2025","TestFooter","footer_test","",""
"","40","H.7 Проверка размера шрифта кнопки 'Войти' в хедере https://app.pulsewave.ru/auth/password?email=","tests.ui_tests","Tue Dec 02 04:08:27 UTC 2025","passed","Tue Dec 02 04:08:27 UTC 2025","TestHeader","header_test","",""
"","2819","S.11 Регистрация с пустым email и сильным паролем и подтверждением пароля","tests.ui_tests","Tue Dec 02 04:11:37 UTC 2025","passed","Tue Dec 02 04:11:40 UTC 2025","TestSignupPage","signup_page_test","",""
"","51","F.6 Проверка шрифта надписи '© PulseWave, 2023-2025' в футере","tests.ui_tests","Tue Dec 02 04:04:16 UTC 2025","passed","Tue Dec 02 04:04:16 UTC 2025","TestFooter","footer_test","",""
"","37","H.7 Проверка шрифта кнопки 'Войти' в хедере https://app.pulsewave.ru/auth/signup","tests.ui_tests","Tue Dec 02 04:08:34 UTC 2025","passed","Tue Dec 02 04:08:34 UTC 2025","TestHeader","header_test","",""
"","898","S.2 Регистрация с корректным email и не совпадающими паролем и подтверждением пароля","tests.ui_tests","Tue Dec 02 04:10:42 UTC 2025","passed","Tue Dec 02 04:10:43 UTC 2025","TestSignupPage","signup_page_test","",""
"","74","M.2 Проверка кликабельности логотипа на лендинге","tests.ui_tests","Tue Dec 02 04:09:08 UTC 2025","passed","Tue Dec 02 04:09:08 UTC 2025","TestLendingPage","lending_test","",""
"","2003","F.1 Проверка попапа о принятии файлов cookie на странице https://app.pulsewave.ru/auth/signup","tests.ui_tests","Tue Dec 02 03:53:39 UTC 2025","passed","Tue Dec 02 03:53:41 UTC 2025","TestFooter","footer_test","",""
"","39","H.8 Проверка цвета кнопки 'Регистрация в хедере https://app.pulsewave.ru/auth/password?email='","tests.ui_tests","Tue Dec 02 04:09:03 UTC 2025","passed","Tue Dec 02 04:09:03 UTC 2025","TestHeader","header_test","",""
"","1534","H.2 Проверка редиректа на главную страницу при клике на логотип","tests.ui_tests","Tue Dec 02 04:07:53 UTC 2025","passed","Tue Dec 02 04:07:55 UTC 2025","TestHeader","header_test","",""
"","2752","M.1 Проверка редиректа с /home на страницу лендинга","tests.ui_tests","Tue Dec 02 04:09:03 UTC 2025","passed","Tue Dec 02 04:09:06 UTC 2025","TestLendingPage","lending_test","",""
"","190","W.10 Проверка цвета переключателя 'Непрочитанные'","tests.ui_tests","Tue Dec 02 04:12:42 UTC 2025","passed","Tue Dec 02 04:12:43 UTC 2025","TestWorkspacePage","workspace_page_test","",""
"","621","H.6 Проверка перехода на страницу 'https://app.pulsewave.ru/auth/signup' по кнопке 'Регистрация'","tests.ui_tests","Tue Dec 02 04:08:18 UTC 2025","passed","Tue Dec 02 04:08:19 UTC 2025","TestHeader","header_test","",""
"","740","A.1 GET Проверка доступности API","tests.api_tests","Tue Dec 02 03:50:40 UTC 2025","passed","Tue Dec 02 03:50:41 UTC 2025","TestAPI","api_test","",""
"","1319","W.9 Проверка возможности изменить цвет переключателя 'Непрочитанные'","tests.ui_tests","Tue Dec 02 04:12:37 UTC 2025","passed","Tue Dec 02 04:12:38 UTC 2025","TestWorkspacePage","workspace_page_test","",""
"","558","F.6 Проверка размера шрифта надписи '© PulseWave, 2023-2025' в футере","tests.ui_tests","Tue Dec 02 04:01:52 UTC 2025","passed","Tue Dec 02 04:01:53 UTC 2025","TestFooter","footer_test","",""
"","557","F.4 Проверка года © PulseWave, 2025 в футере","tests.ui_tests","Tue Dec 02 03:57:09 UTC 2025","passed","Tue Dec 02 03:57:09 UTC 2025","TestFooter","footer_test","",""
"","899","S.6 Окно регистрации сообщение 'Слабый пароль. Пароль должен содержать минимум 8 символов, включая буквы и цифры'","tests.ui_tests","Tue Dec 02 04:11:00 UTC 2025","passed","Tue Dec 02 04:11:01 UTC 2025","TestSignupPage","signup_page_test","",""
"","53","F.6 Проверка цвета шрифта надписи '© PulseWave, 2023-2025' в футере","tests.ui_tests","Tue Dec 02 04:02:57 UTC 2025","passed","Tue Dec 02 04:02:57 UTC 2025","TestFooter","footer_test","",""
"","34","F.7 Проверка значка LinkedIn на странице 'https://app.pulsewave.ru/auth/signup' в футере","tests.ui_tests","Tue Dec 02 04:05:23 UTC 2025","passed","Tue Dec 02 04:05:23 UTC 2025","TestFooter","footer_test","",""
"","60","F.5 Проверка размера шрифта надписи 'info@pulsewave.ru' в футере","tests.ui_tests","Tue Dec 02 03:58:17 UTC 2025","passed","Tue Dec 02 03:58:17 UTC 2025","TestFooter","footer_test","",""
"","75","S.5 Проверка шрифта заголовка 'Регистрация'","tests.ui_tests","Tue Dec 02 04:10:58 UTC 2025","passed","Tue Dec 02 04:10:58 UTC 2025","TestSignupPage","signup_page_test","",""
"","29","H.8 Проверка размера шрифта кнопки 'Регистрация в хедере https://app.pulsewave.ru/auth/login'","tests.ui_tests","Tue Dec 02 04:08:45 UTC 2025","passed","Tue Dec 02 04:08:45 UTC 2025","TestHeader","header_test","",""
"","554","S.5 Проверка цвета шрифта заголовка 'Регистрация'","tests.ui_tests","Tue Dec 02 04:10:55 UTC 2025","passed","Tue Dec 02 04:10:56 UTC 2025","TestSignupPage","signup_page_test","",""
"","3","W.4 Проверка что авторизованный пользователь попадает в Рабочие пространства","tests.ui_tests","Tue Dec 02 04:12:10 UTC 2025","passed","Tue Dec 02 04:12:10 UTC 2025","TestWorkspacePage","workspace_page_test","",""
"","56","F.2 Проверка отсутствия ссылки на Лицензионное соглашение со страницы 'https://app.pulsewave.ru/auth/password?email=","tests.ui_tests","Tue Dec 02 03:54:54 UTC 2025","passed","Tue Dec 02 03:54:54 UTC 2025","TestFooter","footer_test","",""
"","8671","A.5 POST Повторная отправка ссылки с приглашением пользователя","tests.api_tests","Tue Dec 02 03:50:49 UTC 2025","passed","Tue Dec 02 03:50:57 UTC 2025","TestAPI","api_test","",""
"","1866","L.4 Авторизация с корректными данными","tests.ui_tests","Tue Dec 02 04:09:28 UTC 2025","passed","Tue Dec 02 04:09:30 UTC 2025","TestLoginPage","login_page_test","",""
"","574","F.6 Проверка цвета шрифта надписи '© PulseWave, 2023-2025' в футере","tests.ui_tests","Tue Dec 02 04:03:05 UTC 2025","passed","Tue Dec 02 04:03:06 UTC 2025","TestFooter","footer_test","",""
"","630","Проверка доступности https://api.dev.pulsewave.ru/api/healthcheck/","tests.api_tests","Tue Dec 02 03:52:26 UTC 2025","passed","Tue Dec 02 03:52:26 UTC 2025","TestAvailability","availability_test","",""
"","1550","W.5 Проверка что авторизованный пользователь может выйти из аккаунта","tests.ui_tests","Tue Dec 02 04:12:15 UTC 2025","passed","Tue Dec 02 04:12:17 UTC 2025","TestWorkspacePage","workspace_page_test","",""
"","11","F.7 Проверка значка LinkedIn на странице 'https://app.pulsewave.ru/auth/password?email=' в футере","tests.ui_tests","Tue Dec 02 04:05:26 UTC 2025","passed","Tue Dec 02 04:05:26 UTC 2025","TestFooter","footer_test","",""
"","882","S.16 Регистрация с корректным email и слабым паролем и подтверждением пароля","tests.ui_tests","Tue Dec 02 04:11:45 UTC 2025","passed","Tue Dec 02 04:11:46 UTC 2025","TestSignupPage","signup_page_test","",""
"","624","A.7 POST Регистрация ранее зарегистрированного пользователя","tests.api_tests","Tue Dec 02 03:51:00 UTC 2025","passed","Tue Dec 02 03:51:01 UTC 2025","TestAPI","api_test","",""
"","487","A.27 POST Регистрация пользователя без пароля","tests.api_tests","Tue Dec 02 03:52:13 UTC 2025","passed","Tue Dec 02 03:52:13 UTC 2025","TestAPI","api_test","",""
"","551","F.2 Проверка отсутствия ссылки на Лицензионное соглашение со страницы 'https://app.pulsewave.ru/auth/signup","tests.ui_tests","Tue Dec 02 03:54:51 UTC 2025","passed","Tue Dec 02 03:54:51 UTC 2025","TestFooter","footer_test","",""
"","40","H.7 Проверка шрифта кнопки 'Войти' в хедере https://app.pulsewave.ru/auth/password?email=","tests.ui_tests","Tue Dec 02 04:08:37 UTC 2025","passed","Tue Dec 02 04:08:37 UTC 2025","TestHeader","header_test","",""
"","46","R.1 Проверка текста заголовка 'Восстановление пароля'","tests.ui_tests","Tue Dec 02 04:09:58 UTC 2025","passed","Tue Dec 02 04:09:58 UTC 2025","TestPasswordRecoveryPage","password_recovery_test","",""
"","573","F.8 Проверка кликабельности значка LinkedIn на странице 'https://app.pulsewave.ru/auth/signup' в футере","tests.ui_tests","Tue Dec 02 04:06:33 UTC 2025","passed","Tue Dec 02 04:06:33 UTC 2025","TestFooter","footer_test","",""
"","604","H.5 Проверка перехода на страницу 'https://app.pulsewave.ru/auth/login' по кнопке 'Войти'","tests.ui_tests","Tue Dec 02 04:08:15 UTC 2025","passed","Tue Dec 02 04:08:16 UTC 2025","TestHeader","header_test","",""
"","2101","R.3  Проверка некликабельности кнопки 'Продолжить'","tests.ui_tests","Tue Dec 02 04:10:08 UTC 2025","passed","Tue Dec 02 04:10:10 UTC 2025","TestPasswordRecoveryPage","password_recovery_test","",""
"","1400","L.5 Авторизация с некорректным паролем","tests.ui_tests","Tue Dec 02 04:09:32 UTC 2025","passed","Tue Dec 02 04:09:33 UTC 2025","TestLoginPage","login_page_test","",""
"","2224","A.20 POST Запрос на смену почты","tests.api_tests","Tue Dec 02 03:51:28 UTC 2025","passed","Tue Dec 02 03:51:30 UTC 2025","TestAPI","api_test","",""
"","1367","L.7 Авторизация с некорректным емайл","tests.ui_tests","Tue Dec 02 04:09:39 UTC 2025","passed","Tue Dec 02 04:09:41 UTC 2025","TestLoginPage","login_page_test","",""
"","1309","Проверка доступности https://pulsewave.ru/","tests.api_tests","Tue Dec 02 03:52:26 UTC 2025","passed","Tue Dec 02 03:52:27 UTC 2025","TestAvailability","availability_test","",""
"","768","A.28 POST Регистрация пользователя без подтверждения подписки","tests.api_tests","Tue Dec 02 03:52:13 UTC 2025","passed","Tue Dec 02 03:52:14 UTC 2025","TestAPI","api_test","",""
"","3","W.2 Проверка заголовка рабочего пространства","tests.ui_tests","Tue Dec 02 04:12:01 UTC 2025","passed","Tue Dec 02 04:12:01 UTC 2025","TestWorkspacePage","workspace_page_test","",""
"","1845","F.1 Проверка попапа о принятии файлов cookie на странице https://app.pulsewave.ru/auth/login","tests.ui_tests","Tue Dec 02 03:53:37 UTC 2025","passed","Tue Dec 02 03:53:39 UTC 2025","TestFooter","footer_test","",""
"","559","F.5 Проверка цвета шрифта надписи 'info@pulsewave.ru' в футере","tests.ui_tests","Tue Dec 02 03:59:32 UTC 2025","passed","Tue Dec 02 03:59:32 UTC 2025","TestFooter","footer_test","",""
"","55","L.2 Проверка размера шрифта заголовка 'Войти'","tests.ui_tests","Tue Dec 02 04:09:17 UTC 2025","passed","Tue Dec 02 04:09:17 UTC 2025","TestLoginPage","login_page_test","",""
"","113","F.3 Проверка элемента 'info@pulsewave.ru'в хедере","tests.ui_tests","Tue Dec 02 03:55:56 UTC 2025","passed","Tue Dec 02 03:55:56 UTC 2025","TestFooter","footer_test","",""
"","59","M.4 Проверка текста кнопки 'Бесплатная регистрация' на лендинге","tests.ui_tests","Tue Dec 02 04:09:12 UTC 2025","passed","Tue Dec 02 04:09:12 UTC 2025","TestLendingPage","lending_test","",""
"","601","Проверка доступности https://app.pulsewave.ru/","tests.api_tests","Tue Dec 02 03:52:27 UTC 2025","passed","Tue Dec 02 03:52:28 UTC 2025","TestAvailability","availability_test","",""
"","1039","A.2 POST Создать пользователя с корректными данными","tests.api_tests","Tue Dec 02 03:50:41 UTC 2025","passed","Tue Dec 02 03:50:42 UTC 2025","TestAPI","api_test","",""
"","57","H.8 Проверка цвета шрифта кнопки 'Регистрация в хедере https://app.pulsewave.ru/auth/password?email='","tests.ui_tests","Tue Dec 02 04:08:52 UTC 2025","passed","Tue Dec 02 04:08:53 UTC 2025","TestHeader","header_test","",""
"","86","F.9 Проверка перехода в LinkedIn на странице 'https://app.pulsewave.ru/auth/login' в футере","tests.ui_tests","Tue Dec 02 04:07:41 UTC 2025","passed","Tue Dec 02 04:07:41 UTC 2025","TestFooter","footer_test","",""
"","658","W.11 Проверка видимости уведомлений","tests.ui_tests","Tue Dec 02 04:12:47 UTC 2025","passed","Tue Dec 02 04:12:47 UTC 2025","TestWorkspacePage","workspace_page_test","",""
"","517","A.30 POST Создать пользователя с некорректными данными","tests.api_tests","Tue Dec 02 03:52:22 UTC 2025","passed","Tue Dec 02 03:52:23 UTC 2025","TestAPI","api_test","",""
"","1191","Проверка доступности https://web.dev.pulsewave.ru/","tests.api_tests","Tue Dec 02 03:52:24 UTC 2025","passed","Tue Dec 02 03:52:25 UTC 2025","TestAvailability","availability_test","",""
"","597","F.9 Проверка перехода в LinkedIn на странице 'https://app.pulsewave.ru/auth/password?email=' в футере","tests.ui_tests","Tue Dec 02 04:07:46 UTC 2025","passed","Tue Dec 02 04:07:46 UTC 2025","TestFooter","footer_test","",""
"","52","F.5 Проверка шрифта надписи 'info@pulsewave.ru' в футере","tests.ui_tests","Tue Dec 02 04:00:45 UTC 2025","passed","Tue Dec 02 04:00:45 UTC 2025","TestFooter","footer_test","",""
"","35","H.3 Проверка текста кнопки 'Войти'","tests.ui_tests","Tue Dec 02 04:08:01 UTC 2025","passed","Tue Dec 02 04:08:01 UTC 2025","TestHeader","header_test","",""
"","1299","A.22 POST Сброс пароля","tests.api_tests","Tue Dec 02 03:51:41 UTC 2025","passed","Tue Dec 02 03:51:42 UTC 2025","TestAPI","api_test","",""
"","552","F.6 Проверка шрифта надписи '© PulseWave, 2023-2025' в футере","tests.ui_tests","Tue Dec 02 04:04:13 UTC 2025","passed","Tue Dec 02 04:04:13 UTC 2025","TestFooter","footer_test","",""
"","609","H.6 Проверка перехода на страницу 'https://app.pulsewave.ru/auth/signup' по кнопке 'Регистрация'","tests.ui_tests","Tue Dec 02 04:08:21 UTC 2025","passed","Tue Dec 02 04:08:22 UTC 2025","TestHeader","header_test","",""
"","39","H.7 Проверка цвета кнопки 'Войти' в хедере https://app.pulsewave.ru/auth/password?email=","tests.ui_tests","Tue Dec 02 04:08:42 UTC 2025","passed","Tue Dec 02 04:08:42 UTC 2025","TestHeader","header_test","",""
