"DESCRIPTION","DURATION IN MS","NAME","PARENT SUITE","START TIME","STATUS","STOP TIME","SUB SUITE","SUITE","TEST CLASS","TEST METHOD"
"","45","F.6 Проверка размера шрифта надписи '© PulseWave, 2023-2025' в футере","tests.ui_tests","Tue Dec 02 04:01:50 UTC 2025","passed","Tue Dec 02 04:01:50 UTC 2025","TestFooter","footer_test","",""
"","6444","R.5 Восстановить пароль на корректный емайл","tests.ui_tests","Tue Dec 02 04:10:18 UTC 2025","passed","Tue Dec 02 04:10:25 UTC 2025","TestPasswordRecoveryPage","password_recovery_test","",""
"","1681","A.25 DELETE Удалить авторизованного пользователя","tests.api_tests","Tue Dec 02 03:52:10 UTC 2025","passed","Tue Dec 02 03:52:12 UTC 2025","TestAPI","api_test","",""
"","3282","A.12 DELETE Удалить РП","tests.api_tests","Tue Dec 02 03:51:10 UTC 2025","passed","Tue Dec 02 03:51:13 UTC 2025","TestAPI","api_test","",""
"","505","Проверка доступности https://api.pulsewave.ru/api/healthcheck/","tests.api_tests","Tue Dec 02 03:52:28 UTC 2025","passed","Tue Dec 02 03:52:29 UTC 2025","TestAvailability","availability_test","",""
"Создание доски без указания РП, будет создано дефолтное РП для этой доски","1268","A.14 POST Создать доску без указания РП","tests.api_tests","Tue Dec 02 03:51:18 UTC 2025","passed","Tue Dec 02 03:51:19 UTC 2025","TestAPI","api_test","",""
"","1910","S.3 Регистрация с уже зарегистрированным email и корректными паролем и подтверждением пароля","tests.ui_tests","Tue Dec 02 04:10:45 UTC 2025","passed","Tue Dec 02 04:10:47 UTC 2025","TestSignupPage","signup_page_test","",""
"","43","H.8 Проверка размера шрифта кнопки 'Регистрация в хедере https://app.pulsewave.ru/auth/password?email='","tests.ui_tests","Tue Dec 02 04:08:48 UTC 2025","passed","Tue Dec 02 04:08:48 UTC 2025","TestHeader","header_test","",""
"","1310","A.16 POST Создать Рабочее пространство","tests.api_tests","Tue Dec 02 03:51:23 UTC 2025","passed","Tue Dec 02 03:51:24 UTC 2025","TestAPI","api_test","",""
"","62","F.5 Проверка шрифта надписи 'info@pulsewave.ru' в футере","tests.ui_tests","Tue Dec 02 04:00:37 UTC 2025","passed","Tue Dec 02 04:00:37 UTC 2025","TestFooter","footer_test","",""
"","881","S.16 Регистрация с корректным email и слабым паролем и подтверждением пароля","tests.ui_tests","Tue Dec 02 04:11:52 UTC 2025","passed","Tue Dec 02 04:11:53 UTC 2025","TestSignupPage","signup_page_test","",""
"","32","H.8 Проверка цвета шрифта кнопки 'Регистрация в хедере https://app.pulsewave.ru/auth/login'","tests.ui_tests","Tue Dec 02 04:08:50 UTC 2025","passed","Tue Dec 02 04:08:50 UTC 2025","TestHeader","header_test","",""
"","1275","A.17 GET Получить список всех пользователей для поиска","tests.api_tests","Tue Dec 02 03:51:24 UTC 2025","passed","Tue Dec 02 03:51:25 UTC 2025","TestAPI","api_test","",""
"","534","H.7 Проверка размера шрифта кнопки 'Войти' в хедере https://app.pulsewave.ru/auth/signup","tests.ui_tests","Tue Dec 02 04:08:24 UTC 2025","passed","Tue Dec 02 04:08:25 UTC 2025","TestHeader","header_test","",""
"","552","L.2 Проверка шрифта заголовка 'Войти'","tests.ui_tests","Tue Dec 02 04:09:22 UTC 2025","passed","Tue Dec 02 04:09:22 UTC 2025","TestLoginPage","login_page_test","",""
"","14932","S.8 Регистрация с корректными email и паролем без согласия на подписку","tests.ui_tests","Tue Dec 02 04:11:10 UTC 2025","passed","Tue Dec 02 04:11:25 UTC 2025","TestSignupPage","signup_page_test","",""
"","64","F.5 Проверка цвета шрифта надписи 'info@pulsewave.ru' в футере","tests.ui_tests","Tue Dec 02 03:59:29 UTC 2025","passed","Tue Dec 02 03:59:30 UTC 2025","TestFooter","footer_test","",""
"","51","S.4 Проверка текста заголовка 'Регистрация'","tests.ui_tests","Tue Dec 02 04:10:50 UTC 2025","passed","Tue Dec 02 04:10:50 UTC 2025","TestSignupPage","signup_page_test","",""
"","548","H.3 Проверка текста кнопки 'Войти'","tests.ui_tests","Tue Dec 02 04:08:04 UTC 2025","passed","Tue Dec 02 04:08:04 UTC 2025","TestHeader","header_test","",""
"","35","H.8 Проверка цвета кнопки 'Регистрация в хедере https://app.pulsewave.ru/auth/login'","tests.ui_tests","Tue Dec 02 04:09:00 UTC 2025","passed","Tue Dec 02 04:09:00 UTC 2025","TestHeader","header_test","",""
"","580","F.9 Проверка перехода в LinkedIn на странице 'https://app.pulsewave.ru/auth/signup' в футере","tests.ui_tests","Tue Dec 02 04:07:43 UTC 2025","passed","Tue Dec 02 04:07:44 UTC 2025","TestFooter","footer_test","",""
"","10758","A.21 POST Подтверждение смены почты пользователя. Токен из ссылки auth/change_email/{token}.","tests.api_tests","Tue Dec 02 03:51:30 UTC 2025","passed","Tue Dec 02 03:51:41 UTC 2025","TestAPI","api_test","",""
"","523","F.7 Проверка значка LinkedIn на странице 'https://app.pulsewave.ru/auth/login' в футере","tests.ui_tests","Tue Dec 02 04:05:20 UTC 2025","passed","Tue Dec 02 04:05:21 UTC 2025","TestFooter","footer_test","",""
"","3177","R.4 Проверить сообщение об отправке ссылки восстановления пароля на емайл","tests.ui_tests","Tue Dec 02 04:10:13 UTC 2025","passed","Tue Dec 02 04:10:16 UTC 2025","TestPasswordRecoveryPage","password_recovery_test","",""
"","598","F.3 Проверка элемента 'info@pulsewave.ru'в хедере","tests.ui_tests","Tue Dec 02 03:56:01 UTC 2025","passed","Tue Dec 02 03:56:02 UTC 2025","TestFooter","footer_test","",""
"","1580","A.18 POST Обновить JWT refresh token авторизованного пользователя","tests.api_tests","Tue Dec 02 03:51:25 UTC 2025","passed","Tue Dec 02 03:51:27 UTC 2025","TestAPI","api_test","",""
"","506","A.30 POST Создать пользователя с некорректными данными","tests.api_tests","Tue Dec 02 03:52:23 UTC 2025","passed","Tue Dec 02 03:52:23 UTC 2025","TestAPI","api_test","",""
"","60","F.2 Проверка отсутствия ссылки на Лицензионное соглашение со страницы 'https://app.pulsewave.ru/auth/login","tests.ui_tests","Tue Dec 02 03:54:49 UTC 2025","passed","Tue Dec 02 03:54:49 UTC 2025","TestFooter","footer_test","",""
"","53","R.2 Проверка шрифта заголовка 'Восстановление пароля'","tests.ui_tests","Tue Dec 02 04:10:06 UTC 2025","passed","Tue Dec 02 04:10:06 UTC 2025","TestPasswordRecoveryPage","password_recovery_test","",""
"","0","S.14 Окно регистрации сообщение 'Регистрируясь, я соглашаюсь с Условиями пользования и Политикой конфиденциальности' проверка корректности перехода по ссылке 'Политикой конфиденциальности'","tests.ui_tests","Tue Dec 02 04:11:43 UTC 2025","skipped","Tue Dec 02 04:11:43 UTC 2025","TestSignupPage","signup_page_test","",""
"","37","H.4 Проверка текста кнопки 'Регистрация'","tests.ui_tests","Tue Dec 02 04:08:07 UTC 2025","passed","Tue Dec 02 04:08:07 UTC 2025","TestHeader","header_test","",""
"","1557","H.2 Проверка редиректа на главную страницу при клике на логотип","tests.ui_tests","Tue Dec 02 04:07:49 UTC 2025","passed","Tue Dec 02 04:07:51 UTC 2025","TestHeader","header_test","",""
"","1951","F.1 Проверка попапа о принятии файлов cookie на странице https://app.pulsewave.ru/auth/password?email=","tests.ui_tests","Tue Dec 02 03:53:42 UTC 2025","passed","Tue Dec 02 03:53:44 UTC 2025","TestFooter","footer_test","",""
"","2050","W.6 Проверка перехода в Рабочие пространства по ссылке На главную","tests.ui_tests","Tue Dec 02 04:12:21 UTC 2025","passed","Tue Dec 02 04:12:23 UTC 2025","TestWorkspacePage","workspace_page_test","",""
"","2745","A.3 POST Активация пользователя с корректными данными","tests.api_tests","Tue Dec 02 03:50:42 UTC 2025","passed","Tue Dec 02 03:50:44 UTC 2025","TestAPI","api_test","",""
"","3105","A.15 GET Список всех пользователей доски для назначения ответственных","tests.api_tests","Tue Dec 02 03:51:19 UTC 2025","passed","Tue Dec 02 03:51:22 UTC 2025","TestAPI","api_test","",""
"","61864","F.1 Проверка попапа о принятии файлов cookie на странице https://pulsewave.ru/","tests.ui_tests","Tue Dec 02 03:52:35 UTC 2025","passed","Tue Dec 02 03:53:37 UTC 2025","TestFooter","footer_test","",""
"","53","F.5 Проверка размера шрифта надписи 'info@pulsewave.ru' в футере","tests.ui_tests","Tue Dec 02 03:58:25 UTC 2025","passed","Tue Dec 02 03:58:25 UTC 2025","TestFooter","footer_test","",""
"","56","L.1 Проверка текста заголовка 'Войти'","tests.ui_tests","Tue Dec 02 04:09:14 UTC 2025","passed","Tue Dec 02 04:09:14 UTC 2025","TestLoginPage","login_page_test","",""
"","59","F.5 Проверка шрифта надписи 'info@pulsewave.ru' в футере","tests.ui_tests","Tue Dec 02 04:00:39 UTC 2025","passed","Tue Dec 02 04:00:39 UTC 2025","TestFooter","footer_test","",""
"","489","A.26 POST Регистрация пользователя без электронной почты","tests.api_tests","Tue Dec 02 03:52:12 UTC 2025","passed","Tue Dec 02 03:52:13 UTC 2025","TestAPI","api_test","",""
"","2263","L.8 Авторизация с пустым емайл","tests.ui_tests","Tue Dec 02 04:09:43 UTC 2025","passed","Tue Dec 02 04:09:45 UTC 2025","TestLoginPage","login_page_test","",""
"","1639","A.9 GET Получить список всех Рабочих пространств авторизованного пользователя","tests.api_tests","Tue Dec 02 03:51:02 UTC 2025","passed","Tue Dec 02 03:51:03 UTC 2025","TestAPI","api_test","",""
"","385","W.8 Проверка невидимости кнопки 'Отметить все как прочитанные' в прочитанных уведомлениях","tests.ui_tests","Tue Dec 02 04:12:32 UTC 2025","passed","Tue Dec 02 04:12:32 UTC 2025","TestWorkspacePage","workspace_page_test","",""
"","628","L.3 Проверка редиректа на страницу восстановления пароля при клике на ссылку 'Забыли пароль?'","tests.ui_tests","Tue Dec 02 04:09:25 UTC 2025","passed","Tue Dec 02 04:09:25 UTC 2025","TestLoginPage","login_page_test","",""
"","2278","L.8 Авторизация с пустым паролем","tests.ui_tests","Tue Dec 02 04:09:48 UTC 2025","passed","Tue Dec 02 04:09:50 UTC 2025","TestLoginPage","login_page_test","",""
"","496","A.30 POST Создать пользователя с некорректными данными","tests.api_tests","Tue Dec 02 03:52:23 UTC 2025","passed","Tue Dec 02 03:52:24 UTC 2025","TestAPI","api_test","",""
"","2844","S.9 Регистрация с корректным email и паролем и пустым подтверждением пароля","tests.ui_tests","Tue Dec 02 04:11:27 UTC 2025","passed","Tue Dec 02 04:11:30 UTC 2025","TestSignupPage","signup_page_test","",""
"","37","W.7 Проверка видимости заголовка 'Ваши рабочие пространства'","tests.ui_tests","Tue Dec 02 04:12:27 UTC 2025","passed","Tue Dec 02 04:12:27 UTC 2025","TestWorkspacePage","workspace_page_test","",""
"","5139","A.13 POST Подтверждение приглашения в РП","tests.api_tests","Tue Dec 02 03:51:13 UTC 2025","passed","Tue Dec 02 03:51:18 UTC 2025","TestAPI","api_test","",""
"","75","F.8 Проверка кликабельности значка LinkedIn на странице 'https://app.pulsewave.ru/auth/password?email=' в футере","tests.ui_tests","Tue Dec 02 04:06:36 UTC 2025","passed","Tue Dec 02 04:06:36 UTC 2025","TestFooter","footer_test","",""
"","4673","A.24 POST Установить новый пароль. Используется в личном кабинете после авторизации.","tests.api_tests","Tue Dec 02 03:52:06 UTC 2025","passed","Tue Dec 02 03:52:10 UTC 2025","TestAPI","api_test","",""
"","536","H.7 Проверка цвета кнопки 'Войти' в хедере https://app.pulsewave.ru/auth/signup","tests.ui_tests","Tue Dec 02 04:08:39 UTC 2025","passed","Tue Dec 02 04:08:39 UTC 2025","TestHeader","header_test","",""
"","1579","H.2 Проверка редиректа на главную страницу при клике на логотип","tests.ui_tests","Tue Dec 02 04:07:57 UTC 2025","passed","Tue Dec 02 04:07:59 UTC 2025","TestHeader","header_test","",""
"","0","S.15 Окно регистрации сообщение 'Регистрируясь, я соглашаюсь с Условиями пользования и Политикой конфиденциальности', проверка корректности перехода по ссылке 'Условиями пользования'","tests.ui_tests","Tue Dec 02 04:11:43 UTC 2025","skipped","Tue Dec 02 04:11:43 UTC 2025","TestSignupPage","signup_page_test","",""
"Удаление как из участников так и из приглашенных","2789","A.6 POST Удаление приглашенного пользователей из РП","tests.api_tests","Tue Dec 02 03:50:57 UTC 2025","passed","Tue Dec 02 03:51:00 UTC 2025","TestAPI","api_test","",""
"","48","L.2 Проверка цвета шрифта заголовка 'Войти'","tests.ui_tests","Tue Dec 02 04:09:20 UTC 2025","passed","Tue Dec 02 04:09:20 UTC 2025","TestLoginPage","login_page_test","",""
"","61","F.5 Проверка цвета шрифта надписи 'info@pulsewave.ru' в футере","tests.ui_tests","Tue Dec 02 03:59:27 UTC 2025","passed","Tue Dec 02 03:59:27 UTC 2025","TestFooter","footer_test","",""
"","1286","R.6 Восстановить пароль на некорректный емайл","tests.ui_tests","Tue Dec 02 04:10:27 UTC 2025","passed","Tue Dec 02 04:10:28 UTC 2025","TestPasswordRecoveryPage","password_recovery_test","",""
"","8278","S.1 Регистрация с корректными email и паролем и с согласием на подписку","tests.ui_tests","Tue Dec 02 04:10:31 UTC 2025","passed","Tue Dec 02 04:10:40 UTC 2025","TestSignupPage","signup_page_test","",""
"","23564","A.23 POST Подтверждение сброса пароля. Когда пользователь переходит по ссылке     auth/password/reset/confirm/{uid}/{token}","tests.api_tests","Tue Dec 02 03:51:42 UTC 2025","passed","Tue Dec 02 03:52:06 UTC 2025","TestAPI","api_test","",""
"","51","F.6 Проверка размера шрифта надписи '© PulseWave, 2023-2025' в футере","tests.ui_tests","Tue Dec 02 04:01:55 UTC 2025","passed","Tue Dec 02 04:01:55 UTC 2025","TestFooter","footer_test","",""
"","3","W.1 Проверка перехода в рабочее пространство авторизованного пользователя","tests.ui_tests","Tue Dec 02 04:11:57 UTC 2025","passed","Tue Dec 02 04:11:57 UTC 2025","TestWorkspacePage","workspace_page_test","",""
"","1245","A.19 GET Получить данные авторизованного пользователя me","tests.api_tests","Tue Dec 02 03:51:27 UTC 2025","passed","Tue Dec 02 03:51:28 UTC 2025","TestAPI","api_test","",""
"","552","S.5 Проверка размера шрифта заголовка 'Регистрация'","tests.ui_tests","Tue Dec 02 04:10:52 UTC 2025","passed","Tue Dec 02 04:10:53 UTC 2025","TestSignupPage","signup_page_test","",""
"","554","R.2 Проверка цвета шрифта заголовка 'Восстановление пароля'","tests.ui_tests","Tue Dec 02 04:10:03 UTC 2025","passed","Tue Dec 02 04:10:04 UTC 2025","TestPasswordRecoveryPage","password_recovery_test","",""
"","580","S.12 Окно регистрации сообщение 'Я согласен получать новости и обновления PulseWave'","tests.ui_tests","Tue Dec 02 04:11:42 UTC 2025","passed","Tue Dec 02 04:11:43 UTC 2025","TestSignupPage","signup_page_test","",""
"","36","H.8 Проверка шрифта кнопки 'Регистрация в хедере https://app.pulsewave.ru/auth/login'","tests.ui_tests","Tue Dec 02 04:08:55 UTC 2025","passed","Tue Dec 02 04:08:55 UTC 2025","TestHeader","header_test","",""
"","8330","A.29 DELETE Активировать и удалить авторизованного пользователя","tests.api_tests","Tue Dec 02 03:52:14 UTC 2025","passed","Tue Dec 02 03:52:22 UTC 2025","TestAPI","api_test","",""
"","3259","A.11 PATCH Частично обновить данные РП (на данный момент только имя)","tests.api_tests","Tue Dec 02 03:51:06 UTC 2025","passed","Tue Dec 02 03:51:10 UTC 2025","TestAPI","api_test","",""
"","50","F.4 Проверка года © PulseWave, 2025 в футере","tests.ui_tests","Tue Dec 02 03:57:12 UTC 2025","passed","Tue Dec 02 03:57:12 UTC 2025","TestFooter","footer_test","",""
"","52","F.4 Проверка года © PulseWave, 2025 в футере","tests.ui_tests","Tue Dec 02 03:57:14 UTC 2025","passed","Tue Dec 02 03:57:14 UTC 2025","TestFooter","footer_test","",""
"","577","F.5 Проверка размера шрифта надписи 'info@pulsewave.ru' в футере","tests.ui_tests","Tue Dec 02 03:58:22 UTC 2025","passed","Tue Dec 02 03:58:22 UTC 2025","TestFooter","footer_test","",""
"","100","F.3 Проверка элемента 'info@pulsewave.ru'в хедере","tests.ui_tests","Tue Dec 02 03:56:04 UTC 2025","passed","Tue Dec 02 03:56:04 UTC 2025","TestFooter","footer_test","",""
"","50","F.5 Проверка цвета шрифта надписи 'info@pulsewave.ru' в футере","tests.ui_tests","Tue Dec 02 03:59:35 UTC 2025","passed","Tue Dec 02 03:59:35 UTC 2025","TestFooter","footer_test","",""
"","556","F.5 Проверка шрифта надписи 'info@pulsewave.ru' в футере","tests.ui_tests","Tue Dec 02 04:00:42 UTC 2025","passed","Tue Dec 02 04:00:42 UTC 2025","TestFooter","footer_test","",""
"","787","A.8 POST Создать пару токенов access и refresh","tests.api_tests","Tue Dec 02 03:51:01 UTC 2025","passed","Tue Dec 02 03:51:02 UTC 2025","TestAPI","api_test","",""
"","79","F.8 Проверка кликабельности значка LinkedIn на странице 'https://app.pulsewave.ru/auth/login' в футере","tests.ui_tests","Tue Dec 02 04:06:31 UTC 2025","passed","Tue Dec 02 04:06:31 UTC 2025","TestFooter","footer_test","",""
"","1099","H.5 Проверка перехода на страницу 'https://app.pulsewave.ru/auth/login' по кнопке 'Войти'","tests.ui_tests","Tue Dec 02 04:08:11 UTC 2025","passed","Tue Dec 02 04:08:13 UTC 2025","TestHeader","header_test","",""
"","881","S.16 Регистрация с корректным email и слабым паролем и подтверждением пароля","tests.ui_tests","Tue Dec 02 04:11:48 UTC 2025","passed","Tue Dec 02 04:11:49 UTC 2025","TestSignupPage","signup_page_test","",""
"","2815","S.10 Регистрация с корректным email и подтверждением пароля и пустым паролем","tests.ui_tests","Tue Dec 02 04:11:32 UTC 2025","passed","Tue Dec 02 04:11:35 UTC 2025","TestSignupPage","signup_page_test","",""
"Пользователи добавляются по одному. Если пользователя не существует, он будет создан","4214","A.4 POST Пригласить пользователя по email","tests.api_tests","Tue Dec 02 03:50:44 UTC 2025","passed","Tue Dec 02 03:50:49 UTC 2025","TestAPI","api_test","",""
"","52","M.3 Проверка текста кнопки 'Войти' на лендинге","tests.ui_tests","Tue Dec 02 04:09:10 UTC 2025","passed","Tue Dec 02 04:09:10 UTC 2025","TestLendingPage","lending_test","",""
"","40","H.7 Проверка цвета шрифта кнопки 'Войти' в хедере https://app.pulsewave.ru/auth/password?email=","tests.ui_tests","Tue Dec 02 04:08:32 UTC 2025","passed","Tue Dec 02 04:08:32 UTC 2025","TestHeader","header_test","",""
"","3203","A.10 GET Информация о конкретном рабочем пространстве","tests.api_tests","Tue Dec 02 03:51:03 UTC 2025","passed","Tue Dec 02 03:51:06 UTC 2025","TestAPI","api_test","",""
"","112","F.3 Проверка элемента 'info@pulsewave.ru'в хедере","tests.ui_tests","Tue Dec 02 03:55:59 UTC 2025","passed","Tue Dec 02 03:55:59 UTC 2025","TestFooter","footer_test","",""
"","577","F.6 Проверка цвета шрифта надписи '© PulseWave, 2023-2025' в футере","tests.ui_tests","Tue Dec 02 04:03:02 UTC 2025","passed","Tue Dec 02 04:03:03 UTC 2025","TestFooter","footer_test","",""
"","48","F.6 Проверка цвета шрифта надписи '© PulseWave, 2023-2025' в футере","tests.ui_tests","Tue Dec 02 04:03:00 UTC 2025","passed","Tue Dec 02 04:03:00 UTC 2025","TestFooter","footer_test","",""
"","48","R.2 Проверка размера шрифта заголовка 'Восстановление пароля'","tests.ui_tests","Tue Dec 02 04:10:01 UTC 2025","passed","Tue Dec 02 04:10:01 UTC 2025","TestPasswordRecoveryPage","password_recovery_test","",""
"","871","S.7 Регистрация с некорректным email и сильным паролем и подтверждением пароля","tests.ui_tests","Tue Dec 02 04:11:07 UTC 2025","passed","Tue Dec 02 04:11:08 UTC 2025","TestSignupPage","signup_page_test","",""
"","40","H.8 Проверка шрифта кнопки 'Регистрация в хедере https://app.pulsewave.ru/auth/password?email='","tests.ui_tests","Tue Dec 02 04:08:57 UTC 2025","passed","Tue Dec 02 04:08:57 UTC 2025","TestHeader","header_test","",""
"","603","Проверка доступности https://app.dev.pulsewave.ru/","tests.api_tests","Tue Dec 02 03:52:25 UTC 2025","passed","Tue Dec 02 03:52:26 UTC 2025","TestAvailability","availability_test","",""
"","53","F.6 Проверка размера шрифта надписи '© PulseWave, 2023-2025' в футере","tests.ui_tests","Tue Dec 02 04:01:47 UTC 2025","passed","Tue Dec 02 04:01:47 UTC 2025","TestFooter","footer_test","",""
"","60","F.2 Проверка отсутствия ссылки на Лицензионное соглашение со страницы 'https://pulsewave.ru/","tests.ui_tests","Tue Dec 02 03:54:46 UTC 2025","passed","Tue Dec 02 03:54:46 UTC 2025","TestFooter","footer_test","",""
"","37","H.7 Проверка цвета шрифта кнопки 'Войти' в хедере https://app.pulsewave.ru/auth/signup","tests.ui_tests","Tue Dec 02 04:08:29 UTC 2025","passed","Tue Dec 02 04:08:29 UTC 2025","TestHeader","header_test","",""
"","74","F.4 Проверка года © PulseWave, 2025 в футере","tests.ui_tests","Tue Dec 02 03:57:07 UTC 2025","passed","Tue Dec 02 03:57:07 UTC 2025","TestFooter","footer_test","",""
"","2822","L.9 Авторизация с логином заглавными буквами","tests.ui_tests","Tue Dec 02 04:09:52 UTC 2025","passed","Tue Dec 02 04:09:55 UTC 2025","TestLoginPage","login_page_test","",""
"","814","W.12 Проверка прочтения уведомлений","tests.ui_tests","Tue Dec 02 04:12:52 UTC 2025","passed","Tue Dec 02 04:12:53 UTC 2025","TestWorkspacePage","workspace_page_test","",""
"","13","F.7 Проверка значка LinkedIn на странице 'https://pulsewave.ru/' в футере","tests.ui_tests","Tue Dec 02 04:05:18 UTC 2025","passed","Tue Dec 02 04:05:18 UTC 2025","TestFooter","footer_test","",""
"","43","H.4 Проверка текста кнопки 'Регистрация'","tests.ui_tests","Tue Dec 02 04:08:09 UTC 2025","passed","Tue Dec 02 04:08:09 UTC 2025","TestHeader","header_test","",""
"","50","F.5 Проверка размера шрифта надписи 'info@pulsewave.ru' в футере","tests.ui_tests","Tue Dec 02 03:58:19 UTC 2025","passed","Tue Dec 02 03:58:19 UTC 2025","TestFooter","footer_test","",""
"","46","F.6 Проверка шрифта надписи '© PulseWave, 2023-2025' в футере","tests.ui_tests","Tue Dec 02 04:04:08 UTC 2025","passed","Tue Dec 02 04:04:08 UTC 2025","TestFooter","footer_test","",""
"","574","L.6 Окно авторизации сообщение 'Забыли пароль?'","tests.ui_tests","Tue Dec 02 04:09:36 UTC 2025","passed","Tue Dec 02 04:09:36 UTC 2025","TestLoginPage","login_page_test","",""
"","119","W.13 Проверка видимости выпадающего меню Рабочие пространства","tests.ui_tests","Tue Dec 02 04:12:58 UTC 2025","passed","Tue Dec 02 04:12:58 UTC 2025","TestWorkspacePage","workspace_page_test","",""
