"Status","Start Time","Stop Time","Duration in ms","Parent Suite","Suite","Sub Suite","Test Class","Test Method","Name","Description"
"passed","Sat May 25 12:15:04 GMT 2024","Sat May 25 12:15:04 GMT 2024","37","tests.test_main_page","test_main_page","TestMainPage","","","Проверка цвета шрифта элемента 'Удобный и понятный интерфейс!' в футере",""
"passed","Sat May 25 12:12:04 GMT 2024","Sat May 25 12:12:04 GMT 2024","41","tests.test_header","test_header","TestHeader","","","Проверка текста кнопки 'Регистрация'",""
"passed","Sat May 25 12:07:34 GMT 2024","Sat May 25 12:07:47 GMT 2024","12287","tests.test_api","test_api","TestAPI","","","POST Сброс пароля",""
"passed","Sat May 25 12:16:04 GMT 2024","Sat May 25 12:16:04 GMT 2024","38","tests.test_main_page","test_main_page","TestMainPage","","","Проверка текста элемента 'Неограниченный функционал, понятный интерфейс и большое количество возможностей
помогут Вам улучшить рабочий процесс.'",""
"passed","Sat May 25 12:07:55 GMT 2024","Sat May 25 12:07:55 GMT 2024","661","tests.test_api","test_api","TestAPI","","","POST Регистрация пользователя без пароля",""
"passed","Sat May 25 12:09:36 GMT 2024","Sat May 25 12:09:36 GMT 2024","39","tests.test_footer","test_footer","TestFooter","","","Проверка года © PulseWave, 2024 в хедере",""
"passed","Sat May 25 12:09:26 GMT 2024","Sat May 25 12:09:26 GMT 2024","65","tests.test_footer","test_footer","TestFooter","","","Проверка элемента 'info@pulsewave.ru'в хедере",""
"passed","Sat May 25 12:02:08 GMT 2024","Sat May 25 12:02:11 GMT 2024","3458","tests.test_api","test_api","TestAPI","","","Проверка недействительности кеша рабочего пространства",""
"passed","Sat May 25 12:12:15 GMT 2024","Sat May 25 12:12:15 GMT 2024","63","tests.test_header","test_header","TestHeader","","","Проверка перехода на страницу 'https://pulsewave.ru/auth/login' по кнопке 'Войти'",""
"passed","Sat May 25 12:19:13 GMT 2024","Sat May 25 12:19:13 GMT 2024","2","tests.test_workspace_page","test_workspace_page","TestWorkspacePage","","","Проверка что авторизованный пользователь попадает в Рабочие пространства",""
"passed","Sat May 25 12:13:39 GMT 2024","Sat May 25 12:13:39 GMT 2024","36","tests.test_login_page","test_login_page","TestLoginPage","","","Проверка текста заголовка 'Войти'",""
"passed","Sat May 25 12:13:31 GMT 2024","Sat May 25 12:13:31 GMT 2024","37","tests.test_header","test_header","TestHeader","","","Проверка цвета кнопки 'Регистрация в хедере https://pulsewave.ru/'",""
"passed","Sat May 25 12:11:52 GMT 2024","Sat May 25 12:11:52 GMT 2024","62","tests.test_header","test_header","TestHeader","","","1.13 Проверка редиректа на главную страницу при клике на логотип",""
"passed","Sat May 25 12:07:17 GMT 2024","Sat May 25 12:07:30 GMT 2024","13348","tests.test_api","test_api","TestAPI","","","POST Запрос на смену почты",""
"passed","Sat May 25 12:10:23 GMT 2024","Sat May 25 12:10:23 GMT 2024","34","tests.test_footer","test_footer","TestFooter","","","Проверка размера шрифта надписи 'info@pulsewave.ru' в футере",""
"passed","Sat May 25 12:09:29 GMT 2024","Sat May 25 12:09:29 GMT 2024","66","tests.test_footer","test_footer","TestFooter","","","Проверка элемента 'info@pulsewave.ru'в хедере",""
"passed","Sat May 25 12:03:19 GMT 2024","Sat May 25 12:03:26 GMT 2024","6314","tests.test_api","test_api","TestAPI","","","POST Создать колонку на доске",""
"passed","Sat May 25 12:15:56 GMT 2024","Sat May 25 12:15:56 GMT 2024","40","tests.test_main_page","test_main_page","TestMainPage","","","Проверка текста элемента 'Удобный и понятный интерфейс!'",""
"passed","Sat May 25 12:16:01 GMT 2024","Sat May 25 12:16:01 GMT 2024","41","tests.test_main_page","test_main_page","TestMainPage","","","Проверка текста элемента 'Ваша безопасность и конфиденциальность для нас на первом месте!'",""
"passed","Sat May 25 12:09:59 GMT 2024","Sat May 25 12:09:59 GMT 2024","36","tests.test_footer","test_footer","TestFooter","","","Проверка цвета шрифта ссылки 'Условия пользования' в футере",""
"skipped","Sat May 25 12:06:36 GMT 2024","Sat May 25 12:06:46 GMT 2024","9818","tests.test_api","test_api","TestAPI","","","PATCH Частично обновить стикер {'color': '#5ED8FF'}",""
"passed","Sat May 25 12:15:42 GMT 2024","Sat May 25 12:15:42 GMT 2024","34","tests.test_main_page","test_main_page","TestMainPage","","","Проверка размера шрифта элемента 'Одно приложениe для решения всех Ваших задач!' в футере",""
"passed","Sat May 25 12:10:02 GMT 2024","Sat May 25 12:10:02 GMT 2024","35","tests.test_footer","test_footer","TestFooter","","","Проверка цвета шрифта ссылки 'Условия пользования' в футере",""
"passed","Sat May 25 12:01:47 GMT 2024","Sat May 25 12:01:51 GMT 2024","3381","tests.test_api","test_api","TestAPI","","","POST Активация пользователя с корректными данными",""
"passed","Sat May 25 12:17:45 GMT 2024","Sat May 25 12:17:45 GMT 2024","37","tests.test_signup_page","test_signup_page","TestSignupPage","","","1.16 Проверка текста заголовка 'Регистрация'",""
"passed","Sat May 25 12:15:21 GMT 2024","Sat May 25 12:15:21 GMT 2024","39","tests.test_main_page","test_main_page","TestMainPage","","","Проверка цвета шрифта элемента 'Самый высокий уровень бесперебойной работы!' в футере",""
"passed","Sat May 25 12:10:29 GMT 2024","Sat May 25 12:10:29 GMT 2024","34","tests.test_footer","test_footer","TestFooter","","","Проверка цвета шрифта надписи 'info@pulsewave.ru' в футере",""
"passed","Sat May 25 12:02:56 GMT 2024","Sat May 25 12:03:02 GMT 2024","5850","tests.test_api","test_api","TestAPI","","","GET Информация о конкретной доске",""
"passed","Sat May 25 12:14:38 GMT 2024","Sat May 25 12:14:38 GMT 2024","36","tests.test_main_page","test_main_page","TestMainPage","","","Проверка шрифта элемента 'PULSEWAVE'",""
"passed","Sat May 25 12:14:36 GMT 2024","Sat May 25 12:14:36 GMT 2024","35","tests.test_main_page","test_main_page","TestMainPage","","","Проверка цвета шрифта элемента 'PULSEWAVE'",""
"passed","Sat May 25 12:10:07 GMT 2024","Sat May 25 12:10:07 GMT 2024","35","tests.test_footer","test_footer","TestFooter","","","Проверка шрифта ссылки 'Условия пользования' в футере",""
"passed","Sat May 25 12:16:09 GMT 2024","Sat May 25 12:16:09 GMT 2024","37","tests.test_password_recovery","test_password_recovery","TestPasswordRecoveryPage","","","Проверка текста заголовка 'Восстановление пароля'",""
"passed","Sat May 25 12:18:42 GMT 2024","Sat May 25 12:18:42 GMT 2024","97","tests.test_signup_page","test_signup_page","TestSignupPage","","","1.29 Окно регистрации сообщение 'Регистрируясь, я соглашаюсь с Условиями пользования и Политикой конфиденциальности' проверка корректности перехода по ссылке 'Политикой конфиденциальности'",""
"passed","Sat May 25 12:10:55 GMT 2024","Sat May 25 12:10:55 GMT 2024","34","tests.test_footer","test_footer","TestFooter","","","Проверка шрифта надписи 'info@pulsewave.ru' в футере",""
"passed","Sat May 25 12:14:54 GMT 2024","Sat May 25 12:14:54 GMT 2024","35","tests.test_main_page","test_main_page","TestMainPage","","","Проверка цвета шрифта кнопки 'Зарегистрироваться'",""
"passed","Sat May 25 12:18:04 GMT 2024","Sat May 25 12:18:20 GMT 2024","16484","tests.test_signup_page","test_signup_page","TestSignupPage","","","1.23 Регистрация с корректными email и паролем без согласия на подписку",""
"passed","Sat May 25 12:09:49 GMT 2024","Sat May 25 12:09:49 GMT 2024","35","tests.test_footer","test_footer","TestFooter","","","Проверка размера шрифта ссылки 'Условия пользования' в футере",""
"passed","Sat May 25 12:15:02 GMT 2024","Sat May 25 12:15:02 GMT 2024","37","tests.test_main_page","test_main_page","TestMainPage","","","Проверка размера шрифта элемента 'Удобный и понятный интерфейс!' в футере",""
"passed","Sat May 25 12:08:44 GMT 2024","Sat May 25 12:08:47 GMT 2024","2697","tests.test_footer","test_footer","TestFooter","","","Проверка попапа о принятии файлов cookie на странице https://pulsewave.ru/auth/login",""
"passed","Sat May 25 12:18:37 GMT 2024","Sat May 25 12:18:37 GMT 2024","55","tests.test_signup_page","test_signup_page","TestSignupPage","","","1.27 Окно регистрации сообщение 'Я согласен получать новости и обновления PulseWave'",""
"passed","Sat May 25 12:17:58 GMT 2024","Sat May 25 12:17:58 GMT 2024","305","tests.test_signup_page","test_signup_page","TestSignupPage","","","1.21, 1.22 Регистрация с некорректным email и сильным паролем и подтверждением пароля",""
"passed","Sat May 25 12:04:53 GMT 2024","Sat May 25 12:05:01 GMT 2024","8158","tests.test_api","test_api","TestAPI","","","DELETE Удалить колонку",""
"passed","Sat May 25 12:03:08 GMT 2024","Sat May 25 12:03:14 GMT 2024","5711","tests.test_api","test_api","TestAPI","","","PATCH Частично обновить доску",""
"passed","Sat May 25 12:11:25 GMT 2024","Sat May 25 12:11:25 GMT 2024","36","tests.test_footer","test_footer","TestFooter","","","Проверка цвета шрифта надписи '© PulseWave, 2023-2024' в футере",""
"passed","Sat May 25 12:12:33 GMT 2024","Sat May 25 12:12:33 GMT 2024","34","tests.test_header","test_header","TestHeader","","","Проверка размера шрифта кнопки 'Войти' в хедере https://pulsewave.ru/auth/password?email=",""
"passed","Sat May 25 12:13:23 GMT 2024","Sat May 25 12:13:23 GMT 2024","36","tests.test_header","test_header","TestHeader","","","Проверка шрифта кнопки 'Регистрация в хедере https://pulsewave.ru/'",""
"passed","Sat May 25 12:09:16 GMT 2024","Sat May 25 12:09:16 GMT 2024","149","tests.test_footer","test_footer","TestFooter","","","Проверка перехода на страницу c лицензионным соглашением со страницы 'https://pulsewave.ru/auth/password?email=",""
"broken","Sat May 25 12:19:18 GMT 2024","Sat May 25 12:19:18 GMT 2024","28","tests.test_workspace_page","test_workspace_page","TestWorkspacePage","","","Проверка что авторизованный пользователь может выйти из аккаунта",""
"passed","Sat May 25 12:13:11 GMT 2024","Sat May 25 12:13:11 GMT 2024","33","tests.test_header","test_header","TestHeader","","","Проверка размера шрифта кнопки 'Регистрация в хедере https://pulsewave.ru/auth/login'",""
"skipped","Sat May 25 12:05:58 GMT 2024","Sat May 25 12:06:07 GMT 2024","9678","tests.test_api","test_api","TestAPI","","","POST Создать стикер к задаче",""
"passed","Sat May 25 12:12:56 GMT 2024","Sat May 25 12:12:56 GMT 2024","35","tests.test_header","test_header","TestHeader","","","Проверка цвета кнопки 'Войти' в хедере https://pulsewave.ru/auth/password?email=",""
"passed","Sat May 25 12:03:39 GMT 2024","Sat May 25 12:03:48 GMT 2024","8819","tests.test_api","test_api","TestAPI","","","PUT Обновить колонку (название и порядковый номер)",""
"passed","Sat May 25 12:03:02 GMT 2024","Sat May 25 12:03:08 GMT 2024","6384","tests.test_api","test_api","TestAPI","","","PUT Обновить доску",""
"passed","Sat May 25 12:16:17 GMT 2024","Sat May 25 12:16:17 GMT 2024","33","tests.test_password_recovery","test_password_recovery","TestPasswordRecoveryPage","","","Проверка шрифта заголовка 'Восстановление пароля'",""
"passed","Sat May 25 12:19:05 GMT 2024","Sat May 25 12:19:05 GMT 2024","3","tests.test_workspace_page","test_workspace_page","TestWorkspacePage","","","Проверка заголовка рабочего пространства",""
"passed","Sat May 25 12:15:37 GMT 2024","Sat May 25 12:15:37 GMT 2024","35","tests.test_main_page","test_main_page","TestMainPage","","","Проверка цвета шрифта элемента 'Неограниченный функционал, понятный интерфейс и большое количество возможностей
помогут Вам улучшить рабочий процесс.' в футере",""
"passed","Sat May 25 12:07:00 GMT 2024","Sat May 25 12:07:02 GMT 2024","2036","tests.test_api","test_api","TestAPI","","","GET Получить данные авторизованного пользователя",""
"passed","Sat May 25 12:15:32 GMT 2024","Sat May 25 12:15:32 GMT 2024","37","tests.test_main_page","test_main_page","TestMainPage","","","Проверка шрифта элемента 'Ваша безопасность и конфиденциальность для нас на первом месте!' в футере",""
"passed","Sat May 25 12:14:26 GMT 2024","Sat May 25 12:14:28 GMT 2024","2198","tests.test_login_page","test_login_page","TestLoginPage","","","Авторизация с пустым паролем",""
"passed","Sat May 25 12:13:57 GMT 2024","Sat May 25 12:13:59 GMT 2024","2284","tests.test_login_page","test_login_page","TestLoginPage","","","Авторизация с некорректным паролем",""
"passed","Sat May 25 12:17:08 GMT 2024","Sat May 25 12:17:09 GMT 2024","675","tests.test_password_recovery","test_password_recovery","TestPasswordRecoveryPage","","","3.3 Восстановить пароль на некорректный емайл",""
"passed","Sat May 25 12:13:45 GMT 2024","Sat May 25 12:13:45 GMT 2024","34","tests.test_login_page","test_login_page","TestLoginPage","","","Проверка цвета шрифта заголовка 'Войти'",""
"passed","Sat May 25 12:05:09 GMT 2024","Sat May 25 12:05:11 GMT 2024","2031","tests.test_api","test_api","TestAPI","","","GET Список уведомлений текущего пользователя",""
"passed","Sat May 25 12:09:24 GMT 2024","Sat May 25 12:09:24 GMT 2024","65","tests.test_footer","test_footer","TestFooter","","","Проверка элемента 'info@pulsewave.ru'в хедере",""
"passed","Sat May 25 12:09:57 GMT 2024","Sat May 25 12:09:57 GMT 2024","34","tests.test_footer","test_footer","TestFooter","","","Проверка цвета шрифта ссылки 'Условия пользования' в футере",""
"passed","Sat May 25 12:15:40 GMT 2024","Sat May 25 12:15:40 GMT 2024","33","tests.test_main_page","test_main_page","TestMainPage","","","Проверка шрифта элемента 'Неограниченный функционал, понятный интерфейс и большое количество возможностей
помогут Вам улучшить рабочий процесс.' в футере",""
"passed","Sat May 25 12:16:07 GMT 2024","Sat May 25 12:16:07 GMT 2024","39","tests.test_main_page","test_main_page","TestMainPage","","","Проверка текста элемента 'Одно приложениe для решения всех Ваших задач!'",""
"passed","Sat May 25 12:02:52 GMT 2024","Sat May 25 12:02:56 GMT 2024","3782","tests.test_api","test_api","TestAPI","","","POST Создать доску",""
"passed","Sat May 25 12:12:20 GMT 2024","Sat May 25 12:12:20 GMT 2024","68","tests.test_header","test_header","TestHeader","","","1.2 Проверка перехода на страницу 'https://pulsewave.ru/auth/signup' по кнопке 'Регистрация'",""
"passed","Sat May 25 12:17:42 GMT 2024","Sat May 25 12:17:43 GMT 2024","816","tests.test_signup_page","test_signup_page","TestSignupPage","","","1.11 Регистрация с уже зарегистрированным email и корректными паролем и подтверждением пароля",""
"passed","Sat May 25 12:13:16 GMT 2024","Sat May 25 12:13:16 GMT 2024","36","tests.test_header","test_header","TestHeader","","","Проверка цвета шрифта кнопки 'Регистрация в хедере https://pulsewave.ru/'",""
"passed","Sat May 25 12:18:45 GMT 2024","Sat May 25 12:18:45 GMT 2024","111","tests.test_signup_page","test_signup_page","TestSignupPage","","","1.30 Окно регистрации сообщение 'Регистрируясь, я соглашаюсь с Условиями пользования и Политикой конфиденциальности', проверка корректности перехода по ссылке 'Условиями пользования'",""
"passed","Sat May 25 12:15:35 GMT 2024","Sat May 25 12:15:35 GMT 2024","34","tests.test_main_page","test_main_page","TestMainPage","","","Проверка размера шрифта элемента 'Неограниченный функционал, понятный интерфейс и большое количество возможностей
помогут Вам улучшить рабочий процесс.' в футере",""
"passed","Sat May 25 12:13:21 GMT 2024","Sat May 25 12:13:21 GMT 2024","35","tests.test_header","test_header","TestHeader","","","Проверка цвета шрифта кнопки 'Регистрация в хедере https://pulsewave.ru/auth/password?email='",""
"passed","Sat May 25 12:05:07 GMT 2024","Sat May 25 12:05:09 GMT 2024","1871","tests.test_api","test_api","TestAPI","","","POST Создать Рабочее пространство",""
"passed","Sat May 25 12:18:53 GMT 2024","Sat May 25 12:18:54 GMT 2024","325","tests.test_signup_page","test_signup_page","TestSignupPage","","","1.31- 1.34 Регистрация с корректным email и слабым паролем и подтверждением пароля",""
"passed","Sat May 25 12:15:24 GMT 2024","Sat May 25 12:15:24 GMT 2024","37","tests.test_main_page","test_main_page","TestMainPage","","","Проверка шрифта элемента 'Самый высокий уровень бесперебойной работы!' в футере",""
"passed","Sat May 25 12:08:32 GMT 2024","Sat May 25 12:08:44 GMT 2024","12542","tests.test_footer","test_footer","TestFooter","","","Проверка попапа о принятии файлов cookie на странице https://pulsewave.ru/",""
"passed","Sat May 25 12:14:18 GMT 2024","Sat May 25 12:14:19 GMT 2024","735","tests.test_login_page","test_login_page","TestLoginPage","","","Авторизация с некорректным емайл",""
"skipped","Sat May 25 12:06:07 GMT 2024","Sat May 25 12:06:17 GMT 2024","9645","tests.test_api","test_api","TestAPI","","","GET Представление одного стикера",""
"passed","Sat May 25 12:02:28 GMT 2024","Sat May 25 12:02:32 GMT 2024","3914","tests.test_api","test_api","TestAPI","","","DELETE Частично обновить данные РП (на данный момент только имя)",""
"passed","Sat May 25 12:12:28 GMT 2024","Sat May 25 12:12:28 GMT 2024","36","tests.test_header","test_header","TestHeader","","","Проверка размера шрифта кнопки 'Войти' в хедере https://pulsewave.ru/",""
"passed","Sat May 25 12:03:26 GMT 2024","Sat May 25 12:03:31 GMT 2024","5577","tests.test_api","test_api","TestAPI","","","GET Список всех колонок доски",""
"passed","Sat May 25 12:14:02 GMT 2024","Sat May 25 12:14:02 GMT 2024","48","tests.test_login_page","test_login_page","TestLoginPage","","","Окно авторизации сообщение 'Забыли пароль?'",""
"passed","Sat May 25 12:05:13 GMT 2024","Sat May 25 12:05:16 GMT 2024","2358","tests.test_api","test_api","TestAPI","","","PUT Отметить прочтение уведомления",""
"passed","Sat May 25 12:11:49 GMT 2024","Sat May 25 12:11:49 GMT 2024","61","tests.test_header","test_header","TestHeader","","","1.13 Проверка редиректа на главную страницу при клике на логотип",""
"passed","Sat May 25 12:12:48 GMT 2024","Sat May 25 12:12:48 GMT 2024","34","tests.test_header","test_header","TestHeader","","","Проверка шрифта кнопки 'Войти' в хедере https://pulsewave.ru/auth/password?email=",""
"passed","Sat May 25 12:12:07 GMT 2024","Sat May 25 12:12:07 GMT 2024","38","tests.test_header","test_header","TestHeader","","","Проверка текста кнопки 'Регистрация'",""
"passed","Sat May 25 12:11:30 GMT 2024","Sat May 25 12:11:30 GMT 2024","35","tests.test_footer","test_footer","TestFooter","","","Проверка цвета шрифта надписи '© PulseWave, 2023-2024' в футере",""
"passed","Sat May 25 12:02:13 GMT 2024","Sat May 25 12:02:16 GMT 2024","2138","tests.test_api","test_api","TestAPI","","","GET Получить список всех Рабочих пространств авторизованного пользователя",""
"passed","Sat May 25 12:14:51 GMT 2024","Sat May 25 12:14:51 GMT 2024","33","tests.test_main_page","test_main_page","TestMainPage","","","Проверка размера шрифта кнопки 'Зарегистрироваться'",""
"passed","Sat May 25 12:08:47 GMT 2024","Sat May 25 12:08:50 GMT 2024","2369","tests.test_footer","test_footer","TestFooter","","","Проверка попапа о принятии файлов cookie на странице https://pulsewave.ru/auth/signup",""
"passed","Sat May 25 12:15:07 GMT 2024","Sat May 25 12:15:07 GMT 2024","38","tests.test_main_page","test_main_page","TestMainPage","","","Проверка шрифта элемента 'Удобный и понятный интерфейс!' в футере",""
"passed","Sat May 25 12:10:20 GMT 2024","Sat May 25 12:10:20 GMT 2024","34","tests.test_footer","test_footer","TestFooter","","","Проверка размера шрифта надписи 'info@pulsewave.ru' в футере",""
"passed","Sat May 25 12:04:03 GMT 2024","Sat May 25 12:04:11 GMT 2024","7958","tests.test_api","test_api","TestAPI","","","GET Список всех задач колонки",""
"passed","Sat May 25 12:10:26 GMT 2024","Sat May 25 12:10:26 GMT 2024","35","tests.test_footer","test_footer","TestFooter","","","Проверка цвета шрифта надписи 'info@pulsewave.ru' в футере",""
"passed","Sat May 25 12:05:27 GMT 2024","Sat May 25 12:05:38 GMT 2024","10237","tests.test_api","test_api","TestAPI","","","DELETE Удалить комментарий",""
"passed","Sat May 25 12:10:17 GMT 2024","Sat May 25 12:10:17 GMT 2024","37","tests.test_footer","test_footer","TestFooter","","","Проверка размера шрифта надписи 'info@pulsewave.ru' в футере",""
"passed","Sat May 25 12:15:19 GMT 2024","Sat May 25 12:15:19 GMT 2024","35","tests.test_main_page","test_main_page","TestMainPage","","","Проверка размера шрифта элемента 'Самый высокий уровень бесперебойной работы!' в футере",""
"passed","Sat May 25 12:07:15 GMT 2024","Sat May 25 12:07:17 GMT 2024","1724","tests.test_api","test_api","TestAPI","","","PUT Обновить все данные авторизованного пользователя me",""
"passed","Sat May 25 12:07:52 GMT 2024","Sat May 25 12:07:54 GMT 2024","2693","tests.test_api","test_api","TestAPI","","","DELETE Удалить авторизованного пользователя",""
"passed","Sat May 25 12:18:40 GMT 2024","Sat May 25 12:18:40 GMT 2024","55","tests.test_signup_page","test_signup_page","TestSignupPage","","","1.28 Окно регистрации сообщение 'Регистрируясь, я соглашаюсь с Условиями пользования и Политикой конфиденциальности'",""
"passed","Sat May 25 12:12:10 GMT 2024","Sat May 25 12:12:10 GMT 2024","39","tests.test_header","test_header","TestHeader","","","Проверка текста кнопки 'Регистрация'",""
"passed","Sat May 25 12:19:27 GMT 2024","Sat May 25 12:19:27 GMT 2024","34","tests.test_workspace_page","test_workspace_page","TestWorkspacePage","","","Проверка видимости заголовка 'Ваши рабочие пространства'",""
