"Status","Start Time","Stop Time","Duration in ms","Parent Suite","Suite","Sub Suite","Test Class","Test Method","Name","Description"
"passed","Fri Aug 29 03:48:48 GMT 2025","Fri Aug 29 03:48:50 GMT 2025","1858","tests.ui_tests","login_page_test","TestLoginPage","","","L.5 Авторизация с некорректным паролем",""
"skipped","Fri Aug 29 03:51:46 GMT 2025","Fri Aug 29 03:51:46 GMT 2025","0","tests.ui_tests","signup_page_test","TestSignupPage","","","S.15 Окно регистрации сообщение 'Регистрируясь, я соглашаюсь с Условиями пользования и Политикой конфиденциальности', проверка корректности перехода по ссылке 'Условиями пользования'",""
"passed","Fri Aug 29 03:33:37 GMT 2025","Fri Aug 29 03:33:44 GMT 2025","6465","tests.api_tests","api_test","TestAPI","","","A.24 POST Установить новый пароль. Используется в личном кабинете после авторизации.",""
"passed","Fri Aug 29 03:50:50 GMT 2025","Fri Aug 29 03:50:50 GMT 2025","558","tests.ui_tests","signup_page_test","TestSignupPage","","","S.5 Проверка цвета шрифта заголовка 'Регистрация'",""
"passed","Fri Aug 29 03:42:23 GMT 2025","Fri Aug 29 03:42:24 GMT 2025","556","tests.ui_tests","header_test","TestHeader","","","H.3 Проверка текста кнопки 'Войти'",""
"passed","Fri Aug 29 03:51:11 GMT 2025","Fri Aug 29 03:51:22 GMT 2025","11195","tests.ui_tests","signup_page_test","TestSignupPage","","","S.8 Регистрация с корректными email и паролем без согласия на подписку",""
"passed","Fri Aug 29 03:50:36 GMT 2025","Fri Aug 29 03:50:38 GMT 2025","1847","tests.ui_tests","signup_page_test","TestSignupPage","","","S.3 Регистрация с уже зарегистрированным email и корректными паролем и подтверждением пароля",""
"passed","Fri Aug 29 03:33:46 GMT 2025","Fri Aug 29 03:33:46 GMT 2025","772","tests.api_tests","api_test","TestAPI","","","A.26 POST Регистрация пользователя без электронной почты",""
"passed","Fri Aug 29 03:41:07 GMT 2025","Fri Aug 29 03:41:07 GMT 2025","40","tests.ui_tests","footer_test","TestFooter","","","F.6 Проверка шрифта надписи '© PulseWave, 2023-2025' в футере",""
"passed","Fri Aug 29 03:38:59 GMT 2025","Fri Aug 29 03:38:59 GMT 2025","39","tests.ui_tests","footer_test","TestFooter","","","F.2 Проверка отсутствия ссылки на Лицензионное соглашение со страницы 'https://app.pulsewave.ru/auth/login",""
"passed","Fri Aug 29 03:39:25 GMT 2025","Fri Aug 29 03:39:25 GMT 2025","65","tests.ui_tests","footer_test","TestFooter","","","F.4 Проверка года © PulseWave, 2025 в футере",""
"passed","Fri Aug 29 03:52:06 GMT 2025","Fri Aug 29 03:52:06 GMT 2025","3","tests.ui_tests","workspace_page_test","TestWorkspacePage","","","W.1 Проверка перехода в рабочее пространство авторизованного пользователя",""
"skipped","Fri Aug 29 03:51:46 GMT 2025","Fri Aug 29 03:51:46 GMT 2025","0","tests.ui_tests","signup_page_test","TestSignupPage","","","S.14 Окно регистрации сообщение 'Регистрируясь, я соглашаюсь с Условиями пользования и Политикой конфиденциальности' проверка корректности перехода по ссылке 'Политикой конфиденциальности'",""
"skipped","Fri Aug 29 03:43:40 GMT 2025","Fri Aug 29 03:44:40 GMT 2025","60352","tests.ui_tests","header_test","TestHeader","","","H.8 Проверка размера шрифта кнопки 'Регистрация в хедере https://app.pulsewave.ru/auth/login'",""
"passed","Fri Aug 29 03:41:02 GMT 2025","Fri Aug 29 03:41:02 GMT 2025","48","tests.ui_tests","footer_test","TestFooter","","","F.6 Проверка шрифта надписи '© PulseWave, 2023-2025' в футере",""
"passed","Fri Aug 29 03:39:41 GMT 2025","Fri Aug 29 03:39:41 GMT 2025","58","tests.ui_tests","footer_test","TestFooter","","","F.5 Проверка размера шрифта надписи 'info@pulsewave.ru' в футере",""
"passed","Fri Aug 29 03:51:59 GMT 2025","Fri Aug 29 03:51:59 GMT 2025","825","tests.ui_tests","signup_page_test","TestSignupPage","","","S.16 Регистрация с корректным email и слабым паролем и подтверждением пароля",""
"passed","Fri Aug 29 03:48:32 GMT 2025","Fri Aug 29 03:48:32 GMT 2025","39","tests.ui_tests","login_page_test","TestLoginPage","","","L.2 Проверка шрифта заголовка 'Войти'",""
"passed","Fri Aug 29 03:34:29 GMT 2025","Fri Aug 29 03:34:30 GMT 2025","786","tests.api_tests","api_test","TestAPI","","","A.30 POST Создать пользователя с некорректными данными",""
"passed","Fri Aug 29 03:49:38 GMT 2025","Fri Aug 29 03:49:38 GMT 2025","43","tests.ui_tests","password_recovery_test","TestPasswordRecoveryPage","","","R.2 Проверка цвета шрифта заголовка 'Восстановление пароля'",""
"passed","Fri Aug 29 03:40:16 GMT 2025","Fri Aug 29 03:40:16 GMT 2025","44","tests.ui_tests","footer_test","TestFooter","","","F.5 Проверка шрифта надписи 'info@pulsewave.ru' в футере",""
"passed","Fri Aug 29 03:32:36 GMT 2025","Fri Aug 29 03:32:43 GMT 2025","6963","tests.api_tests","api_test","TestAPI","","","A.5 POST Повторная отправка ссылки с приглашением пользователя",""
"passed","Fri Aug 29 03:42:28 GMT 2025","Fri Aug 29 03:42:28 GMT 2025","45","tests.ui_tests","header_test","TestHeader","","","H.3 Проверка текста кнопки 'Войти'",""
"passed","Fri Aug 29 03:32:23 GMT 2025","Fri Aug 29 03:32:24 GMT 2025","1155","tests.api_tests","api_test","TestAPI","","","A.1 GET Проверка доступности API",""
"passed","Fri Aug 29 03:33:47 GMT 2025","Fri Aug 29 03:33:48 GMT 2025","1027","tests.api_tests","api_test","TestAPI","","","A.28 POST Регистрация пользователя без подтверждения подписки",""
"passed","Fri Aug 29 03:48:23 GMT 2025","Fri Aug 29 03:48:23 GMT 2025","43","tests.ui_tests","login_page_test","TestLoginPage","","","L.2 Проверка размера шрифта заголовка 'Войти'",""
"passed","Fri Aug 29 03:43:21 GMT 2025","Fri Aug 29 03:43:22 GMT 2025","552","tests.ui_tests","header_test","TestHeader","","","H.7 Проверка шрифта кнопки 'Войти' в хедере https://app.pulsewave.ru/auth/signup",""
"passed","Fri Aug 29 03:33:10 GMT 2025","Fri Aug 29 03:33:12 GMT 2025","1929","tests.api_tests","api_test","TestAPI","","","A.14 POST Создать доску без указания РП","Создание доски без указания РП, будет создано дефолтное РП для этой доски"
"passed","Fri Aug 29 03:39:14 GMT 2025","Fri Aug 29 03:39:14 GMT 2025","85","tests.ui_tests","footer_test","TestFooter","","","F.3 Проверка элемента 'info@pulsewave.ru'в хедере",""
"passed","Fri Aug 29 03:43:18 GMT 2025","Fri Aug 29 03:43:18 GMT 2025","41","tests.ui_tests","header_test","TestHeader","","","H.7 Проверка цвета шрифта кнопки 'Войти' в хедере https://app.pulsewave.ru/auth/password?email=",""
"passed","Fri Aug 29 03:42:37 GMT 2025","Fri Aug 29 03:42:37 GMT 2025","45","tests.ui_tests","header_test","TestHeader","","","H.4 Проверка текста кнопки 'Регистрация'",""
"passed","Fri Aug 29 03:48:20 GMT 2025","Fri Aug 29 03:48:20 GMT 2025","42","tests.ui_tests","login_page_test","TestLoginPage","","","L.1 Проверка текста заголовка 'Войти'",""
"passed","Fri Aug 29 03:37:47 GMT 2025","Fri Aug 29 03:38:51 GMT 2025","64413","tests.ui_tests","footer_test","TestFooter","","","F.1 Проверка попапа о принятии файлов cookie на странице https://app.pulsewave.ru/auth/password?email=",""
"skipped","Fri Aug 29 03:48:11 GMT 2025","Fri Aug 29 03:48:11 GMT 2025","44","tests.ui_tests","header_test","TestHeader","","","H.8 Проверка цвета кнопки 'Регистрация в хедере https://app.pulsewave.ru/auth/password?email='",""
"passed","Fri Aug 29 03:51:03 GMT 2025","Fri Aug 29 03:51:04 GMT 2025","330","tests.ui_tests","signup_page_test","TestSignupPage","","","S.7 Регистрация с некорректным email и сильным паролем и подтверждением пароля",""
"passed","Fri Aug 29 03:40:09 GMT 2025","Fri Aug 29 03:40:09 GMT 2025","44","tests.ui_tests","footer_test","TestFooter","","","F.5 Проверка цвета шрифта надписи 'info@pulsewave.ru' в футере",""
"passed","Fri Aug 29 03:39:22 GMT 2025","Fri Aug 29 03:39:22 GMT 2025","81","tests.ui_tests","footer_test","TestFooter","","","F.3 Проверка элемента 'info@pulsewave.ru'в хедере",""
"passed","Fri Aug 29 03:41:17 GMT 2025","Fri Aug 29 03:41:17 GMT 2025","9","tests.ui_tests","footer_test","TestFooter","","","F.7 Проверка значка LinkedIn на странице 'https://app.pulsewave.ru/auth/login' в футере",""
"passed","Fri Aug 29 03:44:45 GMT 2025","Fri Aug 29 03:44:45 GMT 2025","41","tests.ui_tests","header_test","TestHeader","","","H.8 Проверка размера шрифта кнопки 'Регистрация в хедере https://app.pulsewave.ru/auth/password?email='",""
"passed","Fri Aug 29 03:48:27 GMT 2025","Fri Aug 29 03:48:27 GMT 2025","40","tests.ui_tests","login_page_test","TestLoginPage","","","L.2 Проверка цвета шрифта заголовка 'Войти'",""
"skipped","Fri Aug 29 03:44:49 GMT 2025","Fri Aug 29 03:45:49 GMT 2025","60349","tests.ui_tests","header_test","TestHeader","","","H.8 Проверка цвета шрифта кнопки 'Регистрация в хедере https://app.pulsewave.ru/auth/login'",""
"passed","Fri Aug 29 03:43:05 GMT 2025","Fri Aug 29 03:43:05 GMT 2025","42","tests.ui_tests","header_test","TestHeader","","","H.7 Проверка размера шрифта кнопки 'Войти' в хедере https://app.pulsewave.ru/auth/signup",""
"passed","Fri Aug 29 03:41:56 GMT 2025","Fri Aug 29 03:41:56 GMT 2025","64","tests.ui_tests","footer_test","TestFooter","","","F.9 Проверка перехода в LinkedIn на странице 'https://app.pulsewave.ru/auth/password?email=' в футере",""
"passed","Fri Aug 29 03:47:02 GMT 2025","Fri Aug 29 03:47:02 GMT 2025","41","tests.ui_tests","header_test","TestHeader","","","H.8 Проверка шрифта кнопки 'Регистрация в хедере https://app.pulsewave.ru/auth/password?email='",""
"passed","Fri Aug 29 03:33:32 GMT 2025","Fri Aug 29 03:33:37 GMT 2025","5135","tests.api_tests","api_test","TestAPI","","","A.23 POST Подтверждение сброса пароля. Когда пользователь переходит по ссылке     auth/password/reset/confirm/{uid}/{token}",""
"passed","Fri Aug 29 03:50:58 GMT 2025","Fri Aug 29 03:50:59 GMT 2025","834","tests.ui_tests","signup_page_test","TestSignupPage","","","S.6 Окно регистрации сообщение 'Слабый пароль. Пароль должен содержать минимум 8 символов, включая буквы и цифры'",""
"passed","Fri Aug 29 03:32:48 GMT 2025","Fri Aug 29 03:32:50 GMT 2025","2442","tests.api_tests","api_test","TestAPI","","","A.9 GET Получить список всех Рабочих пространств авторизованного пользователя",""
"passed","Fri Aug 29 03:43:13 GMT 2025","Fri Aug 29 03:43:14 GMT 2025","43","tests.ui_tests","header_test","TestHeader","","","H.7 Проверка цвета шрифта кнопки 'Войти' в хедере https://app.pulsewave.ru/auth/signup",""
"passed","Fri Aug 29 03:50:14 GMT 2025","Fri Aug 29 03:50:15 GMT 2025","1255","tests.ui_tests","password_recovery_test","TestPasswordRecoveryPage","","","R.6 Восстановить пароль на некорректный емайл",""
"passed","Fri Aug 29 03:41:47 GMT 2025","Fri Aug 29 03:41:47 GMT 2025","65","tests.ui_tests","footer_test","TestFooter","","","F.9 Проверка перехода в LinkedIn на странице 'https://app.pulsewave.ru/auth/login' в футере",""
"passed","Fri Aug 29 03:40:35 GMT 2025","Fri Aug 29 03:40:35 GMT 2025","39","tests.ui_tests","footer_test","TestFooter","","","F.6 Проверка размера шрифта надписи '© PulseWave, 2023-2025' в футере",""
"passed","Fri Aug 29 03:53:16 GMT 2025","Fri Aug 29 03:53:17 GMT 2025","659","tests.ui_tests","workspace_page_test","TestWorkspacePage","","","W.10 Проверка цвета переключателя 'Непрочитанные'",""
"passed","Fri Aug 29 03:53:23 GMT 2025","Fri Aug 29 03:53:24 GMT 2025","1141","tests.ui_tests","workspace_page_test","TestWorkspacePage","","","W.11 Проверка видимости уведомлений",""
"passed","Fri Aug 29 03:42:51 GMT 2025","Fri Aug 29 03:42:51 GMT 2025","609","tests.ui_tests","header_test","TestHeader","","","H.5 Проверка перехода на страницу 'https://app.pulsewave.ru/auth/login' по кнопке 'Войти'",""
"passed","Fri Aug 29 03:50:55 GMT 2025","Fri Aug 29 03:50:55 GMT 2025","38","tests.ui_tests","signup_page_test","TestSignupPage","","","S.5 Проверка шрифта заголовка 'Регистрация'",""
"passed","Fri Aug 29 03:42:45 GMT 2025","Fri Aug 29 03:42:46 GMT 2025","1111","tests.ui_tests","header_test","TestHeader","","","H.5 Проверка перехода на страницу 'https://app.pulsewave.ru/auth/login' по кнопке 'Войти'",""
"passed","Fri Aug 29 03:49:47 GMT 2025","Fri Aug 29 03:49:49 GMT 2025","2077","tests.ui_tests","password_recovery_test","TestPasswordRecoveryPage","","","R.3  Проверка некликабельности кнопки 'Продолжить'",""
"passed","Fri Aug 29 03:43:26 GMT 2025","Fri Aug 29 03:43:26 GMT 2025","41","tests.ui_tests","header_test","TestHeader","","","H.7 Проверка шрифта кнопки 'Войти' в хедере https://app.pulsewave.ru/auth/password?email=",""
"passed","Fri Aug 29 03:49:42 GMT 2025","Fri Aug 29 03:49:42 GMT 2025","40","tests.ui_tests","password_recovery_test","TestPasswordRecoveryPage","","","R.2 Проверка шрифта заголовка 'Восстановление пароля'",""
"passed","Fri Aug 29 03:41:11 GMT 2025","Fri Aug 29 03:41:11 GMT 2025","38","tests.ui_tests","footer_test","TestFooter","","","F.6 Проверка шрифта надписи '© PulseWave, 2023-2025' в футере",""
"passed","Fri Aug 29 03:33:46 GMT 2025","Fri Aug 29 03:33:47 GMT 2025","763","tests.api_tests","api_test","TestAPI","","","A.27 POST Регистрация пользователя без пароля",""
"passed","Fri Aug 29 03:40:42 GMT 2025","Fri Aug 29 03:40:42 GMT 2025","53","tests.ui_tests","footer_test","TestFooter","","","F.6 Проверка цвета шрифта надписи '© PulseWave, 2023-2025' в футере",""
"passed","Fri Aug 29 03:48:59 GMT 2025","Fri Aug 29 03:49:00 GMT 2025","1325","tests.ui_tests","login_page_test","TestLoginPage","","","L.7 Авторизация с некорректным емайл",""
