"Status","Start Time","Stop Time","Duration in ms","Parent Suite","Suite","Sub Suite","Test Class","Test Method","Name","Description"
"passed","Fri Aug 29 03:51:50 GMT 2025","Fri Aug 29 03:51:50 GMT 2025","331","tests.ui_tests","signup_page_test","TestSignupPage","","","S.16 Регистрация с корректным email и слабым паролем и подтверждением пароля",""
"passed","Fri Aug 29 03:51:26 GMT 2025","Fri Aug 29 03:51:28 GMT 2025","2786","tests.ui_tests","signup_page_test","TestSignupPage","","","S.9 Регистрация с корректным email и паролем и пустым подтверждением пароля",""
"passed","Fri Aug 29 03:42:39 GMT 2025","Fri Aug 29 03:42:42 GMT 2025","2650","tests.ui_tests","header_test","TestHeader","","","H.5 Проверка перехода на страницу 'https://app.pulsewave.ru/auth/login' по кнопке 'Войти'",""
"passed","Fri Aug 29 03:50:41 GMT 2025","Fri Aug 29 03:50:42 GMT 2025","560","tests.ui_tests","signup_page_test","TestSignupPage","","","S.4 Проверка текста заголовка 'Регистрация'",""
"passed","Fri Aug 29 03:33:30 GMT 2025","Fri Aug 29 03:33:32 GMT 2025","1887","tests.api_tests","api_test","TestAPI","","","A.22 POST Сброс пароля",""
"passed","Fri Aug 29 03:33:19 GMT 2025","Fri Aug 29 03:33:21 GMT 2025","1879","tests.api_tests","api_test","TestAPI","","","A.18 POST Обновить JWT refresh token авторизованного пользователя",""
"skipped","Fri Aug 29 03:45:57 GMT 2025","Fri Aug 29 03:46:58 GMT 2025","60345","tests.ui_tests","header_test","TestHeader","","","H.8 Проверка шрифта кнопки 'Регистрация в хедере https://app.pulsewave.ru/auth/login'",""
"passed","Fri Aug 29 03:40:39 GMT 2025","Fri Aug 29 03:40:39 GMT 2025","38","tests.ui_tests","footer_test","TestFooter","","","F.6 Проверка размера шрифта надписи '© PulseWave, 2023-2025' в футере",""
"passed","Fri Aug 29 03:48:36 GMT 2025","Fri Aug 29 03:48:37 GMT 2025","607","tests.ui_tests","login_page_test","TestLoginPage","","","L.3 Проверка редиректа на страницу восстановления пароля при клике на ссылку 'Забыли пароль?'",""
"passed","Fri Aug 29 03:42:55 GMT 2025","Fri Aug 29 03:42:55 GMT 2025","603","tests.ui_tests","header_test","TestHeader","","","H.6 Проверка перехода на страницу 'https://app.pulsewave.ru/auth/signup' по кнопке 'Регистрация'",""
"passed","Fri Aug 29 03:52:44 GMT 2025","Fri Aug 29 03:52:46 GMT 2025","2008","tests.ui_tests","workspace_page_test","TestWorkspacePage","","","W.6 Проверка перехода в Рабочие пространства по ссылке На главную",""
"passed","Fri Aug 29 03:51:07 GMT 2025","Fri Aug 29 03:51:08 GMT 2025","818","tests.ui_tests","signup_page_test","TestSignupPage","","","S.7 Регистрация с некорректным email и сильным паролем и подтверждением пароля",""
"passed","Fri Aug 29 03:40:56 GMT 2025","Fri Aug 29 03:40:56 GMT 2025","41","tests.ui_tests","footer_test","TestFooter","","","F.6 Проверка цвета шрифта надписи '© PulseWave, 2023-2025' в футере",""
"passed","Fri Aug 29 03:49:21 GMT 2025","Fri Aug 29 03:49:25 GMT 2025","4302","tests.ui_tests","main_page_test","TestMainPage","","","Проверка редиректа с /home на Главную страницу",""
"passed","Fri Aug 29 03:33:18 GMT 2025","Fri Aug 29 03:33:19 GMT 2025","1797","tests.api_tests","api_test","TestAPI","","","A.17 GET Получить список всех пользователей для поиска",""
"skipped","Fri Aug 29 03:51:46 GMT 2025","Fri Aug 29 03:51:46 GMT 2025","0","tests.ui_tests","signup_page_test","TestSignupPage","","","S.13 Окно регистрации сообщение 'Регистрируясь, я соглашаюсь с Условиями пользования и Политикой конфиденциальности'",""
"passed","Fri Aug 29 03:34:27 GMT 2025","Fri Aug 29 03:34:28 GMT 2025","783","tests.api_tests","api_test","TestAPI","","","A.30 POST Создать пользователя с некорректными данными",""
"passed","Fri Aug 29 03:39:17 GMT 2025","Fri Aug 29 03:39:18 GMT 2025","593","tests.ui_tests","footer_test","TestFooter","","","F.3 Проверка элемента 'info@pulsewave.ru'в хедере",""
"passed","Fri Aug 29 03:33:48 GMT 2025","Fri Aug 29 03:34:27 GMT 2025","39196","tests.api_tests","api_test","TestAPI","","","A.29 DELETE Активировать и удалить авторизованного пользователя",""
"passed","Fri Aug 29 03:52:59 GMT 2025","Fri Aug 29 03:53:00 GMT 2025","767","tests.ui_tests","workspace_page_test","TestWorkspacePage","","","W.8 Проверка невидимости кнопки 'Отметить все как прочитанные' в прочитанных уведомлениях",""
"passed","Fri Aug 29 03:39:29 GMT 2025","Fri Aug 29 03:39:29 GMT 2025","43","tests.ui_tests","footer_test","TestFooter","","","F.4 Проверка года © PulseWave, 2025 в футере",""
"passed","Fri Aug 29 03:52:13 GMT 2025","Fri Aug 29 03:52:13 GMT 2025","3","tests.ui_tests","workspace_page_test","TestWorkspacePage","","","W.2 Проверка заголовка рабочего пространства",""
"passed","Fri Aug 29 03:39:46 GMT 2025","Fri Aug 29 03:39:46 GMT 2025","46","tests.ui_tests","footer_test","TestFooter","","","F.5 Проверка размера шрифта надписи 'info@pulsewave.ru' в футере",""
"passed","Fri Aug 29 03:41:32 GMT 2025","Fri Aug 29 03:41:32 GMT 2025","56","tests.ui_tests","footer_test","TestFooter","","","F.8 Проверка кликабельности значка LinkedIn на странице 'https://app.pulsewave.ru/auth/login' в футере",""
"passed","Fri Aug 29 03:49:05 GMT 2025","Fri Aug 29 03:49:07 GMT 2025","2214","tests.ui_tests","login_page_test","TestLoginPage","","","L.8 Авторизация с пустым емайл",""
"passed","Fri Aug 29 03:40:47 GMT 2025","Fri Aug 29 03:40:47 GMT 2025","41","tests.ui_tests","footer_test","TestFooter","","","F.6 Проверка цвета шрифта надписи '© PulseWave, 2023-2025' в футере",""
"passed","Fri Aug 29 03:33:12 GMT 2025","Fri Aug 29 03:33:16 GMT 2025","3683","tests.api_tests","api_test","TestAPI","","","A.15 GET Список всех пользователей доски для назначения ответственных",""
"skipped","Fri Aug 29 03:43:31 GMT 2025","Fri Aug 29 03:43:31 GMT 2025","44","tests.ui_tests","header_test","TestHeader","","","H.7 Проверка цвета кнопки 'Войти' в хедере https://app.pulsewave.ru/auth/signup",""
"passed","Fri Aug 29 03:40:12 GMT 2025","Fri Aug 29 03:40:12 GMT 2025","54","tests.ui_tests","footer_test","TestFooter","","","F.5 Проверка шрифта надписи 'info@pulsewave.ru' в футере",""
"passed","Fri Aug 29 03:51:33 GMT 2025","Fri Aug 29 03:51:35 GMT 2025","2292","tests.ui_tests","signup_page_test","TestSignupPage","","","S.10 Регистрация с корректным email и подтверждением пароля и пустым паролем",""
"passed","Fri Aug 29 03:40:24 GMT 2025","Fri Aug 29 03:40:24 GMT 2025","44","tests.ui_tests","footer_test","TestFooter","","","F.5 Проверка шрифта надписи 'info@pulsewave.ru' в футере",""
"passed","Fri Aug 29 03:32:46 GMT 2025","Fri Aug 29 03:32:48 GMT 2025","1562","tests.api_tests","api_test","TestAPI","","","A.8 POST Создать пару токенов access и refresh",""
"passed","Fri Aug 29 03:40:27 GMT 2025","Fri Aug 29 03:40:27 GMT 2025","49","tests.ui_tests","footer_test","TestFooter","","","F.6 Проверка размера шрифта надписи '© PulseWave, 2023-2025' в футере",""
"passed","Fri Aug 29 03:50:46 GMT 2025","Fri Aug 29 03:50:46 GMT 2025","43","tests.ui_tests","signup_page_test","TestSignupPage","","","S.5 Проверка размера шрифта заголовка 'Регистрация'",""
"passed","Fri Aug 29 03:33:25 GMT 2025","Fri Aug 29 03:33:30 GMT 2025","4710","tests.api_tests","api_test","TestAPI","","","A.21 POST Подтверждение смены почты пользователя. Токен из ссылки auth/change_email/{token}.",""
"passed","Fri Aug 29 03:40:00 GMT 2025","Fri Aug 29 03:40:00 GMT 2025","52","tests.ui_tests","footer_test","TestFooter","","","F.5 Проверка цвета шрифта надписи 'info@pulsewave.ru' в футере",""
"passed","Fri Aug 29 03:53:31 GMT 2025","Fri Aug 29 03:53:33 GMT 2025","1769","tests.ui_tests","workspace_page_test","TestWorkspacePage","","","W.12 Проверка прочтения уведомлений",""
"passed","Fri Aug 29 03:35:38 GMT 2025","Fri Aug 29 03:36:42 GMT 2025","63584","tests.ui_tests","footer_test","TestFooter","","","F.1 Проверка попапа о принятии файлов cookie на странице https://app.pulsewave.ru/auth/login",""
"passed","Fri Aug 29 03:40:51 GMT 2025","Fri Aug 29 03:40:51 GMT 2025","41","tests.ui_tests","footer_test","TestFooter","","","F.6 Проверка цвета шрифта надписи '© PulseWave, 2023-2025' в футере",""
"passed","Fri Aug 29 03:41:51 GMT 2025","Fri Aug 29 03:41:51 GMT 2025","576","tests.ui_tests","footer_test","TestFooter","","","F.9 Проверка перехода в LinkedIn на странице 'https://app.pulsewave.ru/auth/signup' в футере",""
"passed","Fri Aug 29 03:36:42 GMT 2025","Fri Aug 29 03:37:47 GMT 2025","64306","tests.ui_tests","footer_test","TestFooter","","","F.1 Проверка попапа о принятии файлов cookie на странице https://app.pulsewave.ru/auth/signup",""
"passed","Fri Aug 29 03:33:03 GMT 2025","Fri Aug 29 03:33:10 GMT 2025","7439","tests.api_tests","api_test","TestAPI","","","A.13 POST Подтверждение приглашения в РП",""
"passed","Fri Aug 29 03:49:53 GMT 2025","Fri Aug 29 03:49:57 GMT 2025","4254","tests.ui_tests","password_recovery_test","TestPasswordRecoveryPage","","","R.4 Проверить сообщение об отправке ссылки восстановления пароля на емайл",""
"passed","Fri Aug 29 03:32:46 GMT 2025","Fri Aug 29 03:32:46 GMT 2025","782","tests.api_tests","api_test","TestAPI","","","A.7 POST Регистрация ранее зарегистрированного пользователя",""
"passed","Fri Aug 29 03:33:44 GMT 2025","Fri Aug 29 03:33:46 GMT 2025","2095","tests.api_tests","api_test","TestAPI","","","A.25 DELETE Удалить авторизованного пользователя",""
"passed","Fri Aug 29 03:40:31 GMT 2025","Fri Aug 29 03:40:31 GMT 2025","43","tests.ui_tests","footer_test","TestFooter","","","F.6 Проверка размера шрифта надписи '© PulseWave, 2023-2025' в футере",""
"passed","Fri Aug 29 03:39:54 GMT 2025","Fri Aug 29 03:39:54 GMT 2025","47","tests.ui_tests","footer_test","TestFooter","","","F.5 Проверка размера шрифта надписи 'info@pulsewave.ru' в футере",""
"passed","Fri Aug 29 03:50:02 GMT 2025","Fri Aug 29 03:50:10 GMT 2025","7811","tests.ui_tests","password_recovery_test","TestPasswordRecoveryPage","","","R.5 Восстановить пароль на корректный емайл",""
"passed","Fri Aug 29 03:41:37 GMT 2025","Fri Aug 29 03:41:37 GMT 2025","60","tests.ui_tests","footer_test","TestFooter","","","F.8 Проверка кликабельности значка LinkedIn на странице 'https://app.pulsewave.ru/auth/signup' в футере",""
"skipped","Fri Aug 29 03:47:07 GMT 2025","Fri Aug 29 03:48:07 GMT 2025","60340","tests.ui_tests","header_test","TestHeader","","","H.8 Проверка цвета кнопки 'Регистрация в хедере https://app.pulsewave.ru/auth/login'",""
"passed","Fri Aug 29 03:52:20 GMT 2025","Fri Aug 29 03:52:21 GMT 2025","1033","tests.ui_tests","workspace_page_test","TestWorkspacePage","","","W.3 Проверка видимости аватара",""
"passed","Fri Aug 29 03:48:41 GMT 2025","Fri Aug 29 03:48:44 GMT 2025","2814","tests.ui_tests","login_page_test","TestLoginPage","","","L.4 Авторизация с корректными данными",""
"passed","Fri Aug 29 03:42:03 GMT 2025","Fri Aug 29 03:42:06 GMT 2025","2837","tests.ui_tests","header_test","TestHeader","","","H.2 Проверка редиректа на главную страницу при клике на логотип",""
"passed","Fri Aug 29 03:39:57 GMT 2025","Fri Aug 29 03:39:57 GMT 2025","49","tests.ui_tests","footer_test","TestFooter","","","F.5 Проверка цвета шрифта надписи 'info@pulsewave.ru' в футере",""
"passed","Fri Aug 29 03:32:58 GMT 2025","Fri Aug 29 03:33:03 GMT 2025","4412","tests.api_tests","api_test","TestAPI","","","A.12 DELETE Удалить РП",""
"passed","Fri Aug 29 03:39:09 GMT 2025","Fri Aug 29 03:39:10 GMT 2025","108","tests.ui_tests","footer_test","TestFooter","","","F.3 Проверка элемента 'info@pulsewave.ru'в хедере",""
"passed","Fri Aug 29 03:34:28 GMT 2025","Fri Aug 29 03:34:29 GMT 2025","800","tests.api_tests","api_test","TestAPI","","","A.30 POST Создать пользователя с некорректными данными",""
"passed","Fri Aug 29 03:52:52 GMT 2025","Fri Aug 29 03:52:52 GMT 2025","33","tests.ui_tests","workspace_page_test","TestWorkspacePage","","","W.7 Проверка видимости заголовка 'Ваши рабочие пространства'",""
"passed","Fri Aug 29 03:32:55 GMT 2025","Fri Aug 29 03:32:58 GMT 2025","3730","tests.api_tests","api_test","TestAPI","","","A.11 PATCH Частично обновить данные РП (на данный момент только имя)",""
"passed","Fri Aug 29 03:51:55 GMT 2025","Fri Aug 29 03:51:55 GMT 2025","336","tests.ui_tests","signup_page_test","TestSignupPage","","","S.16 Регистрация с корректным email и слабым паролем и подтверждением пароля",""
"passed","Fri Aug 29 03:41:28 GMT 2025","Fri Aug 29 03:41:28 GMT 2025","72","tests.ui_tests","footer_test","TestFooter","","","F.8 Проверка кликабельности значка LinkedIn на странице 'https://pulsewave.ru/' в футере",""
"passed","Fri Aug 29 03:42:32 GMT 2025","Fri Aug 29 03:42:32 GMT 2025","46","tests.ui_tests","header_test","TestHeader","","","H.4 Проверка текста кнопки 'Регистрация'",""
"skipped","Fri Aug 29 03:41:59 GMT 2025","Fri Aug 29 03:41:59 GMT 2025","37","tests.ui_tests","header_test","TestHeader","","","H.1 Проверка некликабельности логотипа на лендинге",""
"passed","Fri Aug 29 03:48:11 GMT 2025","Fri Aug 29 03:48:15 GMT 2025","3923","tests.ui_tests","lending_test","TestLendingPage","","","M.1 Проверка редиректа с /home на страницу лендинга",""
"passed","Fri Aug 29 03:43:09 GMT 2025","Fri Aug 29 03:43:09 GMT 2025","44","tests.ui_tests","header_test","TestHeader","","","H.7 Проверка размера шрифта кнопки 'Войти' в хедере https://app.pulsewave.ru/auth/password?email=",""
"passed","Fri Aug 29 03:32:26 GMT 2025","Fri Aug 29 03:32:30 GMT 2025","4484","tests.api_tests","api_test","TestAPI","","","A.3 POST Активация пользователя с корректными данными",""
"passed","Fri Aug 29 03:49:18 GMT 2025","Fri Aug 29 03:49:20 GMT 2025","2771","tests.ui_tests","login_page_test","TestLoginPage","","","L.9 Авторизация с логином заглавными буквами",""
"passed","Fri Aug 29 03:40:19 GMT 2025","Fri Aug 29 03:40:20 GMT 2025","558","tests.ui_tests","footer_test","TestFooter","","","F.5 Проверка шрифта надписи 'info@pulsewave.ru' в футере",""
"passed","Fri Aug 29 03:50:18 GMT 2025","Fri Aug 29 03:50:29 GMT 2025","10280","tests.ui_tests","signup_page_test","TestSignupPage","","","S.1 Регистрация с корректными email и паролем и с согласием на подписку",""
"passed","Fri Aug 29 03:52:28 GMT 2025","Fri Aug 29 03:52:28 GMT 2025","3","tests.ui_tests","workspace_page_test","TestWorkspacePage","","","W.4 Проверка что авторизованный пользователь попадает в Рабочие пространства",""
"skipped","Fri Aug 29 03:43:35 GMT 2025","Fri Aug 29 03:43:35 GMT 2025","42","tests.ui_tests","header_test","TestHeader","","","H.7 Проверка цвета кнопки 'Войти' в хедере https://app.pulsewave.ru/auth/password?email=",""
"passed","Fri Aug 29 03:43:00 GMT 2025","Fri Aug 29 03:43:01 GMT 2025","609","tests.ui_tests","header_test","TestHeader","","","H.6 Проверка перехода на страницу 'https://app.pulsewave.ru/auth/signup' по кнопке 'Регистрация'",""
"passed","Fri Aug 29 03:40:05 GMT 2025","Fri Aug 29 03:40:05 GMT 2025","44","tests.ui_tests","footer_test","TestFooter","","","F.5 Проверка цвета шрифта надписи 'info@pulsewave.ru' в футере",""
"passed","Fri Aug 29 03:33:16 GMT 2025","Fri Aug 29 03:33:18 GMT 2025","1853","tests.api_tests","api_test","TestAPI","","","A.16 POST Создать Рабочее пространство",""
"passed","Fri Aug 29 03:48:54 GMT 2025","Fri Aug 29 03:48:54 GMT 2025","59","tests.ui_tests","login_page_test","TestLoginPage","","","L.6 Окно авторизации сообщение 'Забыли пароль?'",""
"passed","Fri Aug 29 03:51:39 GMT 2025","Fri Aug 29 03:51:41 GMT 2025","2767","tests.ui_tests","signup_page_test","TestSignupPage","","","S.11 Регистрация с пустым email и сильным паролем и подтверждением пароля",""
"passed","Fri Aug 29 03:41:21 GMT 2025","Fri Aug 29 03:41:21 GMT 2025","522","tests.ui_tests","footer_test","TestFooter","","","F.7 Проверка значка LinkedIn на странице 'https://app.pulsewave.ru/auth/signup' в футере",""
"passed","Fri Aug 29 03:33:23 GMT 2025","Fri Aug 29 03:33:25 GMT 2025","2149","tests.api_tests","api_test","TestAPI","","","A.20 POST Запрос на смену почты",""
"passed","Fri Aug 29 03:41:14 GMT 2025","Fri Aug 29 03:41:14 GMT 2025","11","tests.ui_tests","footer_test","TestFooter","","","F.7 Проверка значка LinkedIn на странице 'https://pulsewave.ru/' в футере",""
"passed","Fri Aug 29 03:53:07 GMT 2025","Fri Aug 29 03:53:09 GMT 2025","1748","tests.ui_tests","workspace_page_test","TestWorkspacePage","","","W.9 Проверка возможности изменить цвет переключателя 'Непрочитанные'",""
"passed","Fri Aug 29 03:39:02 GMT 2025","Fri Aug 29 03:39:02 GMT 2025","546","tests.ui_tests","footer_test","TestFooter","","","F.2 Проверка отсутствия ссылки на Лицензионное соглашение со страницы 'https://app.pulsewave.ru/auth/signup",""
"passed","Fri Aug 29 03:40:59 GMT 2025","Fri Aug 29 03:40:59 GMT 2025","50","tests.ui_tests","footer_test","TestFooter","","","F.6 Проверка шрифта надписи '© PulseWave, 2023-2025' в футере",""
"passed","Fri Aug 29 03:39:49 GMT 2025","Fri Aug 29 03:39:50 GMT 2025","558","tests.ui_tests","footer_test","TestFooter","","","F.5 Проверка размера шрифта надписи 'info@pulsewave.ru' в футере",""
"passed","Fri Aug 29 03:41:41 GMT 2025","Fri Aug 29 03:41:41 GMT 2025","60","tests.ui_tests","footer_test","TestFooter","","","F.8 Проверка кликабельности значка LinkedIn на странице 'https://app.pulsewave.ru/auth/password?email=' в футере",""
"passed","Fri Aug 29 03:39:07 GMT 2025","Fri Aug 29 03:39:07 GMT 2025","39","tests.ui_tests","footer_test","TestFooter","","","F.2 Проверка отсутствия ссылки на Лицензионное соглашение со страницы 'https://app.pulsewave.ru/auth/password?email=",""
"passed","Fri Aug 29 03:50:32 GMT 2025","Fri Aug 29 03:50:33 GMT 2025","820","tests.ui_tests","signup_page_test","TestSignupPage","","","S.2 Регистрация с корректным email и не совпадающими паролем и подтверждением пароля",""
"passed","Fri Aug 29 03:49:11 GMT 2025","Fri Aug 29 03:49:13 GMT 2025","2230","tests.ui_tests","login_page_test","TestLoginPage","","","L.8 Авторизация с пустым паролем",""
"passed","Fri Aug 29 03:34:35 GMT 2025","Fri Aug 29 03:35:38 GMT 2025","62560","tests.ui_tests","footer_test","TestFooter","","","F.1 Проверка попапа о принятии файлов cookie на странице https://pulsewave.ru/",""
"passed","Fri Aug 29 03:32:24 GMT 2025","Fri Aug 29 03:32:26 GMT 2025","1328","tests.api_tests","api_test","TestAPI","","","A.2 POST Создать пользователя с корректными данными",""
"passed","Fri Aug 29 03:32:30 GMT 2025","Fri Aug 29 03:32:36 GMT 2025","5869","tests.api_tests","api_test","TestAPI","","","A.4 POST Пригласить пользователя по email","Пользователи добавляются по одному. Если пользователя не существует, он будет создан"
"passed","Fri Aug 29 03:41:26 GMT 2025","Fri Aug 29 03:41:26 GMT 2025","10","tests.ui_tests","footer_test","TestFooter","","","F.7 Проверка значка LinkedIn на странице 'https://app.pulsewave.ru/auth/password?email=' в футере",""
"passed","Fri Aug 29 03:42:17 GMT 2025","Fri Aug 29 03:42:20 GMT 2025","2573","tests.ui_tests","header_test","TestHeader","","","H.2 Проверка редиректа на главную страницу при клике на логотип",""
"passed","Fri Aug 29 03:41:44 GMT 2025","Fri Aug 29 03:41:44 GMT 2025","77","tests.ui_tests","footer_test","TestFooter","","","F.9 Проверка перехода в LinkedIn на странице 'https://pulsewave.ru/' в футере",""
"passed","Fri Aug 29 03:42:11 GMT 2025","Fri Aug 29 03:42:13 GMT 2025","2371","tests.ui_tests","header_test","TestHeader","","","H.2 Проверка редиректа на главную страницу при клике на логотип",""
"passed","Fri Aug 29 03:33:21 GMT 2025","Fri Aug 29 03:33:23 GMT 2025","1893","tests.api_tests","api_test","TestAPI","","","A.19 GET Получить данные авторизованного пользователя me",""
"passed","Fri Aug 29 03:51:46 GMT 2025","Fri Aug 29 03:51:46 GMT 2025","67","tests.ui_tests","signup_page_test","TestSignupPage","","","S.12 Окно регистрации сообщение 'Я согласен получать новости и обновления PulseWave'",""
"passed","Fri Aug 29 03:49:34 GMT 2025","Fri Aug 29 03:49:34 GMT 2025","41","tests.ui_tests","password_recovery_test","TestPasswordRecoveryPage","","","R.2 Проверка размера шрифта заголовка 'Восстановление пароля'",""
"passed","Fri Aug 29 03:45:54 GMT 2025","Fri Aug 29 03:45:54 GMT 2025","41","tests.ui_tests","header_test","TestHeader","","","H.8 Проверка цвета шрифта кнопки 'Регистрация в хедере https://app.pulsewave.ru/auth/password?email='",""
"passed","Fri Aug 29 03:39:34 GMT 2025","Fri Aug 29 03:39:34 GMT 2025","45","tests.ui_tests","footer_test","TestFooter","","","F.4 Проверка года © PulseWave, 2025 в футере",""
"passed","Fri Aug 29 03:52:35 GMT 2025","Fri Aug 29 03:52:37 GMT 2025","2018","tests.ui_tests","workspace_page_test","TestWorkspacePage","","","W.5 Проверка что авторизованный пользователь может выйти из аккаунта",""
"passed","Fri Aug 29 03:38:54 GMT 2025","Fri Aug 29 03:38:54 GMT 2025","50","tests.ui_tests","footer_test","TestFooter","","","F.2 Проверка отсутствия ссылки на Лицензионное соглашение со страницы 'https://pulsewave.ru/",""
"passed","Fri Aug 29 03:39:38 GMT 2025","Fri Aug 29 03:39:38 GMT 2025","46","tests.ui_tests","footer_test","TestFooter","","","F.4 Проверка года © PulseWave, 2025 в футере",""
"passed","Fri Aug 29 03:32:50 GMT 2025","Fri Aug 29 03:32:55 GMT 2025","4225","tests.api_tests","api_test","TestAPI","","","A.10 GET Информация о конкретном рабочем пространстве",""
"passed","Fri Aug 29 03:49:29 GMT 2025","Fri Aug 29 03:49:29 GMT 2025","43","tests.ui_tests","password_recovery_test","TestPasswordRecoveryPage","","","R.1 Проверка текста заголовка 'Восстановление пароля'",""
"passed","Fri Aug 29 03:32:43 GMT 2025","Fri Aug 29 03:32:46 GMT 2025","2661","tests.api_tests","api_test","TestAPI","","","A.6 POST Удаление приглашенного пользователей из РП","Удаление как из участников так и из приглашенных"
