"Status","Start Time","Stop Time","Duration in ms","Parent Suite","Suite","Sub Suite","Test Class","Test Method","Name","Description"
"passed","Sat Sep 07 02:50:04 GMT 2024","Sat Sep 07 02:50:06 GMT 2024","2295","tests.test_signup_page","test_signup_page","TestSignupPage","","","1.24 Регистрация с корректным email и паролем и пустым подтверждением пароля",""
"passed","Sat Sep 07 02:37:28 GMT 2024","Sat Sep 07 02:37:37 GMT 2024","8489","tests.test_api","test_api","TestAPI","","","GET Информация о конкретной колонке",""
"passed","Sat Sep 07 02:43:53 GMT 2024","Sat Sep 07 02:43:53 GMT 2024","36","tests.test_footer","test_footer","TestFooter","","","Проверка шрифта надписи '© PulseWave, 2023-2024' в футере",""
"passed","Sat Sep 07 02:49:39 GMT 2024","Sat Sep 07 02:49:39 GMT 2024","295","tests.test_signup_page","test_signup_page","TestSignupPage","","","1.21, 1.22 Регистрация с некорректным email и сильным паролем и подтверждением пароля",""
"passed","Sat Sep 07 02:48:12 GMT 2024","Sat Sep 07 02:48:12 GMT 2024","34","tests.test_password_recovery","test_password_recovery","TestPasswordRecoveryPage","","","Проверка шрифта заголовка 'Восстановление пароля'",""
"passed","Sat Sep 07 02:49:42 GMT 2024","Sat Sep 07 02:50:01 GMT 2024","19032","tests.test_signup_page","test_signup_page","TestSignupPage","","","1.23 Регистрация с корректными email и паролем без согласия на подписку",""
"passed","Sat Sep 07 02:47:46 GMT 2024","Sat Sep 07 02:47:46 GMT 2024","40","tests.test_main_page","test_main_page","TestMainPage","","","Проверка текста элемента 'PULSEWAVE'",""
"passed","Sat Sep 07 02:42:49 GMT 2024","Sat Sep 07 02:42:49 GMT 2024","35","tests.test_footer","test_footer","TestFooter","","","Проверка размера шрифта надписи 'info@pulsewave.ru' в футере",""
"passed","Sat Sep 07 02:42:58 GMT 2024","Sat Sep 07 02:42:58 GMT 2024","35","tests.test_footer","test_footer","TestFooter","","","Проверка размера шрифта надписи 'info@pulsewave.ru' в футере",""
"passed","Sat Sep 07 02:43:47 GMT 2024","Sat Sep 07 02:43:47 GMT 2024","45","tests.test_footer","test_footer","TestFooter","","","Проверка шрифта надписи '© PulseWave, 2023-2024' в футере",""
"passed","Sat Sep 07 02:40:52 GMT 2024","Sat Sep 07 02:41:08 GMT 2024","16158","tests.test_api","test_api","TestAPI","","","POST Регистрация пользователя без подтверждения подписки",""
"passed","Sat Sep 07 02:43:29 GMT 2024","Sat Sep 07 02:43:29 GMT 2024","48","tests.test_footer","test_footer","TestFooter","","","Проверка размера шрифта надписи '© PulseWave, 2023-2024' в футере",""
"passed","Sat Sep 07 02:43:15 GMT 2024","Sat Sep 07 02:43:15 GMT 2024","43","tests.test_footer","test_footer","TestFooter","","","Проверка шрифта надписи 'info@pulsewave.ru' в футере",""
"passed","Sat Sep 07 02:41:31 GMT 2024","Sat Sep 07 02:41:34 GMT 2024","2412","tests.test_footer","test_footer","TestFooter","","","Проверка попапа о принятии файлов cookie на странице https://pulsewave.ru/auth/signup",""
"passed","Sat Sep 07 02:44:30 GMT 2024","Sat Sep 07 02:44:30 GMT 2024","69","tests.test_header","test_header","TestHeader","","","Проверка перехода на страницу 'https://pulsewave.ru/auth/login' по кнопке 'Войти'",""
"passed","Sat Sep 07 02:43:00 GMT 2024","Sat Sep 07 02:43:00 GMT 2024","38","tests.test_footer","test_footer","TestFooter","","","Проверка цвета шрифта надписи 'info@pulsewave.ru' в футере",""
"passed","Sat Sep 07 02:36:15 GMT 2024","Sat Sep 07 02:36:19 GMT 2024","4083","tests.test_api","test_api","TestAPI","","","PUT Обновить все данные РП (на данный момент только имя)",""
"passed","Sat Sep 07 02:40:31 GMT 2024","Sat Sep 07 02:40:43 GMT 2024","12108","tests.test_api","test_api","TestAPI","","","POST Сброс пароля",""
"passed","Sat Sep 07 02:42:26 GMT 2024","Sat Sep 07 02:42:26 GMT 2024","35","tests.test_footer","test_footer","TestFooter","","","Проверка цвета шрифта ссылки 'Условия пользования' в футере",""
"passed","Sat Sep 07 02:50:14 GMT 2024","Sat Sep 07 02:50:16 GMT 2024","2258","tests.test_signup_page","test_signup_page","TestSignupPage","","","1.26 Регистрация с пустым email и сильным паролем и подтверждением пароля",""
"passed","Sat Sep 07 02:46:54 GMT 2024","Sat Sep 07 02:46:54 GMT 2024","35","tests.test_main_page","test_main_page","TestMainPage","","","Проверка шрифта кнопки 'Зарегистрироваться'",""
"passed","Sat Sep 07 02:50:25 GMT 2024","Sat Sep 07 02:50:25 GMT 2024","112","tests.test_signup_page","test_signup_page","TestSignupPage","","","1.29 Окно регистрации сообщение 'Регистрируясь, я соглашаюсь с Условиями пользования и Политикой конфиденциальности' проверка корректности перехода по ссылке 'Политикой конфиденциальности'",""
"passed","Sat Sep 07 02:36:10 GMT 2024","Sat Sep 07 02:36:15 GMT 2024","4385","tests.test_api","test_api","TestAPI","","","GET Информация о конкретном рабочем пространстве",""
"passed","Sat Sep 07 02:39:31 GMT 2024","Sat Sep 07 02:39:43 GMT 2024","11209","tests.test_api","test_api","TestAPI","","","DELETE Удалить комментарий",""
"passed","Sat Sep 07 02:43:50 GMT 2024","Sat Sep 07 02:43:50 GMT 2024","47","tests.test_footer","test_footer","TestFooter","","","Проверка шрифта надписи '© PulseWave, 2023-2024' в футере",""
"passed","Sat Sep 07 02:46:31 GMT 2024","Sat Sep 07 02:46:33 GMT 2024","2235","tests.test_login_page","test_login_page","TestLoginPage","","","Авторизация с пустым паролем",""
"passed","Sat Sep 07 02:43:38 GMT 2024","Sat Sep 07 02:43:38 GMT 2024","45","tests.test_footer","test_footer","TestFooter","","","Проверка цвета шрифта надписи '© PulseWave, 2023-2024' в футере",""
"passed","Sat Sep 07 02:45:01 GMT 2024","Sat Sep 07 02:45:01 GMT 2024","36","tests.test_header","test_header","TestHeader","","","Проверка шрифта кнопки 'Войти' в хедере https://pulsewave.ru/",""
"passed","Sat Sep 07 02:40:08 GMT 2024","Sat Sep 07 02:40:12 GMT 2024","3616","tests.test_api","test_api","TestAPI","","","PATCH Частично обновить данные авторизованного пользователя",""
"passed","Sat Sep 07 02:42:35 GMT 2024","Sat Sep 07 02:42:35 GMT 2024","37","tests.test_footer","test_footer","TestFooter","","","Проверка цвета шрифта ссылки 'Условия пользования' в футере",""
"passed","Sat Sep 07 02:46:45 GMT 2024","Sat Sep 07 02:46:45 GMT 2024","37","tests.test_main_page","test_main_page","TestMainPage","","","Проверка шрифта элемента 'PULSEWAVE'",""
"passed","Sat Sep 07 02:42:20 GMT 2024","Sat Sep 07 02:42:20 GMT 2024","37","tests.test_footer","test_footer","TestFooter","","","Проверка размера шрифта ссылки 'Условия пользования' в футере",""
"passed","Sat Sep 07 02:46:08 GMT 2024","Sat Sep 07 02:46:10 GMT 2024","1770","tests.test_login_page","test_login_page","TestLoginPage","","","Авторизация с корректными данными",""
"passed","Sat Sep 07 02:36:59 GMT 2024","Sat Sep 07 02:37:05 GMT 2024","5849","tests.test_api","test_api","TestAPI","","","PUT Обновить доску",""
"passed","Sat Sep 07 02:35:54 GMT 2024","Sat Sep 07 02:35:57 GMT 2024","2688","tests.test_api","test_api","TestAPI","","","POST Удаление приглашенного пользователей из РП","Удаление как из участников так и из приглашенных"
"passed","Sat Sep 07 02:39:21 GMT 2024","Sat Sep 07 02:39:31 GMT 2024","10253","tests.test_api","test_api","TestAPI","","","POST Создать комментарий",""
"passed","Sat Sep 07 02:36:06 GMT 2024","Sat Sep 07 02:36:07 GMT 2024","962","tests.test_api","test_api","TestAPI","","","POST Регистрация ранее зарегистрированного пользователя",""
"passed","Sat Sep 07 02:44:53 GMT 2024","Sat Sep 07 02:44:53 GMT 2024","47","tests.test_header","test_header","TestHeader","","","Проверка цвета шрифта кнопки 'Войти' в хедере https://pulsewave.ru/",""
"passed","Sat Sep 07 02:48:04 GMT 2024","Sat Sep 07 02:48:04 GMT 2024","38","tests.test_password_recovery","test_password_recovery","TestPasswordRecoveryPage","","","Проверка текста заголовка 'Восстановление пароля'",""
"passed","Sat Sep 07 02:35:42 GMT 2024","Sat Sep 07 02:35:46 GMT 2024","3384","tests.test_api","test_api","TestAPI","","","POST Активация пользователя с корректными данными",""
"passed","Sat Sep 07 02:39:13 GMT 2024","Sat Sep 07 02:39:15 GMT 2024","1808","tests.test_api","test_api","TestAPI","","","GET Список уведомлений текущего пользователя",""
"passed","Sat Sep 07 02:47:38 GMT 2024","Sat Sep 07 02:47:38 GMT 2024","36","tests.test_main_page","test_main_page","TestMainPage","","","Проверка цвета шрифта элемента 'Одно приложениe для решения всех Ваших задач!' в футере",""
"passed","Sat Sep 07 02:47:25 GMT 2024","Sat Sep 07 02:47:25 GMT 2024","38","tests.test_main_page","test_main_page","TestMainPage","","","Проверка размера шрифта элемента 'Неограниченный функционал, понятный интерфейс и большое количество возможностей
помогут Вам улучшить рабочий процесс.' в футере",""
"passed","Sat Sep 07 02:45:07 GMT 2024","Sat Sep 07 02:45:07 GMT 2024","34","tests.test_header","test_header","TestHeader","","","Проверка шрифта кнопки 'Войти' в хедере https://pulsewave.ru/auth/password?email=",""
"passed","Sat Sep 07 02:42:29 GMT 2024","Sat Sep 07 02:42:29 GMT 2024","45","tests.test_footer","test_footer","TestFooter","","","Проверка цвета шрифта ссылки 'Условия пользования' в футере",""
"passed","Sat Sep 07 02:40:14 GMT 2024","Sat Sep 07 02:40:27 GMT 2024","12822","tests.test_api","test_api","TestAPI","","","POST Запрос на смену почты",""
"passed","Sat Sep 07 02:38:46 GMT 2024","Sat Sep 07 02:38:57 GMT 2024","10368","tests.test_api","test_api","TestAPI","","","DELETE Удалить задачу",""
"passed","Sat Sep 07 02:47:41 GMT 2024","Sat Sep 07 02:47:41 GMT 2024","35","tests.test_main_page","test_main_page","TestMainPage","","","Проверка шрифта элемента 'Одно приложениe для решения всех Ваших задач!' в футере",""
"passed","Sat Sep 07 02:41:42 GMT 2024","Sat Sep 07 02:41:43 GMT 2024","169","tests.test_footer","test_footer","TestFooter","","","Проверка перехода на страницу c лицензионным соглашением со страницы 'https://pulsewave.ru/auth/login",""
"passed","Sat Sep 07 02:37:12 GMT 2024","Sat Sep 07 02:37:17 GMT 2024","4446","tests.test_api","test_api","TestAPI","","","GET Список всех пользователей доски для назначения ответственных",""
"passed","Sat Sep 07 02:45:13 GMT 2024","Sat Sep 07 02:45:13 GMT 2024","36","tests.test_header","test_header","TestHeader","","","Проверка цвета кнопки 'Войти' в хедере https://pulsewave.ru/auth/signup",""
"passed","Sat Sep 07 02:43:09 GMT 2024","Sat Sep 07 02:43:09 GMT 2024","36","tests.test_footer","test_footer","TestFooter","","","Проверка цвета шрифта надписи 'info@pulsewave.ru' в футере",""
"passed","Sat Sep 07 02:43:58 GMT 2024","Sat Sep 07 02:43:58 GMT 2024","28","tests.test_header","test_header","TestHeader","","","Проверка некликабельности логотипа на Главной странице",""
"passed","Sat Sep 07 02:42:17 GMT 2024","Sat Sep 07 02:42:17 GMT 2024","37","tests.test_footer","test_footer","TestFooter","","","Проверка размера шрифта ссылки 'Условия пользования' в футере",""
"passed","Sat Sep 07 02:40:51 GMT 2024","Sat Sep 07 02:40:51 GMT 2024","584","tests.test_api","test_api","TestAPI","","","POST Регистрация пользователя без электронной почты",""
"passed","Sat Sep 07 02:42:52 GMT 2024","Sat Sep 07 02:42:52 GMT 2024","36","tests.test_footer","test_footer","TestFooter","","","Проверка размера шрифта надписи 'info@pulsewave.ru' в футере",""
"passed","Sat Sep 07 02:45:10 GMT 2024","Sat Sep 07 02:45:10 GMT 2024","39","tests.test_header","test_header","TestHeader","","","Проверка цвета кнопки 'Войти' в хедере https://pulsewave.ru/",""
"passed","Sat Sep 07 02:40:05 GMT 2024","Sat Sep 07 02:40:08 GMT 2024","3678","tests.test_api","test_api","TestAPI","","","PUT Обновить все данные авторизованного пользователя по id",""
"passed","Sat Sep 07 02:46:57 GMT 2024","Sat Sep 07 02:46:57 GMT 2024","37","tests.test_main_page","test_main_page","TestMainPage","","","Проверка цвета кнопки 'Зарегистрироваться'",""
"passed","Sat Sep 07 02:43:03 GMT 2024","Sat Sep 07 02:43:03 GMT 2024","41","tests.test_footer","test_footer","TestFooter","","","Проверка цвета шрифта надписи 'info@pulsewave.ru' в футере",""
"passed","Sat Sep 07 02:47:49 GMT 2024","Sat Sep 07 02:47:49 GMT 2024","45","tests.test_main_page","test_main_page","TestMainPage","","","Проверка текста элемента 'Удобный и понятный интерфейс!'",""
"passed","Sat Sep 07 02:40:43 GMT 2024","Sat Sep 07 02:40:48 GMT 2024","4667","tests.test_api","test_api","TestAPI","","","POST Подтверждение сброса пароля. Когда пользователь переходит по ссылке     auth/password/reset/confirm/{uid}/{token}",""
"passed","Sat Sep 07 02:39:52 GMT 2024","Sat Sep 07 02:39:54 GMT 2024","1759","tests.test_api","test_api","TestAPI","","","GET Получить список всех пользователей для поиска",""
"passed","Sat Sep 07 02:39:54 GMT 2024","Sat Sep 07 02:39:57 GMT 2024","2891","tests.test_api","test_api","TestAPI","","","POST Обновить JWT access_token авторизованного пользователя",""
"passed","Sat Sep 07 02:44:36 GMT 2024","Sat Sep 07 02:44:36 GMT 2024","101","tests.test_header","test_header","TestHeader","","","1.2 Проверка перехода на страницу 'https://pulsewave.ru/auth/signup' по кнопке 'Регистрация'",""
"passed","Sat Sep 07 02:37:46 GMT 2024","Sat Sep 07 02:37:54 GMT 2024","7896","tests.test_api","test_api","TestAPI","","","PATCH Частично обновить колонку (название/порядковый номер)",""
"passed","Sat Sep 07 02:47:35 GMT 2024","Sat Sep 07 02:47:35 GMT 2024","37","tests.test_main_page","test_main_page","TestMainPage","","","Проверка размера шрифта элемента 'Одно приложениe для решения всех Ваших задач!' в футере",""
"passed","Sat Sep 07 02:44:47 GMT 2024","Sat Sep 07 02:44:47 GMT 2024","37","tests.test_header","test_header","TestHeader","","","Проверка размера шрифта кнопки 'Войти' в хедере https://pulsewave.ru/auth/signup",""
"passed","Sat Sep 07 02:35:57 GMT 2024","Sat Sep 07 02:36:02 GMT 2024","5175","tests.test_api","test_api","TestAPI","","","Проверка недействительности кеша доски",""
"passed","Sat Sep 07 02:47:55 GMT 2024","Sat Sep 07 02:47:55 GMT 2024","60","tests.test_main_page","test_main_page","TestMainPage","","","Проверка текста элемента 'Ваша безопасность и конфиденциальность для нас на первом месте!'",""
"passed","Sat Sep 07 02:41:29 GMT 2024","Sat Sep 07 02:41:31 GMT 2024","2347","tests.test_footer","test_footer","TestFooter","","","Проверка попапа о принятии файлов cookie на странице https://pulsewave.ru/auth/login",""
"passed","Sat Sep 07 02:40:48 GMT 2024","Sat Sep 07 02:40:51 GMT 2024","3154","tests.test_api","test_api","TestAPI","","","DELETE Удалить авторизованного пользователя",""
"passed","Sat Sep 07 02:47:14 GMT 2024","Sat Sep 07 02:47:14 GMT 2024","37","tests.test_main_page","test_main_page","TestMainPage","","","Проверка шрифта элемента 'Самый высокий уровень бесперебойной работы!' в футере",""
"passed","Sat Sep 07 02:41:54 GMT 2024","Sat Sep 07 02:41:55 GMT 2024","73","tests.test_footer","test_footer","TestFooter","","","Проверка элемента 'info@pulsewave.ru'в хедере",""
"passed","Sat Sep 07 02:45:51 GMT 2024","Sat Sep 07 02:45:51 GMT 2024","37","tests.test_header","test_header","TestHeader","","","Проверка цвета кнопки 'Регистрация в хедере https://pulsewave.ru/auth/password?email='",""
"passed","Sat Sep 07 02:44:59 GMT 2024","Sat Sep 07 02:44:59 GMT 2024","36","tests.test_header","test_header","TestHeader","","","Проверка цвета шрифта кнопки 'Войти' в хедере https://pulsewave.ru/auth/password?email=",""
"passed","Sat Sep 07 02:46:48 GMT 2024","Sat Sep 07 02:46:48 GMT 2024","35","tests.test_main_page","test_main_page","TestMainPage","","","Проверка размера шрифта кнопки 'Зарегистрироваться'",""
"passed","Sat Sep 07 02:47:52 GMT 2024","Sat Sep 07 02:47:52 GMT 2024","41","tests.test_main_page","test_main_page","TestMainPage","","","Проверка текста элемента 'Самый высокий уровень бесперебойной работы!'",""
"passed","Sat Sep 07 02:47:19 GMT 2024","Sat Sep 07 02:47:20 GMT 2024","39","tests.test_main_page","test_main_page","TestMainPage","","","Проверка цвета шрифта элемента 'Ваша безопасность и конфиденциальность для нас на первом месте!' в футере",""
"passed","Sat Sep 07 02:39:15 GMT 2024","Sat Sep 07 02:39:17 GMT 2024","2469","tests.test_api","test_api","TestAPI","","","PATCH Отметить прочтение уведомления",""
"passed","Sat Sep 07 02:48:29 GMT 2024","Sat Sep 07 02:48:45 GMT 2024","16198","tests.test_password_recovery","test_password_recovery","TestPasswordRecoveryPage","","","3.2, 3.2.1 Восстановить пароль на корректный емайл",""
"passed","Sat Sep 07 02:42:46 GMT 2024","Sat Sep 07 02:42:46 GMT 2024","38","tests.test_footer","test_footer","TestFooter","","","Проверка шрифта ссылки 'Условия пользования' в футере",""
"passed","Sat Sep 07 02:41:57 GMT 2024","Sat Sep 07 02:41:57 GMT 2024","76","tests.test_footer","test_footer","TestFooter","","","Проверка элемента 'info@pulsewave.ru'в хедере",""
"passed","Sat Sep 07 02:40:27 GMT 2024","Sat Sep 07 02:40:31 GMT 2024","4092","tests.test_api","test_api","TestAPI","","","POST Подтверждение смены почты пользователя. Токен получить из ссылки auth/change_email/{token}.",""
"passed","Sat Sep 07 02:42:32 GMT 2024","Sat Sep 07 02:42:32 GMT 2024","48","tests.test_footer","test_footer","TestFooter","","","Проверка цвета шрифта ссылки 'Условия пользования' в футере",""
"passed","Sat Sep 07 02:48:01 GMT 2024","Sat Sep 07 02:48:01 GMT 2024","41","tests.test_main_page","test_main_page","TestMainPage","","","Проверка текста элемента 'Одно приложениe для решения всех Ваших задач!'",""
"passed","Sat Sep 07 02:44:41 GMT 2024","Sat Sep 07 02:44:42 GMT 2024","86","tests.test_header","test_header","TestHeader","","","1.2 Проверка перехода на страницу 'https://pulsewave.ru/auth/signup' по кнопке 'Регистрация'",""
"passed","Sat Sep 07 02:46:19 GMT 2024","Sat Sep 07 02:46:19 GMT 2024","50","tests.test_login_page","test_login_page","TestLoginPage","","","Окно авторизации сообщение 'Забыли пароль?'",""
"broken","Sat Sep 07 02:51:15 GMT 2024","Sat Sep 07 02:51:15 GMT 2024","347","tests.test_workspace_page","test_workspace_page","TestWorkspacePage","","","Проверка что авторизованный пользователь может выйти из аккаунта",""
"passed","Sat Sep 07 02:45:34 GMT 2024","Sat Sep 07 02:45:34 GMT 2024","37","tests.test_header","test_header","TestHeader","","","Проверка цвета шрифта кнопки 'Регистрация в хедере https://pulsewave.ru/auth/password?email='",""
"passed","Sat Sep 07 02:50:22 GMT 2024","Sat Sep 07 02:50:22 GMT 2024","61","tests.test_signup_page","test_signup_page","TestSignupPage","","","1.28 Окно регистрации сообщение 'Регистрируясь, я соглашаюсь с Условиями пользования и Политикой конфиденциальности'",""
"passed","Sat Sep 07 02:50:54 GMT 2024","Sat Sep 07 02:50:54 GMT 2024","3","tests.test_workspace_page","test_workspace_page","TestWorkspacePage","","","Проверка перехода в рабочее пространство авторизованного пользователя",""
"passed","Sat Sep 07 02:44:16 GMT 2024","Sat Sep 07 02:44:16 GMT 2024","47","tests.test_header","test_header","TestHeader","","","Проверка текста кнопки 'Войти'",""
"passed","Sat Sep 07 02:39:11 GMT 2024","Sat Sep 07 02:39:13 GMT 2024","1817","tests.test_api","test_api","TestAPI","","","POST Создать Рабочее пространство",""
"passed","Sat Sep 07 02:44:50 GMT 2024","Sat Sep 07 02:44:50 GMT 2024","38","tests.test_header","test_header","TestHeader","","","Проверка размера шрифта кнопки 'Войти' в хедере https://pulsewave.ru/auth/password?email=",""
"passed","Sat Sep 07 02:44:24 GMT 2024","Sat Sep 07 02:44:24 GMT 2024","38","tests.test_header","test_header","TestHeader","","","Проверка текста кнопки 'Регистрация'",""
"passed","Sat Sep 07 02:36:09 GMT 2024","Sat Sep 07 02:36:10 GMT 2024","1723","tests.test_api","test_api","TestAPI","","","GET Получить список всех Рабочих пространств авторизованного пользователя",""
"passed","Sat Sep 07 02:47:11 GMT 2024","Sat Sep 07 02:47:11 GMT 2024","39","tests.test_main_page","test_main_page","TestMainPage","","","Проверка цвета шрифта элемента 'Самый высокий уровень бесперебойной работы!' в футере",""
"passed","Sat Sep 07 02:44:56 GMT 2024","Sat Sep 07 02:44:56 GMT 2024","37","tests.test_header","test_header","TestHeader","","","Проверка цвета шрифта кнопки 'Войти' в хедере https://pulsewave.ru/auth/signup",""
"passed","Sat Sep 07 02:44:27 GMT 2024","Sat Sep 07 02:44:27 GMT 2024","69","tests.test_header","test_header","TestHeader","","","Проверка перехода на страницу 'https://pulsewave.ru/auth/login' по кнопке 'Войти'",""
"passed","Sat Sep 07 02:44:21 GMT 2024","Sat Sep 07 02:44:21 GMT 2024","43","tests.test_header","test_header","TestHeader","","","Проверка текста кнопки 'Регистрация'",""
"passed","Sat Sep 07 02:46:13 GMT 2024","Sat Sep 07 02:46:16 GMT 2024","2856","tests.test_login_page","test_login_page","TestLoginPage","","","Авторизация с некорректным паролем",""
"passed","Sat Sep 07 02:42:06 GMT 2024","Sat Sep 07 02:42:06 GMT 2024","39","tests.test_footer","test_footer","TestFooter","","","Проверка года © PulseWave, 2024 в хедере",""
"passed","Sat Sep 07 02:50:28 GMT 2024","Sat Sep 07 02:50:28 GMT 2024","128","tests.test_signup_page","test_signup_page","TestSignupPage","","","1.30 Окно регистрации сообщение 'Регистрируясь, я соглашаюсь с Условиями пользования и Политикой конфиденциальности', проверка корректности перехода по ссылке 'Условиями пользования'",""
