"Status","Start Time","Stop Time","Duration in ms","Parent Suite","Suite","Sub Suite","Test Class","Test Method","Name","Description"
"passed","Wed Mar 06 18:40:03 GMT 2024","Wed Mar 06 18:40:11 GMT 2024","7509","tests.test_api","test_api","TestAPI","","","GET Список стикеров задачи",""
"passed","Wed Mar 06 18:44:35 GMT 2024","Wed Mar 06 18:44:35 GMT 2024","32","tests.test_footer","test_footer","TestFooter","","","Проверка шрифта надписи 'info@pulsewave.ru' в футере",""
"passed","Wed Mar 06 18:46:54 GMT 2024","Wed Mar 06 18:46:54 GMT 2024","33","tests.test_header","test_header","TestHeader","","","Проверка цвета шрифта кнопки 'Регистрация в хедере https://pulsewave.ru/auth/login'",""
"passed","Wed Mar 06 18:47:09 GMT 2024","Wed Mar 06 18:47:09 GMT 2024","35","tests.test_header","test_header","TestHeader","","","Проверка цвета кнопки 'Регистрация в хедере https://pulsewave.ru/home'",""
"passed","Wed Mar 06 18:46:00 GMT 2024","Wed Mar 06 18:46:00 GMT 2024","62","tests.test_header","test_header","TestHeader","","","1.2 Проверка перехода на страницу 'https://pulsewave.ru/auth/signup' по кнопке 'Регистрация'",""
"passed","Wed Mar 06 18:42:51 GMT 2024","Wed Mar 06 18:42:51 GMT 2024","231","tests.test_footer","test_footer","TestFooter","","","Проверка перехода на страницу c лицензионным соглашением со страницы 'https://pulsewave.ru/",""
"passed","Wed Mar 06 18:46:27 GMT 2024","Wed Mar 06 18:46:27 GMT 2024","33","tests.test_header","test_header","TestHeader","","","Проверка шрифта кнопки 'Войти' в хедере https://pulsewave.ru/auth/signup",""
"passed","Wed Mar 06 18:49:02 GMT 2024","Wed Mar 06 18:49:02 GMT 2024","32","tests.test_main_page","test_main_page","TestMainPage","","","Проверка шрифта элемента 'Одно приложениe для решения всех Ваших задач!' в футере",""
"passed","Wed Mar 06 18:44:29 GMT 2024","Wed Mar 06 18:44:29 GMT 2024","34","tests.test_footer","test_footer","TestFooter","","","Проверка шрифта надписи 'info@pulsewave.ru' в футере",""
"passed","Wed Mar 06 18:43:33 GMT 2024","Wed Mar 06 18:43:33 GMT 2024","34","tests.test_footer","test_footer","TestFooter","","","Проверка размера шрифта ссылки 'Условия пользования' в футере",""
"passed","Wed Mar 06 18:45:32 GMT 2024","Wed Mar 06 18:45:32 GMT 2024","35","tests.test_header","test_header","TestHeader","","","Проверка текста кнопки 'Войти'",""
"passed","Wed Mar 06 18:50:55 GMT 2024","Wed Mar 06 18:51:12 GMT 2024","17234","tests.test_signup_page","test_signup_page","TestSignupPage","","","1.23 Регистрация с корректными email и паролем без согласия на подписку",""
"passed","Wed Mar 06 18:44:38 GMT 2024","Wed Mar 06 18:44:38 GMT 2024","37","tests.test_footer","test_footer","TestFooter","","","Проверка размера шрифта надписи '© PulseWave, 2023-2024' в футере",""
"passed","Wed Mar 06 18:46:30 GMT 2024","Wed Mar 06 18:46:30 GMT 2024","33","tests.test_header","test_header","TestHeader","","","Проверка шрифта кнопки 'Войти' в хедере https://pulsewave.ru/auth/password?email=",""
"passed","Wed Mar 06 18:41:27 GMT 2024","Wed Mar 06 18:41:39 GMT 2024","11810","tests.test_api","test_api","TestAPI","","","POST Сброс пароля",""
"passed","Wed Mar 06 18:48:25 GMT 2024","Wed Mar 06 18:48:25 GMT 2024","34","tests.test_main_page","test_main_page","TestMainPage","","","Проверка цвета шрифта элемента 'Удобный и понятный интерфейс!' в футере",""
"passed","Wed Mar 06 18:43:27 GMT 2024","Wed Mar 06 18:43:27 GMT 2024","33","tests.test_footer","test_footer","TestFooter","","","Проверка размера шрифта ссылки 'Условия пользования' в футере",""
"passed","Wed Mar 06 18:43:51 GMT 2024","Wed Mar 06 18:43:51 GMT 2024","32","tests.test_footer","test_footer","TestFooter","","","Проверка шрифта ссылки 'Условия пользования' в футере",""
"passed","Wed Mar 06 18:48:22 GMT 2024","Wed Mar 06 18:48:22 GMT 2024","34","tests.test_main_page","test_main_page","TestMainPage","","","Проверка размера шрифта элемента 'Удобный и понятный интерфейс!' в футере",""
"passed","Wed Mar 06 18:41:00 GMT 2024","Wed Mar 06 18:41:01 GMT 2024","1437","tests.test_api","test_api","TestAPI","","","GET Получить данные авторизованного пользователя",""
"passed","Wed Mar 06 18:48:50 GMT 2024","Wed Mar 06 18:48:50 GMT 2024","33","tests.test_main_page","test_main_page","TestMainPage","","","Проверка цвета шрифта элемента 'Неограниченный функционал, понятный интерфейс и большое количество возможностей
помогут Вам улучшить рабочий процесс.' в футере",""
"passed","Wed Mar 06 18:52:00 GMT 2024","Wed Mar 06 18:52:00 GMT 2024","2","tests.test_workspace_page","test_workspace_page","TestWorkspacePage","","","Проверка заголовка рабочего пространства",""
"passed","Wed Mar 06 18:37:03 GMT 2024","Wed Mar 06 18:37:07 GMT 2024","3521","tests.test_api","test_api","TestAPI","","","POST Повторная отправка ссылки с приглашением пользователя",""
"passed","Wed Mar 06 18:49:29 GMT 2024","Wed Mar 06 18:49:29 GMT 2024","33","tests.test_password_recovery","test_password_recovery","TestPasswordRecoveryPage","","","Проверка размера шрифта заголовка 'Восстановление пароля'",""
"passed","Wed Mar 06 18:51:42 GMT 2024","Wed Mar 06 18:51:42 GMT 2024","310","tests.test_signup_page","test_signup_page","TestSignupPage","","","1.31- 1.34 Регистрация с корректным email и слабым паролем и подтверждением пароля",""
"passed","Wed Mar 06 18:40:11 GMT 2024","Wed Mar 06 18:40:18 GMT 2024","7228","tests.test_api","test_api","TestAPI","","","POST Создать стикер к задаче",""
"passed","Wed Mar 06 18:51:15 GMT 2024","Wed Mar 06 18:51:17 GMT 2024","2248","tests.test_signup_page","test_signup_page","TestSignupPage","","","1.24 Регистрация с корректным email и паролем и пустым подтверждением пароля",""
"passed","Wed Mar 06 18:40:25 GMT 2024","Wed Mar 06 18:40:33 GMT 2024","7689","tests.test_api","test_api","TestAPI","","","PUT Обновить стикер",""
"passed","Wed Mar 06 18:42:45 GMT 2024","Wed Mar 06 18:42:48 GMT 2024","2670","tests.test_footer","test_footer","TestFooter","","","Проверка попапа о принятии файлов cookie на странице https://pulsewave.ru/auth/password?email=",""
"passed","Wed Mar 06 18:37:16 GMT 2024","Wed Mar 06 18:37:17 GMT 2024","880","tests.test_api","test_api","TestAPI","","","POST Регистрация ранее зарегистрированного пользователя",""
"passed","Wed Mar 06 18:46:51 GMT 2024","Wed Mar 06 18:46:51 GMT 2024","38","tests.test_header","test_header","TestHeader","","","Проверка цвета шрифта кнопки 'Регистрация в хедере https://pulsewave.ru/home'",""
"passed","Wed Mar 06 18:37:33 GMT 2024","Wed Mar 06 18:37:50 GMT 2024","16435","tests.test_api","test_api","TestAPI","","","POST Подтверждение приглашения в РП",""
"passed","Wed Mar 06 18:50:08 GMT 2024","Wed Mar 06 18:50:25 GMT 2024","16456","tests.test_signup_page","test_signup_page","TestSignupPage","","","1.3, 1.3.1, 1.15 Регистрация с корректными email и паролем и с согласием на подписку",""
"passed","Wed Mar 06 18:43:30 GMT 2024","Wed Mar 06 18:43:30 GMT 2024","33","tests.test_footer","test_footer","TestFooter","","","Проверка размера шрифта ссылки 'Условия пользования' в футере",""
"passed","Wed Mar 06 18:44:11 GMT 2024","Wed Mar 06 18:44:11 GMT 2024","32","tests.test_footer","test_footer","TestFooter","","","Проверка размера шрифта надписи 'info@pulsewave.ru' в футере",""
"passed","Wed Mar 06 18:49:34 GMT 2024","Wed Mar 06 18:49:34 GMT 2024","32","tests.test_password_recovery","test_password_recovery","TestPasswordRecoveryPage","","","Проверка шрифта заголовка 'Восстановление пароля'",""
"passed","Wed Mar 06 18:49:42 GMT 2024","Wed Mar 06 18:49:44 GMT 2024","1682","tests.test_password_recovery","test_password_recovery","TestPasswordRecoveryPage","","","Проверить сообщение об отправке ссылки восстановления пароля на емайл",""
"passed","Wed Mar 06 18:39:06 GMT 2024","Wed Mar 06 18:39:15 GMT 2024","8470","tests.test_api","test_api","TestAPI","","","PATCH Частично обновить задачу","Перемещение между колонками возможно только PUT запросом"
"passed","Wed Mar 06 18:51:36 GMT 2024","Wed Mar 06 18:51:36 GMT 2024","88","tests.test_signup_page","test_signup_page","TestSignupPage","","","1.29 Окно регистрации сообщение 'Регистрируясь, я соглашаюсь с Условиями пользования и Политикой конфиденциальности' проверка корректности перехода по ссылке 'Политикой конфиденциальности'",""
"passed","Wed Mar 06 18:50:27 GMT 2024","Wed Mar 06 18:50:28 GMT 2024","306","tests.test_signup_page","test_signup_page","TestSignupPage","","","1.6 Регистрация с корректным email и не совпадающими паролем и подтверждением пароля",""
"passed","Wed Mar 06 18:38:09 GMT 2024","Wed Mar 06 18:38:12 GMT 2024","3177","tests.test_api","test_api","TestAPI","","","GET Список всех пользователей доски для назначения ответственных",""
"passed","Wed Mar 06 18:51:45 GMT 2024","Wed Mar 06 18:51:45 GMT 2024","277","tests.test_signup_page","test_signup_page","TestSignupPage","","","1.31- 1.34 Регистрация с корректным email и слабым паролем и подтверждением пароля",""
"passed","Wed Mar 06 18:38:21 GMT 2024","Wed Mar 06 18:38:26 GMT 2024","5738","tests.test_api","test_api","TestAPI","","","GET Информация о конкретной колонке",""
"passed","Wed Mar 06 18:47:29 GMT 2024","Wed Mar 06 18:47:29 GMT 2024","60","tests.test_login_page","test_login_page","TestLoginPage","","","Проверка редиректа на страницу восстановления пароля при клике на ссылку 'Забыли пароль?'",""
"passed","Wed Mar 06 18:45:17 GMT 2024","Wed Mar 06 18:45:17 GMT 2024","58","tests.test_header","test_header","TestHeader","","","1.13 Проверка редиректа на главную страницу при клике на логотип",""
"passed","Wed Mar 06 18:48:19 GMT 2024","Wed Mar 06 18:48:19 GMT 2024","33","tests.test_main_page","test_main_page","TestMainPage","","","Проверка цвета кнопки 'Зарегистрироваться'",""
"passed","Wed Mar 06 18:37:07 GMT 2024","Wed Mar 06 18:37:09 GMT 2024","2316","tests.test_api","test_api","TestAPI","","","POST Удаление приглашенного пользователей из РП","Удаление как из участников так и из приглашенных"
"passed","Wed Mar 06 18:46:03 GMT 2024","Wed Mar 06 18:46:03 GMT 2024","62","tests.test_header","test_header","TestHeader","","","1.2 Проверка перехода на страницу 'https://pulsewave.ru/auth/signup' по кнопке 'Регистрация'",""
"passed","Wed Mar 06 18:48:56 GMT 2024","Wed Mar 06 18:48:56 GMT 2024","34","tests.test_main_page","test_main_page","TestMainPage","","","Проверка размера шрифта элемента 'Одно приложениe для решения всех Ваших задач!' в футере",""
"passed","Wed Mar 06 18:45:26 GMT 2024","Wed Mar 06 18:45:26 GMT 2024","36","tests.test_header","test_header","TestHeader","","","Проверка текста кнопки 'Войти'",""
"passed","Wed Mar 06 18:38:04 GMT 2024","Wed Mar 06 18:38:08 GMT 2024","4074","tests.test_api","test_api","TestAPI","","","PATCH Частично обновить доску",""
"passed","Wed Mar 06 18:50:37 GMT 2024","Wed Mar 06 18:50:37 GMT 2024","32","tests.test_signup_page","test_signup_page","TestSignupPage","","","1.17-1.19 Проверка размера шрифта заголовка 'Регистрация'",""
"passed","Wed Mar 06 18:44:50 GMT 2024","Wed Mar 06 18:44:50 GMT 2024","33","tests.test_footer","test_footer","TestFooter","","","Проверка цвета шрифта надписи '© PulseWave, 2023-2024' в футере",""
"passed","Wed Mar 06 18:43:24 GMT 2024","Wed Mar 06 18:43:24 GMT 2024","35","tests.test_footer","test_footer","TestFooter","","","Проверка года © PulseWave, 2024 в хедере",""
"passed","Wed Mar 06 18:51:30 GMT 2024","Wed Mar 06 18:51:30 GMT 2024","56","tests.test_signup_page","test_signup_page","TestSignupPage","","","1.27 Окно регистрации сообщение 'Я согласен получать новости и обновления PulseWave'",""
"passed","Wed Mar 06 18:50:40 GMT 2024","Wed Mar 06 18:50:40 GMT 2024","32","tests.test_signup_page","test_signup_page","TestSignupPage","","","1.17-1.19 Проверка цвета шрифта заголовка 'Регистрация'",""
"passed","Wed Mar 06 18:47:15 GMT 2024","Wed Mar 06 18:47:15 GMT 2024","33","tests.test_header","test_header","TestHeader","","","Проверка цвета кнопки 'Регистрация в хедере https://pulsewave.ru/auth/password?email='",""
"passed","Wed Mar 06 18:50:31 GMT 2024","Wed Mar 06 18:50:31 GMT 2024","790","tests.test_signup_page","test_signup_page","TestSignupPage","","","1.11 Регистрация с уже зарегистрированным email и корректными паролем и подтверждением пароля",""
"passed","Wed Mar 06 18:44:56 GMT 2024","Wed Mar 06 18:44:56 GMT 2024","33","tests.test_footer","test_footer","TestFooter","","","Проверка цвета шрифта надписи '© PulseWave, 2023-2024' в футере",""
"passed","Wed Mar 06 18:46:48 GMT 2024","Wed Mar 06 18:46:48 GMT 2024","33","tests.test_header","test_header","TestHeader","","","Проверка размера шрифта кнопки 'Регистрация в хедере https://pulsewave.ru/auth/password?email='",""
"passed","Wed Mar 06 18:45:11 GMT 2024","Wed Mar 06 18:45:11 GMT 2024","33","tests.test_footer","test_footer","TestFooter","","","Проверка шрифта надписи '© PulseWave, 2023-2024' в футере",""
"passed","Wed Mar 06 18:43:00 GMT 2024","Wed Mar 06 18:43:00 GMT 2024","129","tests.test_footer","test_footer","TestFooter","","","Проверка перехода на страницу c лицензионным соглашением со страницы 'https://pulsewave.ru/auth/password?email=",""
"passed","Wed Mar 06 18:41:45 GMT 2024","Wed Mar 06 18:41:46 GMT 2024","410","tests.test_api","test_api","TestAPI","","","POST Регистрация пользователя без электронной почты",""
"passed","Wed Mar 06 18:44:41 GMT 2024","Wed Mar 06 18:44:41 GMT 2024","32","tests.test_footer","test_footer","TestFooter","","","Проверка размера шрифта надписи '© PulseWave, 2023-2024' в футере",""
"passed","Wed Mar 06 18:48:39 GMT 2024","Wed Mar 06 18:48:39 GMT 2024","35","tests.test_main_page","test_main_page","TestMainPage","","","Проверка размера шрифта элемента 'Ваша безопасность и конфиденциальность для нас на первом месте!' в футере",""
"passed","Wed Mar 06 18:46:57 GMT 2024","Wed Mar 06 18:46:57 GMT 2024","36","tests.test_header","test_header","TestHeader","","","Проверка цвета шрифта кнопки 'Регистрация в хедере https://pulsewave.ru/auth/password?email='",""
"passed","Wed Mar 06 18:46:09 GMT 2024","Wed Mar 06 18:46:09 GMT 2024","33","tests.test_header","test_header","TestHeader","","","Проверка размера шрифта кнопки 'Войти' в хедере https://pulsewave.ru/auth/signup",""
"passed","Wed Mar 06 18:41:02 GMT 2024","Wed Mar 06 18:41:05 GMT 2024","2611","tests.test_api","test_api","TestAPI","","","GET Получить данные авторизованного пользователя по id",""
"passed","Wed Mar 06 18:46:12 GMT 2024","Wed Mar 06 18:46:12 GMT 2024","34","tests.test_header","test_header","TestHeader","","","Проверка размера шрифта кнопки 'Войти' в хедере https://pulsewave.ru/auth/password?email=",""
"passed","Wed Mar 06 18:37:27 GMT 2024","Wed Mar 06 18:37:29 GMT 2024","2676","tests.test_api","test_api","TestAPI","","","PATCH Частично обновить данные РП (на данный момент только имя)",""
"passed","Wed Mar 06 18:42:57 GMT 2024","Wed Mar 06 18:42:57 GMT 2024","133","tests.test_footer","test_footer","TestFooter","","","Проверка перехода на страницу c лицензионным соглашением со страницы 'https://pulsewave.ru/auth/signup",""
"passed","Wed Mar 06 18:40:18 GMT 2024","Wed Mar 06 18:40:25 GMT 2024","7697","tests.test_api","test_api","TestAPI","","","GET Представление одного стикера",""
"passed","Wed Mar 06 18:49:26 GMT 2024","Wed Mar 06 18:49:26 GMT 2024","35","tests.test_password_recovery","test_password_recovery","TestPasswordRecoveryPage","","","Проверка текста заголовка 'Восстановление пароля'",""
"passed","Wed Mar 06 18:44:53 GMT 2024","Wed Mar 06 18:44:53 GMT 2024","33","tests.test_footer","test_footer","TestFooter","","","Проверка цвета шрифта надписи '© PulseWave, 2023-2024' в футере",""
"passed","Wed Mar 06 18:36:56 GMT 2024","Wed Mar 06 18:36:59 GMT 2024","3069","tests.test_api","test_api","TestAPI","","","POST Активация пользователя с корректными данными",""
"passed","Wed Mar 06 18:38:51 GMT 2024","Wed Mar 06 18:38:58 GMT 2024","7273","tests.test_api","test_api","TestAPI","","","GET Получение одной задачи",""
"passed","Wed Mar 06 18:37:13 GMT 2024","Wed Mar 06 18:37:16 GMT 2024","3082","tests.test_api","test_api","TestAPI","","","Проверка недействительности кеша рабочего пространства",""
"passed","Wed Mar 06 18:44:17 GMT 2024","Wed Mar 06 18:44:17 GMT 2024","33","tests.test_footer","test_footer","TestFooter","","","Проверка цвета шрифта надписи 'info@pulsewave.ru' в футере",""
"passed","Wed Mar 06 18:46:36 GMT 2024","Wed Mar 06 18:46:36 GMT 2024","33","tests.test_header","test_header","TestHeader","","","Проверка цвета кнопки 'Войти' в хедере https://pulsewave.ru/auth/signup",""
"passed","Wed Mar 06 18:46:42 GMT 2024","Wed Mar 06 18:46:42 GMT 2024","35","tests.test_header","test_header","TestHeader","","","Проверка размера шрифта кнопки 'Регистрация в хедере https://pulsewave.ru/home'",""
"passed","Wed Mar 06 18:47:06 GMT 2024","Wed Mar 06 18:47:06 GMT 2024","33","tests.test_header","test_header","TestHeader","","","Проверка шрифта кнопки 'Регистрация в хедере https://pulsewave.ru/auth/password?email='",""
"passed","Wed Mar 06 18:43:48 GMT 2024","Wed Mar 06 18:43:48 GMT 2024","34","tests.test_footer","test_footer","TestFooter","","","Проверка цвета шрифта ссылки 'Условия пользования' в футере",""
"passed","Wed Mar 06 18:47:36 GMT 2024","Wed Mar 06 18:47:38 GMT 2024","1760","tests.test_login_page","test_login_page","TestLoginPage","","","Авторизация с некорректным паролем",""
"passed","Wed Mar 06 18:47:58 GMT 2024","Wed Mar 06 18:47:58 GMT 2024","61","tests.test_main_page","test_main_page","TestMainPage","","","1.1 Проверка перехода на страницу https://pulsewave.ru/auth/signup по кнопке 'Зарегистрироваться'",""
"passed","Wed Mar 06 18:44:32 GMT 2024","Wed Mar 06 18:44:32 GMT 2024","32","tests.test_footer","test_footer","TestFooter","","","Проверка шрифта надписи 'info@pulsewave.ru' в футере",""
"passed","Wed Mar 06 18:39:40 GMT 2024","Wed Mar 06 18:39:41 GMT 2024","1362","tests.test_api","test_api","TestAPI","","","PATCH Отметить прочтение всех уведомлений",""
"passed","Wed Mar 06 18:45:57 GMT 2024","Wed Mar 06 18:45:57 GMT 2024","127","tests.test_header","test_header","TestHeader","","","1.2 Проверка перехода на страницу 'https://pulsewave.ru/auth/signup' по кнопке 'Регистрация'",""
"passed","Wed Mar 06 18:37:18 GMT 2024","Wed Mar 06 18:37:20 GMT 2024","2197","tests.test_api","test_api","TestAPI","","","GET Получить список всех Рабочих пространств авторизованного пользователя",""
"passed","Wed Mar 06 18:51:56 GMT 2024","Wed Mar 06 18:51:56 GMT 2024","2","tests.test_workspace_page","test_workspace_page","TestWorkspacePage","","","Проверка перехода в рабочее пространство авторизованного пользователя",""
"passed","Wed Mar 06 18:51:20 GMT 2024","Wed Mar 06 18:51:22 GMT 2024","2244","tests.test_signup_page","test_signup_page","TestSignupPage","","","1.25 Регистрация с корректным email и подтверждением пароля и пустым паролем",""
"passed","Wed Mar 06 18:41:10 GMT 2024","Wed Mar 06 18:41:12 GMT 2024","1333","tests.test_api","test_api","TestAPI","","","PUT Обновить все данные авторизованного пользователя me",""
"passed","Wed Mar 06 18:48:28 GMT 2024","Wed Mar 06 18:48:28 GMT 2024","34","tests.test_main_page","test_main_page","TestMainPage","","","Проверка шрифта элемента 'Удобный и понятный интерфейс!' в футере",""
"passed","Wed Mar 06 18:45:29 GMT 2024","Wed Mar 06 18:45:29 GMT 2024","35","tests.test_header","test_header","TestHeader","","","Проверка текста кнопки 'Войти'",""
"passed","Wed Mar 06 18:43:36 GMT 2024","Wed Mar 06 18:43:36 GMT 2024","33","tests.test_footer","test_footer","TestFooter","","","Проверка размера шрифта ссылки 'Условия пользования' в футере",""
"passed","Wed Mar 06 18:43:42 GMT 2024","Wed Mar 06 18:43:42 GMT 2024","33","tests.test_footer","test_footer","TestFooter","","","Проверка цвета шрифта ссылки 'Условия пользования' в футере",""
"passed","Wed Mar 06 18:41:46 GMT 2024","Wed Mar 06 18:41:46 GMT 2024","416","tests.test_api","test_api","TestAPI","","","POST Регистрация пользователя без пароля",""
"passed","Wed Mar 06 18:48:04 GMT 2024","Wed Mar 06 18:48:04 GMT 2024","34","tests.test_main_page","test_main_page","TestMainPage","","","Проверка цвета шрифта элемента 'PULSEWAVE'",""
"passed","Wed Mar 06 18:45:46 GMT 2024","Wed Mar 06 18:45:46 GMT 2024","59","tests.test_header","test_header","TestHeader","","","Проверка перехода на страницу 'https://pulsewave.ru/auth/login' по кнопке 'Войти'",""
"passed","Wed Mar 06 18:37:29 GMT 2024","Wed Mar 06 18:37:33 GMT 2024","3782","tests.test_api","test_api","TestAPI","","","DELETE Частично обновить данные РП (на данный момент только имя)",""
"passed","Wed Mar 06 18:40:48 GMT 2024","Wed Mar 06 18:40:56 GMT 2024","7666","tests.test_api","test_api","TestAPI","","","DELETE Удалить стикер",""
"passed","Wed Mar 06 18:41:24 GMT 2024","Wed Mar 06 18:41:27 GMT 2024","3370","tests.test_api","test_api","TestAPI","","","POST Подтверждение смены почты пользователя. Токен получить из ссылки auth/change_email/{token}.",""
"passed","Wed Mar 06 18:47:41 GMT 2024","Wed Mar 06 18:47:41 GMT 2024","47","tests.test_login_page","test_login_page","TestLoginPage","","","Окно авторизации сообщение 'Забыли пароль?'",""
"passed","Wed Mar 06 18:44:20 GMT 2024","Wed Mar 06 18:44:20 GMT 2024","33","tests.test_footer","test_footer","TestFooter","","","Проверка цвета шрифта надписи 'info@pulsewave.ru' в футере",""
