"Status","Start Time","Stop Time","Duration in ms","Parent Suite","Suite","Sub Suite","Test Class","Test Method","Name","Description"
"passed","Wed Mar 06 18:42:54 GMT 2024","Wed Mar 06 18:42:54 GMT 2024","131","tests.test_footer","test_footer","TestFooter","","","Проверка перехода на страницу c лицензионным соглашением со страницы 'https://pulsewave.ru/auth/login",""
"passed","Wed Mar 06 18:39:34 GMT 2024","Wed Mar 06 18:39:35 GMT 2024","1265","tests.test_api","test_api","TestAPI","","","POST index fixed",""
"passed","Wed Mar 06 18:41:08 GMT 2024","Wed Mar 06 18:41:10 GMT 2024","2630","tests.test_api","test_api","TestAPI","","","PATCH Частично обновить данные авторизованного пользователя",""
"passed","Wed Mar 06 18:41:58 GMT 2024","Wed Mar 06 18:42:12 GMT 2024","14467","tests.test_api","test_api","TestAPI","","","DELETE Активировать и удалить авторизованного пользователя",""
"passed","Wed Mar 06 18:39:15 GMT 2024","Wed Mar 06 18:39:22 GMT 2024","7469","tests.test_api","test_api","TestAPI","","","DELETE Удалить задачу",""
"passed","Wed Mar 06 18:39:32 GMT 2024","Wed Mar 06 18:39:34 GMT 2024","1392","tests.test_api","test_api","TestAPI","","","POST Создать Рабочее пространство",""
"passed","Wed Mar 06 18:39:22 GMT 2024","Wed Mar 06 18:39:28 GMT 2024","5841","tests.test_api","test_api","TestAPI","","","DELETE Удалить колонку",""
"passed","Wed Mar 06 18:36:44 GMT 2024","Wed Mar 06 18:36:56 GMT 2024","11987","tests.test_api","test_api","TestAPI","","","POST Создать пользователя с корректными данными",""
"passed","Wed Mar 06 18:48:07 GMT 2024","Wed Mar 06 18:48:07 GMT 2024","33","tests.test_main_page","test_main_page","TestMainPage","","","Проверка шрифта элемента 'PULSEWAVE'",""
"passed","Wed Mar 06 18:46:33 GMT 2024","Wed Mar 06 18:46:33 GMT 2024","35","tests.test_header","test_header","TestHeader","","","Проверка цвета кнопки 'Войти' в хедере https://pulsewave.ru/home",""
"passed","Wed Mar 06 18:45:14 GMT 2024","Wed Mar 06 18:45:14 GMT 2024","26","tests.test_header","test_header","TestHeader","","","Проверка некликабельности логотипа на Главной странице",""
"passed","Wed Mar 06 18:49:14 GMT 2024","Wed Mar 06 18:49:14 GMT 2024","37","tests.test_main_page","test_main_page","TestMainPage","","","Проверка текста элемента 'Самый высокий уровень бесперебойной работы!'",""
"passed","Wed Mar 06 18:38:08 GMT 2024","Wed Mar 06 18:38:09 GMT 2024","1417","tests.test_api","test_api","TestAPI","","","POST Создать доску без указания РП","Создание доски без указания РП, будет создано дефолтное РП для этой доски"
"passed","Wed Mar 06 18:48:47 GMT 2024","Wed Mar 06 18:48:48 GMT 2024","33","tests.test_main_page","test_main_page","TestMainPage","","","Проверка размера шрифта элемента 'Неограниченный функционал, понятный интерфейс и большое количество возможностей
помогут Вам улучшить рабочий процесс.' в футере",""
"passed","Wed Mar 06 18:43:09 GMT 2024","Wed Mar 06 18:43:09 GMT 2024","60","tests.test_footer","test_footer","TestFooter","","","Проверка элемента 'info@pulsewave.ru'в хедере",""
"passed","Wed Mar 06 18:49:05 GMT 2024","Wed Mar 06 18:49:05 GMT 2024","35","tests.test_main_page","test_main_page","TestMainPage","","","Проверка текста кнопки 'Зарегистрироваться'",""
"passed","Wed Mar 06 18:41:39 GMT 2024","Wed Mar 06 18:41:43 GMT 2024","3940","tests.test_api","test_api","TestAPI","","","POST Подтверждение сброса пароля. Когда пользователь переходит по ссылке     auth/password/reset/confirm/{uid}/{token}",""
"passed","Wed Mar 06 18:45:49 GMT 2024","Wed Mar 06 18:45:49 GMT 2024","62","tests.test_header","test_header","TestHeader","","","Проверка перехода на страницу 'https://pulsewave.ru/auth/login' по кнопке 'Войти'",""
"passed","Wed Mar 06 18:37:50 GMT 2024","Wed Mar 06 18:37:53 GMT 2024","3166","tests.test_api","test_api","TestAPI","","","GET Список всех досок указанного РП",""
"passed","Wed Mar 06 18:48:37 GMT 2024","Wed Mar 06 18:48:37 GMT 2024","34","tests.test_main_page","test_main_page","TestMainPage","","","Проверка шрифта элемента 'Самый высокий уровень бесперебойной работы!' в футере",""
"passed","Wed Mar 06 18:51:39 GMT 2024","Wed Mar 06 18:51:39 GMT 2024","96","tests.test_signup_page","test_signup_page","TestSignupPage","","","1.30 Окно регистрации сообщение 'Регистрируясь, я соглашаюсь с Условиями пользования и Политикой конфиденциальности', проверка корректности перехода по ссылке 'Условиями пользования'",""
"passed","Wed Mar 06 18:47:44 GMT 2024","Wed Mar 06 18:47:45 GMT 2024","1227","tests.test_login_page","test_login_page","TestLoginPage","","","Авторизация с некорректным емайл",""
"passed","Wed Mar 06 18:49:11 GMT 2024","Wed Mar 06 18:49:11 GMT 2024","38","tests.test_main_page","test_main_page","TestMainPage","","","Проверка текста элемента 'Удобный и понятный интерфейс!'",""
"passed","Wed Mar 06 18:38:33 GMT 2024","Wed Mar 06 18:38:39 GMT 2024","5863","tests.test_api","test_api","TestAPI","","","PATCH Частично обновить колонку (название/порядковый номер)",""
