"DESCRIPTION","DURATION IN MS","NAME","PARENT SUITE","START TIME","STATUS","STOP TIME","SUB SUITE","SUITE","TEST CLASS","TEST METHOD"
"","529","H.8 Проверка цвета кнопки 'Регистрация в хедере https://app.pulsewave.ru/auth/login'","tests.ui_tests","Fri Nov 28 04:02:23 UTC 2025","passed","Fri Nov 28 04:02:23 UTC 2025","TestHeader","header_test","",""
"","557","A.30 POST Создать пользователя с некорректными данными","tests.api_tests","Fri Nov 28 03:45:35 UTC 2025","passed","Fri Nov 28 03:45:36 UTC 2025","TestAPI","api_test","",""
"","641","W.11 Проверка видимости уведомлений","tests.ui_tests","Fri Nov 28 04:06:44 UTC 2025","passed","Fri Nov 28 04:06:45 UTC 2025","TestWorkspacePage","workspace_page_test","",""
"","159","W.10 Проверка цвета переключателя 'Непрочитанные'","tests.ui_tests","Fri Nov 28 04:06:39 UTC 2025","passed","Fri Nov 28 04:06:39 UTC 2025","TestWorkspacePage","workspace_page_test","",""
"","11716","A.21 POST Подтверждение смены почты пользователя. Токен из ссылки auth/change_email/{token}.","tests.api_tests","Fri Nov 28 03:43:59 UTC 2025","passed","Fri Nov 28 03:44:10 UTC 2025","TestAPI","api_test","",""
"","42","F.2 Проверка отсутствия ссылки на Лицензионное соглашение со страницы 'https://app.pulsewave.ru/auth/login","tests.ui_tests","Fri Nov 28 03:48:03 UTC 2025","passed","Fri Nov 28 03:48:03 UTC 2025","TestFooter","footer_test","",""
"","42","F.6 Проверка шрифта надписи '© PulseWave, 2023-2025' в футере","tests.ui_tests","Fri Nov 28 03:57:34 UTC 2025","passed","Fri Nov 28 03:57:34 UTC 2025","TestFooter","footer_test","",""
"","8383","S.1 Регистрация с корректными email и паролем и с согласием на подписку","tests.ui_tests","Fri Nov 28 04:04:18 UTC 2025","passed","Fri Nov 28 04:04:26 UTC 2025","TestSignupPage","signup_page_test","",""
"","44","F.2 Проверка отсутствия ссылки на Лицензионное соглашение со страницы 'https://app.pulsewave.ru/auth/signup","tests.ui_tests","Fri Nov 28 03:48:06 UTC 2025","passed","Fri Nov 28 03:48:06 UTC 2025","TestFooter","footer_test","",""
"","58","F.8 Проверка кликабельности значка LinkedIn на странице 'https://app.pulsewave.ru/auth/login' в футере","tests.ui_tests","Fri Nov 28 03:59:49 UTC 2025","passed","Fri Nov 28 03:59:49 UTC 2025","TestFooter","footer_test","",""
"","68","F.8 Проверка кликабельности значка LinkedIn на странице 'https://pulsewave.ru/' в футере","tests.ui_tests","Fri Nov 28 03:59:46 UTC 2025","passed","Fri Nov 28 03:59:46 UTC 2025","TestFooter","footer_test","",""
"","24813","R.5 Восстановить пароль на корректный емайл","tests.ui_tests","Fri Nov 28 04:03:47 UTC 2025","passed","Fri Nov 28 04:04:12 UTC 2025","TestPasswordRecoveryPage","password_recovery_test","",""
"","553","A.27 POST Регистрация пользователя без пароля","tests.api_tests","Fri Nov 28 03:45:10 UTC 2025","passed","Fri Nov 28 03:45:10 UTC 2025","TestAPI","api_test","",""
"","537","H.4 Проверка текста кнопки 'Регистрация'","tests.ui_tests","Fri Nov 28 04:01:30 UTC 2025","passed","Fri Nov 28 04:01:30 UTC 2025","TestHeader","header_test","",""
"","108","F.3 Проверка элемента 'info@pulsewave.ru'в хедере","tests.ui_tests","Fri Nov 28 03:49:11 UTC 2025","passed","Fri Nov 28 03:49:11 UTC 2025","TestFooter","footer_test","",""
"","2079","F.1 Проверка попапа о принятии файлов cookie на странице https://app.pulsewave.ru/auth/password?email=","tests.ui_tests","Fri Nov 28 03:46:56 UTC 2025","passed","Fri Nov 28 03:46:58 UTC 2025","TestFooter","footer_test","",""
"","1237","W.12 Проверка прочтения уведомлений","tests.ui_tests","Fri Nov 28 04:06:50 UTC 2025","passed","Fri Nov 28 04:06:51 UTC 2025","TestWorkspacePage","workspace_page_test","",""
"","51","M.3 Проверка текста кнопки 'Войти' на лендинге","tests.ui_tests","Fri Nov 28 04:02:35 UTC 2025","passed","Fri Nov 28 04:02:35 UTC 2025","TestLendingPage","lending_test","",""
"","2818","A.15 GET Список всех пользователей доски для назначения ответственных","tests.api_tests","Fri Nov 28 03:43:49 UTC 2025","passed","Fri Nov 28 03:43:51 UTC 2025","TestAPI","api_test","",""
"","30","H.4 Проверка текста кнопки 'Регистрация'","tests.ui_tests","Fri Nov 28 04:01:27 UTC 2025","passed","Fri Nov 28 04:01:27 UTC 2025","TestHeader","header_test","",""
"","34","H.7 Проверка цвета кнопки 'Войти' в хедере https://app.pulsewave.ru/auth/password?email=","tests.ui_tests","Fri Nov 28 04:02:05 UTC 2025","passed","Fri Nov 28 04:02:05 UTC 2025","TestHeader","header_test","",""
"","543","R.2 Проверка цвета шрифта заголовка 'Восстановление пароля'","tests.ui_tests","Fri Nov 28 04:03:30 UTC 2025","passed","Fri Nov 28 04:03:31 UTC 2025","TestPasswordRecoveryPage","password_recovery_test","",""
"","2223","L.8 Авторизация с пустым емайл","tests.ui_tests","Fri Nov 28 04:03:10 UTC 2025","passed","Fri Nov 28 04:03:12 UTC 2025","TestLoginPage","login_page_test","",""
"","3083","A.11 PATCH Частично обновить данные РП (на данный момент только имя)","tests.api_tests","Fri Nov 28 03:43:31 UTC 2025","passed","Fri Nov 28 03:43:34 UTC 2025","TestAPI","api_test","",""
"","1747","H.2 Проверка редиректа на главную страницу при клике на логотип","tests.ui_tests","Fri Nov 28 04:01:13 UTC 2025","passed","Fri Nov 28 04:01:15 UTC 2025","TestHeader","header_test","",""
"","3626","A.12 DELETE Удалить РП","tests.api_tests","Fri Nov 28 03:43:34 UTC 2025","passed","Fri Nov 28 03:43:38 UTC 2025","TestAPI","api_test","",""
"","43","F.4 Проверка года © PulseWave, 2025 в футере","tests.ui_tests","Fri Nov 28 03:50:24 UTC 2025","passed","Fri Nov 28 03:50:24 UTC 2025","TestFooter","footer_test","",""
"","91","F.3 Проверка элемента 'info@pulsewave.ru'в хедере","tests.ui_tests","Fri Nov 28 03:49:19 UTC 2025","passed","Fri Nov 28 03:49:19 UTC 2025","TestFooter","footer_test","",""
"","32","H.8 Проверка шрифта кнопки 'Регистрация в хедере https://app.pulsewave.ru/auth/password?email='","tests.ui_tests","Fri Nov 28 04:02:20 UTC 2025","passed","Fri Nov 28 04:02:20 UTC 2025","TestHeader","header_test","",""
"","560","F.8 Проверка кликабельности значка LinkedIn на странице 'https://app.pulsewave.ru/auth/signup' в футере","tests.ui_tests","Fri Nov 28 03:59:51 UTC 2025","passed","Fri Nov 28 03:59:52 UTC 2025","TestFooter","footer_test","",""
"","43","F.5 Проверка шрифта надписи 'info@pulsewave.ru' в футере","tests.ui_tests","Fri Nov 28 03:53:56 UTC 2025","passed","Fri Nov 28 03:53:56 UTC 2025","TestFooter","footer_test","",""
"","548","F.5 Проверка шрифта надписи 'info@pulsewave.ru' в футере","tests.ui_tests","Fri Nov 28 03:53:59 UTC 2025","passed","Fri Nov 28 03:53:59 UTC 2025","TestFooter","footer_test","",""
"","11","F.7 Проверка значка LinkedIn на странице 'https://app.pulsewave.ru/auth/password?email=' в футере","tests.ui_tests","Fri Nov 28 03:58:44 UTC 2025","passed","Fri Nov 28 03:58:44 UTC 2025","TestFooter","footer_test","",""
"","1383","Проверка доступности https://pulsewave.ru/","tests.api_tests","Fri Nov 28 03:45:39 UTC 2025","passed","Fri Nov 28 03:45:40 UTC 2025","TestAvailability","availability_test","",""
"","529","H.7 Проверка цвета кнопки 'Войти' в хедере https://app.pulsewave.ru/auth/signup","tests.ui_tests","Fri Nov 28 04:02:01 UTC 2025","passed","Fri Nov 28 04:02:02 UTC 2025","TestHeader","header_test","",""
"","794","S.16 Регистрация с корректным email и слабым паролем и подтверждением пароля","tests.ui_tests","Fri Nov 28 04:05:38 UTC 2025","passed","Fri Nov 28 04:05:39 UTC 2025","TestSignupPage","signup_page_test","",""
"","1226","R.6 Восстановить пароль на некорректный емайл","tests.ui_tests","Fri Nov 28 04:04:14 UTC 2025","passed","Fri Nov 28 04:04:16 UTC 2025","TestPasswordRecoveryPage","password_recovery_test","",""
"","37","F.6 Проверка шрифта надписи '© PulseWave, 2023-2025' в футере","tests.ui_tests","Fri Nov 28 03:57:31 UTC 2025","passed","Fri Nov 28 03:57:31 UTC 2025","TestFooter","footer_test","",""
"","692","Проверка доступности https://app.pulsewave.ru/","tests.api_tests","Fri Nov 28 03:45:40 UTC 2025","passed","Fri Nov 28 03:45:41 UTC 2025","TestAvailability","availability_test","",""
"","1665","A.20 POST Запрос на смену почты","tests.api_tests","Fri Nov 28 03:43:57 UTC 2025","passed","Fri Nov 28 03:43:59 UTC 2025","TestAPI","api_test","",""
"","1438","A.16 POST Создать Рабочее пространство","tests.api_tests","Fri Nov 28 03:43:51 UTC 2025","passed","Fri Nov 28 03:43:53 UTC 2025","TestAPI","api_test","",""
"","566","A.30 POST Создать пользователя с некорректными данными","tests.api_tests","Fri Nov 28 03:45:34 UTC 2025","passed","Fri Nov 28 03:45:35 UTC 2025","TestAPI","api_test","",""
"","545","S.5 Проверка шрифта заголовка 'Регистрация'","tests.ui_tests","Fri Nov 28 04:04:45 UTC 2025","passed","Fri Nov 28 04:04:45 UTC 2025","TestSignupPage","signup_page_test","",""
"","32","H.7 Проверка шрифта кнопки 'Войти' в хедере https://app.pulsewave.ru/auth/password?email=","tests.ui_tests","Fri Nov 28 04:01:59 UTC 2025","passed","Fri Nov 28 04:01:59 UTC 2025","TestHeader","header_test","",""
"","2090","F.1 Проверка попапа о принятии файлов cookie на странице https://app.pulsewave.ru/auth/signup","tests.ui_tests","Fri Nov 28 03:46:54 UTC 2025","passed","Fri Nov 28 03:46:56 UTC 2025","TestFooter","footer_test","",""
"","606","H.5 Проверка перехода на страницу 'https://app.pulsewave.ru/auth/login' по кнопке 'Войти'","tests.ui_tests","Fri Nov 28 04:01:36 UTC 2025","passed","Fri Nov 28 04:01:37 UTC 2025","TestHeader","header_test","",""
"","42","S.4 Проверка текста заголовка 'Регистрация'","tests.ui_tests","Fri Nov 28 04:04:37 UTC 2025","passed","Fri Nov 28 04:04:37 UTC 2025","TestSignupPage","signup_page_test","",""
"","545","R.2 Проверка размера шрифта заголовка 'Восстановление пароля'","tests.ui_tests","Fri Nov 28 04:03:28 UTC 2025","passed","Fri Nov 28 04:03:28 UTC 2025","TestPasswordRecoveryPage","password_recovery_test","",""
"","2107","F.1 Проверка попапа о принятии файлов cookie на странице https://app.pulsewave.ru/auth/login","tests.ui_tests","Fri Nov 28 03:46:51 UTC 2025","passed","Fri Nov 28 03:46:53 UTC 2025","TestFooter","footer_test","",""
"","26","H.8 Проверка размера шрифта кнопки 'Регистрация в хедере https://app.pulsewave.ru/auth/login'","tests.ui_tests","Fri Nov 28 04:02:07 UTC 2025","passed","Fri Nov 28 04:02:07 UTC 2025","TestHeader","header_test","",""
"","52","F.5 Проверка шрифта надписи 'info@pulsewave.ru' в футере","tests.ui_tests","Fri Nov 28 03:53:53 UTC 2025","passed","Fri Nov 28 03:53:54 UTC 2025","TestFooter","footer_test","",""
"","1433","A.19 GET Получить данные авторизованного пользователя me","tests.api_tests","Fri Nov 28 03:43:56 UTC 2025","passed","Fri Nov 28 03:43:57 UTC 2025","TestAPI","api_test","",""
"","40","F.6 Проверка размера шрифта надписи '© PulseWave, 2023-2025' в футере","tests.ui_tests","Fri Nov 28 03:55:07 UTC 2025","passed","Fri Nov 28 03:55:07 UTC 2025","TestFooter","footer_test","",""
"","549","F.4 Проверка года © PulseWave, 2025 в футере","tests.ui_tests","Fri Nov 28 03:50:26 UTC 2025","passed","Fri Nov 28 03:50:27 UTC 2025","TestFooter","footer_test","",""
"","3","W.4 Проверка что авторизованный пользователь попадает в Рабочие пространства","tests.ui_tests","Fri Nov 28 04:06:04 UTC 2025","passed","Fri Nov 28 04:06:04 UTC 2025","TestWorkspacePage","workspace_page_test","",""
"","518","F.7 Проверка значка LinkedIn на странице 'https://app.pulsewave.ru/auth/signup' в футере","tests.ui_tests","Fri Nov 28 03:58:41 UTC 2025","passed","Fri Nov 28 03:58:41 UTC 2025","TestFooter","footer_test","",""
"","24","H.7 Проверка цвета шрифта кнопки 'Войти' в хедере https://app.pulsewave.ru/auth/signup","tests.ui_tests","Fri Nov 28 04:01:51 UTC 2025","passed","Fri Nov 28 04:01:51 UTC 2025","TestHeader","header_test","",""
"","2765","S.10 Регистрация с корректным email и подтверждением пароля и пустым паролем","tests.ui_tests","Fri Nov 28 04:05:24 UTC 2025","passed","Fri Nov 28 04:05:27 UTC 2025","TestSignupPage","signup_page_test","",""
"","1484","W.6 Проверка перехода в Рабочие пространства по ссылке На главную","tests.ui_tests","Fri Nov 28 04:06:16 UTC 2025","passed","Fri Nov 28 04:06:17 UTC 2025","TestWorkspacePage","workspace_page_test","",""
"","43","F.5 Проверка размера шрифта надписи 'info@pulsewave.ru' в футере","tests.ui_tests","Fri Nov 28 03:51:40 UTC 2025","passed","Fri Nov 28 03:51:41 UTC 2025","TestFooter","footer_test","",""
"Удаление как из участников так и из приглашенных","2452","A.6 POST Удаление приглашенного пользователей из РП","tests.api_tests","Fri Nov 28 03:43:23 UTC 2025","passed","Fri Nov 28 03:43:25 UTC 2025","TestAPI","api_test","",""
"","580","H.6 Проверка перехода на страницу 'https://app.pulsewave.ru/auth/signup' по кнопке 'Регистрация'","tests.ui_tests","Fri Nov 28 04:01:40 UTC 2025","passed","Fri Nov 28 04:01:40 UTC 2025","TestHeader","header_test","",""
"","808","A.8 POST Создать пару токенов access и refresh","tests.api_tests","Fri Nov 28 03:43:26 UTC 2025","passed","Fri Nov 28 03:43:27 UTC 2025","TestAPI","api_test","",""
"","55","F.8 Проверка кликабельности значка LinkedIn на странице 'https://app.pulsewave.ru/auth/password?email=' в футере","tests.ui_tests","Fri Nov 28 03:59:54 UTC 2025","passed","Fri Nov 28 03:59:55 UTC 2025","TestFooter","footer_test","",""
"","320","S.7 Регистрация с некорректным email и сильным паролем и подтверждением пароля","tests.ui_tests","Fri Nov 28 04:04:54 UTC 2025","passed","Fri Nov 28 04:04:55 UTC 2025","TestSignupPage","signup_page_test","",""
"","568","S.12 Окно регистрации сообщение 'Я согласен получать новости и обновления PulseWave'","tests.ui_tests","Fri Nov 28 04:05:35 UTC 2025","passed","Fri Nov 28 04:05:35 UTC 2025","TestSignupPage","signup_page_test","",""
"","10","W.3 Проверка видимости аватара","tests.ui_tests","Fri Nov 28 04:05:59 UTC 2025","passed","Fri Nov 28 04:05:59 UTC 2025","TestWorkspacePage","workspace_page_test","",""
"","528","H.8 Проверка шрифта кнопки 'Регистрация в хедере https://app.pulsewave.ru/auth/login'","tests.ui_tests","Fri Nov 28 04:02:17 UTC 2025","passed","Fri Nov 28 04:02:18 UTC 2025","TestHeader","header_test","",""
"","1914","H.2 Проверка редиректа на главную страницу при клике на логотип","tests.ui_tests","Fri Nov 28 04:01:08 UTC 2025","passed","Fri Nov 28 04:01:10 UTC 2025","TestHeader","header_test","",""
"","2714","L.8 Авторизация с пустым паролем","tests.ui_tests","Fri Nov 28 04:03:14 UTC 2025","passed","Fri Nov 28 04:03:17 UTC 2025","TestLoginPage","login_page_test","",""
"","1016","A.2 POST Создать пользователя с корректными данными","tests.api_tests","Fri Nov 28 03:42:48 UTC 2025","passed","Fri Nov 28 03:42:49 UTC 2025","TestAPI","api_test","",""
"","4570","A.5 POST Повторная отправка ссылки с приглашением пользователя","tests.api_tests","Fri Nov 28 03:43:18 UTC 2025","passed","Fri Nov 28 03:43:23 UTC 2025","TestAPI","api_test","",""
"","720","A.1 GET Проверка доступности API","tests.api_tests","Fri Nov 28 03:42:47 UTC 2025","passed","Fri Nov 28 03:42:48 UTC 2025","TestAPI","api_test","",""
