"DESCRIPTION","DURATION IN MS","NAME","PARENT SUITE","START TIME","STATUS","STOP TIME","SUB SUITE","SUITE","TEST CLASS","TEST METHOD"
"","58","F.2 Проверка отсутствия ссылки на Лицензионное соглашение со страницы 'https://app.pulsewave.ru/auth/login","tests.ui_tests","Mon Nov 24 03:58:37 UTC 2025","passed","Mon Nov 24 03:58:37 UTC 2025","TestFooter","footer_test","",""
"","551","S.4 Проверка текста заголовка 'Регистрация'","tests.ui_tests","Mon Nov 24 04:14:59 UTC 2025","passed","Mon Nov 24 04:14:59 UTC 2025","TestSignupPage","signup_page_test","",""
"","1877","L.4 Авторизация с корректными данными","tests.ui_tests","Mon Nov 24 04:13:20 UTC 2025","passed","Mon Nov 24 04:13:22 UTC 2025","TestLoginPage","login_page_test","",""
"","919","A.8 POST Создать пару токенов access и refresh","tests.api_tests","Mon Nov 24 03:55:13 UTC 2025","passed","Mon Nov 24 03:55:14 UTC 2025","TestAPI","api_test","",""
"","1734","A.25 DELETE Удалить авторизованного пользователя","tests.api_tests","Mon Nov 24 03:55:54 UTC 2025","passed","Mon Nov 24 03:55:56 UTC 2025","TestAPI","api_test","",""
"","44","F.5 Проверка размера шрифта надписи 'info@pulsewave.ru' в футере","tests.ui_tests","Mon Nov 24 04:02:14 UTC 2025","passed","Mon Nov 24 04:02:14 UTC 2025","TestFooter","footer_test","",""
"","570","F.9 Проверка перехода в LinkedIn на странице 'https://app.pulsewave.ru/auth/signup' в футере","tests.ui_tests","Mon Nov 24 04:11:33 UTC 2025","passed","Mon Nov 24 04:11:33 UTC 2025","TestFooter","footer_test","",""
"","2232","L.8 Авторизация с пустым емайл","tests.ui_tests","Mon Nov 24 04:13:34 UTC 2025","passed","Mon Nov 24 04:13:36 UTC 2025","TestLoginPage","login_page_test","",""
"","45","F.2 Проверка отсутствия ссылки на Лицензионное соглашение со страницы 'https://app.pulsewave.ru/auth/password?email=","tests.ui_tests","Mon Nov 24 03:58:43 UTC 2025","passed","Mon Nov 24 03:58:43 UTC 2025","TestFooter","footer_test","",""
"","12438","S.1 Регистрация с корректными email и паролем и с согласием на подписку","tests.ui_tests","Mon Nov 24 04:14:37 UTC 2025","passed","Mon Nov 24 04:14:49 UTC 2025","TestSignupPage","signup_page_test","",""
"","2842","M.1 Проверка редиректа с /home на страницу лендинга","tests.ui_tests","Mon Nov 24 04:12:56 UTC 2025","passed","Mon Nov 24 04:12:59 UTC 2025","TestLendingPage","lending_test","",""
"","94","F.3 Проверка элемента 'info@pulsewave.ru'в хедере","tests.ui_tests","Mon Nov 24 03:59:48 UTC 2025","passed","Mon Nov 24 03:59:48 UTC 2025","TestFooter","footer_test","",""
"","2247","L.8 Авторизация с пустым паролем","tests.ui_tests","Mon Nov 24 04:13:39 UTC 2025","passed","Mon Nov 24 04:13:41 UTC 2025","TestLoginPage","login_page_test","",""
"","751","A.1 GET Проверка доступности API","tests.api_tests","Mon Nov 24 03:54:48 UTC 2025","passed","Mon Nov 24 03:54:49 UTC 2025","TestAPI","api_test","",""
"","628","Проверка доступности https://app.pulsewave.ru/","tests.api_tests","Mon Nov 24 03:56:16 UTC 2025","passed","Mon Nov 24 03:56:16 UTC 2025","TestAvailability","availability_test","",""
"","37","R.2 Проверка размера шрифта заголовка 'Восстановление пароля'","tests.ui_tests","Mon Nov 24 04:13:50 UTC 2025","passed","Mon Nov 24 04:13:50 UTC 2025","TestPasswordRecoveryPage","password_recovery_test","",""
"","1220","Проверка доступности https://pulsewave.ru/","tests.api_tests","Mon Nov 24 03:56:15 UTC 2025","passed","Mon Nov 24 03:56:16 UTC 2025","TestAvailability","availability_test","",""
"","502","A.26 POST Регистрация пользователя без электронной почты","tests.api_tests","Mon Nov 24 03:55:56 UTC 2025","passed","Mon Nov 24 03:55:56 UTC 2025","TestAPI","api_test","",""
"","16338","R.5 Восстановить пароль на корректный емайл","tests.ui_tests","Mon Nov 24 04:14:14 UTC 2025","passed","Mon Nov 24 04:14:31 UTC 2025","TestPasswordRecoveryPage","password_recovery_test","",""
"","530","H.7 Проверка цвета шрифта кнопки 'Войти' в хедере https://app.pulsewave.ru/auth/signup","tests.ui_tests","Mon Nov 24 04:12:20 UTC 2025","passed","Mon Nov 24 04:12:21 UTC 2025","TestHeader","header_test","",""
"","3047","A.12 DELETE Удалить РП","tests.api_tests","Mon Nov 24 03:55:22 UTC 2025","passed","Mon Nov 24 03:55:25 UTC 2025","TestAPI","api_test","",""
"","1338","L.5 Авторизация с некорректным паролем","tests.ui_tests","Mon Nov 24 04:13:24 UTC 2025","passed","Mon Nov 24 04:13:26 UTC 2025","TestLoginPage","login_page_test","",""
"","824","S.16 Регистрация с корректным email и слабым паролем и подтверждением пароля","tests.ui_tests","Mon Nov 24 04:15:54 UTC 2025","passed","Mon Nov 24 04:15:55 UTC 2025","TestSignupPage","signup_page_test","",""
"","9259","R.4 Проверить сообщение об отправке ссылки восстановления пароля на емайл","tests.ui_tests","Mon Nov 24 04:14:03 UTC 2025","passed","Mon Nov 24 04:14:12 UTC 2025","TestPasswordRecoveryPage","password_recovery_test","",""
"","1269","W.12 Проверка прочтения уведомлений","tests.ui_tests","Mon Nov 24 04:16:59 UTC 2025","passed","Mon Nov 24 04:17:00 UTC 2025","TestWorkspacePage","workspace_page_test","",""
"Удаление как из участников так и из приглашенных","2122","A.6 POST Удаление приглашенного пользователей из РП","tests.api_tests","Mon Nov 24 03:55:11 UTC 2025","passed","Mon Nov 24 03:55:13 UTC 2025","TestAPI","api_test","",""
"","41","F.6 Проверка шрифта надписи '© PulseWave, 2023-2025' в футере","tests.ui_tests","Mon Nov 24 04:08:00 UTC 2025","passed","Mon Nov 24 04:08:00 UTC 2025","TestFooter","footer_test","",""
"","2975","A.21 POST Подтверждение смены почты пользователя. Токен из ссылки auth/change_email/{token}.","tests.api_tests","Mon Nov 24 03:55:42 UTC 2025","passed","Mon Nov 24 03:55:45 UTC 2025","TestAPI","api_test","",""
"","50","F.4 Проверка года © PulseWave, 2025 в футере","tests.ui_tests","Mon Nov 24 04:01:04 UTC 2025","passed","Mon Nov 24 04:01:04 UTC 2025","TestFooter","footer_test","",""
"","1981","F.1 Проверка попапа о принятии файлов cookie на странице https://app.pulsewave.ru/auth/password?email=","tests.ui_tests","Mon Nov 24 03:57:31 UTC 2025","passed","Mon Nov 24 03:57:33 UTC 2025","TestFooter","footer_test","",""
"","1081","H.5 Проверка перехода на страницу 'https://app.pulsewave.ru/auth/login' по кнопке 'Войти'","tests.ui_tests","Mon Nov 24 04:12:02 UTC 2025","passed","Mon Nov 24 04:12:03 UTC 2025","TestHeader","header_test","",""
"","325","W.8 Проверка невидимости кнопки 'Отметить все как прочитанные' в прочитанных уведомлениях","tests.ui_tests","Mon Nov 24 04:16:37 UTC 2025","passed","Mon Nov 24 04:16:37 UTC 2025","TestWorkspacePage","workspace_page_test","",""
"","25","H.8 Проверка цвета кнопки 'Регистрация в хедере https://app.pulsewave.ru/auth/login'","tests.ui_tests","Mon Nov 24 04:12:54 UTC 2025","passed","Mon Nov 24 04:12:54 UTC 2025","TestHeader","header_test","",""
"","25","H.8 Проверка цвета шрифта кнопки 'Регистрация в хедере https://app.pulsewave.ru/auth/login'","tests.ui_tests","Mon Nov 24 04:12:43 UTC 2025","passed","Mon Nov 24 04:12:43 UTC 2025","TestHeader","header_test","",""
"","39","L.2 Проверка размера шрифта заголовка 'Войти'","tests.ui_tests","Mon Nov 24 04:13:10 UTC 2025","passed","Mon Nov 24 04:13:10 UTC 2025","TestLoginPage","login_page_test","",""
"","9082","S.8 Регистрация с корректными email и паролем без согласия на подписку","tests.ui_tests","Mon Nov 24 04:15:19 UTC 2025","passed","Mon Nov 24 04:15:28 UTC 2025","TestSignupPage","signup_page_test","",""
"","25","H.8 Проверка шрифта кнопки 'Регистрация в хедере https://app.pulsewave.ru/auth/login'","tests.ui_tests","Mon Nov 24 04:12:48 UTC 2025","passed","Mon Nov 24 04:12:48 UTC 2025","TestHeader","header_test","",""
"","54","F.4 Проверка года © PulseWave, 2025 в футере","tests.ui_tests","Mon Nov 24 04:00:56 UTC 2025","passed","Mon Nov 24 04:00:56 UTC 2025","TestFooter","footer_test","",""
"","981","A.2 POST Создать пользователя с корректными данными","tests.api_tests","Mon Nov 24 03:54:49 UTC 2025","passed","Mon Nov 24 03:54:50 UTC 2025","TestAPI","api_test","",""
"","46","F.5 Проверка шрифта надписи 'info@pulsewave.ru' в футере","tests.ui_tests","Mon Nov 24 04:04:33 UTC 2025","passed","Mon Nov 24 04:04:33 UTC 2025","TestFooter","footer_test","",""
"","1614","A.20 POST Запрос на смену почты","tests.api_tests","Mon Nov 24 03:55:40 UTC 2025","passed","Mon Nov 24 03:55:42 UTC 2025","TestAPI","api_test","",""
"","569","S.12 Окно регистрации сообщение 'Я согласен получать новости и обновления PulseWave'","tests.ui_tests","Mon Nov 24 04:15:45 UTC 2025","passed","Mon Nov 24 04:15:46 UTC 2025","TestSignupPage","signup_page_test","",""
"","543","F.2 Проверка отсутствия ссылки на Лицензионное соглашение со страницы 'https://app.pulsewave.ru/auth/signup","tests.ui_tests","Mon Nov 24 03:58:39 UTC 2025","passed","Mon Nov 24 03:58:40 UTC 2025","TestFooter","footer_test","",""
"","1737","H.2 Проверка редиректа на главную страницу при клике на логотип","tests.ui_tests","Mon Nov 24 04:11:47 UTC 2025","passed","Mon Nov 24 04:11:49 UTC 2025","TestHeader","header_test","",""
"","511","A.30 POST Создать пользователя с некорректными данными","tests.api_tests","Mon Nov 24 03:56:11 UTC 2025","passed","Mon Nov 24 03:56:12 UTC 2025","TestAPI","api_test","",""
"","518","A.7 POST Регистрация ранее зарегистрированного пользователя","tests.api_tests","Mon Nov 24 03:55:13 UTC 2025","passed","Mon Nov 24 03:55:13 UTC 2025","TestAPI","api_test","",""
"","10","F.7 Проверка значка LinkedIn на странице 'https://app.pulsewave.ru/auth/password?email=' в футере","tests.ui_tests","Mon Nov 24 04:09:15 UTC 2025","passed","Mon Nov 24 04:09:15 UTC 2025","TestFooter","footer_test","",""
"","90","F.3 Проверка элемента 'info@pulsewave.ru'в хедере","tests.ui_tests","Mon Nov 24 03:59:51 UTC 2025","passed","Mon Nov 24 03:59:52 UTC 2025","TestFooter","footer_test","",""
"","38","H.4 Проверка текста кнопки 'Регистрация'","tests.ui_tests","Mon Nov 24 04:12:00 UTC 2025","passed","Mon Nov 24 04:12:00 UTC 2025","TestHeader","header_test","",""
"","2762","S.11 Регистрация с пустым email и сильным паролем и подтверждением пароля","tests.ui_tests","Mon Nov 24 04:15:40 UTC 2025","passed","Mon Nov 24 04:15:43 UTC 2025","TestSignupPage","signup_page_test","",""
"","1934","F.1 Проверка попапа о принятии файлов cookie на странице https://app.pulsewave.ru/auth/signup","tests.ui_tests","Mon Nov 24 03:57:28 UTC 2025","passed","Mon Nov 24 03:57:30 UTC 2025","TestFooter","footer_test","",""
"","52","F.5 Проверка шрифта надписи 'info@pulsewave.ru' в футере","tests.ui_tests","Mon Nov 24 04:04:27 UTC 2025","passed","Mon Nov 24 04:04:27 UTC 2025","TestFooter","footer_test","",""
"","45","L.1 Проверка текста заголовка 'Войти'","tests.ui_tests","Mon Nov 24 04:13:07 UTC 2025","passed","Mon Nov 24 04:13:07 UTC 2025","TestLoginPage","login_page_test","",""
"","47","F.6 Проверка цвета шрифта надписи '© PulseWave, 2023-2025' в футере","tests.ui_tests","Mon Nov 24 04:06:50 UTC 2025","passed","Mon Nov 24 04:06:50 UTC 2025","TestFooter","footer_test","",""
"","3160","A.23 POST Подтверждение сброса пароля. Когда пользователь переходит по ссылке     auth/password/reset/confirm/{uid}/{token}","tests.api_tests","Mon Nov 24 03:55:46 UTC 2025","passed","Mon Nov 24 03:55:49 UTC 2025","TestAPI","api_test","",""
"","2080","R.3  Проверка некликабельности кнопки 'Продолжить'","tests.ui_tests","Mon Nov 24 04:13:58 UTC 2025","passed","Mon Nov 24 04:14:00 UTC 2025","TestPasswordRecoveryPage","password_recovery_test","",""
"","510","A.30 POST Создать пользователя с некорректными данными","tests.api_tests","Mon Nov 24 03:56:12 UTC 2025","passed","Mon Nov 24 03:56:12 UTC 2025","TestAPI","api_test","",""
"","40","L.2 Проверка цвета шрифта заголовка 'Войти'","tests.ui_tests","Mon Nov 24 04:13:12 UTC 2025","passed","Mon Nov 24 04:13:12 UTC 2025","TestLoginPage","login_page_test","",""
"","1445","A.19 GET Получить данные авторизованного пользователя me","tests.api_tests","Mon Nov 24 03:55:39 UTC 2025","passed","Mon Nov 24 03:55:40 UTC 2025","TestAPI","api_test","",""
"","48","L.2 Проверка шрифта заголовка 'Войти'","tests.ui_tests","Mon Nov 24 04:13:14 UTC 2025","passed","Mon Nov 24 04:13:14 UTC 2025","TestLoginPage","login_page_test","",""
"","45","F.6 Проверка размера шрифта надписи '© PulseWave, 2023-2025' в футере","tests.ui_tests","Mon Nov 24 04:05:38 UTC 2025","passed","Mon Nov 24 04:05:38 UTC 2025","TestFooter","footer_test","",""
"","1830","L.9 Авторизация с логином заглавными буквами","tests.ui_tests","Mon Nov 24 04:13:43 UTC 2025","passed","Mon Nov 24 04:13:45 UTC 2025","TestLoginPage","login_page_test","",""
"","2252","F.1 Проверка попапа о принятии файлов cookie на странице https://app.pulsewave.ru/auth/login","tests.ui_tests","Mon Nov 24 03:57:26 UTC 2025","passed","Mon Nov 24 03:57:28 UTC 2025","TestFooter","footer_test","",""
"","11","F.7 Проверка значка LinkedIn на странице 'https://pulsewave.ru/' в футере","tests.ui_tests","Mon Nov 24 04:09:08 UTC 2025","passed","Mon Nov 24 04:09:08 UTC 2025","TestFooter","footer_test","",""
"","12924","A.29 DELETE Активировать и удалить авторизованного пользователя","tests.api_tests","Mon Nov 24 03:55:58 UTC 2025","passed","Mon Nov 24 03:56:10 UTC 2025","TestAPI","api_test","",""
"","3","W.2 Проверка заголовка рабочего пространства","tests.ui_tests","Mon Nov 24 04:16:04 UTC 2025","passed","Mon Nov 24 04:16:04 UTC 2025","TestWorkspacePage","workspace_page_test","",""
"","639","Проверка доступности https://api.dev.pulsewave.ru/api/healthcheck/","tests.api_tests","Mon Nov 24 03:56:14 UTC 2025","passed","Mon Nov 24 03:56:15 UTC 2025","TestAvailability","availability_test","",""
"","2227","H.2 Проверка редиректа на главную страницу при клике на логотип","tests.ui_tests","Mon Nov 24 04:11:42 UTC 2025","passed","Mon Nov 24 04:11:44 UTC 2025","TestHeader","header_test","",""
"","551","F.5 Проверка размера шрифта надписи 'info@pulsewave.ru' в футере","tests.ui_tests","Mon Nov 24 04:02:11 UTC 2025","passed","Mon Nov 24 04:02:11 UTC 2025","TestFooter","footer_test","",""
"","563","F.6 Проверка цвета шрифта надписи '© PulseWave, 2023-2025' в футере","tests.ui_tests","Mon Nov 24 04:06:55 UTC 2025","passed","Mon Nov 24 04:06:56 UTC 2025","TestFooter","footer_test","",""
"","530","H.7 Проверка размера шрифта кнопки 'Войти' в хедере https://app.pulsewave.ru/auth/signup","tests.ui_tests","Mon Nov 24 04:12:15 UTC 2025","passed","Mon Nov 24 04:12:16 UTC 2025","TestHeader","header_test","",""
"","7","W.3 Проверка видимости аватара","tests.ui_tests","Mon Nov 24 04:16:09 UTC 2025","passed","Mon Nov 24 04:16:09 UTC 2025","TestWorkspacePage","workspace_page_test","",""
"","587","H.6 Проверка перехода на страницу 'https://app.pulsewave.ru/auth/signup' по кнопке 'Регистрация'","tests.ui_tests","Mon Nov 24 04:12:09 UTC 2025","passed","Mon Nov 24 04:12:10 UTC 2025","TestHeader","header_test","",""
