"Status","Start Time","Stop Time","Duration in ms","Parent Suite","Suite","Sub Suite","Test Class","Test Method","Name","Description"
"passed","Mon Aug 18 11:49:22 GMT 2025","Mon Aug 18 11:49:29 GMT 2025","7008","tests.api_tests","api_test","TestAPI","","","A.4 POST Пригласить пользователя по email","Пользователи добавляются по одному. Если пользователя не существует, он будет создан"
"passed","Mon Aug 18 11:55:10 GMT 2025","Mon Aug 18 11:55:21 GMT 2025","10675","tests.ui_tests","signup_page_test","TestSignupPage","","","S.8 Регистрация с корректными email и паролем без согласия на подписку",""
"passed","Mon Aug 18 11:52:49 GMT 2025","Mon Aug 18 11:52:50 GMT 2025","1339","tests.ui_tests","login_page_test","TestLoginPage","","","L.7 Авторизация с некорректным емайл",""
"passed","Mon Aug 18 11:55:43 GMT 2025","Mon Aug 18 11:55:44 GMT 2025","576","tests.ui_tests","signup_page_test","TestSignupPage","","","S.12 Окно регистрации сообщение 'Я согласен получать новости и обновления PulseWave'",""
"passed","Mon Aug 18 11:57:21 GMT 2025","Mon Aug 18 11:57:22 GMT 2025","1139","tests.ui_tests","workspace_page_test","TestWorkspacePage","","","W.11 Проверка видимости уведомлений",""
"passed","Mon Aug 18 11:54:48 GMT 2025","Mon Aug 18 11:54:48 GMT 2025","44","tests.ui_tests","signup_page_test","TestSignupPage","","","S.5 Проверка цвета шрифта заголовка 'Регистрация'",""
"skipped","Mon Aug 18 11:55:44 GMT 2025","Mon Aug 18 11:55:44 GMT 2025","0","tests.ui_tests","signup_page_test","TestSignupPage","","","S.13 Окно регистрации сообщение 'Регистрируясь, я соглашаюсь с Условиями пользования и Политикой конфиденциальности'",""
"passed","Mon Aug 18 11:50:41 GMT 2025","Mon Aug 18 11:50:42 GMT 2025","1018","tests.api_tests","api_test","TestAPI","","","A.27 POST Регистрация пользователя без пароля",""
"passed","Mon Aug 18 11:51:27 GMT 2025","Mon Aug 18 11:51:30 GMT 2025","2389","tests.ui_tests","header_test","TestHeader","","","H.2 Проверка редиректа на главную страницу при клике на логотип",""
"passed","Mon Aug 18 11:54:08 GMT 2025","Mon Aug 18 11:54:09 GMT 2025","1265","tests.ui_tests","password_recovery_test","TestPasswordRecoveryPage","","","R.6 Восстановить пароль на некорректный емайл",""
"passed","Mon Aug 18 11:50:42 GMT 2025","Mon Aug 18 11:50:43 GMT 2025","1047","tests.api_tests","api_test","TestAPI","","","A.28 POST Регистрация пользователя без подтверждения подписки",""
"passed","Mon Aug 18 11:56:33 GMT 2025","Mon Aug 18 11:56:35 GMT 2025","2022","tests.ui_tests","workspace_page_test","TestWorkspacePage","","","W.5 Проверка что авторизованный пользователь может выйти из аккаунта",""
"passed","Mon Aug 18 11:52:44 GMT 2025","Mon Aug 18 11:52:44 GMT 2025","70","tests.ui_tests","login_page_test","TestLoginPage","","","L.6 Окно авторизации сообщение 'Забыли пароль?'",""
"passed","Mon Aug 18 11:55:25 GMT 2025","Mon Aug 18 11:55:27 GMT 2025","2309","tests.ui_tests","signup_page_test","TestSignupPage","","","S.9 Регистрация с корректным email и паролем и пустым подтверждением пароля",""
"passed","Mon Aug 18 11:51:06 GMT 2025","Mon Aug 18 11:51:07 GMT 2025","776","tests.api_tests","api_test","TestAPI","","","A.30 POST Создать пользователя с некорректными данными",""
"passed","Mon Aug 18 11:50:38 GMT 2025","Mon Aug 18 11:50:40 GMT 2025","2081","tests.api_tests","api_test","TestAPI","","","A.25 DELETE Удалить авторизованного пользователя",""
"passed","Mon Aug 18 11:49:42 GMT 2025","Mon Aug 18 11:49:46 GMT 2025","3654","tests.api_tests","api_test","TestAPI","","","A.10 GET Информация о конкретном рабочем пространстве",""
"passed","Mon Aug 18 11:52:27 GMT 2025","Mon Aug 18 11:52:27 GMT 2025","615","tests.ui_tests","login_page_test","TestLoginPage","","","L.3 Проверка редиректа на страницу восстановления пароля при клике на ссылку 'Забыли пароль?'",""
"passed","Mon Aug 18 11:51:39 GMT 2025","Mon Aug 18 11:51:43 GMT 2025","3607","tests.ui_tests","header_test","TestHeader","","","H.5 Проверка перехода на страницу 'https://app.dev.pulsewave.ru/auth/login' по кнопке 'Войти'",""
"passed","Mon Aug 18 11:51:51 GMT 2025","Mon Aug 18 11:51:52 GMT 2025","625","tests.ui_tests","header_test","TestHeader","","","H.5 Проверка перехода на страницу 'https://app.dev.pulsewave.ru/auth/login' по кнопке 'Войти'",""
"passed","Mon Aug 18 11:53:43 GMT 2025","Mon Aug 18 11:53:51 GMT 2025","8182","tests.ui_tests","password_recovery_test","TestPasswordRecoveryPage","","","R.4 Проверить сообщение об отправке ссылки восстановления пароля на емайл",""
"passed","Mon Aug 18 11:53:10 GMT 2025","Mon Aug 18 11:53:15 GMT 2025","4515","tests.ui_tests","main_page_test","TestMainPage","","","Проверка редиректа с /home на Главную страницу",""
"passed","Mon Aug 18 11:50:10 GMT 2025","Mon Aug 18 11:50:12 GMT 2025","1862","tests.api_tests","api_test","TestAPI","","","A.17 GET Получить список всех пользователей для поиска",""
"passed","Mon Aug 18 11:49:39 GMT 2025","Mon Aug 18 11:49:40 GMT 2025","1437","tests.api_tests","api_test","TestAPI","","","A.8 POST Создать пару токенов access и refresh",""
"passed","Mon Aug 18 11:49:18 GMT 2025","Mon Aug 18 11:49:22 GMT 2025","4174","tests.api_tests","api_test","TestAPI","","","A.3 POST Активация пользователя с корректными данными",""
"passed","Mon Aug 18 11:52:18 GMT 2025","Mon Aug 18 11:52:18 GMT 2025","40","tests.ui_tests","login_page_test","TestLoginPage","","","L.2 Проверка цвета шрифта заголовка 'Войти'",""
"skipped","Mon Aug 18 11:51:15 GMT 2025","Mon Aug 18 11:51:15 GMT 2025","63","tests.ui_tests","header_test","TestHeader","","","H.1 Проверка некликабельности логотипа на лендинге",""
"passed","Mon Aug 18 11:54:30 GMT 2025","Mon Aug 18 11:54:30 GMT 2025","355","tests.ui_tests","signup_page_test","TestSignupPage","","","S.2 Регистрация с корректным email и не совпадающими паролем и подтверждением пароля",""
"passed","Mon Aug 18 11:54:56 GMT 2025","Mon Aug 18 11:54:57 GMT 2025","863","tests.ui_tests","signup_page_test","TestSignupPage","","","S.6 Окно регистрации сообщение 'Слабый пароль. Пароль должен содержать минимум 8 символов, включая буквы и цифры'",""
"passed","Mon Aug 18 11:51:06 GMT 2025","Mon Aug 18 11:51:06 GMT 2025","791","tests.api_tests","api_test","TestAPI","","","A.30 POST Создать пользователя с некорректными данными",""
"passed","Mon Aug 18 11:56:51 GMT 2025","Mon Aug 18 11:56:51 GMT 2025","35","tests.ui_tests","workspace_page_test","TestWorkspacePage","","","W.7 Проверка видимости заголовка 'Ваши рабочие пространства'",""
"passed","Mon Aug 18 11:52:01 GMT 2025","Mon Aug 18 11:52:01 GMT 2025","621","tests.ui_tests","header_test","TestHeader","","","H.6 Проверка перехода на страницу 'https://app.dev.pulsewave.ru/auth/signup' по кнопке 'Регистрация'",""
"passed","Mon Aug 18 11:49:17 GMT 2025","Mon Aug 18 11:49:18 GMT 2025","1276","tests.api_tests","api_test","TestAPI","","","A.2 POST Создать пользователя с корректными данными",""
"passed","Mon Aug 18 11:56:11 GMT 2025","Mon Aug 18 11:56:11 GMT 2025","4","tests.ui_tests","workspace_page_test","TestWorkspacePage","","","W.2 Проверка заголовка рабочего пространства",""
"passed","Mon Aug 18 11:57:06 GMT 2025","Mon Aug 18 11:57:07 GMT 2025","1252","tests.ui_tests","workspace_page_test","TestWorkspacePage","","","W.9 Проверка возможности изменить цвет переключателя 'Непрочитанные'",""
"passed","Mon Aug 18 11:50:04 GMT 2025","Mon Aug 18 11:50:08 GMT 2025","3780","tests.api_tests","api_test","TestAPI","","","A.15 GET Список всех пользователей доски для назначения ответственных",""
"passed","Mon Aug 18 11:50:08 GMT 2025","Mon Aug 18 11:50:10 GMT 2025","1855","tests.api_tests","api_test","TestAPI","","","A.16 POST Создать Рабочее пространство",""
"passed","Mon Aug 18 11:53:37 GMT 2025","Mon Aug 18 11:53:39 GMT 2025","2086","tests.ui_tests","password_recovery_test","TestPasswordRecoveryPage","","","R.3  Проверка некликабельности кнопки 'Продолжить'",""
"passed","Mon Aug 18 11:53:19 GMT 2025","Mon Aug 18 11:53:19 GMT 2025","42","tests.ui_tests","password_recovery_test","TestPasswordRecoveryPage","","","R.1 Проверка текста заголовка 'Восстановление пароля'",""
"passed","Mon Aug 18 11:53:56 GMT 2025","Mon Aug 18 11:54:04 GMT 2025","7796","tests.ui_tests","password_recovery_test","TestPasswordRecoveryPage","","","R.5 Восстановить пароль на корректный емайл",""
"passed","Mon Aug 18 11:51:56 GMT 2025","Mon Aug 18 11:51:57 GMT 2025","603","tests.ui_tests","header_test","TestHeader","","","H.6 Проверка перехода на страницу 'https://app.dev.pulsewave.ru/auth/signup' по кнопке 'Регистрация'",""
"passed","Mon Aug 18 11:56:18 GMT 2025","Mon Aug 18 11:56:18 GMT 2025","520","tests.ui_tests","workspace_page_test","TestWorkspacePage","","","W.3 Проверка видимости аватара",""
"passed","Mon Aug 18 11:51:20 GMT 2025","Mon Aug 18 11:51:23 GMT 2025","2393","tests.ui_tests","header_test","TestHeader","","","H.2 Проверка редиректа на главную страницу при клике на логотип",""
"passed","Mon Aug 18 11:56:04 GMT 2025","Mon Aug 18 11:56:04 GMT 2025","3","tests.ui_tests","workspace_page_test","TestWorkspacePage","","","W.1 Проверка перехода в рабочее пространство авторизованного пользователя",""
"passed","Mon Aug 18 11:55:31 GMT 2025","Mon Aug 18 11:55:34 GMT 2025","2301","tests.ui_tests","signup_page_test","TestSignupPage","","","S.10 Регистрация с корректным email и подтверждением пароля и пустым паролем",""
"passed","Mon Aug 18 11:50:15 GMT 2025","Mon Aug 18 11:50:17 GMT 2025","2120","tests.api_tests","api_test","TestAPI","","","A.20 POST Запрос на смену почты",""
"passed","Mon Aug 18 11:56:26 GMT 2025","Mon Aug 18 11:56:26 GMT 2025","3","tests.ui_tests","workspace_page_test","TestWorkspacePage","","","W.4 Проверка что авторизованный пользователь попадает в Рабочие пространства",""
"passed","Mon Aug 18 11:54:52 GMT 2025","Mon Aug 18 11:54:52 GMT 2025","573","tests.ui_tests","signup_page_test","TestSignupPage","","","S.5 Проверка шрифта заголовка 'Регистрация'",""
"skipped","Mon Aug 18 11:55:44 GMT 2025","Mon Aug 18 11:55:44 GMT 2025","0","tests.ui_tests","signup_page_test","TestSignupPage","","","S.14 Окно регистрации сообщение 'Регистрируясь, я соглашаюсь с Условиями пользования и Политикой конфиденциальности' проверка корректности перехода по ссылке 'Политикой конфиденциальности'",""
"passed","Mon Aug 18 11:50:12 GMT 2025","Mon Aug 18 11:50:13 GMT 2025","1836","tests.api_tests","api_test","TestAPI","","","A.18 POST Обновить JWT refresh token авторизованного пользователя",""
"passed","Mon Aug 18 11:52:13 GMT 2025","Mon Aug 18 11:52:13 GMT 2025","42","tests.ui_tests","login_page_test","TestLoginPage","","","L.2 Проверка размера шрифта заголовка 'Войти'",""
"passed","Mon Aug 18 11:49:15 GMT 2025","Mon Aug 18 11:49:17 GMT 2025","1166","tests.api_tests","api_test","TestAPI","","","A.1 GET Проверка доступности API",""
"passed","Mon Aug 18 11:53:07 GMT 2025","Mon Aug 18 11:53:10 GMT 2025","3294","tests.ui_tests","login_page_test","TestLoginPage","","","L.9 Авторизация с логином заглавными буквами",""
"skipped","Mon Aug 18 11:55:44 GMT 2025","Mon Aug 18 11:55:44 GMT 2025","0","tests.ui_tests","signup_page_test","TestSignupPage","","","S.15 Окно регистрации сообщение 'Регистрируясь, я соглашаюсь с Условиями пользования и Политикой конфиденциальности', проверка корректности перехода по ссылке 'Условиями пользования'",""
"passed","Mon Aug 18 11:57:30 GMT 2025","Mon Aug 18 11:57:30 GMT 2025","742","tests.ui_tests","workspace_page_test","TestWorkspacePage","","","W.12 Проверка прочтения уведомлений",""
"passed","Mon Aug 18 11:52:55 GMT 2025","Mon Aug 18 11:52:57 GMT 2025","2225","tests.ui_tests","login_page_test","TestLoginPage","","","L.8 Авторизация с пустым емайл",""
"passed","Mon Aug 18 11:53:33 GMT 2025","Mon Aug 18 11:53:33 GMT 2025","39","tests.ui_tests","password_recovery_test","TestPasswordRecoveryPage","","","R.2 Проверка шрифта заголовка 'Восстановление пароля'",""
"passed","Mon Aug 18 11:49:46 GMT 2025","Mon Aug 18 11:49:50 GMT 2025","3657","tests.api_tests","api_test","TestAPI","","","A.11 PATCH Частично обновить данные РП (на данный момент только имя)",""
"passed","Mon Aug 18 11:57:14 GMT 2025","Mon Aug 18 11:57:14 GMT 2025","174","tests.ui_tests","workspace_page_test","TestWorkspacePage","","","W.10 Проверка цвета переключателя 'Непрочитанные'",""
"passed","Mon Aug 18 11:51:47 GMT 2025","Mon Aug 18 11:51:47 GMT 2025","636","tests.ui_tests","header_test","TestHeader","","","H.5 Проверка перехода на страницу 'https://app.dev.pulsewave.ru/auth/login' по кнопке 'Войти'",""
"passed","Mon Aug 18 11:52:38 GMT 2025","Mon Aug 18 11:52:40 GMT 2025","1873","tests.ui_tests","login_page_test","TestLoginPage","","","L.5 Авторизация с некорректным паролем",""
"passed","Mon Aug 18 11:55:52 GMT 2025","Mon Aug 18 11:55:52 GMT 2025","825","tests.ui_tests","signup_page_test","TestSignupPage","","","S.16 Регистрация с корректным email и слабым паролем и подтверждением пароля",""
"passed","Mon Aug 18 11:49:38 GMT 2025","Mon Aug 18 11:49:39 GMT 2025","784","tests.api_tests","api_test","TestAPI","","","A.7 POST Регистрация ранее зарегистрированного пользователя",""
"passed","Mon Aug 18 11:52:09 GMT 2025","Mon Aug 18 11:52:09 GMT 2025","43","tests.ui_tests","login_page_test","TestLoginPage","","","L.1 Проверка текста заголовка 'Войти'",""
"passed","Mon Aug 18 11:54:39 GMT 2025","Mon Aug 18 11:54:39 GMT 2025","43","tests.ui_tests","signup_page_test","TestSignupPage","","","S.4 Проверка текста заголовка 'Регистрация'",""
"passed","Mon Aug 18 11:51:05 GMT 2025","Mon Aug 18 11:51:06 GMT 2025","783","tests.api_tests","api_test","TestAPI","","","A.30 POST Создать пользователя с некорректными данными",""
"passed","Mon Aug 18 11:56:58 GMT 2025","Mon Aug 18 11:56:59 GMT 2025","261","tests.ui_tests","workspace_page_test","TestWorkspacePage","","","W.8 Проверка невидимости кнопки 'Отметить все как прочитанные' в прочитанных уведомлениях",""
"passed","Mon Aug 18 11:49:50 GMT 2025","Mon Aug 18 11:49:54 GMT 2025","4210","tests.api_tests","api_test","TestAPI","","","A.12 DELETE Удалить РП",""
"passed","Mon Aug 18 11:50:43 GMT 2025","Mon Aug 18 11:51:05 GMT 2025","21910","tests.api_tests","api_test","TestAPI","","","A.29 DELETE Активировать и удалить авторизованного пользователя",""
"passed","Mon Aug 18 11:49:40 GMT 2025","Mon Aug 18 11:49:42 GMT 2025","2410","tests.api_tests","api_test","TestAPI","","","A.9 GET Получить список всех Рабочих пространств авторизованного пользователя",""
"passed","Mon Aug 18 11:50:31 GMT 2025","Mon Aug 18 11:50:38 GMT 2025","6424","tests.api_tests","api_test","TestAPI","","","A.24 POST Установить новый пароль. Используется в личном кабинете после авторизации.",""
"passed","Mon Aug 18 11:55:05 GMT 2025","Mon Aug 18 11:55:06 GMT 2025","345","tests.ui_tests","signup_page_test","TestSignupPage","","","S.7 Регистрация с некорректным email и сильным паролем и подтверждением пароля",""
"passed","Mon Aug 18 11:54:44 GMT 2025","Mon Aug 18 11:54:44 GMT 2025","40","tests.ui_tests","signup_page_test","TestSignupPage","","","S.5 Проверка размера шрифта заголовка 'Регистрация'",""
"passed","Mon Aug 18 11:50:25 GMT 2025","Mon Aug 18 11:50:26 GMT 2025","1873","tests.api_tests","api_test","TestAPI","","","A.22 POST Сброс пароля",""
"passed","Mon Aug 18 11:56:42 GMT 2025","Mon Aug 18 11:56:44 GMT 2025","2004","tests.ui_tests","workspace_page_test","TestWorkspacePage","","","W.6 Проверка перехода в Рабочие пространства по ссылке На главную",""
"passed","Mon Aug 18 11:53:24 GMT 2025","Mon Aug 18 11:53:24 GMT 2025","43","tests.ui_tests","password_recovery_test","TestPasswordRecoveryPage","","","R.2 Проверка размера шрифта заголовка 'Восстановление пароля'",""
"passed","Mon Aug 18 11:49:35 GMT 2025","Mon Aug 18 11:49:38 GMT 2025","3091","tests.api_tests","api_test","TestAPI","","","A.6 POST Удаление приглашенного пользователей из РП","Удаление как из участников так и из приглашенных"
"passed","Mon Aug 18 11:55:56 GMT 2025","Mon Aug 18 11:55:57 GMT 2025","835","tests.ui_tests","signup_page_test","TestSignupPage","","","S.16 Регистрация с корректным email и слабым паролем и подтверждением пароля",""
"passed","Mon Aug 18 11:54:33 GMT 2025","Mon Aug 18 11:54:35 GMT 2025","1385","tests.ui_tests","signup_page_test","TestSignupPage","","","S.3 Регистрация с уже зарегистрированным email и корректными паролем и подтверждением пароля",""
"passed","Mon Aug 18 11:52:31 GMT 2025","Mon Aug 18 11:52:34 GMT 2025","2881","tests.ui_tests","login_page_test","TestLoginPage","","","L.4 Авторизация с корректными данными",""
"passed","Mon Aug 18 11:49:54 GMT 2025","Mon Aug 18 11:50:02 GMT 2025","8078","tests.api_tests","api_test","TestAPI","","","A.13 POST Подтверждение приглашения в РП",""
"passed","Mon Aug 18 11:54:14 GMT 2025","Mon Aug 18 11:54:25 GMT 2025","11321","tests.ui_tests","signup_page_test","TestSignupPage","","","S.1 Регистрация с корректными email и паролем и с согласием на подписку",""
"passed","Mon Aug 18 11:53:29 GMT 2025","Mon Aug 18 11:53:29 GMT 2025","39","tests.ui_tests","password_recovery_test","TestPasswordRecoveryPage","","","R.2 Проверка цвета шрифта заголовка 'Восстановление пароля'",""
"passed","Mon Aug 18 11:50:40 GMT 2025","Mon Aug 18 11:50:41 GMT 2025","771","tests.api_tests","api_test","TestAPI","","","A.26 POST Регистрация пользователя без электронной почты",""
"passed","Mon Aug 18 11:49:29 GMT 2025","Mon Aug 18 11:49:35 GMT 2025","5663","tests.api_tests","api_test","TestAPI","","","A.5 POST Повторная отправка ссылки с приглашением пользователя",""
"passed","Mon Aug 18 11:53:01 GMT 2025","Mon Aug 18 11:53:03 GMT 2025","2248","tests.ui_tests","login_page_test","TestLoginPage","","","L.8 Авторизация с пустым паролем",""
"passed","Mon Aug 18 11:50:17 GMT 2025","Mon Aug 18 11:50:25 GMT 2025","7182","tests.api_tests","api_test","TestAPI","","","A.21 POST Подтверждение смены почты пользователя. Токен из ссылки auth/change_email/{token}.",""
"passed","Mon Aug 18 11:50:02 GMT 2025","Mon Aug 18 11:50:04 GMT 2025","1915","tests.api_tests","api_test","TestAPI","","","A.14 POST Создать доску без указания РП","Создание доски без указания РП, будет создано дефолтное РП для этой доски"
"passed","Mon Aug 18 11:52:02 GMT 2025","Mon Aug 18 11:52:05 GMT 2025","2828","tests.ui_tests","lending_test","TestLendingPage","","","M.1 Проверка редиректа с /home на страницу лендинга",""
"passed","Mon Aug 18 11:51:34 GMT 2025","Mon Aug 18 11:51:37 GMT 2025","2333","tests.ui_tests","header_test","TestHeader","","","H.2 Проверка редиректа на главную страницу при клике на логотип",""
"passed","Mon Aug 18 11:55:00 GMT 2025","Mon Aug 18 11:55:01 GMT 2025","822","tests.ui_tests","signup_page_test","TestSignupPage","","","S.7 Регистрация с некорректным email и сильным паролем и подтверждением пароля",""
"passed","Mon Aug 18 11:50:13 GMT 2025","Mon Aug 18 11:50:15 GMT 2025","1945","tests.api_tests","api_test","TestAPI","","","A.19 GET Получить данные авторизованного пользователя me",""
"passed","Mon Aug 18 11:52:22 GMT 2025","Mon Aug 18 11:52:22 GMT 2025","38","tests.ui_tests","login_page_test","TestLoginPage","","","L.2 Проверка шрифта заголовка 'Войти'",""
"passed","Mon Aug 18 11:50:26 GMT 2025","Mon Aug 18 11:50:31 GMT 2025","5008","tests.api_tests","api_test","TestAPI","","","A.23 POST Подтверждение сброса пароля. Когда пользователь переходит по ссылке     auth/password/reset/confirm/{uid}/{token}",""
"passed","Mon Aug 18 11:55:37 GMT 2025","Mon Aug 18 11:55:39 GMT 2025","2296","tests.ui_tests","signup_page_test","TestSignupPage","","","S.11 Регистрация с пустым email и сильным паролем и подтверждением пароля",""
"passed","Mon Aug 18 11:55:48 GMT 2025","Mon Aug 18 11:55:48 GMT 2025","343","tests.ui_tests","signup_page_test","TestSignupPage","","","S.16 Регистрация с корректным email и слабым паролем и подтверждением пароля",""
