"DESCRIPTION","DURATION IN MS","NAME","PARENT SUITE","START TIME","STATUS","STOP TIME","SUB SUITE","SUITE","TEST CLASS","TEST METHOD"
"","0","S.13 Окно регистрации сообщение 'Регистрируясь, я соглашаюсь с Условиями пользования и Политикой конфиденциальности'","tests.ui_tests","Tue Nov 11 15:57:27 UTC 2025","skipped","Tue Nov 11 15:57:27 UTC 2025","TestSignupPage","signup_page_test","",""
"","38","F.6 Проверка размера шрифта надписи '© PulseWave, 2023-2025' в футере","tests.ui_tests","Tue Nov 11 15:45:08 UTC 2025","passed","Tue Nov 11 15:45:08 UTC 2025","TestFooter","footer_test","",""
"","3","W.2 Проверка заголовка рабочего пространства","tests.ui_tests","Tue Nov 11 15:57:54 UTC 2025","passed","Tue Nov 11 15:57:54 UTC 2025","TestWorkspacePage","workspace_page_test","",""
"","9","W.3 Проверка видимости аватара","tests.ui_tests","Tue Nov 11 15:58:01 UTC 2025","passed","Tue Nov 11 15:58:01 UTC 2025","TestWorkspacePage","workspace_page_test","",""
"","3128","F.1 Проверка попапа о принятии файлов cookie на странице https://app.pulsewave.ru/auth/signup","tests.ui_tests","Tue Nov 11 15:36:10 UTC 2025","passed","Tue Nov 11 15:36:13 UTC 2025","TestFooter","footer_test","",""
"","15686","S.8 Регистрация с корректными email и паролем без согласия на подписку","tests.ui_tests","Tue Nov 11 15:56:47 UTC 2025","passed","Tue Nov 11 15:57:02 UTC 2025","TestSignupPage","signup_page_test","",""
"","10037","S.1 Регистрация с корректными email и паролем и с согласием на подписку","tests.ui_tests","Tue Nov 11 15:55:52 UTC 2025","passed","Tue Nov 11 15:56:02 UTC 2025","TestSignupPage","signup_page_test","",""
"","378","S.16 Регистрация с корректным email и слабым паролем и подтверждением пароля","tests.ui_tests","Tue Nov 11 15:57:36 UTC 2025","passed","Tue Nov 11 15:57:36 UTC 2025","TestSignupPage","signup_page_test","",""
"Удаление как из участников так и из приглашенных","3028","A.6 POST Удаление приглашенного пользователей из РП","tests.api_tests","Tue Nov 11 15:33:31 UTC 2025","passed","Tue Nov 11 15:33:34 UTC 2025","TestAPI","api_test","",""
"","42","S.5 Проверка шрифта заголовка 'Регистрация'","tests.ui_tests","Tue Nov 11 15:56:29 UTC 2025","passed","Tue Nov 11 15:56:29 UTC 2025","TestSignupPage","signup_page_test","",""
"","54","F.5 Проверка цвета шрифта надписи 'info@pulsewave.ru' в футере","tests.ui_tests","Tue Nov 11 15:42:24 UTC 2025","passed","Tue Nov 11 15:42:24 UTC 2025","TestFooter","footer_test","",""
"","30","H.7 Проверка цвета шрифта кнопки 'Войти' в хедере https://app.pulsewave.ru/auth/signup","tests.ui_tests","Tue Nov 11 15:52:37 UTC 2025","passed","Tue Nov 11 15:52:37 UTC 2025","TestHeader","header_test","",""
"","11","F.7 Проверка значка LinkedIn на странице 'https://app.pulsewave.ru/auth/login' в футере","tests.ui_tests","Tue Nov 11 15:48:47 UTC 2025","passed","Tue Nov 11 15:48:47 UTC 2025","TestFooter","footer_test","",""
"","608","L.3 Проверка редиректа на страницу восстановления пароля при клике на ссылку 'Забыли пароль?'","tests.ui_tests","Tue Nov 11 15:54:09 UTC 2025","passed","Tue Nov 11 15:54:10 UTC 2025","TestLoginPage","login_page_test","",""
"","44","L.1 Проверка текста заголовка 'Войти'","tests.ui_tests","Tue Nov 11 15:53:52 UTC 2025","passed","Tue Nov 11 15:53:52 UTC 2025","TestLoginPage","login_page_test","",""
"","750","A.30 POST Создать пользователя с некорректными данными","tests.api_tests","Tue Nov 11 15:34:50 UTC 2025","passed","Tue Nov 11 15:34:50 UTC 2025","TestAPI","api_test","",""
"","138","M.2 Проверка кликабельности логотипа на лендинге","tests.ui_tests","Tue Nov 11 15:53:42 UTC 2025","passed","Tue Nov 11 15:53:42 UTC 2025","TestLendingPage","lending_test","",""
"","2028","W.5 Проверка что авторизованный пользователь может выйти из аккаунта","tests.ui_tests","Tue Nov 11 15:58:16 UTC 2025","passed","Tue Nov 11 15:58:18 UTC 2025","TestWorkspacePage","workspace_page_test","",""
"","33","H.7 Проверка шрифта кнопки 'Войти' в хедере https://app.pulsewave.ru/auth/password?email=","tests.ui_tests","Tue Nov 11 15:52:50 UTC 2025","passed","Tue Nov 11 15:52:50 UTC 2025","TestHeader","header_test","",""
"","1250","R.6 Восстановить пароль на некорректный емайл","tests.ui_tests","Tue Nov 11 15:55:46 UTC 2025","passed","Tue Nov 11 15:55:47 UTC 2025","TestPasswordRecoveryPage","password_recovery_test","",""
"","537","H.7 Проверка размера шрифта кнопки 'Войти' в хедере https://app.pulsewave.ru/auth/password?email=","tests.ui_tests","Tue Nov 11 15:52:32 UTC 2025","passed","Tue Nov 11 15:52:32 UTC 2025","TestHeader","header_test","",""
"","107","W.13 Проверка видимости выпадающего меню Рабочие пространства","tests.ui_tests","Tue Nov 11 15:59:19 UTC 2025","passed","Tue Nov 11 15:59:19 UTC 2025","TestWorkspacePage","workspace_page_test","",""
"","1788","A.18 POST Обновить JWT refresh token авторизованного пользователя","tests.api_tests","Tue Nov 11 15:34:06 UTC 2025","passed","Tue Nov 11 15:34:08 UTC 2025","TestAPI","api_test","",""
"","45","S.5 Проверка цвета шрифта заголовка 'Регистрация'","tests.ui_tests","Tue Nov 11 15:56:24 UTC 2025","passed","Tue Nov 11 15:56:24 UTC 2025","TestSignupPage","signup_page_test","",""
"","4678","A.21 POST Подтверждение смены почты пользователя. Токен из ссылки auth/change_email/{token}.","tests.api_tests","Tue Nov 11 15:34:12 UTC 2025","passed","Tue Nov 11 15:34:17 UTC 2025","TestAPI","api_test","",""
"","745","A.27 POST Регистрация пользователя без пароля","tests.api_tests","Tue Nov 11 15:34:32 UTC 2025","passed","Tue Nov 11 15:34:33 UTC 2025","TestAPI","api_test","",""
"","13007","A.5 POST Повторная отправка ссылки с приглашением пользователя","tests.api_tests","Tue Nov 11 15:33:18 UTC 2025","passed","Tue Nov 11 15:33:31 UTC 2025","TestAPI","api_test","",""
"","46","R.2 Проверка размера шрифта заголовка 'Восстановление пароля'","tests.ui_tests","Tue Nov 11 15:55:02 UTC 2025","passed","Tue Nov 11 15:55:02 UTC 2025","TestPasswordRecoveryPage","password_recovery_test","",""
"","11","F.7 Проверка значка LinkedIn на странице 'https://app.pulsewave.ru/auth/password?email=' в футере","tests.ui_tests","Tue Nov 11 15:48:55 UTC 2025","passed","Tue Nov 11 15:48:55 UTC 2025","TestFooter","footer_test","",""
"","4144","A.12 DELETE Удалить РП","tests.api_tests","Tue Nov 11 15:33:46 UTC 2025","passed","Tue Nov 11 15:33:50 UTC 2025","TestAPI","api_test","",""
"","55","F.4 Проверка года © PulseWave, 2025 в футере","tests.ui_tests","Tue Nov 11 15:39:53 UTC 2025","passed","Tue Nov 11 15:39:53 UTC 2025","TestFooter","footer_test","",""
"","3638","A.11 PATCH Частично обновить данные РП (на данный момент только имя)","tests.api_tests","Tue Nov 11 15:33:42 UTC 2025","passed","Tue Nov 11 15:33:46 UTC 2025","TestAPI","api_test","",""
"","2134","A.20 POST Запрос на смену почты","tests.api_tests","Tue Nov 11 15:34:10 UTC 2025","passed","Tue Nov 11 15:34:12 UTC 2025","TestAPI","api_test","",""
"","403","S.6 Окно регистрации сообщение 'Слабый пароль. Пароль должен содержать минимум 8 символов, включая буквы и цифры'","tests.ui_tests","Tue Nov 11 15:56:32 UTC 2025","passed","Tue Nov 11 15:56:33 UTC 2025","TestSignupPage","signup_page_test","",""
"","966","Проверка доступности https://app.pulsewave.ru/","tests.api_tests","Tue Nov 11 15:34:52 UTC 2025","passed","Tue Nov 11 15:34:53 UTC 2025","TestAvailability","availability_test","",""
"","31","H.7 Проверка цвета кнопки 'Войти' в хедере https://app.pulsewave.ru/auth/signup","tests.ui_tests","Tue Nov 11 15:52:55 UTC 2025","passed","Tue Nov 11 15:52:55 UTC 2025","TestHeader","header_test","",""
"","597","H.6 Проверка перехода на страницу 'https://app.pulsewave.ru/auth/signup' по кнопке 'Регистрация'","tests.ui_tests","Tue Nov 11 15:52:23 UTC 2025","passed","Tue Nov 11 15:52:24 UTC 2025","TestHeader","header_test","",""
"","0","S.15 Окно регистрации сообщение 'Регистрируясь, я соглашаюсь с Условиями пользования и Политикой конфиденциальности', проверка корректности перехода по ссылке 'Условиями пользования'","tests.ui_tests","Tue Nov 11 15:57:27 UTC 2025","skipped","Tue Nov 11 15:57:27 UTC 2025","TestSignupPage","signup_page_test","",""
"","47","F.5 Проверка размера шрифта надписи 'info@pulsewave.ru' в футере","tests.ui_tests","Tue Nov 11 15:41:21 UTC 2025","passed","Tue Nov 11 15:41:21 UTC 2025","TestFooter","footer_test","",""
"","45","F.5 Проверка шрифта надписи 'info@pulsewave.ru' в футере","tests.ui_tests","Tue Nov 11 15:43:44 UTC 2025","passed","Tue Nov 11 15:43:44 UTC 2025","TestFooter","footer_test","",""
"","656","W.11 Проверка видимости уведомлений","tests.ui_tests","Tue Nov 11 15:59:04 UTC 2025","passed","Tue Nov 11 15:59:04 UTC 2025","TestWorkspacePage","workspace_page_test","",""
"","51","F.2 Проверка отсутствия ссылки на Лицензионное соглашение со страницы 'https://pulsewave.ru/","tests.ui_tests","Tue Nov 11 15:37:20 UTC 2025","passed","Tue Nov 11 15:37:20 UTC 2025","TestFooter","footer_test","",""
"","6148","A.24 POST Установить новый пароль. Используется в личном кабинете после авторизации.","tests.api_tests","Tue Nov 11 15:34:23 UTC 2025","passed","Tue Nov 11 15:34:29 UTC 2025","TestAPI","api_test","",""
"","2071","A.9 GET Получить список всех Рабочих пространств авторизованного пользователя","tests.api_tests","Tue Nov 11 15:33:36 UTC 2025","passed","Tue Nov 11 15:33:38 UTC 2025","TestAPI","api_test","",""
"","44","F.6 Проверка шрифта надписи '© PulseWave, 2023-2025' в футере","tests.ui_tests","Tue Nov 11 15:47:40 UTC 2025","passed","Tue Nov 11 15:47:40 UTC 2025","TestFooter","footer_test","",""
"","15922","A.29 DELETE Активировать и удалить авторизованного пользователя","tests.api_tests","Tue Nov 11 15:34:34 UTC 2025","passed","Tue Nov 11 15:34:50 UTC 2025","TestAPI","api_test","",""
"","62","F.9 Проверка перехода в LinkedIn на странице 'https://app.pulsewave.ru/auth/login' в футере","tests.ui_tests","Tue Nov 11 15:51:18 UTC 2025","passed","Tue Nov 11 15:51:18 UTC 2025","TestFooter","footer_test","",""
"","1797","A.19 GET Получить данные авторизованного пользователя me","tests.api_tests","Tue Nov 11 15:34:08 UTC 2025","passed","Tue Nov 11 15:34:10 UTC 2025","TestAPI","api_test","",""
"","2835","L.4 Авторизация с корректными данными","tests.ui_tests","Tue Nov 11 15:54:14 UTC 2025","passed","Tue Nov 11 15:54:17 UTC 2025","TestLoginPage","login_page_test","",""
"","62","F.9 Проверка перехода в LinkedIn на странице 'https://app.pulsewave.ru/auth/password?email=' в футере","tests.ui_tests","Tue Nov 11 15:51:26 UTC 2025","passed","Tue Nov 11 15:51:26 UTC 2025","TestFooter","footer_test","",""
"","60","M.4 Проверка текста кнопки 'Бесплатная регистрация' на лендинге","tests.ui_tests","Tue Nov 11 15:53:47 UTC 2025","passed","Tue Nov 11 15:53:47 UTC 2025","TestLendingPage","lending_test","",""
"","73","F.8 Проверка кликабельности значка LinkedIn на странице 'https://pulsewave.ru/' в футере","tests.ui_tests","Tue Nov 11 15:49:58 UTC 2025","passed","Tue Nov 11 15:49:58 UTC 2025","TestFooter","footer_test","",""
"","29","H.7 Проверка шрифта кнопки 'Войти' в хедере https://app.pulsewave.ru/auth/signup","tests.ui_tests","Tue Nov 11 15:52:46 UTC 2025","passed","Tue Nov 11 15:52:46 UTC 2025","TestHeader","header_test","",""
"","26","H.8 Проверка размера шрифта кнопки 'Регистрация в хедере https://app.pulsewave.ru/auth/login'","tests.ui_tests","Tue Nov 11 15:53:04 UTC 2025","passed","Tue Nov 11 15:53:04 UTC 2025","TestHeader","header_test","",""
"","36","H.8 Проверка размера шрифта кнопки 'Регистрация в хедере https://app.pulsewave.ru/auth/password?email='","tests.ui_tests","Tue Nov 11 15:53:08 UTC 2025","passed","Tue Nov 11 15:53:08 UTC 2025","TestHeader","header_test","",""
"","61","F.8 Проверка кликабельности значка LinkedIn на странице 'https://app.pulsewave.ru/auth/password?email=' в футере","tests.ui_tests","Tue Nov 11 15:50:11 UTC 2025","passed","Tue Nov 11 15:50:11 UTC 2025","TestFooter","footer_test","",""
"","1815","A.16 POST Создать Рабочее пространство","tests.api_tests","Tue Nov 11 15:34:03 UTC 2025","passed","Tue Nov 11 15:34:05 UTC 2025","TestAPI","api_test","",""
"","88","F.3 Проверка элемента 'info@pulsewave.ru'в хедере","tests.ui_tests","Tue Nov 11 15:38:41 UTC 2025","passed","Tue Nov 11 15:38:41 UTC 2025","TestFooter","footer_test","",""
"Создание доски без указания РП, будет создано дефолтное РП для этой доски","2410","A.14 POST Создать доску без указания РП","tests.api_tests","Tue Nov 11 15:33:56 UTC 2025","passed","Tue Nov 11 15:33:59 UTC 2025","TestAPI","api_test","",""
"","2233","L.8 Авторизация с пустым емайл","tests.ui_tests","Tue Nov 11 15:54:38 UTC 2025","passed","Tue Nov 11 15:54:40 UTC 2025","TestLoginPage","login_page_test","",""
"","4398","A.23 POST Подтверждение сброса пароля. Когда пользователь переходит по ссылке     auth/password/reset/confirm/{uid}/{token}","tests.api_tests","Tue Nov 11 15:34:19 UTC 2025","passed","Tue Nov 11 15:34:23 UTC 2025","TestAPI","api_test","",""
"","549","L.2 Проверка шрифта заголовка 'Войти'","tests.ui_tests","Tue Nov 11 15:54:04 UTC 2025","passed","Tue Nov 11 15:54:05 UTC 2025","TestLoginPage","login_page_test","",""
"","62886","F.1 Проверка попапа о принятии файлов cookie на странице https://pulsewave.ru/","tests.ui_tests","Tue Nov 11 15:35:03 UTC 2025","passed","Tue Nov 11 15:36:06 UTC 2025","TestFooter","footer_test","",""
"","10","F.7 Проверка значка LinkedIn на странице 'https://pulsewave.ru/' в футере","tests.ui_tests","Tue Nov 11 15:48:43 UTC 2025","passed","Tue Nov 11 15:48:43 UTC 2025","TestFooter","footer_test","",""
"","47","F.5 Проверка цвета шрифта надписи 'info@pulsewave.ru' в футере","tests.ui_tests","Tue Nov 11 15:42:37 UTC 2025","passed","Tue Nov 11 15:42:37 UTC 2025","TestFooter","footer_test","",""
"","61","F.8 Проверка кликабельности значка LinkedIn на странице 'https://app.pulsewave.ru/auth/login' в футере","tests.ui_tests","Tue Nov 11 15:50:02 UTC 2025","passed","Tue Nov 11 15:50:02 UTC 2025","TestFooter","footer_test","",""
"","586","H.6 Проверка перехода на страницу 'https://app.pulsewave.ru/auth/signup' по кнопке 'Регистрация'","tests.ui_tests","Tue Nov 11 15:52:18 UTC 2025","passed","Tue Nov 11 15:52:19 UTC 2025","TestHeader","header_test","",""
"","553","F.5 Проверка цвета шрифта надписи 'info@pulsewave.ru' в футере","tests.ui_tests","Tue Nov 11 15:42:32 UTC 2025","passed","Tue Nov 11 15:42:33 UTC 2025","TestFooter","footer_test","",""
"","31","H.4 Проверка текста кнопки 'Регистрация'","tests.ui_tests","Tue Nov 11 15:52:00 UTC 2025","passed","Tue Nov 11 15:52:00 UTC 2025","TestHeader","header_test","",""
"","2319","H.2 Проверка редиректа на главную страницу при клике на логотип","tests.ui_tests","Tue Nov 11 15:51:38 UTC 2025","passed","Tue Nov 11 15:51:40 UTC 2025","TestHeader","header_test","",""
"","359","S.16 Регистрация с корректным email и слабым паролем и подтверждением пароля","tests.ui_tests","Tue Nov 11 15:57:31 UTC 2025","passed","Tue Nov 11 15:57:32 UTC 2025","TestSignupPage","signup_page_test","",""
"","32","H.8 Проверка шрифта кнопки 'Регистрация в хедере https://app.pulsewave.ru/auth/password?email='","tests.ui_tests","Tue Nov 11 15:53:26 UTC 2025","passed","Tue Nov 11 15:53:26 UTC 2025","TestHeader","header_test","",""
"","36","H.8 Проверка цвета кнопки 'Регистрация в хедере https://app.pulsewave.ru/auth/password?email='","tests.ui_tests","Tue Nov 11 15:53:34 UTC 2025","passed","Tue Nov 11 15:53:34 UTC 2025","TestHeader","header_test","",""
"","350","S.7 Регистрация с некорректным email и сильным паролем и подтверждением пароля","tests.ui_tests","Tue Nov 11 15:56:37 UTC 2025","passed","Tue Nov 11 15:56:37 UTC 2025","TestSignupPage","signup_page_test","",""
"","3","W.4 Проверка что авторизованный пользователь попадает в Рабочие пространства","tests.ui_tests","Tue Nov 11 15:58:09 UTC 2025","passed","Tue Nov 11 15:58:09 UTC 2025","TestWorkspacePage","workspace_page_test","",""
"","49","F.5 Проверка шрифта надписи 'info@pulsewave.ru' в футере","tests.ui_tests","Tue Nov 11 15:43:40 UTC 2025","passed","Tue Nov 11 15:43:40 UTC 2025","TestFooter","footer_test","",""
"","50","M.3 Проверка текста кнопки 'Войти' на лендинге","tests.ui_tests","Tue Nov 11 15:53:44 UTC 2025","passed","Tue Nov 11 15:53:44 UTC 2025","TestLendingPage","lending_test","",""
"","42","F.5 Проверка размера шрифта надписи 'info@pulsewave.ru' в футере","tests.ui_tests","Tue Nov 11 15:41:12 UTC 2025","passed","Tue Nov 11 15:41:12 UTC 2025","TestFooter","footer_test","",""
"","62","F.8 Проверка кликабельности значка LinkedIn на странице 'https://app.pulsewave.ru/auth/signup' в футере","tests.ui_tests","Tue Nov 11 15:50:07 UTC 2025","passed","Tue Nov 11 15:50:07 UTC 2025","TestFooter","footer_test","",""
"","31","H.3 Проверка текста кнопки 'Войти'","tests.ui_tests","Tue Nov 11 15:51:51 UTC 2025","passed","Tue Nov 11 15:51:51 UTC 2025","TestHeader","header_test","",""
"","44","F.2 Проверка отсутствия ссылки на Лицензионное соглашение со страницы 'https://app.pulsewave.ru/auth/signup","tests.ui_tests","Tue Nov 11 15:37:29 UTC 2025","passed","Tue Nov 11 15:37:30 UTC 2025","TestFooter","footer_test","",""
"","26","H.8 Проверка цвета шрифта кнопки 'Регистрация в хедере https://app.pulsewave.ru/auth/login'","tests.ui_tests","Tue Nov 11 15:53:13 UTC 2025","passed","Tue Nov 11 15:53:13 UTC 2025","TestHeader","header_test","",""
"","2087","R.3  Проверка некликабельности кнопки 'Продолжить'","tests.ui_tests","Tue Nov 11 15:55:16 UTC 2025","passed","Tue Nov 11 15:55:18 UTC 2025","TestPasswordRecoveryPage","password_recovery_test","",""
"","550","F.4 Проверка года © PulseWave, 2025 в футере","tests.ui_tests","Tue Nov 11 15:40:00 UTC 2025","passed","Tue Nov 11 15:40:01 UTC 2025","TestFooter","footer_test","",""
"","44","R.1 Проверка текста заголовка 'Восстановление пароля'","tests.ui_tests","Tue Nov 11 15:54:58 UTC 2025","passed","Tue Nov 11 15:54:58 UTC 2025","TestPasswordRecoveryPage","password_recovery_test","",""
"","41","F.6 Проверка размера шрифта надписи '© PulseWave, 2023-2025' в футере","tests.ui_tests","Tue Nov 11 15:45:05 UTC 2025","passed","Tue Nov 11 15:45:05 UTC 2025","TestFooter","footer_test","",""
"","98","F.3 Проверка элемента 'info@pulsewave.ru'в хедере","tests.ui_tests","Tue Nov 11 15:38:37 UTC 2025","passed","Tue Nov 11 15:38:37 UTC 2025","TestFooter","footer_test","",""
"","48","F.5 Проверка размера шрифта надписи 'info@pulsewave.ru' в футере","tests.ui_tests","Tue Nov 11 15:41:17 UTC 2025","passed","Tue Nov 11 15:41:17 UTC 2025","TestFooter","footer_test","",""
"","665","W.10 Проверка цвета переключателя 'Непрочитанные'","tests.ui_tests","Tue Nov 11 15:58:56 UTC 2025","passed","Tue Nov 11 15:58:56 UTC 2025","TestWorkspacePage","workspace_page_test","",""
"","589","H.5 Проверка перехода на страницу 'https://app.pulsewave.ru/auth/login' по кнопке 'Войти'","tests.ui_tests","Tue Nov 11 15:52:09 UTC 2025","passed","Tue Nov 11 15:52:10 UTC 2025","TestHeader","header_test","",""
"","1886","Проверка доступности https://pulsewave.ru/","tests.api_tests","Tue Nov 11 15:34:53 UTC 2025","passed","Tue Nov 11 15:34:55 UTC 2025","TestAvailability","availability_test","",""
"","1812","A.17 GET Получить список всех пользователей для поиска","tests.api_tests","Tue Nov 11 15:34:05 UTC 2025","passed","Tue Nov 11 15:34:06 UTC 2025","TestAPI","api_test","",""
"","35","W.7 Проверка видимости заголовка 'Ваши рабочие пространства'","tests.ui_tests","Tue Nov 11 15:58:33 UTC 2025","passed","Tue Nov 11 15:58:34 UTC 2025","TestWorkspacePage","workspace_page_test","",""
"","33","H.8 Проверка цвета шрифта кнопки 'Регистрация в хедере https://app.pulsewave.ru/auth/password?email='","tests.ui_tests","Tue Nov 11 15:53:17 UTC 2025","passed","Tue Nov 11 15:53:17 UTC 2025","TestHeader","header_test","",""
"","49","F.5 Проверка цвета шрифта надписи 'info@pulsewave.ru' в футере","tests.ui_tests","Tue Nov 11 15:42:29 UTC 2025","passed","Tue Nov 11 15:42:29 UTC 2025","TestFooter","footer_test","",""
"","42","S.5 Проверка размера шрифта заголовка 'Регистрация'","tests.ui_tests","Tue Nov 11 15:56:20 UTC 2025","passed","Tue Nov 11 15:56:20 UTC 2025","TestSignupPage","signup_page_test","",""
"","1011","A.8 POST Создать пару токенов access и refresh","tests.api_tests","Tue Nov 11 15:33:35 UTC 2025","passed","Tue Nov 11 15:33:36 UTC 2025","TestAPI","api_test","",""
"","966","A.7 POST Регистрация ранее зарегистрированного пользователя","tests.api_tests","Tue Nov 11 15:33:34 UTC 2025","passed","Tue Nov 11 15:33:35 UTC 2025","TestAPI","api_test","",""
"","45","S.4 Проверка текста заголовка 'Регистрация'","tests.ui_tests","Tue Nov 11 15:56:15 UTC 2025","passed","Tue Nov 11 15:56:15 UTC 2025","TestSignupPage","signup_page_test","",""
"","65","F.9 Проверка перехода в LinkedIn на странице 'https://app.pulsewave.ru/auth/signup' в футере","tests.ui_tests","Tue Nov 11 15:51:22 UTC 2025","passed","Tue Nov 11 15:51:22 UTC 2025","TestFooter","footer_test","",""
"","41","R.2 Проверка шрифта заголовка 'Восстановление пароля'","tests.ui_tests","Tue Nov 11 15:55:11 UTC 2025","passed","Tue Nov 11 15:55:11 UTC 2025","TestPasswordRecoveryPage","password_recovery_test","",""
"","43","F.6 Проверка цвета шрифта надписи '© PulseWave, 2023-2025' в футере","tests.ui_tests","Tue Nov 11 15:46:16 UTC 2025","passed","Tue Nov 11 15:46:16 UTC 2025","TestFooter","footer_test","",""
"Пользователи добавляются по одному. Если пользователя не существует, он будет создан","5350","A.4 POST Пригласить пользователя по email","tests.api_tests","Tue Nov 11 15:33:13 UTC 2025","passed","Tue Nov 11 15:33:18 UTC 2025","TestAPI","api_test","",""
"","3605","A.10 GET Информация о конкретном рабочем пространстве","tests.api_tests","Tue Nov 11 15:33:38 UTC 2025","passed","Tue Nov 11 15:33:42 UTC 2025","TestAPI","api_test","",""
