"DESCRIPTION","DURATION IN MS","NAME","PARENT SUITE","START TIME","STATUS","STOP TIME","SUB SUITE","SUITE","TEST CLASS","TEST METHOD"
"","28","H.8 Проверка шрифта кнопки 'Регистрация в хедере https://app.pulsewave.ru/auth/login'","tests.ui_tests","Tue Nov 11 15:53:21 UTC 2025","passed","Tue Nov 11 15:53:21 UTC 2025","TestHeader","header_test","",""
"","1344","L.7 Авторизация с некорректным емайл","tests.ui_tests","Tue Nov 11 15:54:32 UTC 2025","passed","Tue Nov 11 15:54:34 UTC 2025","TestLoginPage","login_page_test","",""
"","11","F.7 Проверка значка LinkedIn на странице 'https://app.pulsewave.ru/auth/signup' в футере","tests.ui_tests","Tue Nov 11 15:48:52 UTC 2025","passed","Tue Nov 11 15:48:52 UTC 2025","TestFooter","footer_test","",""
"","4619","R.4 Проверить сообщение об отправке ссылки восстановления пароля на емайл","tests.ui_tests","Tue Nov 11 15:55:22 UTC 2025","passed","Tue Nov 11 15:55:26 UTC 2025","TestPasswordRecoveryPage","password_recovery_test","",""
"","84","F.3 Проверка элемента 'info@pulsewave.ru'в хедере","tests.ui_tests","Tue Nov 11 15:38:50 UTC 2025","passed","Tue Nov 11 15:38:50 UTC 2025","TestFooter","footer_test","",""
"","1871","L.5 Авторизация с некорректным паролем","tests.ui_tests","Tue Nov 11 15:54:21 UTC 2025","passed","Tue Nov 11 15:54:23 UTC 2025","TestLoginPage","login_page_test","",""
"","0","S.14 Окно регистрации сообщение 'Регистрируясь, я соглашаюсь с Условиями пользования и Политикой конфиденциальности' проверка корректности перехода по ссылке 'Политикой конфиденциальности'","tests.ui_tests","Tue Nov 11 15:57:27 UTC 2025","skipped","Tue Nov 11 15:57:27 UTC 2025","TestSignupPage","signup_page_test","",""
"","42","F.2 Проверка отсутствия ссылки на Лицензионное соглашение со страницы 'https://app.pulsewave.ru/auth/login","tests.ui_tests","Tue Nov 11 15:37:25 UTC 2025","passed","Tue Nov 11 15:37:25 UTC 2025","TestFooter","footer_test","",""
"","1253","W.9 Проверка возможности изменить цвет переключателя 'Непрочитанные'","tests.ui_tests","Tue Nov 11 15:58:48 UTC 2025","passed","Tue Nov 11 15:58:49 UTC 2025","TestWorkspacePage","workspace_page_test","",""
"","3374","F.1 Проверка попапа о принятии файлов cookie на странице https://app.pulsewave.ru/auth/login","tests.ui_tests","Tue Nov 11 15:36:06 UTC 2025","passed","Tue Nov 11 15:36:09 UTC 2025","TestFooter","footer_test","",""
"","37","H.7 Проверка цвета шрифта кнопки 'Войти' в хедере https://app.pulsewave.ru/auth/password?email=","tests.ui_tests","Tue Nov 11 15:52:41 UTC 2025","passed","Tue Nov 11 15:52:42 UTC 2025","TestHeader","header_test","",""
"","39","F.6 Проверка цвета шрифта надписи '© PulseWave, 2023-2025' в футере","tests.ui_tests","Tue Nov 11 15:46:24 UTC 2025","passed","Tue Nov 11 15:46:24 UTC 2025","TestFooter","footer_test","",""
"","2127","A.25 DELETE Удалить авторизованного пользователя","tests.api_tests","Tue Nov 11 15:34:29 UTC 2025","passed","Tue Nov 11 15:34:31 UTC 2025","TestAPI","api_test","",""
"","3842","A.15 GET Список всех пользователей доски для назначения ответственных","tests.api_tests","Tue Nov 11 15:33:59 UTC 2025","passed","Tue Nov 11 15:34:03 UTC 2025","TestAPI","api_test","",""
"","90","F.3 Проверка элемента 'info@pulsewave.ru'в хедере","tests.ui_tests","Tue Nov 11 15:38:45 UTC 2025","passed","Tue Nov 11 15:38:45 UTC 2025","TestFooter","footer_test","",""
"","63","L.6 Окно авторизации сообщение 'Забыли пароль?'","tests.ui_tests","Tue Nov 11 15:54:28 UTC 2025","passed","Tue Nov 11 15:54:28 UTC 2025","TestLoginPage","login_page_test","",""
"","773","A.30 POST Создать пользователя с некорректными данными","tests.api_tests","Tue Nov 11 15:34:50 UTC 2025","passed","Tue Nov 11 15:34:51 UTC 2025","TestAPI","api_test","",""
"","3","W.1 Проверка перехода в рабочее пространство авторизованного пользователя","tests.ui_tests","Tue Nov 11 15:57:48 UTC 2025","passed","Tue Nov 11 15:57:48 UTC 2025","TestWorkspacePage","workspace_page_test","",""
"","1267","W.12 Проверка прочтения уведомлений","tests.ui_tests","Tue Nov 11 15:59:11 UTC 2025","passed","Tue Nov 11 15:59:12 UTC 2025","TestWorkspacePage","workspace_page_test","",""
"","6742","A.13 POST Подтверждение приглашения в РП","tests.api_tests","Tue Nov 11 15:33:50 UTC 2025","passed","Tue Nov 11 15:33:56 UTC 2025","TestAPI","api_test","",""
"","41","L.2 Проверка размера шрифта заголовка 'Войти'","tests.ui_tests","Tue Nov 11 15:53:56 UTC 2025","passed","Tue Nov 11 15:53:56 UTC 2025","TestLoginPage","login_page_test","",""
"","2251","L.8 Авторизация с пустым паролем","tests.ui_tests","Tue Nov 11 15:54:44 UTC 2025","passed","Tue Nov 11 15:54:46 UTC 2025","TestLoginPage","login_page_test","",""
"","354","S.7 Регистрация с некорректным email и сильным паролем и подтверждением пароля","tests.ui_tests","Tue Nov 11 15:56:42 UTC 2025","passed","Tue Nov 11 15:56:42 UTC 2025","TestSignupPage","signup_page_test","",""
"","4228","F.1 Проверка попапа о принятии файлов cookie на странице https://app.pulsewave.ru/auth/password?email=","tests.ui_tests","Tue Nov 11 15:36:13 UTC 2025","passed","Tue Nov 11 15:36:17 UTC 2025","TestFooter","footer_test","",""
"","55","F.5 Проверка размера шрифта надписи 'info@pulsewave.ru' в футере","tests.ui_tests","Tue Nov 11 15:41:08 UTC 2025","passed","Tue Nov 11 15:41:08 UTC 2025","TestFooter","footer_test","",""
"","4462","M.1 Проверка редиректа с /home на страницу лендинга","tests.ui_tests","Tue Nov 11 15:53:34 UTC 2025","passed","Tue Nov 11 15:53:39 UTC 2025","TestLendingPage","lending_test","",""
"","841","S.16 Регистрация с корректным email и слабым паролем и подтверждением пароля","tests.ui_tests","Tue Nov 11 15:57:40 UTC 2025","passed","Tue Nov 11 15:57:41 UTC 2025","TestSignupPage","signup_page_test","",""
"","1009","A.28 POST Регистрация пользователя без подтверждения подписки","tests.api_tests","Tue Nov 11 15:34:33 UTC 2025","passed","Tue Nov 11 15:34:34 UTC 2025","TestAPI","api_test","",""
"","2324","S.9 Регистрация с корректным email и паролем и пустым подтверждением пароля","tests.ui_tests","Tue Nov 11 15:57:07 UTC 2025","passed","Tue Nov 11 15:57:09 UTC 2025","TestSignupPage","signup_page_test","",""
"","44","L.2 Проверка цвета шрифта заголовка 'Войти'","tests.ui_tests","Tue Nov 11 15:54:00 UTC 2025","passed","Tue Nov 11 15:54:01 UTC 2025","TestLoginPage","login_page_test","",""
"","76","F.9 Проверка перехода в LinkedIn на странице 'https://pulsewave.ru/' в футере","tests.ui_tests","Tue Nov 11 15:51:14 UTC 2025","passed","Tue Nov 11 15:51:14 UTC 2025","TestFooter","footer_test","",""
"","48","F.2 Проверка отсутствия ссылки на Лицензионное соглашение со страницы 'https://app.pulsewave.ru/auth/password?email=","tests.ui_tests","Tue Nov 11 15:37:34 UTC 2025","passed","Tue Nov 11 15:37:34 UTC 2025","TestFooter","footer_test","",""
"","259","W.8 Проверка невидимости кнопки 'Отметить все как прочитанные' в прочитанных уведомлениях","tests.ui_tests","Tue Nov 11 15:58:41 UTC 2025","passed","Tue Nov 11 15:58:41 UTC 2025","TestWorkspacePage","workspace_page_test","",""
"","2318","S.10 Регистрация с корректным email и подтверждением пароля и пустым паролем","tests.ui_tests","Tue Nov 11 15:57:14 UTC 2025","passed","Tue Nov 11 15:57:16 UTC 2025","TestSignupPage","signup_page_test","",""
"","2872","H.2 Проверка редиректа на главную страницу при клике на логотип","tests.ui_tests","Tue Nov 11 15:51:44 UTC 2025","passed","Tue Nov 11 15:51:47 UTC 2025","TestHeader","header_test","",""
"","45","F.5 Проверка шрифта надписи 'info@pulsewave.ru' в футере","tests.ui_tests","Tue Nov 11 15:43:49 UTC 2025","passed","Tue Nov 11 15:43:49 UTC 2025","TestFooter","footer_test","",""
"","49","F.6 Проверка размера шрифта надписи '© PulseWave, 2023-2025' в футере","tests.ui_tests","Tue Nov 11 15:44:55 UTC 2025","passed","Tue Nov 11 15:44:55 UTC 2025","TestFooter","footer_test","",""
"","54","F.6 Проверка шрифта надписи '© PulseWave, 2023-2025' в футере","tests.ui_tests","Tue Nov 11 15:47:27 UTC 2025","passed","Tue Nov 11 15:47:27 UTC 2025","TestFooter","footer_test","",""
"","1489","A.2 POST Создать пользователя с корректными данными","tests.api_tests","Tue Nov 11 15:33:07 UTC 2025","passed","Tue Nov 11 15:33:08 UTC 2025","TestAPI","api_test","",""
"","360","S.2 Регистрация с корректным email и не совпадающими паролем и подтверждением пароля","tests.ui_tests","Tue Nov 11 15:56:05 UTC 2025","passed","Tue Nov 11 15:56:06 UTC 2025","TestSignupPage","signup_page_test","",""
"","41","F.4 Проверка года © PulseWave, 2025 в футере","tests.ui_tests","Tue Nov 11 15:40:05 UTC 2025","passed","Tue Nov 11 15:40:06 UTC 2025","TestFooter","footer_test","",""
"","73","S.12 Окно регистрации сообщение 'Я согласен получать новости и обновления PulseWave'","tests.ui_tests","Tue Nov 11 15:57:27 UTC 2025","passed","Tue Nov 11 15:57:27 UTC 2025","TestSignupPage","signup_page_test","",""
"","1386","S.3 Регистрация с уже зарегистрированным email и корректными паролем и подтверждением пароля","tests.ui_tests","Tue Nov 11 15:56:09 UTC 2025","passed","Tue Nov 11 15:56:11 UTC 2025","TestSignupPage","signup_page_test","",""
"","594","H.5 Проверка перехода на страницу 'https://app.pulsewave.ru/auth/login' по кнопке 'Войти'","tests.ui_tests","Tue Nov 11 15:52:13 UTC 2025","passed","Tue Nov 11 15:52:14 UTC 2025","TestHeader","header_test","",""
"","1501","W.6 Проверка перехода в Рабочие пространства по ссылке На главную","tests.ui_tests","Tue Nov 11 15:58:25 UTC 2025","passed","Tue Nov 11 15:58:26 UTC 2025","TestWorkspacePage","workspace_page_test","",""
"","1783","A.22 POST Сброс пароля","tests.api_tests","Tue Nov 11 15:34:17 UTC 2025","passed","Tue Nov 11 15:34:19 UTC 2025","TestAPI","api_test","",""
"","770","A.26 POST Регистрация пользователя без электронной почты","tests.api_tests","Tue Nov 11 15:34:31 UTC 2025","passed","Tue Nov 11 15:34:32 UTC 2025","TestAPI","api_test","",""
"","758","A.30 POST Создать пользователя с некорректными данными","tests.api_tests","Tue Nov 11 15:34:51 UTC 2025","passed","Tue Nov 11 15:34:52 UTC 2025","TestAPI","api_test","",""
"","27","H.8 Проверка цвета кнопки 'Регистрация в хедере https://app.pulsewave.ru/auth/login'","tests.ui_tests","Tue Nov 11 15:53:30 UTC 2025","passed","Tue Nov 11 15:53:30 UTC 2025","TestHeader","header_test","",""
"","552","F.6 Проверка цвета шрифта надписи '© PulseWave, 2023-2025' в футере","tests.ui_tests","Tue Nov 11 15:46:19 UTC 2025","passed","Tue Nov 11 15:46:20 UTC 2025","TestFooter","footer_test","",""
"","37","H.4 Проверка текста кнопки 'Регистрация'","tests.ui_tests","Tue Nov 11 15:52:05 UTC 2025","passed","Tue Nov 11 15:52:05 UTC 2025","TestHeader","header_test","",""
"","41","R.2 Проверка цвета шрифта заголовка 'Восстановление пароля'","tests.ui_tests","Tue Nov 11 15:55:07 UTC 2025","passed","Tue Nov 11 15:55:07 UTC 2025","TestPasswordRecoveryPage","password_recovery_test","",""
"","37","H.3 Проверка текста кнопки 'Войти'","tests.ui_tests","Tue Nov 11 15:51:56 UTC 2025","passed","Tue Nov 11 15:51:56 UTC 2025","TestHeader","header_test","",""
"","29","H.7 Проверка размера шрифта кнопки 'Войти' в хедере https://app.pulsewave.ru/auth/signup","tests.ui_tests","Tue Nov 11 15:52:28 UTC 2025","passed","Tue Nov 11 15:52:28 UTC 2025","TestHeader","header_test","",""
"","41","F.6 Проверка шрифта надписи '© PulseWave, 2023-2025' в футере","tests.ui_tests","Tue Nov 11 15:47:32 UTC 2025","passed","Tue Nov 11 15:47:32 UTC 2025","TestFooter","footer_test","",""
"","2607","H.2 Проверка редиректа на главную страницу при клике на логотип","tests.ui_tests","Tue Nov 11 15:51:31 UTC 2025","passed","Tue Nov 11 15:51:33 UTC 2025","TestHeader","header_test","",""
"","39","F.4 Проверка года © PulseWave, 2025 в футере","tests.ui_tests","Tue Nov 11 15:39:57 UTC 2025","passed","Tue Nov 11 15:39:57 UTC 2025","TestFooter","footer_test","",""
"","41","F.6 Проверка размера шрифта надписи '© PulseWave, 2023-2025' в футере","tests.ui_tests","Tue Nov 11 15:45:00 UTC 2025","passed","Tue Nov 11 15:45:00 UTC 2025","TestFooter","footer_test","",""
"","4415","A.3 POST Активация пользователя с корректными данными","tests.api_tests","Tue Nov 11 15:33:08 UTC 2025","passed","Tue Nov 11 15:33:13 UTC 2025","TestAPI","api_test","",""
"","2830","L.9 Авторизация с логином заглавными буквами","tests.ui_tests","Tue Nov 11 15:54:51 UTC 2025","passed","Tue Nov 11 15:54:54 UTC 2025","TestLoginPage","login_page_test","",""
"","12681","R.5 Восстановить пароль на корректный емайл","tests.ui_tests","Tue Nov 11 15:55:30 UTC 2025","passed","Tue Nov 11 15:55:42 UTC 2025","TestPasswordRecoveryPage","password_recovery_test","",""
"","35","H.7 Проверка цвета кнопки 'Войти' в хедере https://app.pulsewave.ru/auth/password?email=","tests.ui_tests","Tue Nov 11 15:52:59 UTC 2025","passed","Tue Nov 11 15:52:59 UTC 2025","TestHeader","header_test","",""
"","1181","A.1 GET Проверка доступности API","tests.api_tests","Tue Nov 11 15:33:06 UTC 2025","passed","Tue Nov 11 15:33:07 UTC 2025","TestAPI","api_test","",""
"","38","F.6 Проверка шрифта надписи '© PulseWave, 2023-2025' в футере","tests.ui_tests","Tue Nov 11 15:47:35 UTC 2025","passed","Tue Nov 11 15:47:35 UTC 2025","TestFooter","footer_test","",""
"","2299","S.11 Регистрация с пустым email и сильным паролем и подтверждением пароля","tests.ui_tests","Tue Nov 11 15:57:21 UTC 2025","passed","Tue Nov 11 15:57:23 UTC 2025","TestSignupPage","signup_page_test","",""
"","52","F.6 Проверка цвета шрифта надписи '© PulseWave, 2023-2025' в футере","tests.ui_tests","Tue Nov 11 15:46:11 UTC 2025","passed","Tue Nov 11 15:46:11 UTC 2025","TestFooter","footer_test","",""
"","47","F.5 Проверка шрифта надписи 'info@pulsewave.ru' в футере","tests.ui_tests","Tue Nov 11 15:43:52 UTC 2025","passed","Tue Nov 11 15:43:52 UTC 2025","TestFooter","footer_test","",""
